defined_class	defined_class_label	anatomical_entity	anatomical_entity_label	location	location_label
http://purl.obolibrary.org/obo/MP_0011059	abnormal ependyma motile cilium morphology	http://purl.obolibrary.org/obo/GO_0031514	motile cilium	http://purl.obolibrary.org/obo/CL_0000065	ependymal cell
http://purl.obolibrary.org/obo/MP_0014353	abnormal gastrointestinal brush cell morphology	http://purl.obolibrary.org/obo/CL_0002204	brush cell	http://purl.obolibrary.org/obo/UBERON_0004808	gastrointestinal system epithelium
http://purl.obolibrary.org/obo/MP_0020901	abnormal middle ear goblet cell morphology	http://purl.obolibrary.org/obo/CL_0000160	goblet cell	http://purl.obolibrary.org/obo/UBERON_0015813	middle ear epithelium
http://purl.obolibrary.org/obo/MP_0011644	abnormal oviduct epithelium motile cilium morphology	http://purl.obolibrary.org/obo/GO_0031514	motile cilium	http://purl.obolibrary.org/obo/UBERON_0007589	ciliated columnar oviduct epithelium
http://purl.obolibrary.org/obo/MP_0011050	abnormal respiratory motile cilium morphology	http://purl.obolibrary.org/obo/GO_0031514	motile cilium	http://purl.obolibrary.org/obo/CL_0002368	respiratory epithelial cell
http://purl.obolibrary.org/obo/MP_0011050	abnormal respiratory motile cilium morphology	http://purl.obolibrary.org/obo/GO_0031514	motile cilium	http://purl.obolibrary.org/obo/CL_0002368	respiratory tract epithelial cell
http://purl.obolibrary.org/obo/MP_0014354	abnormal respiratory tract brush cell morphology	http://purl.obolibrary.org/obo/CL_0002204	brush cell	http://purl.obolibrary.org/obo/UBERON_0004807	respiratory system epithelium
http://purl.obolibrary.org/obo/MP_0011064	abnormal vestibular hair cell kinocilium morphology	http://purl.obolibrary.org/obo/GO_0060091	kinocilium	http://purl.obolibrary.org/obo/CL_0000609	vestibular hair cell
