defined_class	defined_class_label	anatomical_entity	anatomical_entity_label
http://purl.obolibrary.org/obo/MP_0010156	abnormal small intestinal crypt cell physiology	http://purl.obolibrary.org/obo/UBERON_0001241	crypt of Lieberkuhn of small intestine
http://purl.obolibrary.org/obo/MP_0005423	abnormal somatic nervous system physiology	http://purl.obolibrary.org/obo/UBERON_0000012	somatic nervous system
http://purl.obolibrary.org/obo/MP_0001908	abnormal somatosensory cortex physiology	http://purl.obolibrary.org/obo/UBERON_0001872	parietal lobe
http://purl.obolibrary.org/obo/MP_0004543	abnormal sperm physiology	http://purl.obolibrary.org/obo/CL_0000019	sperm
http://purl.obolibrary.org/obo/MP_0008737	abnormal spleen physiology	http://purl.obolibrary.org/obo/UBERON_0002106	spleen
http://purl.obolibrary.org/obo/MP_0009333	abnormal splenocyte physiology	http://purl.obolibrary.org/obo/CL_2000074	splenocyte
http://purl.obolibrary.org/obo/MP_0013536	abnormal sublingual gland physiology	http://purl.obolibrary.org/obo/UBERON_0001832	sublingual gland
http://purl.obolibrary.org/obo/MP_0013300	abnormal submandibular gland physiology	http://purl.obolibrary.org/obo/UBERON_0001736	submandibular gland
http://purl.obolibrary.org/obo/MP_0014031	abnormal submucosal gland physiology	http://purl.obolibrary.org/obo/UBERON_0011148	submucosal gland
http://purl.obolibrary.org/obo/MP_0020842	abnormal supporting cell of carotid body physiology	http://purl.obolibrary.org/obo/CL_0002256	supporting cell of carotid body
http://purl.obolibrary.org/obo/MP_0004782	abnormal surfactant physiology	http://purl.obolibrary.org/obo/UBERON_0008826	pulmonary surfactant
http://purl.obolibrary.org/obo/MP_0013368	abnormal sweat gland physiology	http://purl.obolibrary.org/obo/UBERON_0001820	sweat gland
http://purl.obolibrary.org/obo/MP_0004183	abnormal sympathetic nervous system physiology	http://purl.obolibrary.org/obo/UBERON_0000013	sympathetic nervous system
http://purl.obolibrary.org/obo/MP_0021009	abnormal synaptic physiology	http://purl.obolibrary.org/obo/GO_0045202	synapse
http://purl.obolibrary.org/obo/MP_0030802	abnormal tendon physiology	http://purl.obolibrary.org/obo/UBERON_0000043	tendon
http://purl.obolibrary.org/obo/MP_0004884	abnormal testis physiology	http://purl.obolibrary.org/obo/UBERON_0000473	testis
http://purl.obolibrary.org/obo/MP_0003763	abnormal thymus physiology	http://purl.obolibrary.org/obo/UBERON_0002370	thymus
http://purl.obolibrary.org/obo/MP_0002876	abnormal thyroid gland physiology	http://purl.obolibrary.org/obo/UBERON_0002046	thyroid gland
http://purl.obolibrary.org/obo/MP_0020843	abnormal type I cell of carotid body physiology	http://purl.obolibrary.org/obo/CL_0002292	type I cell of carotid body
http://purl.obolibrary.org/obo/MP_0003589	abnormal ureter physiology	http://purl.obolibrary.org/obo/UBERON_0000056	ureter
http://purl.obolibrary.org/obo/MP_0010386	abnormal urinary bladder physiology	http://purl.obolibrary.org/obo/UBERON_0001255	urinary bladder
http://purl.obolibrary.org/obo/MP_0009099	abnormal uterine NK cell physiology	http://purl.obolibrary.org/obo/CL_0002343	decidual natural killer cell, human
http://purl.obolibrary.org/obo/MP_0009671	abnormal uterus physiology	http://purl.obolibrary.org/obo/UBERON_0000995	uterus
http://purl.obolibrary.org/obo/MP_0031162	abnormal vagina physiology	http://purl.obolibrary.org/obo/UBERON_0000996	vagina
http://purl.obolibrary.org/obo/MP_0004003	abnormal vascular endothelial cell physiology	http://purl.obolibrary.org/obo/CL_0000071	blood vessel endothelial cell
http://purl.obolibrary.org/obo/MP_0005595	abnormal vascular smooth muscle physiology	http://purl.obolibrary.org/obo/UBERON_0004237	blood vessel smooth muscle
http://purl.obolibrary.org/obo/MP_0031170	abnormal vasculature physiology	http://purl.obolibrary.org/obo/UBERON_0000055	vessel
http://purl.obolibrary.org/obo/MP_0004438	abnormal vestibular hair cell physiology	http://purl.obolibrary.org/obo/CL_0000609	vestibular hair cell
http://purl.obolibrary.org/obo/MP_0004742	abnormal vestibular system physiology	http://purl.obolibrary.org/obo/UBERON_0004681	vestibular system
http://purl.obolibrary.org/obo/MP_0012028	abnormal visceral endoderm physiology	http://purl.obolibrary.org/obo/UBERON_0004877	visceral endoderm
http://purl.obolibrary.org/obo/MP_0020517	abnormal visceral yolk sac physiology	http://purl.obolibrary.org/obo/UBERON_0008852	visceral yolk sac
http://purl.obolibrary.org/obo/MP_0013596	abnormal vomeronasal organ physiology	http://purl.obolibrary.org/obo/UBERON_0002255	vomeronasal organ
http://purl.obolibrary.org/obo/MP_0011678	abnormal vomeronasal sensory neuron physiology	http://purl.obolibrary.org/obo/CL_1001561	vomeronasal sensory neuron
http://purl.obolibrary.org/obo/MP_0005670	abnormal white adipose tissue physiology	http://purl.obolibrary.org/obo/UBERON_0001347	white adipose tissue
