defined_class	defined_class_label	anatomical_entity	anatomical_entity_label
http://purl.obolibrary.org/obo/XPO_0103005	abnormal oxygen accumulating cell morphology	http://purl.obolibrary.org/obo/XAO_0003262	oxygen accumulating cell
http://purl.obolibrary.org/obo/XPO_0101888	abnormal paired appendage morphology	http://purl.obolibrary.org/obo/XAO_0004283	paired appendage
http://purl.obolibrary.org/obo/XPO_0101774	abnormal paired dorsal aorta morphology	http://purl.obolibrary.org/obo/XAO_0005019	paired dorsal aorta
http://purl.obolibrary.org/obo/XPO_0102823	abnormal palatoquadrate morphology	http://purl.obolibrary.org/obo/XAO_0004218	palatoquadrate
http://purl.obolibrary.org/obo/XPO_0102628	abnormal palatoquadrati morphology	http://purl.obolibrary.org/obo/XAO_0004378	palatoquadrati
http://purl.obolibrary.org/obo/XPO_0101805	abnormal pallidum morphology	http://purl.obolibrary.org/obo/XAO_0004578	pallidum
http://purl.obolibrary.org/obo/XPO_0102174	abnormal pallium morphology	http://purl.obolibrary.org/obo/XAO_0004302	pallium
http://purl.obolibrary.org/obo/XPO_0102240	abnormal pancreas morphology	http://purl.obolibrary.org/obo/XAO_0000136	pancreas
http://purl.obolibrary.org/obo/XPO_0103133	abnormal parabrachial area morphology	http://purl.obolibrary.org/obo/XAO_0005050	parabrachial area
http://purl.obolibrary.org/obo/XPO_0102331	abnormal parachordal morphology	http://purl.obolibrary.org/obo/XAO_0004372	parachordal
http://purl.obolibrary.org/obo/XPO_0103067	abnormal paracrine cell morphology	http://purl.obolibrary.org/obo/XAO_0003263	paracrine cell
http://purl.obolibrary.org/obo/XPO_0102492	abnormal parathyroid morphology	http://purl.obolibrary.org/obo/XAO_0000167	parathyroid
http://purl.obolibrary.org/obo/XPO_0102396	abnormal paraxial mesoderm morphology	http://purl.obolibrary.org/obo/XAO_0000259	paraxial mesoderm
http://purl.obolibrary.org/obo/XPO_0103026	abnormal parotic crest morphology	http://purl.obolibrary.org/obo/XAO_0005147	parotic crest
http://purl.obolibrary.org/obo/XPO_0102123	abnormal pars distalis morphology	http://purl.obolibrary.org/obo/XAO_0005188	pars distalis
http://purl.obolibrary.org/obo/XPO_0103159	abnormal pars externa of the stapes morphology	http://purl.obolibrary.org/obo/XAO_0005141	pars externa of the stapes
http://purl.obolibrary.org/obo/XPO_0102546	abnormal pars intermedia morphology	http://purl.obolibrary.org/obo/XAO_0005190	pars intermedia
http://purl.obolibrary.org/obo/XPO_0102811	abnormal pars interna of the stapes morphology	http://purl.obolibrary.org/obo/XAO_0005143	pars interna of the stapes
http://purl.obolibrary.org/obo/XPO_0103105	abnormal pars media of the stapes morphology	http://purl.obolibrary.org/obo/XAO_0005142	pars media of the stapes
http://purl.obolibrary.org/obo/XPO_0101865	abnormal pars nervosa morphology	http://purl.obolibrary.org/obo/XAO_0005189	pars nervosa
http://purl.obolibrary.org/obo/XPO_0102065	abnormal pectoral appendage morphology	http://purl.obolibrary.org/obo/XAO_0004284	pectoral appendage
http://purl.obolibrary.org/obo/XPO_0102400	abnormal pectoral girdle morphology	http://purl.obolibrary.org/obo/XAO_0003063	pectoral girdle
http://purl.obolibrary.org/obo/XPO_0101887	abnormal pelvic appendage morphology	http://purl.obolibrary.org/obo/XAO_0004285	pelvic appendage
http://purl.obolibrary.org/obo/XPO_0101755	abnormal pelvic girdle morphology	http://purl.obolibrary.org/obo/XAO_0003064	pelvic girdle
http://purl.obolibrary.org/obo/XPO_0101914	abnormal pelvic girdle primordium morphology	http://purl.obolibrary.org/obo/XAO_0004493	pelvic girdle primordium
http://purl.obolibrary.org/obo/XPO_0103081	abnormal pericardial muscle morphology	http://purl.obolibrary.org/obo/XAO_0004183	pericardial muscle
http://purl.obolibrary.org/obo/XPO_0102044	abnormal pericardial roof morphology	http://purl.obolibrary.org/obo/XAO_0004184	pericardial roof
http://purl.obolibrary.org/obo/XPO_0102252	abnormal pericardium morphology	http://purl.obolibrary.org/obo/XAO_0004182	pericardium
http://purl.obolibrary.org/obo/XPO_0102514	abnormal perichondrial cell morphology	http://purl.obolibrary.org/obo/XAO_0004315	perichondrial cell
http://purl.obolibrary.org/obo/XPO_0102010	abnormal perichondrium morphology	http://purl.obolibrary.org/obo/XAO_0004049	perichondrium
http://purl.obolibrary.org/obo/XPO_0102980	abnormal perichordal tissue morphology	http://purl.obolibrary.org/obo/XAO_0004050	perichordal tissue
http://purl.obolibrary.org/obo/XPO_0102109	abnormal pericyte morphology	http://purl.obolibrary.org/obo/XAO_0003264	pericyte
http://purl.obolibrary.org/obo/XPO_0141280	abnormal periocular mesenchyme morphology	http://purl.obolibrary.org/obo/XAO_0005316	periocular mesenchyme
http://purl.obolibrary.org/obo/XPO_0102296	abnormal periocular region morphology	http://purl.obolibrary.org/obo/XAO_0004089	periocular region
http://purl.obolibrary.org/obo/XPO_0102489	abnormal periosteum (sensu fibrous layer) morphology	http://purl.obolibrary.org/obo/XAO_0004504	periosteum (sensu fibrous layer)
http://purl.obolibrary.org/obo/XPO_0102245	abnormal periosteum (sensu osteogenic layer) morphology	http://purl.obolibrary.org/obo/XAO_0004505	periosteum (sensu osteogenic layer)
http://purl.obolibrary.org/obo/XPO_0102011	abnormal periosteum morphology	http://purl.obolibrary.org/obo/XAO_0004503	periosteum
http://purl.obolibrary.org/obo/XPO_0102319	abnormal periotic region morphology	http://purl.obolibrary.org/obo/XAO_0004474	periotic region
http://purl.obolibrary.org/obo/XPO_0107344	abnormal peripheral ganglion morphology	http://purl.obolibrary.org/obo/XAO_0005199	peripheral ganglion
http://purl.obolibrary.org/obo/XPO_0102836	abnormal peripheral nerve morphology	http://purl.obolibrary.org/obo/XAO_0000204	peripheral nerve
http://purl.obolibrary.org/obo/XPO_0101746	abnormal peripheral nervous system morphology	http://purl.obolibrary.org/obo/XAO_0000178	peripheral nervous system
http://purl.obolibrary.org/obo/XPO_0103186	abnormal peripheral retina morphology	http://purl.obolibrary.org/obo/XAO_0004458	peripheral retina
http://purl.obolibrary.org/obo/XPO_0103205	abnormal peripheral vegetal yolk mass morphology	http://purl.obolibrary.org/obo/XAO_0004384	peripheral vegetal yolk mass
http://purl.obolibrary.org/obo/XPO_0102253	abnormal peritoneum morphology	http://purl.obolibrary.org/obo/XAO_0000139	peritoneum
http://purl.obolibrary.org/obo/XPO_0103041	abnormal perivitelline space morphology	http://purl.obolibrary.org/obo/XAO_0000260	perivitelline space
http://purl.obolibrary.org/obo/XPO_0102223	abnormal pharyngeal arch morphology	http://purl.obolibrary.org/obo/XAO_0000096	pharyngeal arch
http://purl.obolibrary.org/obo/XPO_0102522	abnormal pharyngeal cavity morphology	http://purl.obolibrary.org/obo/XAO_0000105	pharyngeal cavity
http://purl.obolibrary.org/obo/XPO_0102006	abnormal pharyngeal endoderm morphology	http://purl.obolibrary.org/obo/XAO_0004463	pharyngeal endoderm
http://purl.obolibrary.org/obo/XPO_0102961	abnormal pharyngeal epithelium morphology	http://purl.obolibrary.org/obo/XAO_0003202	pharyngeal epithelium
http://purl.obolibrary.org/obo/XPO_0102735	abnormal pharyngeal mesenchyme morphology	http://purl.obolibrary.org/obo/XAO_0004524	pharyngeal mesenchyme
http://purl.obolibrary.org/obo/XPO_0102804	abnormal pharyngeal pouch morphology	http://purl.obolibrary.org/obo/XAO_0004260	pharyngeal pouch
http://purl.obolibrary.org/obo/XPO_0102259	abnormal pharyngeal region morphology	http://purl.obolibrary.org/obo/XAO_0004261	pharyngeal region
http://purl.obolibrary.org/obo/XPO_0102668	abnormal pharynx morphology	http://purl.obolibrary.org/obo/XAO_0003227	pharynx
http://purl.obolibrary.org/obo/XPO_0101861	abnormal photoreceptor layer morphology	http://purl.obolibrary.org/obo/XAO_0003215	photoreceptor layer
http://purl.obolibrary.org/obo/XPO_0141304	abnormal pia mater morphology	http://purl.obolibrary.org/obo/XAO_0005289	pia mater
http://purl.obolibrary.org/obo/XPO_0141301	abnormal pial cell morphology	http://purl.obolibrary.org/obo/XAO_0005288	pial cell
http://purl.obolibrary.org/obo/XPO_0102910	abnormal pigment cell morphology	http://purl.obolibrary.org/obo/XAO_0003014	pigment cell
http://purl.obolibrary.org/obo/XPO_0102942	abnormal pigment layer morphology	http://purl.obolibrary.org/obo/XAO_0000261	pigment layer
http://purl.obolibrary.org/obo/XPO_0102700	abnormal pineal gland morphology	http://purl.obolibrary.org/obo/XAO_0000160	pineal gland
http://purl.obolibrary.org/obo/XPO_0102632	abnormal planum hypobranchiale morphology	http://purl.obolibrary.org/obo/XAO_0004374	planum hypobranchiale
http://purl.obolibrary.org/obo/XPO_0102209	abnormal planum trabeculare anticum morphology	http://purl.obolibrary.org/obo/XAO_0004375	planum trabeculare anticum
http://purl.obolibrary.org/obo/XPO_0102693	abnormal plasma membrane morphology	http://purl.obolibrary.org/obo/XAO_0005154	plasma membrane
http://purl.obolibrary.org/obo/XPO_0103049	abnormal podocyte morphology	http://purl.obolibrary.org/obo/XAO_0003206	podocyte
http://purl.obolibrary.org/obo/XPO_0102270	abnormal polar body morphology	http://purl.obolibrary.org/obo/XAO_0000262	polar body
http://purl.obolibrary.org/obo/XPO_0101976	abnormal portion of organism substance morphology	http://purl.obolibrary.org/obo/XAO_0004001	portion of organism substance
http://purl.obolibrary.org/obo/XPO_0103188	abnormal post-anal gut morphology	http://purl.obolibrary.org/obo/XAO_0000106	post-anal gut
http://purl.obolibrary.org/obo/XPO_0102962	abnormal postcaval vein morphology	http://purl.obolibrary.org/obo/XAO_0004253	postcaval vein
http://purl.obolibrary.org/obo/XPO_0102461	abnormal postcranial axial skeleton morphology	http://purl.obolibrary.org/obo/XAO_0003073	postcranial axial skeleton
http://purl.obolibrary.org/obo/XPO_0102656	abnormal posterior branchial crest morphology	http://purl.obolibrary.org/obo/XAO_0004188	posterior branchial crest
http://purl.obolibrary.org/obo/XPO_0102712	abnormal posterior cardinal vein morphology	http://purl.obolibrary.org/obo/XAO_0000241	posterior cardinal vein
http://purl.obolibrary.org/obo/XPO_0102409	abnormal posterior cerebral vein morphology	http://purl.obolibrary.org/obo/XAO_0004159	posterior cerebral vein
http://purl.obolibrary.org/obo/XPO_0102898	abnormal posterior commissure morphology	http://purl.obolibrary.org/obo/XAO_0004579	posterior commissure
http://purl.obolibrary.org/obo/XPO_0101896	abnormal posterior crista morphology	http://purl.obolibrary.org/obo/XAO_0004133	posterior crista
http://purl.obolibrary.org/obo/XPO_0141291	abnormal posterior endoderm morphology	http://purl.obolibrary.org/obo/XAO_0005302	posterior endoderm
http://purl.obolibrary.org/obo/XPO_0141306	abnormal posterior endomesoderm morphology	http://purl.obolibrary.org/obo/XAO_0005307	posterior endomesoderm
http://purl.obolibrary.org/obo/XPO_0102733	abnormal posterior foregut morphology	http://purl.obolibrary.org/obo/XAO_0005128	posterior foregut
http://purl.obolibrary.org/obo/XPO_0107394	abnormal posterior hindgut endoderm morphology	http://purl.obolibrary.org/obo/XAO_0005250	posterior hindgut endoderm
http://purl.obolibrary.org/obo/XPO_0102925	abnormal posterior hypothalamus morphology	http://purl.obolibrary.org/obo/XAO_0004236	posterior hypothalamus
http://purl.obolibrary.org/obo/XPO_0102300	abnormal posterior lateral line ganglion morphology	http://purl.obolibrary.org/obo/XAO_0004422	posterior lateral line ganglion
http://purl.obolibrary.org/obo/XPO_0103198	abnormal posterior lateral line morphology	http://purl.obolibrary.org/obo/XAO_0004268	posterior lateral line
http://purl.obolibrary.org/obo/XPO_0102930	abnormal posterior lateral line placode morphology	http://purl.obolibrary.org/obo/XAO_0004223	posterior lateral line placode
http://purl.obolibrary.org/obo/XPO_0107386	abnormal posterior neural fold morphology	http://purl.obolibrary.org/obo/XAO_0005242	posterior neural fold
http://purl.obolibrary.org/obo/XPO_0102419	abnormal posterior neural tube morphology	http://purl.obolibrary.org/obo/XAO_0000250	posterior neural tube
http://purl.obolibrary.org/obo/XPO_0141723	abnormal posterior notochord morphology	http://purl.obolibrary.org/obo/XAO_0005424	posterior notochord
http://purl.obolibrary.org/obo/XPO_0102503	abnormal posterior palatine artery morphology	http://purl.obolibrary.org/obo/XAO_0000354	posterior palatine artery
http://purl.obolibrary.org/obo/XPO_0102487	abnormal posterior placodal area morphology	http://purl.obolibrary.org/obo/XAO_0004207	posterior placodal area
http://purl.obolibrary.org/obo/XPO_0102134	abnormal posterior semicircular canal morphology	http://purl.obolibrary.org/obo/XAO_0005042	posterior semicircular canal
http://purl.obolibrary.org/obo/XPO_0107352	abnormal posterior side morphology	http://purl.obolibrary.org/obo/XAO_0005207	posterior side
http://purl.obolibrary.org/obo/XPO_0107405	abnormal posterior tail morphology	http://purl.obolibrary.org/obo/XAO_0005261	posterior tail
http://purl.obolibrary.org/obo/XPO_0103016	abnormal posterior tectum morphology	http://purl.obolibrary.org/obo/XAO_0004515	posterior tectum
http://purl.obolibrary.org/obo/XPO_0103157	abnormal posterior vena cava morphology	http://purl.obolibrary.org/obo/XAO_0000388	posterior vena cava
http://purl.obolibrary.org/obo/XPO_0102820	abnormal posterior ventral blood island morphology	http://purl.obolibrary.org/obo/XAO_0004628	posterior ventral blood island
http://purl.obolibrary.org/obo/XPO_0102427	abnormal posterior wall of neurenteric canal morphology	http://purl.obolibrary.org/obo/XAO_0000109	posterior wall of neurenteric canal
http://purl.obolibrary.org/obo/XPO_0102969	abnormal posterior-proximal mesenchyme morphology	http://purl.obolibrary.org/obo/XAO_0004409	posterior-proximal mesenchyme
http://purl.obolibrary.org/obo/XPO_0103055	abnormal posterodorsal tegmental nucleus morphology	http://purl.obolibrary.org/obo/XAO_0004581	posterodorsal tegmental nucleus
http://purl.obolibrary.org/obo/XPO_0102287	abnormal posteroventral tegmental nucleus morphology	http://purl.obolibrary.org/obo/XAO_0004582	posteroventral tegmental nucleus
http://purl.obolibrary.org/obo/XPO_0102592	abnormal postmigratory neural crest cell morphology	http://purl.obolibrary.org/obo/XAO_0004309	postmigratory neural crest cell
http://purl.obolibrary.org/obo/XPO_0102858	abnormal postsacral vertebra morphology	http://purl.obolibrary.org/obo/XAO_0004499	postsacral vertebra
http://purl.obolibrary.org/obo/XPO_0102737	abnormal pre-chordal neural plate border morphology	http://purl.obolibrary.org/obo/XAO_0004102	pre-chordal neural plate border
http://purl.obolibrary.org/obo/XPO_0102341	abnormal pre-chordal neural plate morphology	http://purl.obolibrary.org/obo/XAO_0000045	pre-chordal neural plate
http://purl.obolibrary.org/obo/XPO_0102278	abnormal pre-dentine morphology	http://purl.obolibrary.org/obo/XAO_0004052	pre-dentine
http://purl.obolibrary.org/obo/XPO_0102543	abnormal pre-enamel morphology	http://purl.obolibrary.org/obo/XAO_0004202	pre-enamel
http://purl.obolibrary.org/obo/XPO_0102841	abnormal pre-enameloid morphology	http://purl.obolibrary.org/obo/XAO_0004203	pre-enameloid
http://purl.obolibrary.org/obo/XPO_0102237	abnormal prechordal plate morphology	http://purl.obolibrary.org/obo/XAO_0000079	prechordal plate
http://purl.obolibrary.org/obo/XPO_0101830	abnormal prehallux morphology	http://purl.obolibrary.org/obo/XAO_0005161	prehallux
http://purl.obolibrary.org/obo/XPO_0102798	abnormal premigratory neural crest cell morphology	http://purl.obolibrary.org/obo/XAO_0004522	premigratory neural crest cell
http://purl.obolibrary.org/obo/XPO_0101826	abnormal preoptic area morphology	http://purl.obolibrary.org/obo/XAO_0004583	preoptic area
http://purl.obolibrary.org/obo/XPO_0102037	abnormal preplacodal ectoderm morphology	http://purl.obolibrary.org/obo/XAO_0004092	preplacodal ectoderm
http://purl.obolibrary.org/obo/XPO_0102774	abnormal prepollex morphology	http://purl.obolibrary.org/obo/XAO_0005160	prepollex
http://purl.obolibrary.org/obo/XPO_0102527	abnormal presacral vertebra morphology	http://purl.obolibrary.org/obo/XAO_0003077	presacral vertebra
http://purl.obolibrary.org/obo/XPO_0102039	abnormal presomitic mesoderm morphology	http://purl.obolibrary.org/obo/XAO_0000057	presomitic mesoderm
http://purl.obolibrary.org/obo/XPO_0102418	abnormal presumptive axial mesoderm morphology	http://purl.obolibrary.org/obo/XAO_0004406	presumptive axial mesoderm
http://purl.obolibrary.org/obo/XPO_0102413	abnormal presumptive ectoderm morphology	http://purl.obolibrary.org/obo/XAO_0004132	presumptive ectoderm
http://purl.obolibrary.org/obo/XPO_0102490	abnormal presumptive midbrain-hindbrain boundary morphology	http://purl.obolibrary.org/obo/XAO_0004086	presumptive midbrain-hindbrain boundary
http://purl.obolibrary.org/obo/XPO_0102447	abnormal presumptive paraxial mesoderm morphology	http://purl.obolibrary.org/obo/XAO_0004134	presumptive paraxial mesoderm
http://purl.obolibrary.org/obo/XPO_0101794	abnormal presumptive rhombomere morphology	http://purl.obolibrary.org/obo/XAO_0005026	presumptive rhombomere
http://purl.obolibrary.org/obo/XPO_0102395	abnormal pretectum morphology	http://purl.obolibrary.org/obo/XAO_0004303	pretectum
http://purl.obolibrary.org/obo/XPO_0102603	abnormal prethalamus basal plate morphology	http://purl.obolibrary.org/obo/XAO_0005049	prethalamus basal plate
http://purl.obolibrary.org/obo/XPO_0101895	abnormal prethalamus morphology	http://purl.obolibrary.org/obo/XAO_0004304	prethalamus
http://purl.obolibrary.org/obo/XPO_0101778	abnormal primary germ layer morphology	http://purl.obolibrary.org/obo/XAO_0003011	primary germ layer
http://purl.obolibrary.org/obo/XPO_0102758	abnormal primary heart field morphology	http://purl.obolibrary.org/obo/XAO_0004185	primary heart field
http://purl.obolibrary.org/obo/XPO_0102260	abnormal primary oogonium morphology	http://purl.obolibrary.org/obo/XAO_0000263	primary oogonium
http://purl.obolibrary.org/obo/XPO_0102298	abnormal primary spermatogonium morphology	http://purl.obolibrary.org/obo/XAO_0003018	primary spermatogonium
http://purl.obolibrary.org/obo/XPO_0102189	abnormal prime meridian morphology	http://purl.obolibrary.org/obo/XAO_0005121	prime meridian
http://purl.obolibrary.org/obo/XPO_0102258	abnormal primordial germ cell morphology	http://purl.obolibrary.org/obo/XAO_0003149	primordial germ cell
http://purl.obolibrary.org/obo/XPO_0101783	abnormal primordium morphology	http://purl.obolibrary.org/obo/XAO_0003043	primordium
http://purl.obolibrary.org/obo/XPO_0102548	abnormal principal cavity morphology	http://purl.obolibrary.org/obo/XAO_0004526	principal cavity
http://purl.obolibrary.org/obo/XPO_0102055	abnormal process morphology	http://purl.obolibrary.org/obo/XAO_0004020	process
http://purl.obolibrary.org/obo/XPO_0103060	abnormal processus anterior hyalis morphology	http://purl.obolibrary.org/obo/XAO_0004369	processus anterior hyalis
http://purl.obolibrary.org/obo/XPO_0102940	abnormal processus articularis palatoquadrati morphology	http://purl.obolibrary.org/obo/XAO_0004370	processus articularis palatoquadrati
http://purl.obolibrary.org/obo/XPO_0102952	abnormal processus ascendens palatoquadrate morphology	http://purl.obolibrary.org/obo/XAO_0004371	processus ascendens palatoquadrate
http://purl.obolibrary.org/obo/XPO_0102110	abnormal processus lateralis hyalis morphology	http://purl.obolibrary.org/obo/XAO_0004373	processus lateralis hyalis
http://purl.obolibrary.org/obo/XPO_0102160	abnormal processus muscularis palatoquadrati morphology	http://purl.obolibrary.org/obo/XAO_0004376	processus muscularis palatoquadrati
http://purl.obolibrary.org/obo/XPO_0103137	abnormal processus posterior hyalis morphology	http://purl.obolibrary.org/obo/XAO_0004377	processus posterior hyalis
http://purl.obolibrary.org/obo/XPO_0102337	abnormal processus retroarticularis of Meckel's cartilage morphology	http://purl.obolibrary.org/obo/XAO_0004379	processus retroarticularis of Meckel's cartilage
http://purl.obolibrary.org/obo/XPO_0103233	abnormal proctodeum morphology	http://purl.obolibrary.org/obo/XAO_0001019	proctodeum
http://purl.obolibrary.org/obo/XPO_0102069	abnormal proepicardium morphology	http://purl.obolibrary.org/obo/XAO_0005062	proepicardium
http://purl.obolibrary.org/obo/XPO_0102372	abnormal profundal placode morphology	http://purl.obolibrary.org/obo/XAO_0004093	profundal placode
http://purl.obolibrary.org/obo/XPO_0102405	abnormal profundus ganglion morphology	http://purl.obolibrary.org/obo/XAO_0000323	profundus ganglion
http://purl.obolibrary.org/obo/XPO_0101917	abnormal progenitor cell morphology	http://purl.obolibrary.org/obo/XAO_0005033	progenitor cell
http://purl.obolibrary.org/obo/XPO_0102163	abnormal proliferative region morphology	http://purl.obolibrary.org/obo/XAO_0004122	proliferative region
http://purl.obolibrary.org/obo/XPO_0101924	abnormal pronephric duct morphology	http://purl.obolibrary.org/obo/XAO_0000063	pronephric duct
http://purl.obolibrary.org/obo/XPO_0102197	abnormal pronephric kidney morphology	http://purl.obolibrary.org/obo/XAO_0002000	pronephric kidney
http://purl.obolibrary.org/obo/XPO_0101965	abnormal pronephric mesenchyme morphology	http://purl.obolibrary.org/obo/XAO_0000264	pronephric mesenchyme
http://purl.obolibrary.org/obo/XPO_0102582	abnormal pronephric nephron morphology	http://purl.obolibrary.org/obo/XAO_0000285	pronephric nephron
http://purl.obolibrary.org/obo/XPO_0102132	abnormal pronephric nephrostome morphology	http://purl.obolibrary.org/obo/XAO_0000062	pronephric nephrostome
http://purl.obolibrary.org/obo/XPO_0103182	abnormal pronephric sinus morphology	http://purl.obolibrary.org/obo/XAO_0000385	pronephric sinus
http://purl.obolibrary.org/obo/XPO_0102467	abnormal pronephric tubule morphology	http://purl.obolibrary.org/obo/XAO_0004105	pronephric tubule
http://purl.obolibrary.org/obo/XPO_0141278	abnormal prootic bone morphology	http://purl.obolibrary.org/obo/XAO_0005314	prootic bone
http://purl.obolibrary.org/obo/XPO_0103227	abnormal prosomere 4 morphology	http://purl.obolibrary.org/obo/XAO_0004599	prosomere 4
http://purl.obolibrary.org/obo/XPO_0103200	abnormal prosomere 5 morphology	http://purl.obolibrary.org/obo/XAO_0004600	prosomere 5
http://purl.obolibrary.org/obo/XPO_0102978	abnormal prosomere 6 morphology	http://purl.obolibrary.org/obo/XAO_0004601	prosomere 6
http://purl.obolibrary.org/obo/XPO_0102282	abnormal prosomere morphology	http://purl.obolibrary.org/obo/XAO_0004598	prosomere
http://purl.obolibrary.org/obo/XPO_0101883	abnormal proteinaceous extracellular matrix morphology	http://purl.obolibrary.org/obo/XAO_0004032	proteinaceous extracellular matrix
http://purl.obolibrary.org/obo/XPO_0102045	abnormal proximal mesenchyme morphology	http://purl.obolibrary.org/obo/XAO_0004407	proximal mesenchyme
http://purl.obolibrary.org/obo/XPO_0102023	abnormal proximal stomach morphology	http://purl.obolibrary.org/obo/XAO_0005129	proximal stomach
http://purl.obolibrary.org/obo/XPO_0102807	abnormal proximal tubule branch morphology	http://purl.obolibrary.org/obo/XAO_0004520	proximal tubule branch
http://purl.obolibrary.org/obo/XPO_0102647	abnormal proximal tubule morphology	http://purl.obolibrary.org/obo/XAO_0004518	proximal tubule
http://purl.obolibrary.org/obo/XPO_0107357	abnormal proximal-distal axis morphology	http://purl.obolibrary.org/obo/XAO_0005212	proximal-distal axis
http://purl.obolibrary.org/obo/XPO_0102428	abnormal pseudoblastema morphology	http://purl.obolibrary.org/obo/XAO_0004402	pseudoblastema
http://purl.obolibrary.org/obo/XPO_0102905	abnormal pubis morphology	http://purl.obolibrary.org/obo/XAO_0004498	pubis
http://purl.obolibrary.org/obo/XPO_0101842	abnormal pulmonary artery morphology	http://purl.obolibrary.org/obo/XAO_0004162	pulmonary artery
http://purl.obolibrary.org/obo/XPO_0102502	abnormal pulmonary epithelium morphology	http://purl.obolibrary.org/obo/XAO_0005124	pulmonary epithelium
http://purl.obolibrary.org/obo/XPO_0103180	abnormal pulmonary vein morphology	http://purl.obolibrary.org/obo/XAO_0000394	pulmonary vein
http://purl.obolibrary.org/obo/XPO_0103210	abnormal pupil morphology	http://purl.obolibrary.org/obo/XAO_0000283	pupil
http://purl.obolibrary.org/obo/XPO_0103171	abnormal pyloric sphincter morphology	http://purl.obolibrary.org/obo/XAO_0000457	pyloric sphincter
http://purl.obolibrary.org/obo/XPO_0102721	abnormal pylorus morphology	http://purl.obolibrary.org/obo/XAO_0005158	pylorus
http://purl.obolibrary.org/obo/XPO_0102757	abnormal radial glial cell morphology	http://purl.obolibrary.org/obo/XAO_0005031	radial glial cell
http://purl.obolibrary.org/obo/XPO_0102031	abnormal radio-ulna morphology	http://purl.obolibrary.org/obo/XAO_0003209	radio-ulna
http://purl.obolibrary.org/obo/XPO_0103231	abnormal raphe nucleus morphology	http://purl.obolibrary.org/obo/XAO_0004584	raphe nucleus
http://purl.obolibrary.org/obo/XPO_0102407	abnormal rectal diverticulum morphology	http://purl.obolibrary.org/obo/XAO_0001015	rectal diverticulum
http://purl.obolibrary.org/obo/XPO_0103103	abnormal rectum morphology	http://purl.obolibrary.org/obo/XAO_0000238	rectum
http://purl.obolibrary.org/obo/XPO_0103000	abnormal regenerating eye morphology	http://purl.obolibrary.org/obo/XAO_0004109	regenerating eye
http://purl.obolibrary.org/obo/XPO_0102382	abnormal regenerating fin morphology	http://purl.obolibrary.org/obo/XAO_0004312	regenerating fin
http://purl.obolibrary.org/obo/XPO_0102574	abnormal regenerating forelimb morphology	http://purl.obolibrary.org/obo/XAO_0004106	regenerating forelimb
http://purl.obolibrary.org/obo/XPO_0102813	abnormal regenerating hindlimb morphology	http://purl.obolibrary.org/obo/XAO_0004107	regenerating hindlimb
http://purl.obolibrary.org/obo/XPO_0107384	abnormal regenerating lens morphology	http://purl.obolibrary.org/obo/XAO_0005240	regenerating lens
