defined_class	defined_class_label	anatomical_entity	anatomical_entity_label
http://purl.obolibrary.org/obo/XPO_0102416	abnormal left blastomere morphology	http://purl.obolibrary.org/obo/XAO_0005172	left blastomere
http://purl.obolibrary.org/obo/XPO_0102311	abnormal left channel of ventral aorta morphology	http://purl.obolibrary.org/obo/XAO_0000339	left channel of ventral aorta
http://purl.obolibrary.org/obo/XPO_0102172	abnormal left lymph heart morphology	http://purl.obolibrary.org/obo/XAO_0000372	left lymph heart
http://purl.obolibrary.org/obo/XPO_0102987	abnormal left omphalomesenteric vein morphology	http://purl.obolibrary.org/obo/XAO_0004166	left omphalomesenteric vein
http://purl.obolibrary.org/obo/XPO_0107355	abnormal left side morphology	http://purl.obolibrary.org/obo/XAO_0005210	left side
http://purl.obolibrary.org/obo/XPO_0102964	abnormal left spleen primordium morphology	http://purl.obolibrary.org/obo/XAO_0000326	left spleen primordium
http://purl.obolibrary.org/obo/XPO_0103230	abnormal left ventricle morphology	http://purl.obolibrary.org/obo/XAO_0004610	left ventricle
http://purl.obolibrary.org/obo/XPO_0102474	abnormal left-dorsal blastomere morphology	http://purl.obolibrary.org/obo/XAO_0005174	left-dorsal blastomere
http://purl.obolibrary.org/obo/XPO_0107349	abnormal left-right axis morphology	http://purl.obolibrary.org/obo/XAO_0005204	left-right axis
http://purl.obolibrary.org/obo/XPO_0103071	abnormal left-right organizer morphology	http://purl.obolibrary.org/obo/XAO_0005170	left-right organizer
http://purl.obolibrary.org/obo/XPO_0102537	abnormal left-right organizer primordium morphology	http://purl.obolibrary.org/obo/XAO_0005169	left-right organizer primordium
http://purl.obolibrary.org/obo/XPO_0102915	abnormal left-ventral blastomere morphology	http://purl.obolibrary.org/obo/XAO_0005176	left-ventral blastomere
http://purl.obolibrary.org/obo/XPO_0101823	abnormal lens epithelium morphology	http://purl.obolibrary.org/obo/XAO_0004094	lens epithelium
http://purl.obolibrary.org/obo/XPO_0103110	abnormal lens fiber cell mass morphology	http://purl.obolibrary.org/obo/XAO_0004096	lens fiber cell mass
http://purl.obolibrary.org/obo/XPO_0102550	abnormal lens morphology	http://purl.obolibrary.org/obo/XAO_0000008	lens
http://purl.obolibrary.org/obo/XPO_0102111	abnormal lens placode morphology	http://purl.obolibrary.org/obo/XAO_0000240	lens placode
http://purl.obolibrary.org/obo/XPO_0102476	abnormal lens transitional zone morphology	http://purl.obolibrary.org/obo/XAO_0004095	lens transitional zone
http://purl.obolibrary.org/obo/XPO_0102625	abnormal ligament cell morphology	http://purl.obolibrary.org/obo/XAO_0003253	ligament cell
http://purl.obolibrary.org/obo/XPO_0102048	abnormal ligament morphology	http://purl.obolibrary.org/obo/XAO_0004031	ligament
http://purl.obolibrary.org/obo/XPO_0102098	abnormal limb bud morphology	http://purl.obolibrary.org/obo/XAO_0003161	limb bud
http://purl.obolibrary.org/obo/XPO_0102018	abnormal limb morphology	http://purl.obolibrary.org/obo/XAO_0003027	limb
http://purl.obolibrary.org/obo/XPO_0101837	abnormal limb segment morphology	http://purl.obolibrary.org/obo/XAO_0004294	limb segment
http://purl.obolibrary.org/obo/XPO_0102125	abnormal liver and biliary system morphology	http://purl.obolibrary.org/obo/XAO_0000132	liver and biliary system
http://purl.obolibrary.org/obo/XPO_0102126	abnormal liver diverticulum morphology	http://purl.obolibrary.org/obo/XAO_0000101	liver diverticulum
http://purl.obolibrary.org/obo/XPO_0102426	abnormal liver morphology	http://purl.obolibrary.org/obo/XAO_0000133	liver
http://purl.obolibrary.org/obo/XPO_0103168	abnormal liver parenchyme morphology	http://purl.obolibrary.org/obo/XAO_0000454	liver parenchyme
http://purl.obolibrary.org/obo/XPO_0102498	abnormal liver primordium morphology	http://purl.obolibrary.org/obo/XAO_0003266	liver primordium
http://purl.obolibrary.org/obo/XPO_0102250	abnormal locus coeruleus morphology	http://purl.obolibrary.org/obo/XAO_0004566	locus coeruleus
http://purl.obolibrary.org/obo/XPO_0102437	abnormal lower blastopore lip morphology	http://purl.obolibrary.org/obo/XAO_0000089	lower blastopore lip
http://purl.obolibrary.org/obo/XPO_0102723	abnormal lower eyelid morphology	http://purl.obolibrary.org/obo/XAO_0000007	lower eyelid
http://purl.obolibrary.org/obo/XPO_0101659	abnormal lower jaw morphology	http://purl.obolibrary.org/obo/XAO_0003084	lower jaw
http://purl.obolibrary.org/obo/XPO_0102086	abnormal lung bud morphology	http://purl.obolibrary.org/obo/XAO_0005140	lung bud
http://purl.obolibrary.org/obo/XPO_0102932	abnormal lung morphology	http://purl.obolibrary.org/obo/XAO_0000119	lung
http://purl.obolibrary.org/obo/XPO_0102294	abnormal lung primordium morphology	http://purl.obolibrary.org/obo/XAO_0001002	lung primordium
http://purl.obolibrary.org/obo/XPO_0102554	abnormal lymph vessel morphology	http://purl.obolibrary.org/obo/XAO_0000375	lymph vessel
http://purl.obolibrary.org/obo/XPO_0101864	abnormal lymphatic system morphology	http://purl.obolibrary.org/obo/XAO_0003199	lymphatic system
http://purl.obolibrary.org/obo/XPO_0141503	abnormal lymphoblast morphology	http://purl.obolibrary.org/obo/XAO_0005323	lymphoblast
http://purl.obolibrary.org/obo/XPO_0102081	abnormal lymphocyte morphology	http://purl.obolibrary.org/obo/XAO_0003155	lymphocyte
http://purl.obolibrary.org/obo/XPO_0102658	abnormal m. constrictor laryngis morphology	http://purl.obolibrary.org/obo/XAO_0004349	m. constrictor laryngis
http://purl.obolibrary.org/obo/XPO_0102246	abnormal m. constrictor laryngis primordium morphology	http://purl.obolibrary.org/obo/XAO_0004446	m. constrictor laryngis primordium
http://purl.obolibrary.org/obo/XPO_0102796	abnormal m. cucullaris morphology	http://purl.obolibrary.org/obo/XAO_0005152	m. cucullaris
http://purl.obolibrary.org/obo/XPO_0102511	abnormal m. depressor mandibulae morphology	http://purl.obolibrary.org/obo/XAO_0005148	m. depressor mandibulae
http://purl.obolibrary.org/obo/XPO_0102893	abnormal m. dilatator laryngis morphology	http://purl.obolibrary.org/obo/XAO_0004350	m. dilatator laryngis
http://purl.obolibrary.org/obo/XPO_0102175	abnormal m. dilatator laryngis primordium morphology	http://purl.obolibrary.org/obo/XAO_0004447	m. dilatator laryngis primordium
http://purl.obolibrary.org/obo/XPO_0103027	abnormal m. geniohyoideus morphology	http://purl.obolibrary.org/obo/XAO_0004127	m. geniohyoideus
http://purl.obolibrary.org/obo/XPO_0102236	abnormal m. geniohyoideus primordium morphology	http://purl.obolibrary.org/obo/XAO_0004444	m. geniohyoideus primordium
http://purl.obolibrary.org/obo/XPO_0103036	abnormal m. interhyoideus morphology	http://purl.obolibrary.org/obo/XAO_0004336	m. interhyoideus
http://purl.obolibrary.org/obo/XPO_0101963	abnormal m. interhyoideus primordium morphology	http://purl.obolibrary.org/obo/XAO_0004433	m. interhyoideus primordium
http://purl.obolibrary.org/obo/XPO_0102989	abnormal m. intermandibularis morphology	http://purl.obolibrary.org/obo/XAO_0004333	m. intermandibularis
http://purl.obolibrary.org/obo/XPO_0102687	abnormal m. intermandibularis primordium morphology	http://purl.obolibrary.org/obo/XAO_0004430	m. intermandibularis primordium
http://purl.obolibrary.org/obo/XPO_0102406	abnormal m. levator mandibulae articularis morphology	http://purl.obolibrary.org/obo/XAO_0004331	m. levator mandibulae articularis
http://purl.obolibrary.org/obo/XPO_0102269	abnormal m. levator mandibulae articularis primordium morphology	http://purl.obolibrary.org/obo/XAO_0004428	m. levator mandibulae articularis primordium
http://purl.obolibrary.org/obo/XPO_0102560	abnormal m. levator mandibulae externus morphology	http://purl.obolibrary.org/obo/XAO_0004332	m. levator mandibulae externus
http://purl.obolibrary.org/obo/XPO_0102088	abnormal m. levator mandibulae externus primordium morphology	http://purl.obolibrary.org/obo/XAO_0004429	m. levator mandibulae externus primordium
http://purl.obolibrary.org/obo/XPO_0103183	abnormal m. levator mandibulae longus internus morphology	http://purl.obolibrary.org/obo/XAO_0004328	m. levator mandibulae longus internus
http://purl.obolibrary.org/obo/XPO_0102002	abnormal m. levator mandibulae longus internus primordium morphology	http://purl.obolibrary.org/obo/XAO_0004425	m. levator mandibulae longus internus primordium
http://purl.obolibrary.org/obo/XPO_0102810	abnormal m. levator mandibulae longus profundus morphology	http://purl.obolibrary.org/obo/XAO_0004329	m. levator mandibulae longus profundus
http://purl.obolibrary.org/obo/XPO_0102022	abnormal m. levator mandibulae longus profundus primordium morphology	http://purl.obolibrary.org/obo/XAO_0004426	m. levator mandibulae longus profundus primordium
http://purl.obolibrary.org/obo/XPO_0102012	abnormal m. levator mandibulae longus superficialis morphology	http://purl.obolibrary.org/obo/XAO_0004330	m. levator mandibulae longus superficialis
http://purl.obolibrary.org/obo/XPO_0102508	abnormal m. levator mandibulae longus superior primordium morphology	http://purl.obolibrary.org/obo/XAO_0004427	m. levator mandibulae longus superior primordium
http://purl.obolibrary.org/obo/XPO_0102310	abnormal m. levator scapulae inferior morphology	http://purl.obolibrary.org/obo/XAO_0005150	m. levator scapulae inferior
http://purl.obolibrary.org/obo/XPO_0103050	abnormal m. levator scapulae superior morphology	http://purl.obolibrary.org/obo/XAO_0005149	m. levator scapulae superior
http://purl.obolibrary.org/obo/XPO_0102609	abnormal m. obliquus inferior morphology	http://purl.obolibrary.org/obo/XAO_0004356	m. obliquus inferior
http://purl.obolibrary.org/obo/XPO_0102857	abnormal m. obliquus inferior primordium morphology	http://purl.obolibrary.org/obo/XAO_0004453	m. obliquus inferior primordium
http://purl.obolibrary.org/obo/XPO_0102809	abnormal m. obliquus superior morphology	http://purl.obolibrary.org/obo/XAO_0004357	m. obliquus superior
http://purl.obolibrary.org/obo/XPO_0101954	abnormal m. obliquus superior primordium morphology	http://purl.obolibrary.org/obo/XAO_0004454	m. obliquus superior primordium
http://purl.obolibrary.org/obo/XPO_0103087	abnormal m. orbitohyoideus morphology	http://purl.obolibrary.org/obo/XAO_0004335	m. orbitohyoideus
http://purl.obolibrary.org/obo/XPO_0102184	abnormal m. orbitohyoideus primordium morphology	http://purl.obolibrary.org/obo/XAO_0004432	m. orbitohyoideus primordium
http://purl.obolibrary.org/obo/XPO_0102580	abnormal m. petrohyoideus morphology	http://purl.obolibrary.org/obo/XAO_0005151	m. petrohyoideus
http://purl.obolibrary.org/obo/XPO_0103079	abnormal m. quadrato-hyoangularis morphology	http://purl.obolibrary.org/obo/XAO_0004334	m. quadrato-hyoangularis
http://purl.obolibrary.org/obo/XPO_0102317	abnormal m. quadrato-hyoangularis primordium morphology	http://purl.obolibrary.org/obo/XAO_0004431	m. quadrato-hyoangularis primordium
http://purl.obolibrary.org/obo/XPO_0102928	abnormal m. rectus abdominis morphology	http://purl.obolibrary.org/obo/XAO_0004128	m. rectus abdominis
http://purl.obolibrary.org/obo/XPO_0103172	abnormal m. rectus anterior morphology	http://purl.obolibrary.org/obo/XAO_0004352	m. rectus anterior
http://purl.obolibrary.org/obo/XPO_0101988	abnormal m. rectus anterior primordium morphology	http://purl.obolibrary.org/obo/XAO_0004449	m. rectus anterior primordium
http://purl.obolibrary.org/obo/XPO_0102289	abnormal m. rectus cervicis primordium morphology	http://purl.obolibrary.org/obo/XAO_0004445	m. rectus cervicis primordium
http://purl.obolibrary.org/obo/XPO_0102770	abnormal m. rectus cervicus morphology	http://purl.obolibrary.org/obo/XAO_0004129	m. rectus cervicus
http://purl.obolibrary.org/obo/XPO_0102650	abnormal m. rectus inferior morphology	http://purl.obolibrary.org/obo/XAO_0004354	m. rectus inferior
http://purl.obolibrary.org/obo/XPO_0102458	abnormal m. rectus inferior primordium morphology	http://purl.obolibrary.org/obo/XAO_0004451	m. rectus inferior primordium
http://purl.obolibrary.org/obo/XPO_0103154	abnormal m. rectus posterior morphology	http://purl.obolibrary.org/obo/XAO_0004353	m. rectus posterior
http://purl.obolibrary.org/obo/XPO_0102470	abnormal m. rectus posterior primordium morphology	http://purl.obolibrary.org/obo/XAO_0004450	m. rectus posterior primordium
http://purl.obolibrary.org/obo/XPO_0102692	abnormal m. rectus superior morphology	http://purl.obolibrary.org/obo/XAO_0004355	m. rectus superior
http://purl.obolibrary.org/obo/XPO_0102402	abnormal m. rectus superior primordium morphology	http://purl.obolibrary.org/obo/XAO_0004452	m. rectus superior primordium
http://purl.obolibrary.org/obo/XPO_0102362	abnormal m. subarcualis rectus I morphology	http://purl.obolibrary.org/obo/XAO_0004337	m. subarcualis rectus I
http://purl.obolibrary.org/obo/XPO_0102517	abnormal m. subarcualis rectus I primordium morphology	http://purl.obolibrary.org/obo/XAO_0004434	m. subarcualis rectus I primordium
http://purl.obolibrary.org/obo/XPO_0102956	abnormal m. transversus anterior morphology	http://purl.obolibrary.org/obo/XAO_0004338	m. transversus anterior
http://purl.obolibrary.org/obo/XPO_0102501	abnormal m. transversus anterior primordium morphology	http://purl.obolibrary.org/obo/XAO_0004435	m. transversus anterior primordium
http://purl.obolibrary.org/obo/XPO_0102095	abnormal m. transversus ventralis II morphology	http://purl.obolibrary.org/obo/XAO_0004339	m. transversus ventralis II
http://purl.obolibrary.org/obo/XPO_0102304	abnormal m. transversus ventralis II primordium morphology	http://purl.obolibrary.org/obo/XAO_0004436	m. transversus ventralis II primordium
http://purl.obolibrary.org/obo/XPO_0102848	abnormal macrophage morphology	http://purl.obolibrary.org/obo/XAO_0005025	macrophage
http://purl.obolibrary.org/obo/XPO_0103052	abnormal magnocellular preoptic nucleus morphology	http://purl.obolibrary.org/obo/XAO_0004567	magnocellular preoptic nucleus
http://purl.obolibrary.org/obo/XPO_0142063	abnormal main body axis morphology	http://purl.obolibrary.org/obo/XAO_0005502	main body axis
http://purl.obolibrary.org/obo/XPO_0102397	abnormal male genitalia morphology	http://purl.obolibrary.org/obo/XAO_0000155	male genitalia
http://purl.obolibrary.org/obo/XPO_0102177	abnormal male organism morphology	http://purl.obolibrary.org/obo/XAO_0003006	male organism
http://purl.obolibrary.org/obo/XPO_0102707	abnormal mammilary region morphology	http://purl.obolibrary.org/obo/XAO_0004605	mammilary region
http://purl.obolibrary.org/obo/XPO_0102103	abnormal mandibular arch morphology	http://purl.obolibrary.org/obo/XAO_0000097	mandibular arch
http://purl.obolibrary.org/obo/XPO_0102215	abnormal mandibular arch skeleton morphology	http://purl.obolibrary.org/obo/XAO_0005162	mandibular arch skeleton
http://purl.obolibrary.org/obo/XPO_0101707	abnormal mandibular artery morphology	http://purl.obolibrary.org/obo/XAO_0004244	mandibular artery
http://purl.obolibrary.org/obo/XPO_0102102	abnormal mandibular crest morphology	http://purl.obolibrary.org/obo/XAO_0000024	mandibular crest
http://purl.obolibrary.org/obo/XPO_0102013	abnormal mandibular head muscle morphology	http://purl.obolibrary.org/obo/XAO_0004323	mandibular head muscle
http://purl.obolibrary.org/obo/XPO_0102164	abnormal mandibular mesenchyme morphology	http://purl.obolibrary.org/obo/XAO_0004508	mandibular mesenchyme
http://purl.obolibrary.org/obo/XPO_0141300	abnormal mandibular nerve morphology	http://purl.obolibrary.org/obo/XAO_0005294	mandibular nerve
http://purl.obolibrary.org/obo/XPO_0103009	abnormal manicotto glandulare morphology	http://purl.obolibrary.org/obo/XAO_0004235	manicotto glandulare
http://purl.obolibrary.org/obo/XPO_0103043	abnormal marginal zone (sensu neural) morphology	http://purl.obolibrary.org/obo/XAO_0000309	marginal zone (sensu neural)
http://purl.obolibrary.org/obo/XPO_0102026	abnormal marginal zone morphology	http://purl.obolibrary.org/obo/XAO_0000068	marginal zone
http://purl.obolibrary.org/obo/XPO_0102439	abnormal matrix-based tissue morphology	http://purl.obolibrary.org/obo/XAO_0005000	matrix-based tissue
http://purl.obolibrary.org/obo/XPO_0102777	abnormal maxillary artery morphology	http://purl.obolibrary.org/obo/XAO_0004245	maxillary artery
http://purl.obolibrary.org/obo/XPO_0141312	abnormal maxillary nerve morphology	http://purl.obolibrary.org/obo/XAO_0005293	maxillary nerve
http://purl.obolibrary.org/obo/XPO_0102166	abnormal medial abdominal vein morphology	http://purl.obolibrary.org/obo/XAO_0000395	medial abdominal vein
http://purl.obolibrary.org/obo/XPO_0103057	abnormal medial amygdala morphology	http://purl.obolibrary.org/obo/XAO_0004568	medial amygdala
http://purl.obolibrary.org/obo/XPO_0102284	abnormal medial cardinal vein morphology	http://purl.obolibrary.org/obo/XAO_0000384	medial cardinal vein
http://purl.obolibrary.org/obo/XPO_0102968	abnormal medial ganglionic eminence morphology	http://purl.obolibrary.org/obo/XAO_0004259	medial ganglionic eminence
http://purl.obolibrary.org/obo/XPO_0103101	abnormal medial nasal prominence morphology	http://purl.obolibrary.org/obo/XAO_0005194	medial nasal prominence
http://purl.obolibrary.org/obo/XPO_0102442	abnormal medial pallium morphology	http://purl.obolibrary.org/obo/XAO_0004570	medial pallium
http://purl.obolibrary.org/obo/XPO_0102854	abnormal medial septum morphology	http://purl.obolibrary.org/obo/XAO_0004571	medial septum
http://purl.obolibrary.org/obo/XPO_0103051	abnormal median fin morphology	http://purl.obolibrary.org/obo/XAO_0004281	median fin
http://purl.obolibrary.org/obo/XPO_0101913	abnormal median fin skeleton morphology	http://purl.obolibrary.org/obo/XAO_0004282	median fin skeleton
http://purl.obolibrary.org/obo/XPO_0102169	abnormal medium cavity morphology	http://purl.obolibrary.org/obo/XAO_0004525	medium cavity
http://purl.obolibrary.org/obo/XPO_0101936	abnormal medulla oblongata morphology	http://purl.obolibrary.org/obo/XAO_0003100	medulla oblongata
http://purl.obolibrary.org/obo/XPO_0102165	abnormal melanoblast morphology	http://purl.obolibrary.org/obo/XAO_0004510	melanoblast
http://purl.obolibrary.org/obo/XPO_0103019	abnormal melanophore morphology	http://purl.obolibrary.org/obo/XAO_0001014	melanophore
http://purl.obolibrary.org/obo/XPO_0102578	abnormal melanotrope morphology	http://purl.obolibrary.org/obo/XAO_0005116	melanotrope
http://purl.obolibrary.org/obo/XPO_0101853	abnormal membrane bone morphology	http://purl.obolibrary.org/obo/XAO_0004014	membrane bone
http://purl.obolibrary.org/obo/XPO_0102417	abnormal mesencephalic artery morphology	http://purl.obolibrary.org/obo/XAO_0004173	mesencephalic artery
http://purl.obolibrary.org/obo/XPO_0102887	abnormal mesencephalic vein morphology	http://purl.obolibrary.org/obo/XAO_0004174	mesencephalic vein
http://purl.obolibrary.org/obo/XPO_0102860	abnormal mesenchymal stem cell morphology	http://purl.obolibrary.org/obo/XAO_0004320	mesenchymal stem cell
http://purl.obolibrary.org/obo/XPO_0101655	abnormal mesenchyme morphology	http://purl.obolibrary.org/obo/XAO_0003046	mesenchyme
http://purl.obolibrary.org/obo/XPO_0102716	abnormal mesentery morphology	http://purl.obolibrary.org/obo/XAO_0000138	mesentery
http://purl.obolibrary.org/obo/XPO_0101737	abnormal mesoderm morphology	http://purl.obolibrary.org/obo/XAO_0000050	mesoderm
http://purl.obolibrary.org/obo/XPO_0102901	abnormal mesodermal cell morphology	http://purl.obolibrary.org/obo/XAO_0003255	mesodermal cell
http://purl.obolibrary.org/obo/XPO_0102199	abnormal mesonephric collecting duct morphology	http://purl.obolibrary.org/obo/XAO_0000151	mesonephric collecting duct
http://purl.obolibrary.org/obo/XPO_0102585	abnormal mesonephric duct morphology	http://purl.obolibrary.org/obo/XAO_0000242	mesonephric duct
http://purl.obolibrary.org/obo/XPO_0103197	abnormal mesonephric early distal tubule morphology	http://purl.obolibrary.org/obo/XAO_0000333	mesonephric early distal tubule
http://purl.obolibrary.org/obo/XPO_0102879	abnormal mesonephric early proximal tubule morphology	http://purl.obolibrary.org/obo/XAO_0000331	mesonephric early proximal tubule
http://purl.obolibrary.org/obo/XPO_0102410	abnormal mesonephric kidney morphology	http://purl.obolibrary.org/obo/XAO_0000141	mesonephric kidney
http://purl.obolibrary.org/obo/XPO_0102743	abnormal mesonephric late distal tubule morphology	http://purl.obolibrary.org/obo/XAO_0000334	mesonephric late distal tubule
http://purl.obolibrary.org/obo/XPO_0103121	abnormal mesonephric late proximal tubule morphology	http://purl.obolibrary.org/obo/XAO_0000332	mesonephric late proximal tubule
http://purl.obolibrary.org/obo/XPO_0101779	abnormal mesonephric mesenchyme morphology	http://purl.obolibrary.org/obo/XAO_0000291	mesonephric mesenchyme
http://purl.obolibrary.org/obo/XPO_0101903	abnormal mesonephric nephron morphology	http://purl.obolibrary.org/obo/XAO_0000292	mesonephric nephron
http://purl.obolibrary.org/obo/XPO_0101717	abnormal mesonephric sinus morphology	http://purl.obolibrary.org/obo/XAO_0000381	mesonephric sinus
http://purl.obolibrary.org/obo/XPO_0101902	abnormal mesonephric tubule morphology	http://purl.obolibrary.org/obo/XAO_0000148	mesonephric tubule
http://purl.obolibrary.org/obo/XPO_0102349	abnormal metacarpus morphology	http://purl.obolibrary.org/obo/XAO_0003208	metacarpus
http://purl.obolibrary.org/obo/XPO_0102914	abnormal metatarsus morphology	http://purl.obolibrary.org/obo/XAO_0003212	metatarsus
http://purl.obolibrary.org/obo/XPO_0102695	abnormal metencephalic artery morphology	http://purl.obolibrary.org/obo/XAO_0004167	metencephalic artery
http://purl.obolibrary.org/obo/XPO_0102273	abnormal metencephalic vein morphology	http://purl.obolibrary.org/obo/XAO_0004168	metencephalic vein
http://purl.obolibrary.org/obo/XPO_0102333	abnormal microglial cell morphology	http://purl.obolibrary.org/obo/XAO_0005134	microglial cell
http://purl.obolibrary.org/obo/XPO_0102520	abnormal microtubule morphology	http://purl.obolibrary.org/obo/XAO_0005122	microtubule
http://purl.obolibrary.org/obo/XPO_0101972	abnormal midbrain morphology	http://purl.obolibrary.org/obo/XAO_0000014	midbrain
http://purl.obolibrary.org/obo/XPO_0101877	abnormal midbrain tegmentum morphology	http://purl.obolibrary.org/obo/XAO_0004271	midbrain tegmentum
http://purl.obolibrary.org/obo/XPO_0102112	abnormal midbrain-hindbrain boundary morphology	http://purl.obolibrary.org/obo/XAO_0000016	midbrain-hindbrain boundary
http://purl.obolibrary.org/obo/XPO_0102754	abnormal middle cerebral vein morphology	http://purl.obolibrary.org/obo/XAO_0004161	middle cerebral vein
http://purl.obolibrary.org/obo/XPO_0102637	abnormal middle ear morphology	http://purl.obolibrary.org/obo/XAO_0000191	middle ear
http://purl.obolibrary.org/obo/XPO_0101951	abnormal middle lateral line morphology	http://purl.obolibrary.org/obo/XAO_0000463	middle lateral line
http://purl.obolibrary.org/obo/XPO_0102579	abnormal middle lateral line placode morphology	http://purl.obolibrary.org/obo/XAO_0004222	middle lateral line placode
http://purl.obolibrary.org/obo/XPO_0102155	abnormal midgut morphology	http://purl.obolibrary.org/obo/XAO_0000103	midgut
http://purl.obolibrary.org/obo/XPO_0102462	abnormal midgut primordium morphology	http://purl.obolibrary.org/obo/XAO_0004512	midgut primordium
http://purl.obolibrary.org/obo/XPO_0102847	abnormal migrating macrophage morphology	http://purl.obolibrary.org/obo/XAO_0005037	migrating macrophage
http://purl.obolibrary.org/obo/XPO_0107371	abnormal migrating myoblast morphology	http://purl.obolibrary.org/obo/XAO_0005226	migrating myoblast
http://purl.obolibrary.org/obo/XPO_0101807	abnormal migrating neuroblast morphology	http://purl.obolibrary.org/obo/XAO_0004272	migrating neuroblast
http://purl.obolibrary.org/obo/XPO_0103006	abnormal migratory neural crest cell morphology	http://purl.obolibrary.org/obo/XAO_0004069	migratory neural crest cell
http://purl.obolibrary.org/obo/XPO_0107390	abnormal migratory trunk neural crest cell morphology	http://purl.obolibrary.org/obo/XAO_0005246	migratory trunk neural crest cell
http://purl.obolibrary.org/obo/XPO_0102729	abnormal mineralized avascular GAG-rich matrix morphology	http://purl.obolibrary.org/obo/XAO_0004036	mineralized avascular GAG-rich matrix
http://purl.obolibrary.org/obo/XPO_0102149	abnormal mineralized bone tissue morphology	http://purl.obolibrary.org/obo/XAO_0004040	mineralized bone tissue
http://purl.obolibrary.org/obo/XPO_0102208	abnormal mineralized cartilage tissue morphology	http://purl.obolibrary.org/obo/XAO_0004055	mineralized cartilage tissue
http://purl.obolibrary.org/obo/XPO_0102730	abnormal mineralized extracellular matrix morphology	http://purl.obolibrary.org/obo/XAO_0004034	mineralized extracellular matrix
http://purl.obolibrary.org/obo/XPO_0102714	abnormal mineralized hyaline cartilage tissue morphology	http://purl.obolibrary.org/obo/XAO_0004041	mineralized hyaline cartilage tissue
http://purl.obolibrary.org/obo/XPO_0102151	abnormal mineralized tissue morphology	http://purl.obolibrary.org/obo/XAO_0004039	mineralized tissue
http://purl.obolibrary.org/obo/XPO_0102704	abnormal mitochondrial cloud morphology	http://purl.obolibrary.org/obo/XAO_0000245	mitochondrial cloud
http://purl.obolibrary.org/obo/XPO_0102181	abnormal mitotic cell morphology	http://purl.obolibrary.org/obo/XAO_0004502	mitotic cell
http://purl.obolibrary.org/obo/XPO_0102896	abnormal mitotic spindle morphology	http://purl.obolibrary.org/obo/XAO_0005009	mitotic spindle
http://purl.obolibrary.org/obo/XPO_0102247	abnormal mitral cell layer of the olfactory bulb morphology	http://purl.obolibrary.org/obo/XAO_0004574	mitral cell layer of the olfactory bulb
http://purl.obolibrary.org/obo/XPO_0102771	abnormal mitral cell morphology	http://purl.obolibrary.org/obo/XAO_0004573	mitral cell
http://purl.obolibrary.org/obo/XPO_0103011	abnormal mm. constrictores branchiales II morphology	http://purl.obolibrary.org/obo/XAO_0004344	mm. constrictores branchiales II
