defined_class	defined_class_label	biological_process	biological_process_label
http://purl.obolibrary.org/obo/XPO_0141877	abnormal 2-deoxyribose 1-phosphate metabolic process	http://purl.obolibrary.org/obo/GO_0046384	2-deoxyribose 1-phosphate metabolic process
http://purl.obolibrary.org/obo/XPO_0141793	abnormal ATP metabolic process	http://purl.obolibrary.org/obo/GO_0046034	ATP metabolic process
http://purl.obolibrary.org/obo/XPO_0131700	abnormal BMP signaling pathway	http://purl.obolibrary.org/obo/GO_0030509	BMP signaling pathway
http://purl.obolibrary.org/obo/XPO_0141902	abnormal D-methionine transport	http://purl.obolibrary.org/obo/GO_0048473	D-methionine transmembrane transport
http://purl.obolibrary.org/obo/XPO_0141910	abnormal D-ribose metabolic process	http://purl.obolibrary.org/obo/GO_0006014	D-ribose metabolic process
http://purl.obolibrary.org/obo/XPO_0141912	abnormal D-serine metabolic process	http://purl.obolibrary.org/obo/GO_0070178	D-serine metabolic process
http://purl.obolibrary.org/obo/XPO_0131718	abnormal JNK cascade	http://purl.obolibrary.org/obo/GO_0007254	JNK cascade
http://purl.obolibrary.org/obo/XPO_0141913	abnormal L-serine metabolic process	http://purl.obolibrary.org/obo/GO_0006563	L-serine metabolic process
http://purl.obolibrary.org/obo/XPO_0141780	abnormal NAD metabolic process	http://purl.obolibrary.org/obo/GO_0019674	NAD metabolic process
http://purl.obolibrary.org/obo/XPO_0141773	abnormal NADH metabolic process	http://purl.obolibrary.org/obo/GO_0006734	NADH metabolic process
http://purl.obolibrary.org/obo/XPO_0141774	abnormal NADP metabolic process	http://purl.obolibrary.org/obo/GO_0006739	NADP metabolic process
http://purl.obolibrary.org/obo/XPO_0131738	abnormal Wnt signaling pathway	http://purl.obolibrary.org/obo/GO_0016055	Wnt signaling pathway
http://purl.obolibrary.org/obo/XPO_0131726	abnormal Wnt signaling pathway, planar cell polarity pathway	http://purl.obolibrary.org/obo/GO_0060071	Wnt signaling pathway, planar cell polarity pathway
http://purl.obolibrary.org/obo/XPO_0131719	abnormal activation of meiosis	http://purl.obolibrary.org/obo/GO_0090427	activation of meiosis
http://purl.obolibrary.org/obo/XPO_0141865	abnormal adenine metabolic process	http://purl.obolibrary.org/obo/GO_0046083	adenine metabolic process
http://purl.obolibrary.org/obo/XPO_0141843	abnormal alanine metabolic process	http://purl.obolibrary.org/obo/GO_0006522	alanine metabolic process
http://purl.obolibrary.org/obo/XPO_0141869	abnormal alpha-amino acid metabolic process	http://purl.obolibrary.org/obo/GO_1901605	alpha-amino acid metabolic process
http://purl.obolibrary.org/obo/XPO_0141845	abnormal alpha-linolenic acid metabolic process	http://purl.obolibrary.org/obo/GO_0036109	alpha-linolenic acid metabolic process
http://purl.obolibrary.org/obo/XPO_0141735	abnormal amino acid homeostasis	http://purl.obolibrary.org/obo/GO_0080144	intracellular amino acid homeostasis
http://purl.obolibrary.org/obo/XPO_0141736	abnormal anatomical structure homeostasis	http://purl.obolibrary.org/obo/GO_0060249	anatomical structure homeostasis
http://purl.obolibrary.org/obo/XPO_0103447	abnormal anterior/posterior axis specification	http://purl.obolibrary.org/obo/GO_0009948	anterior/posterior axis specification
http://purl.obolibrary.org/obo/XPO_0131744	abnormal apical constriction	http://purl.obolibrary.org/obo/GO_0003383	apical constriction
http://purl.obolibrary.org/obo/XPO_0131698	abnormal apical constriction involved in gastrulation	http://purl.obolibrary.org/obo/GO_0003384	apical constriction involved in gastrulation
http://purl.obolibrary.org/obo/XPO_0141867	abnormal arachidonic acid metabolic process	http://purl.obolibrary.org/obo/GO_0019369	arachidonate metabolic process
http://purl.obolibrary.org/obo/XPO_0141847	abnormal arginine metabolic process	http://purl.obolibrary.org/obo/GO_0006525	arginine metabolic process
http://purl.obolibrary.org/obo/XPO_0141868	abnormal asparagine metabolic process	http://purl.obolibrary.org/obo/GO_0006528	asparagine metabolic process
http://purl.obolibrary.org/obo/XPO_0131745	abnormal axis elongation	http://purl.obolibrary.org/obo/GO_0003401	axis elongation
http://purl.obolibrary.org/obo/XPO_0116433	abnormal axis specification	http://purl.obolibrary.org/obo/GO_0009798	axis specification
http://purl.obolibrary.org/obo/XPO_0131699	abnormal axon extension involved in axon guidance	http://purl.obolibrary.org/obo/GO_0048846	axon extension involved in axon guidance
http://purl.obolibrary.org/obo/XPO_0131742	abnormal axon extension involved in regeneration	http://purl.obolibrary.org/obo/GO_0048677	axon extension involved in regeneration
http://purl.obolibrary.org/obo/XPO_0116429	abnormal behavior	http://purl.obolibrary.org/obo/GO_0007610	behavior
http://purl.obolibrary.org/obo/XPO_0131401	abnormal behavioral response to pain	http://purl.obolibrary.org/obo/GO_0048266	behavioral response to pain
http://purl.obolibrary.org/obo/XPO_0116434	abnormal biological process	http://purl.obolibrary.org/obo/GO_0008150	biological process
http://purl.obolibrary.org/obo/XPO_0116434	abnormal biological process	http://purl.obolibrary.org/obo/GO_0008150	biological_process
http://purl.obolibrary.org/obo/XPO_0141778	abnormal biosynthetic process	http://purl.obolibrary.org/obo/GO_0009058	biosynthetic process
http://purl.obolibrary.org/obo/XPO_0141871	abnormal cadaverine transport	http://purl.obolibrary.org/obo/GO_0015839	cadaverine transport
http://purl.obolibrary.org/obo/XPO_0131701	abnormal calcium ion transport	http://purl.obolibrary.org/obo/GO_0006816	calcium ion transport
http://purl.obolibrary.org/obo/XPO_0131702	abnormal canonical Wnt signaling pathway	http://purl.obolibrary.org/obo/GO_0060070	canonical Wnt signaling pathway
http://purl.obolibrary.org/obo/XPO_0141737	abnormal carbohydrate homeostasis	http://purl.obolibrary.org/obo/GO_0033500	carbohydrate homeostasis
http://purl.obolibrary.org/obo/XPO_0141777	abnormal catabolic process	http://purl.obolibrary.org/obo/GO_0009056	catabolic process
http://purl.obolibrary.org/obo/XPO_0133340	abnormal cell adhesion	http://purl.obolibrary.org/obo/GO_0007155	cell adhesion
http://purl.obolibrary.org/obo/XPO_0131703	abnormal cell division	http://purl.obolibrary.org/obo/GO_0051301	cell division
http://purl.obolibrary.org/obo/XPO_0131704	abnormal cell migration	http://purl.obolibrary.org/obo/GO_0016477	cell migration
http://purl.obolibrary.org/obo/XPO_0141739	abnormal cell redox homeostasis	http://purl.obolibrary.org/obo/GO_0045454	cell redox homeostasis
http://purl.obolibrary.org/obo/XPO_0141740	abnormal cell volume homeostasis	http://purl.obolibrary.org/obo/GO_0006884	cell volume homeostasis
http://purl.obolibrary.org/obo/XPO_0141741	abnormal cellular chemical homeostasis	http://purl.obolibrary.org/obo/GO_0055082	intracellular chemical homeostasis
http://purl.obolibrary.org/obo/XPO_0141742	abnormal cellular homeostasis	http://purl.obolibrary.org/obo/GO_0019725	cellular homeostasis
http://purl.obolibrary.org/obo/XPO_0141790	abnormal cellular metabolic process	http://purl.obolibrary.org/obo/GO_0044237	cellular metabolic process
http://purl.obolibrary.org/obo/XPO_0141790	abnormal cellular metabolic process	http://purl.obolibrary.org/obo/GO_0044237	obsolete cellular metabolic process
http://purl.obolibrary.org/obo/XPO_0141744	abnormal chemical homeostasis	http://purl.obolibrary.org/obo/GO_0048878	chemical homeostasis
http://purl.obolibrary.org/obo/XPO_0131705	abnormal chemotaxis	http://purl.obolibrary.org/obo/GO_0006935	chemotaxis
http://purl.obolibrary.org/obo/XPO_0141872	abnormal cholesterol metabolic process	http://purl.obolibrary.org/obo/GO_0008203	cholesterol metabolic process
http://purl.obolibrary.org/obo/XPO_0131706	abnormal ciliary basal body organization	http://purl.obolibrary.org/obo/GO_0032053	ciliary basal body organization
http://purl.obolibrary.org/obo/XPO_0131707	abnormal cilium assembly	http://purl.obolibrary.org/obo/GO_0060271	cilium assembly
http://purl.obolibrary.org/obo/XPO_0131708	abnormal cilium disassembly	http://purl.obolibrary.org/obo/GO_0061523	cilium disassembly
http://purl.obolibrary.org/obo/XPO_0141975	abnormal cilium motility	http://purl.obolibrary.org/obo/GO_0003341	cilium movement
http://purl.obolibrary.org/obo/XPO_0141783	abnormal collagen metabolic process	http://purl.obolibrary.org/obo/GO_0032963	collagen metabolic process
http://purl.obolibrary.org/obo/XPO_0131741	abnormal convergent extension	http://purl.obolibrary.org/obo/GO_0060026	convergent extension
http://purl.obolibrary.org/obo/XPO_0131709	abnormal convergent extension involved in axis elongation	http://purl.obolibrary.org/obo/GO_0060028	convergent extension involved in axis elongation
http://purl.obolibrary.org/obo/XPO_0131747	abnormal convergent extension involved in neural plate elongation	http://purl.obolibrary.org/obo/GO_0022007	convergent extension involved in neural plate elongation
http://purl.obolibrary.org/obo/XPO_0131748	abnormal convergent extension involved in notochord morphogenesis	http://purl.obolibrary.org/obo/GO_1904126	convergent extension involved in notochord morphogenesis
http://purl.obolibrary.org/obo/XPO_0131400	abnormal courtship behavior	http://purl.obolibrary.org/obo/GO_0007619	courtship behavior
http://purl.obolibrary.org/obo/XPO_0141874	abnormal creatinine metabolic process	http://purl.obolibrary.org/obo/GO_0046449	creatinine metabolic process
http://purl.obolibrary.org/obo/XPO_0141875	abnormal cytosine metabolic process	http://purl.obolibrary.org/obo/GO_0019858	cytosine metabolic process
http://purl.obolibrary.org/obo/XPO_0141796	abnormal demethylation	http://purl.obolibrary.org/obo/GO_0070988	demethylation
http://purl.obolibrary.org/obo/XPO_0141876	abnormal deoxyinosine metabolic process	http://purl.obolibrary.org/obo/GO_0046094	deoxyinosine metabolic process
http://purl.obolibrary.org/obo/XPO_0131740	abnormal detection of nodal flow	http://purl.obolibrary.org/obo/GO_0003127	detection of nodal flow
http://purl.obolibrary.org/obo/XPO_0131722	abnormal determination of left/right symmetry	http://purl.obolibrary.org/obo/GO_0007368	determination of left/right symmetry
http://purl.obolibrary.org/obo/XPO_0133403	abnormal developmental process	http://purl.obolibrary.org/obo/GO_0032502	developmental process
http://purl.obolibrary.org/obo/XPO_0141866	abnormal dicarboxylic acid metabolic process	http://purl.obolibrary.org/obo/GO_0043648	dicarboxylic acid metabolic process
http://purl.obolibrary.org/obo/XPO_0141894	abnormal dicarboxylic acid transport	http://purl.obolibrary.org/obo/GO_0006835	dicarboxylic acid transport
http://purl.obolibrary.org/obo/XPO_0103443	abnormal dorsal/ventral axis specification	http://purl.obolibrary.org/obo/GO_0009950	dorsal/ventral axis specification
http://purl.obolibrary.org/obo/XPO_0141746	abnormal energy homeostasis	http://purl.obolibrary.org/obo/GO_0097009	energy homeostasis
http://purl.obolibrary.org/obo/XPO_0141747	abnormal epidermal stem cell homeostasis	http://purl.obolibrary.org/obo/GO_0036334	epidermal stem cell homeostasis
http://purl.obolibrary.org/obo/XPO_0131710	abnormal establishment of apical/basal cell polarity	http://purl.obolibrary.org/obo/GO_0035089	establishment of apical/basal cell polarity
http://purl.obolibrary.org/obo/XPO_0131711	abnormal establishment of cell polarity	http://purl.obolibrary.org/obo/GO_0030010	establishment of cell polarity
http://purl.obolibrary.org/obo/XPO_0131712	abnormal establishment of epithelial cell planar polarity	http://purl.obolibrary.org/obo/GO_0090163	establishment of epithelial cell planar polarity
http://purl.obolibrary.org/obo/XPO_0131713	abnormal establishment of epithelial cell polarity	http://purl.obolibrary.org/obo/GO_0090162	establishment of epithelial cell polarity
http://purl.obolibrary.org/obo/XPO_0131743	abnormal establishment of planar polarity	http://purl.obolibrary.org/obo/GO_0001736	establishment of planar polarity
http://purl.obolibrary.org/obo/XPO_0131714	abnormal establishment of tissue polarity	http://purl.obolibrary.org/obo/GO_0007164	establishment of tissue polarity
http://purl.obolibrary.org/obo/XPO_0141880	abnormal ethanolamine metabolic process	http://purl.obolibrary.org/obo/GO_0006580	ethanolamine metabolic process
http://purl.obolibrary.org/obo/XPO_0141849	abnormal fatty acid biosynthetic process	http://purl.obolibrary.org/obo/GO_0006633	fatty acid biosynthetic process
http://purl.obolibrary.org/obo/XPO_0141870	abnormal fatty acid metabolic process	http://purl.obolibrary.org/obo/GO_0006631	fatty acid metabolic process
http://purl.obolibrary.org/obo/XPO_0131408	abnormal feeding behavior	http://purl.obolibrary.org/obo/GO_0007631	feeding behavior
http://purl.obolibrary.org/obo/XPO_0131715	abnormal fibroblast growth factor receptor signaling pathway	http://purl.obolibrary.org/obo/GO_0008543	fibroblast growth factor receptor signaling pathway
http://purl.obolibrary.org/obo/XPO_0141881	abnormal fructose metabolic process	http://purl.obolibrary.org/obo/GO_0006000	fructose metabolic process
http://purl.obolibrary.org/obo/XPO_0141850	abnormal galactose metabolic process	http://purl.obolibrary.org/obo/GO_0006012	galactose metabolic process
http://purl.obolibrary.org/obo/XPO_0141882	abnormal gamma-aminobutyric acid metabolic process	http://purl.obolibrary.org/obo/GO_0009448	gamma-aminobutyric acid metabolic process
http://purl.obolibrary.org/obo/XPO_0103444	abnormal gastrulation	http://purl.obolibrary.org/obo/GO_0007369	gastrulation
http://purl.obolibrary.org/obo/XPO_0141749	abnormal germ-line stem-cell niche homeostasis	http://purl.obolibrary.org/obo/GO_0060250	germ-line stem-cell niche homeostasis
http://purl.obolibrary.org/obo/XPO_0141851	abnormal gluconeogenesis	http://purl.obolibrary.org/obo/GO_0006094	gluconeogenesis
http://purl.obolibrary.org/obo/XPO_0141904	abnormal glucosamine metabolic process	http://purl.obolibrary.org/obo/GO_0006041	glucosamine metabolic process
http://purl.obolibrary.org/obo/XPO_0141852	abnormal glucose metabolic process	http://purl.obolibrary.org/obo/GO_0006006	glucose metabolic process
http://purl.obolibrary.org/obo/XPO_0141853	abnormal glutamate metabolic process	http://purl.obolibrary.org/obo/GO_0006536	glutamate metabolic process
http://purl.obolibrary.org/obo/XPO_0141854	abnormal glutathione metabolic process	http://purl.obolibrary.org/obo/GO_0006749	glutathione metabolic process
http://purl.obolibrary.org/obo/XPO_0141883	abnormal glycerol metabolic process	http://purl.obolibrary.org/obo/GO_0006071	glycerol metabolic process
http://purl.obolibrary.org/obo/XPO_0141856	abnormal glycerolipid metabolic process	http://purl.obolibrary.org/obo/GO_0046486	glycerolipid metabolic process
http://purl.obolibrary.org/obo/XPO_0141855	abnormal glycerophosphate shuttle	http://purl.obolibrary.org/obo/GO_0006127	glycerophosphate shuttle
http://purl.obolibrary.org/obo/XPO_0141857	abnormal glycine metabolic process	http://purl.obolibrary.org/obo/GO_0006544	glycine metabolic process
http://purl.obolibrary.org/obo/XPO_0141795	abnormal glycosylation	http://purl.obolibrary.org/obo/GO_0070085	glycosylation
http://purl.obolibrary.org/obo/XPO_0141885	abnormal guanine metabolic process	http://purl.obolibrary.org/obo/GO_0046098	guanine metabolic process
http://purl.obolibrary.org/obo/XPO_0141886	abnormal guanosine metabolic process	http://purl.obolibrary.org/obo/GO_0008617	guanosine metabolic process
http://purl.obolibrary.org/obo/XPO_0131470	abnormal heart contraction	http://purl.obolibrary.org/obo/GO_0060047	heart contraction
http://purl.obolibrary.org/obo/XPO_0131468	abnormal heart looping	http://purl.obolibrary.org/obo/GO_0001947	heart looping
http://purl.obolibrary.org/obo/XPO_0131469	abnormal heart process	http://purl.obolibrary.org/obo/GO_0003015	heart process
http://purl.obolibrary.org/obo/XPO_0141750	abnormal hematopoietic stem cell homeostasis	http://purl.obolibrary.org/obo/GO_0061484	hematopoietic stem cell homeostasis
http://purl.obolibrary.org/obo/XPO_0141751	abnormal hepatocyte homeostasis	http://purl.obolibrary.org/obo/GO_0036333	hepatocyte homeostasis
http://purl.obolibrary.org/obo/XPO_0141887	abnormal histidine metabolic process	http://purl.obolibrary.org/obo/GO_0006547	L-histidine metabolic process
http://purl.obolibrary.org/obo/XPO_0141753	abnormal homeostasis of number of cells	http://purl.obolibrary.org/obo/GO_0048872	homeostasis of number of cells
http://purl.obolibrary.org/obo/XPO_0141752	abnormal homeostasis of number of cells within a tissue	http://purl.obolibrary.org/obo/GO_0048873	homeostasis of number of cells within a tissue
http://purl.obolibrary.org/obo/XPO_0141754	abnormal homeostatic process	http://purl.obolibrary.org/obo/GO_0042592	homeostatic process
http://purl.obolibrary.org/obo/XPO_0141889	abnormal homoserine metabolic process	http://purl.obolibrary.org/obo/GO_0009092	homoserine metabolic process
http://purl.obolibrary.org/obo/XPO_0141788	abnormal hormone biosynthetic process	http://purl.obolibrary.org/obo/GO_0042446	hormone biosynthetic process
http://purl.obolibrary.org/obo/XPO_0141789	abnormal hormone catabolic process	http://purl.obolibrary.org/obo/GO_0042447	hormone catabolic process
http://purl.obolibrary.org/obo/XPO_0141787	abnormal hormone metabolic process	http://purl.obolibrary.org/obo/GO_0042445	hormone metabolic process
http://purl.obolibrary.org/obo/XPO_0141797	abnormal hydrogen metabolic process	http://purl.obolibrary.org/obo/GO_1902421	hydrogen metabolic process
http://purl.obolibrary.org/obo/XPO_0141890	abnormal hypoxanthine metabolic process	http://purl.obolibrary.org/obo/GO_0046100	hypoxanthine metabolic process
http://purl.obolibrary.org/obo/XPO_0141891	abnormal inosine metabolic process	http://purl.obolibrary.org/obo/GO_0046102	inosine metabolic process
http://purl.obolibrary.org/obo/XPO_0141892	abnormal inositol metabolic process	http://purl.obolibrary.org/obo/GO_0006020	inositol metabolic process
http://purl.obolibrary.org/obo/XPO_0141903	abnormal inositol phosphate metabolic process	http://purl.obolibrary.org/obo/GO_0043647	inositol phosphate metabolic process
http://purl.obolibrary.org/obo/XPO_0133397	abnormal insulin receptor signaling pathway	http://purl.obolibrary.org/obo/GO_0008286	insulin receptor signaling pathway
http://purl.obolibrary.org/obo/XPO_0141755	abnormal intestinal stem cell homeostasis	http://purl.obolibrary.org/obo/GO_0036335	intestinal stem cell homeostasis
http://purl.obolibrary.org/obo/XPO_0141756	abnormal intracellular accumulation of glycerol	http://purl.obolibrary.org/obo/GO_0006973	intracellular accumulation of glycerol
http://purl.obolibrary.org/obo/XPO_0141757	abnormal ion homeostasis	http://purl.obolibrary.org/obo/GO_0050801	monoatomic ion homeostasis
http://purl.obolibrary.org/obo/XPO_0141893	abnormal isoleucine metabolic process	http://purl.obolibrary.org/obo/GO_0006549	isoleucine metabolic process
http://purl.obolibrary.org/obo/XPO_0141863	abnormal lactate metabolic process	http://purl.obolibrary.org/obo/GO_0006089	lactate metabolic process
http://purl.obolibrary.org/obo/XPO_0141859	abnormal lactose catabolic process	http://purl.obolibrary.org/obo/GO_0005990	lactose catabolic process
http://purl.obolibrary.org/obo/XPO_0103445	abnormal left/right axis specification	http://purl.obolibrary.org/obo/GO_0070986	left/right axis specification
http://purl.obolibrary.org/obo/XPO_0141895	abnormal leucine metabolic process	http://purl.obolibrary.org/obo/GO_0006551	L-leucine metabolic process
http://purl.obolibrary.org/obo/XPO_0141758	abnormal leukocyte homeostasis	http://purl.obolibrary.org/obo/GO_0001776	leukocyte homeostasis
http://purl.obolibrary.org/obo/XPO_0141846	abnormal linoleic acid metabolic process	http://purl.obolibrary.org/obo/GO_0043651	linoleic acid metabolic process
http://purl.obolibrary.org/obo/XPO_0141759	abnormal lipid homeostasis	http://purl.obolibrary.org/obo/GO_0055088	lipid homeostasis
http://purl.obolibrary.org/obo/XPO_0141798	abnormal lipid metabolic process	http://purl.obolibrary.org/obo/GO_0006629	lipid metabolic process
http://purl.obolibrary.org/obo/XPO_0131409	abnormal locomotory behavior	http://purl.obolibrary.org/obo/GO_0007626	locomotory behavior
http://purl.obolibrary.org/obo/XPO_0141844	abnormal long-chain fatty acid metabolic process	http://purl.obolibrary.org/obo/GO_0001676	long-chain fatty acid metabolic process
http://purl.obolibrary.org/obo/XPO_0141896	abnormal lysine metabolic process	http://purl.obolibrary.org/obo/GO_0006553	lysine metabolic process
http://purl.obolibrary.org/obo/XPO_0141860	abnormal malate-aspartate shuttle	http://purl.obolibrary.org/obo/GO_0043490	malate-aspartate shuttle
http://purl.obolibrary.org/obo/XPO_0141897	abnormal malonic acid transport	http://purl.obolibrary.org/obo/GO_1900752	malonic acid transport
http://purl.obolibrary.org/obo/XPO_0141898	abnormal maltose metabolic process	http://purl.obolibrary.org/obo/GO_0000023	maltose metabolic process
http://purl.obolibrary.org/obo/XPO_0141899	abnormal mandelate metabolic process	http://purl.obolibrary.org/obo/GO_0018924	mandelate metabolic process
http://purl.obolibrary.org/obo/XPO_0141900	abnormal mannose metabolic process	http://purl.obolibrary.org/obo/GO_0006013	mannose metabolic process
http://purl.obolibrary.org/obo/XPO_0141901	abnormal mannose to fructose-6-phosphate metabolic process	http://purl.obolibrary.org/obo/GO_0061611	mannose to fructose-6-phosphate catabolic process
http://purl.obolibrary.org/obo/XPO_0131407	abnormal mating behavior	http://purl.obolibrary.org/obo/GO_0007617	mating behavior
http://purl.obolibrary.org/obo/XPO_0131403	abnormal mechanosensory behavior	http://purl.obolibrary.org/obo/GO_0007638	mechanosensory behavior
http://purl.obolibrary.org/obo/XPO_0141776	abnormal metabolic process	http://purl.obolibrary.org/obo/GO_0008152	metabolic process
http://purl.obolibrary.org/obo/XPO_0141597	abnormal metamorphosis	http://purl.obolibrary.org/obo/GO_0007552	metamorphosis
http://purl.obolibrary.org/obo/XPO_0141782	abnormal methylation	http://purl.obolibrary.org/obo/GO_0032259	methylation
http://purl.obolibrary.org/obo/XPO_0131720	abnormal mitotic spindle assembly	http://purl.obolibrary.org/obo/GO_0090307	mitotic spindle assembly
http://purl.obolibrary.org/obo/XPO_0141760	abnormal multicellular organismal homeostasis	http://purl.obolibrary.org/obo/GO_0048871	multicellular organismal-level homeostasis
http://purl.obolibrary.org/obo/XPO_0141761	abnormal multicellular organismal iron ion homeostasis	http://purl.obolibrary.org/obo/GO_0060586	multicellular organismal-level iron ion homeostasis
http://purl.obolibrary.org/obo/XPO_0141762	abnormal multicellular organismal water homeostasis	http://purl.obolibrary.org/obo/GO_0050891	multicellular organismal-level water homeostasis
http://purl.obolibrary.org/obo/XPO_0141763	abnormal muscle cell cellular homeostasis	http://purl.obolibrary.org/obo/GO_0046716	muscle cell cellular homeostasis
http://purl.obolibrary.org/obo/XPO_0141764	abnormal myeloid cell homeostasis	http://purl.obolibrary.org/obo/GO_0002262	myeloid cell homeostasis
http://purl.obolibrary.org/obo/XPO_0131746	abnormal neural tube closure	http://purl.obolibrary.org/obo/GO_0001843	neural tube closure
http://purl.obolibrary.org/obo/XPO_0141765	abnormal neuron cellular homeostasis	http://purl.obolibrary.org/obo/GO_0070050	neuron cellular homeostasis
http://purl.obolibrary.org/obo/XPO_0141775	abnormal nitrogen compound metabolic process	http://purl.obolibrary.org/obo/GO_0006807	nitrogen compound metabolic process
http://purl.obolibrary.org/obo/XPO_0141775	abnormal nitrogen compound metabolic process	http://purl.obolibrary.org/obo/GO_0006807	obsolete nitrogen compound metabolic process
http://purl.obolibrary.org/obo/XPO_0131721	abnormal nodal signaling pathway	http://purl.obolibrary.org/obo/GO_0038092	nodal signaling pathway
http://purl.obolibrary.org/obo/XPO_0131402	abnormal olfactory behavior	http://purl.obolibrary.org/obo/GO_0042048	olfactory behavior
http://purl.obolibrary.org/obo/XPO_0131405	abnormal optokinetic behavior	http://purl.obolibrary.org/obo/GO_0007634	optokinetic behavior
http://purl.obolibrary.org/obo/XPO_0141905	abnormal ornithine metabolic process	http://purl.obolibrary.org/obo/GO_0006591	ornithine metabolic process
http://purl.obolibrary.org/obo/XPO_0141879	abnormal oxalate metabolic process	http://purl.obolibrary.org/obo/GO_0033609	oxalate metabolic process
http://purl.obolibrary.org/obo/XPO_0141906	abnormal palmitic acid metabolic process	http://purl.obolibrary.org/obo/GO_1900533	palmitic acid metabolic process
http://purl.obolibrary.org/obo/XPO_0141779	abnormal peptide hormone processing	http://purl.obolibrary.org/obo/GO_0016486	peptide hormone processing
http://purl.obolibrary.org/obo/XPO_0141884	abnormal phosphagen metabolic process	http://purl.obolibrary.org/obo/GO_0006599	phosphagen metabolic process
http://purl.obolibrary.org/obo/XPO_0131731	abnormal pigment accumulation in tissues	http://purl.obolibrary.org/obo/GO_0043480	pigment accumulation in tissues
http://purl.obolibrary.org/obo/XPO_0141786	abnormal pigment metabolic process	http://purl.obolibrary.org/obo/GO_0042440	pigment metabolic process
http://purl.obolibrary.org/obo/XPO_0141766	abnormal polyamine homeostasis	http://purl.obolibrary.org/obo/GO_0010509	intracellular polyamine homeostasis
http://purl.obolibrary.org/obo/XPO_0141724	abnormal prevention of polyspermy	http://purl.obolibrary.org/obo/GO_0060468	prevention of polyspermy
http://purl.obolibrary.org/obo/XPO_0141791	abnormal primary metabolic process	http://purl.obolibrary.org/obo/GO_0044238	primary metabolic process
http://purl.obolibrary.org/obo/XPO_0141848	abnormal proline metabolic process	http://purl.obolibrary.org/obo/GO_0006560	proline metabolic process
