defined_class	defined_class_label	anatomical_entity	anatomical_entity_label
http://purl.obolibrary.org/obo/XPO_0101889	abnormal diaphysis morphology	http://purl.obolibrary.org/obo/XAO_0004488	diaphysis
http://purl.obolibrary.org/obo/XPO_0102207	abnormal diencephalon morphology	http://purl.obolibrary.org/obo/XAO_0000013	diencephalon
http://purl.obolibrary.org/obo/XPO_0102830	abnormal digestive enzyme secreting cell morphology	http://purl.obolibrary.org/obo/XAO_0003240	digestive enzyme secreting cell
http://purl.obolibrary.org/obo/XPO_0142061	abnormal digestive tract morphology	http://purl.obolibrary.org/obo/XAO_0005501	digestive tract
http://purl.obolibrary.org/obo/XPO_0101810	abnormal digit morphology	http://purl.obolibrary.org/obo/XAO_0003032	digit
http://purl.obolibrary.org/obo/XPO_0102880	abnormal digit-joint region morphology	http://purl.obolibrary.org/obo/XAO_0004314	digit-joint region
http://purl.obolibrary.org/obo/XPO_0102601	abnormal disaggregated/reaggregated ectoderm treated with activin morphology	http://purl.obolibrary.org/obo/XAO_0003009	disaggregated/reaggregated ectoderm treated with activin
http://purl.obolibrary.org/obo/XPO_0101654	abnormal distal mesenchyme morphology	http://purl.obolibrary.org/obo/XAO_0004056	distal mesenchyme
http://purl.obolibrary.org/obo/XPO_0102403	abnormal distal stomach morphology	http://purl.obolibrary.org/obo/XAO_0005130	distal stomach
http://purl.obolibrary.org/obo/XPO_0102119	abnormal distal tubule morphology	http://purl.obolibrary.org/obo/XAO_0004519	distal tubule
http://purl.obolibrary.org/obo/XPO_0102028	abnormal dorsal animal hemisphere blastomere morphology	http://purl.obolibrary.org/obo/XAO_0005113	dorsal animal hemisphere blastomere
http://purl.obolibrary.org/obo/XPO_0101711	abnormal dorsal aorta morphology	http://purl.obolibrary.org/obo/XAO_0000051	dorsal aorta
http://purl.obolibrary.org/obo/XPO_0102553	abnormal dorsal caudal lymphatic vessel morphology	http://purl.obolibrary.org/obo/XAO_0004321	dorsal caudal lymphatic vessel
http://purl.obolibrary.org/obo/XPO_0103181	abnormal dorsal column nucleus morphology	http://purl.obolibrary.org/obo/XAO_0004545	dorsal column nucleus
http://purl.obolibrary.org/obo/XPO_0103064	abnormal dorsal crest of the endoderm morphology	http://purl.obolibrary.org/obo/XAO_0005045	dorsal crest of the endoderm
http://purl.obolibrary.org/obo/XPO_0103149	abnormal dorsal endoderm morphology	http://purl.obolibrary.org/obo/XAO_0004462	dorsal endoderm
http://purl.obolibrary.org/obo/XPO_0141309	abnormal dorsal endomesoderm morphology	http://purl.obolibrary.org/obo/XAO_0005304	dorsal endomesoderm
http://purl.obolibrary.org/obo/XPO_0102516	abnormal dorsal fin margin morphology	http://purl.obolibrary.org/obo/XAO_0004061	dorsal fin margin
http://purl.obolibrary.org/obo/XPO_0102322	abnormal dorsal fin morphology	http://purl.obolibrary.org/obo/XAO_0004063	dorsal fin
http://purl.obolibrary.org/obo/XPO_0101912	abnormal dorsal fin skeleton morphology	http://purl.obolibrary.org/obo/XAO_0004280	dorsal fin skeleton
http://purl.obolibrary.org/obo/XPO_0102468	abnormal dorsal fin vasculature morphology	http://purl.obolibrary.org/obo/XAO_0004625	dorsal fin vasculature
http://purl.obolibrary.org/obo/XPO_0102653	abnormal dorsal foregut morphology	http://purl.obolibrary.org/obo/XAO_0005126	dorsal foregut
http://purl.obolibrary.org/obo/XPO_0103058	abnormal dorsal funiculus morphology	http://purl.obolibrary.org/obo/XAO_0004580	dorsal funiculus
http://purl.obolibrary.org/obo/XPO_0102983	abnormal dorsal habenular nucleus morphology	http://purl.obolibrary.org/obo/XAO_0004546	dorsal habenular nucleus
http://purl.obolibrary.org/obo/XPO_0102690	abnormal dorsal hyoid arch skeleton morphology	http://purl.obolibrary.org/obo/XAO_0003178	dorsal hyoid arch skeleton
http://purl.obolibrary.org/obo/XPO_0102856	abnormal dorsal involuting marginal zone morphology	http://purl.obolibrary.org/obo/XAO_0005136	dorsal involuting marginal zone
http://purl.obolibrary.org/obo/XPO_0102523	abnormal dorsal lateral line morphology	http://purl.obolibrary.org/obo/XAO_0000462	dorsal lateral line
http://purl.obolibrary.org/obo/XPO_0102053	abnormal dorsal lateral plate mesoderm morphology	http://purl.obolibrary.org/obo/XAO_0004509	dorsal lateral plate mesoderm
http://purl.obolibrary.org/obo/XPO_0102612	abnormal dorsal longitudinal anastomosing vessel - left branch morphology	http://purl.obolibrary.org/obo/XAO_0004178	dorsal longitudinal anastomosing vessel - left branch
http://purl.obolibrary.org/obo/XPO_0103217	abnormal dorsal longitudinal anastomosing vessel - right branch morphology	http://purl.obolibrary.org/obo/XAO_0004179	dorsal longitudinal anastomosing vessel - right branch
http://purl.obolibrary.org/obo/XPO_0102613	abnormal dorsal longitudinal anastomosing vessel morphology	http://purl.obolibrary.org/obo/XAO_0004177	dorsal longitudinal anastomosing vessel
http://purl.obolibrary.org/obo/XPO_0103083	abnormal dorsal lymph space morphology	http://purl.obolibrary.org/obo/XAO_0000374	dorsal lymph space
http://purl.obolibrary.org/obo/XPO_0102642	abnormal dorsal marginal zone morphology	http://purl.obolibrary.org/obo/XAO_0000072	dorsal marginal zone
http://purl.obolibrary.org/obo/XPO_0102760	abnormal dorsal pallidum morphology	http://purl.obolibrary.org/obo/XAO_0004547	dorsal pallidum
http://purl.obolibrary.org/obo/XPO_0103178	abnormal dorsal pallium morphology	http://purl.obolibrary.org/obo/XAO_0004548	dorsal pallium
http://purl.obolibrary.org/obo/XPO_0102535	abnormal dorsal pancreatic bud morphology	http://purl.obolibrary.org/obo/XAO_0000467	dorsal pancreatic bud
http://purl.obolibrary.org/obo/XPO_0107392	abnormal dorsal posterior hindgut endoderm morphology	http://purl.obolibrary.org/obo/XAO_0005248	dorsal posterior hindgut endoderm
http://purl.obolibrary.org/obo/XPO_0102584	abnormal dorsal septum morphology	http://purl.obolibrary.org/obo/XAO_0004549	dorsal septum
http://purl.obolibrary.org/obo/XPO_0107353	abnormal dorsal side morphology	http://purl.obolibrary.org/obo/XAO_0005208	dorsal side
http://purl.obolibrary.org/obo/XPO_0102316	abnormal dorsal tail fin morphology	http://purl.obolibrary.org/obo/XAO_0000469	dorsal tail fin
http://purl.obolibrary.org/obo/XPO_0107408	abnormal dorsal tail morphology	http://purl.obolibrary.org/obo/XAO_0005264	dorsal tail
http://purl.obolibrary.org/obo/XPO_0102540	abnormal dorsal tegmentum morphology	http://purl.obolibrary.org/obo/XAO_0004227	dorsal tegmentum
http://purl.obolibrary.org/obo/XPO_0107380	abnormal dorsal telencephalon morphology	http://purl.obolibrary.org/obo/XAO_0005235	dorsal telencephalon
http://purl.obolibrary.org/obo/XPO_0102594	abnormal dorsal thalamus morphology	http://purl.obolibrary.org/obo/XAO_0004390	dorsal thalamus
http://purl.obolibrary.org/obo/XPO_0107409	abnormal dorsal trunk morphology	http://purl.obolibrary.org/obo/XAO_0005265	dorsal trunk
http://purl.obolibrary.org/obo/XPO_0102307	abnormal dorsal vegetal hemisphere blastomere morphology	http://purl.obolibrary.org/obo/XAO_0005112	dorsal vegetal hemisphere blastomere
http://purl.obolibrary.org/obo/XPO_0107348	abnormal dorsal-ventral axis morphology	http://purl.obolibrary.org/obo/XAO_0005203	dorsal-ventral axis
http://purl.obolibrary.org/obo/XPO_0102724	abnormal dorso-lateral marginal zone morphology	http://purl.obolibrary.org/obo/XAO_0000071	dorso-lateral marginal zone
http://purl.obolibrary.org/obo/XPO_0102496	abnormal dorsolateral ascending neuron morphology	http://purl.obolibrary.org/obo/XAO_0005184	dorsolateral ascending neuron
http://purl.obolibrary.org/obo/XPO_0102819	abnormal dorsolateral commissural neuron morphology	http://purl.obolibrary.org/obo/XAO_0005185	dorsolateral commissural neuron
http://purl.obolibrary.org/obo/XPO_0103025	abnormal dorsolateral neural tube morphology	http://purl.obolibrary.org/obo/XAO_0004617	dorsolateral neural tube
http://purl.obolibrary.org/obo/XPO_0102257	abnormal dorsolateral placode region morphology	http://purl.obolibrary.org/obo/XAO_0000187	dorsolateral placode region
http://purl.obolibrary.org/obo/XPO_0102158	abnormal dorsomedial edge of myotome morphology	http://purl.obolibrary.org/obo/XAO_0005078	dorsomedial edge of myotome
http://purl.obolibrary.org/obo/XPO_0101925	abnormal duct morphology	http://purl.obolibrary.org/obo/XAO_0004000	duct
http://purl.obolibrary.org/obo/XPO_0102570	abnormal duct of Cuvier morphology	http://purl.obolibrary.org/obo/XAO_0000373	duct of Cuvier
http://purl.obolibrary.org/obo/XPO_0102953	abnormal duodenum morphology	http://purl.obolibrary.org/obo/XAO_0000236	duodenum
http://purl.obolibrary.org/obo/XPO_0103216	abnormal early distal tubule morphology	http://purl.obolibrary.org/obo/XAO_0000287	early distal tubule
http://purl.obolibrary.org/obo/XPO_0101940	abnormal early embryonic cell morphology	http://purl.obolibrary.org/obo/XAO_0003241	early embryonic cell
http://purl.obolibrary.org/obo/XPO_0103214	abnormal early proximal tubule morphology	http://purl.obolibrary.org/obo/XAO_0000288	early proximal tubule
http://purl.obolibrary.org/obo/XPO_0101800	abnormal ectoderm morphology	http://purl.obolibrary.org/obo/XAO_0000001	ectoderm
http://purl.obolibrary.org/obo/XPO_0103122	abnormal ectodermal cell morphology	http://purl.obolibrary.org/obo/XAO_0003245	ectodermal cell
http://purl.obolibrary.org/obo/XPO_0107373	abnormal efferent neuron morphology	http://purl.obolibrary.org/obo/XAO_0005228	efferent neuron
http://purl.obolibrary.org/obo/XPO_0102741	abnormal egg cell-free extract morphology	http://purl.obolibrary.org/obo/XAO_0005083	egg cell-free extract
http://purl.obolibrary.org/obo/XPO_0102297	abnormal egg jelly morphology	http://purl.obolibrary.org/obo/XAO_0005081	egg jelly
http://purl.obolibrary.org/obo/XPO_0102648	abnormal egg morphology	http://purl.obolibrary.org/obo/XAO_0003048	egg
http://purl.obolibrary.org/obo/XPO_0101943	abnormal elastic cartilage tissue morphology	http://purl.obolibrary.org/obo/XAO_0004197	elastic cartilage tissue
http://purl.obolibrary.org/obo/XPO_0102217	abnormal elastica externa morphology	http://purl.obolibrary.org/obo/XAO_0001020	elastica externa
http://purl.obolibrary.org/obo/XPO_0102386	abnormal electrically active cell morphology	http://purl.obolibrary.org/obo/XAO_0003246	electrically active cell
http://purl.obolibrary.org/obo/XPO_0101834	abnormal embryo morphology	http://purl.obolibrary.org/obo/XAO_0000113	embryo
http://purl.obolibrary.org/obo/XPO_0107387	abnormal embryonic kidney morphology	http://purl.obolibrary.org/obo/XAO_0005243	embryonic kidney
http://purl.obolibrary.org/obo/XPO_0101736	abnormal embryonic structure morphology	http://purl.obolibrary.org/obo/XAO_0003042	embryonic structure
http://purl.obolibrary.org/obo/XPO_0107411	abnormal embryonic thrombocyte morphology	http://purl.obolibrary.org/obo/XAO_0005267	embryonic thrombocyte
http://purl.obolibrary.org/obo/XPO_0102986	abnormal eminentia thalami morphology	http://purl.obolibrary.org/obo/XAO_0004301	eminentia thalami
http://purl.obolibrary.org/obo/XPO_0103039	abnormal enamel morphology	http://purl.obolibrary.org/obo/XAO_0004198	enamel
http://purl.obolibrary.org/obo/XPO_0102912	abnormal enameloid morphology	http://purl.obolibrary.org/obo/XAO_0004199	enameloid
http://purl.obolibrary.org/obo/XPO_0102874	abnormal endocardial cushion morphology	http://purl.obolibrary.org/obo/XAO_0004189	endocardial cushion
http://purl.obolibrary.org/obo/XPO_0102651	abnormal endocardial tube morphology	http://purl.obolibrary.org/obo/XAO_0000337	endocardial tube
http://purl.obolibrary.org/obo/XPO_0101891	abnormal endocardium morphology	http://purl.obolibrary.org/obo/XAO_0000066	endocardium
http://purl.obolibrary.org/obo/XPO_0101753	abnormal endochondral bone morphology	http://purl.obolibrary.org/obo/XAO_0004018	endochondral bone
http://purl.obolibrary.org/obo/XPO_0101756	abnormal endochondral element morphology	http://purl.obolibrary.org/obo/XAO_0004017	endochondral element
http://purl.obolibrary.org/obo/XPO_0101835	abnormal endocrine cell morphology	http://purl.obolibrary.org/obo/XAO_0003247	endocrine cell
http://purl.obolibrary.org/obo/XPO_0101857	abnormal endocrine system morphology	http://purl.obolibrary.org/obo/XAO_0000158	endocrine system
http://purl.obolibrary.org/obo/XPO_0101704	abnormal endoderm morphology	http://purl.obolibrary.org/obo/XAO_0000090	endoderm
http://purl.obolibrary.org/obo/XPO_0103132	abnormal endodermal cell morphology	http://purl.obolibrary.org/obo/XAO_0003248	endodermal cell
http://purl.obolibrary.org/obo/XPO_0103140	abnormal endolymphatic duct morphology	http://purl.obolibrary.org/obo/XAO_0004465	endolymphatic duct
http://purl.obolibrary.org/obo/XPO_0103164	abnormal endomesoderm morphology	http://purl.obolibrary.org/obo/XAO_0003044	endomesoderm
http://purl.obolibrary.org/obo/XPO_0102703	abnormal endoplasmic reticulum morphology	http://purl.obolibrary.org/obo/XAO_0005120	endoplasmic reticulum
http://purl.obolibrary.org/obo/XPO_0102130	abnormal endoskeleton morphology	http://purl.obolibrary.org/obo/XAO_0004026	endoskeleton
http://purl.obolibrary.org/obo/XPO_0102990	abnormal endothelial cell morphology	http://purl.obolibrary.org/obo/XAO_0004149	endothelial cell
http://purl.obolibrary.org/obo/XPO_0107340	abnormal enteric nervous system morphology	http://purl.obolibrary.org/obo/XAO_0005195	enteric nervous system
http://purl.obolibrary.org/obo/XPO_0102295	abnormal enteric neuron morphology	http://purl.obolibrary.org/obo/XAO_0004523	enteric neuron
http://purl.obolibrary.org/obo/XPO_0101821	abnormal enteroendocrine cell morphology	http://purl.obolibrary.org/obo/XAO_0005135	enteroendocrine cell
http://purl.obolibrary.org/obo/XPO_0102521	abnormal epaxial muscle morphology	http://purl.obolibrary.org/obo/XAO_0003229	epaxial muscle
http://purl.obolibrary.org/obo/XPO_0101934	abnormal epibranchial placode morphology	http://purl.obolibrary.org/obo/XAO_0000284	epibranchial placode
http://purl.obolibrary.org/obo/XPO_0102161	abnormal epicardial precursor cell morphology	http://purl.obolibrary.org/obo/XAO_0004482	epicardial precursor cell
http://purl.obolibrary.org/obo/XPO_0103195	abnormal epicardium morphology	http://purl.obolibrary.org/obo/XAO_0000316	epicardium
http://purl.obolibrary.org/obo/XPO_0102346	abnormal epidermal cell morphology	http://purl.obolibrary.org/obo/XAO_0004621	epidermal cell
http://purl.obolibrary.org/obo/XPO_0102064	abnormal epidermis inner layer morphology	http://purl.obolibrary.org/obo/XAO_0000041	epidermis inner layer
http://purl.obolibrary.org/obo/XPO_0101640	abnormal epidermis morphology	http://purl.obolibrary.org/obo/XAO_0000028	epidermis
http://purl.obolibrary.org/obo/XPO_0102312	abnormal epidermis outer layer morphology	http://purl.obolibrary.org/obo/XAO_0000029	epidermis outer layer
http://purl.obolibrary.org/obo/XPO_0103119	abnormal epigastric artery morphology	http://purl.obolibrary.org/obo/XAO_0004248	epigastric artery
http://purl.obolibrary.org/obo/XPO_0102369	abnormal epiphysis morphology	http://purl.obolibrary.org/obo/XAO_0004487	epiphysis
http://purl.obolibrary.org/obo/XPO_0101850	abnormal epithelial cell morphology	http://purl.obolibrary.org/obo/XAO_0003249	epithelial cell
http://purl.obolibrary.org/obo/XPO_0101824	abnormal epithelium morphology	http://purl.obolibrary.org/obo/XAO_0003045	epithelium
http://purl.obolibrary.org/obo/XPO_0102067	abnormal epsilon cell morphology	http://purl.obolibrary.org/obo/XAO_0005167	epsilon cell
http://purl.obolibrary.org/obo/XPO_0102739	abnormal erythroid cell morphology	http://purl.obolibrary.org/obo/XAO_0004150	erythroid lineage cell
http://purl.obolibrary.org/obo/XPO_0141308	abnormal esophageal epithelium morphology	http://purl.obolibrary.org/obo/XAO_0005299	esophageal epithelium
http://purl.obolibrary.org/obo/XPO_0102429	abnormal esophagus morphology	http://purl.obolibrary.org/obo/XAO_0000127	esophagus
http://purl.obolibrary.org/obo/XPO_0102576	abnormal ethmoid bone morphology	http://purl.obolibrary.org/obo/XAO_0005191	ethmoid bone
http://purl.obolibrary.org/obo/XPO_0102092	abnormal ethmoid region morphology	http://purl.obolibrary.org/obo/XAO_0005192	ethmoid region
http://purl.obolibrary.org/obo/XPO_0102434	abnormal exocrine cell morphology	http://purl.obolibrary.org/obo/XAO_0003250	exocrine cell
http://purl.obolibrary.org/obo/XPO_0102988	abnormal exocrine pancreas morphology	http://purl.obolibrary.org/obo/XAO_0000137	exocrine pancreas
http://purl.obolibrary.org/obo/XPO_0102786	abnormal external carotid artery morphology	http://purl.obolibrary.org/obo/XAO_0000345	external carotid artery
http://purl.obolibrary.org/obo/XPO_0102920	abnormal external coil of the small intestine morphology	http://purl.obolibrary.org/obo/XAO_0005063	external coil of the small intestine
http://purl.obolibrary.org/obo/XPO_0103175	abnormal external gill morphology	http://purl.obolibrary.org/obo/XAO_0000120	external gill
http://purl.obolibrary.org/obo/XPO_0102120	abnormal external jugular vein morphology	http://purl.obolibrary.org/obo/XAO_0000379	external jugular vein
http://purl.obolibrary.org/obo/XPO_0101652	abnormal external plexiform layer of the olfactory bulb morphology	http://purl.obolibrary.org/obo/XAO_0004551	external plexiform layer of the olfactory bulb
http://purl.obolibrary.org/obo/XPO_0101927	abnormal extracellular matrix morphology	http://purl.obolibrary.org/obo/XAO_0004027	extracellular matrix
http://purl.obolibrary.org/obo/XPO_0102205	abnormal extraembryonic structure morphology	http://purl.obolibrary.org/obo/XAO_0004005	extraembryonic structure
http://purl.obolibrary.org/obo/XPO_0101817	abnormal eye morphology	http://purl.obolibrary.org/obo/XAO_0000179	eye
http://purl.obolibrary.org/obo/XPO_0101953	abnormal eye muscle morphology	http://purl.obolibrary.org/obo/XAO_0004327	eye muscle
http://purl.obolibrary.org/obo/XPO_0102232	abnormal eye photoreceptor cell morphology	http://purl.obolibrary.org/obo/XAO_0004110	eye photoreceptor cell
http://purl.obolibrary.org/obo/XPO_0102194	abnormal eye primordium morphology	http://purl.obolibrary.org/obo/XAO_0000227	eye primordium
http://purl.obolibrary.org/obo/XPO_0102643	abnormal facial epibranchial placode morphology	http://purl.obolibrary.org/obo/XAO_0004211	facial epibranchial placode
http://purl.obolibrary.org/obo/XPO_0101855	abnormal facial nerve morphology	http://purl.obolibrary.org/obo/XAO_0003094	facial nerve
http://purl.obolibrary.org/obo/XPO_0103003	abnormal facial vein morphology	http://purl.obolibrary.org/obo/XAO_0004250	facial vein
http://purl.obolibrary.org/obo/XPO_0102955	abnormal facies hyoidis of the palatoquadrate morphology	http://purl.obolibrary.org/obo/XAO_0004366	facies hyoidis of the palatoquadrate
http://purl.obolibrary.org/obo/XPO_0102475	abnormal fasciculated network of fibrils morphology	http://purl.obolibrary.org/obo/XAO_0000229	fasciculated network of fibrils
http://purl.obolibrary.org/obo/XPO_0103125	abnormal fat body morphology	http://purl.obolibrary.org/obo/XAO_0003050	fat body
http://purl.obolibrary.org/obo/XPO_0102864	abnormal female genitalia morphology	http://purl.obolibrary.org/obo/XAO_0000156	female genitalia
http://purl.obolibrary.org/obo/XPO_0102789	abnormal female organism morphology	http://purl.obolibrary.org/obo/XAO_0003005	female organism
http://purl.obolibrary.org/obo/XPO_0103139	abnormal femoral vein morphology	http://purl.obolibrary.org/obo/XAO_0004243	femoral vein
http://purl.obolibrary.org/obo/XPO_0102033	abnormal femur morphology	http://purl.obolibrary.org/obo/XAO_0003214	femur
http://purl.obolibrary.org/obo/XPO_0102827	abnormal femur rudiment morphology	http://purl.obolibrary.org/obo/XAO_0004238	femur rudiment
http://purl.obolibrary.org/obo/XPO_0103176	abnormal fenestra basicranialis morphology	http://purl.obolibrary.org/obo/XAO_0004365	fenestra basicranialis
http://purl.obolibrary.org/obo/XPO_0102776	abnormal fenestra subocularis morphology	http://purl.obolibrary.org/obo/XAO_0004367	fenestra subocularis
http://purl.obolibrary.org/obo/XPO_0102365	abnormal fibroblast morphology	http://purl.obolibrary.org/obo/XAO_0003017	fibroblast
http://purl.obolibrary.org/obo/XPO_0103012	abnormal fibrocartilage morphology	http://purl.obolibrary.org/obo/XAO_0004028	fibrocartilage
http://purl.obolibrary.org/obo/XPO_0103092	abnormal fibrocellular pad morphology	http://purl.obolibrary.org/obo/XAO_0004403	fibrocellular pad
http://purl.obolibrary.org/obo/XPO_0107399	abnormal filopodium morphology	http://purl.obolibrary.org/obo/XAO_0005255	filopodium
http://purl.obolibrary.org/obo/XPO_0102674	abnormal filter chamber morphology	http://purl.obolibrary.org/obo/XAO_0000439	filter chamber
http://purl.obolibrary.org/obo/XPO_0102408	abnormal fin crest morphology	http://purl.obolibrary.org/obo/XAO_0004229	fin crest
http://purl.obolibrary.org/obo/XPO_0102084	abnormal fin margin morphology	http://purl.obolibrary.org/obo/XAO_0005171	fin margin
http://purl.obolibrary.org/obo/XPO_0101937	abnormal fin morphology	http://purl.obolibrary.org/obo/XAO_0000002	fin
http://purl.obolibrary.org/obo/XPO_0101744	abnormal fin vasculature morphology	http://purl.obolibrary.org/obo/XAO_0004624	fin vasculature
http://purl.obolibrary.org/obo/XPO_0101847	abnormal first pancreatic bud morphology	http://purl.obolibrary.org/obo/XAO_0001101	first pancreatic bud
http://purl.obolibrary.org/obo/XPO_0107372	abnormal flexural organ morphology	http://purl.obolibrary.org/obo/XAO_0005227	flexural organ
http://purl.obolibrary.org/obo/XPO_0103002	abnormal floor plate morphology	http://purl.obolibrary.org/obo/XAO_0000306	floor plate
http://purl.obolibrary.org/obo/XPO_0101910	abnormal follicle cell morphology	http://purl.obolibrary.org/obo/XAO_0000230	follicle cell
http://purl.obolibrary.org/obo/XPO_0102596	abnormal follicle layer morphology	http://purl.obolibrary.org/obo/XAO_0000231	follicle layer
http://purl.obolibrary.org/obo/XPO_0102089	abnormal foot morphology	http://purl.obolibrary.org/obo/XAO_0004300	foot
http://purl.obolibrary.org/obo/XPO_0102708	abnormal footplate of the stapes morphology	http://purl.obolibrary.org/obo/XAO_0005144	footplate of the stapes
http://purl.obolibrary.org/obo/XPO_0102249	abnormal forebrain morphology	http://purl.obolibrary.org/obo/XAO_0000011	forebrain
http://purl.obolibrary.org/obo/XPO_0103076	abnormal forebrain-midbrain boundary morphology	http://purl.obolibrary.org/obo/XAO_0005027	forebrain-midbrain boundary
http://purl.obolibrary.org/obo/XPO_0102042	abnormal foregut endoderm morphology	http://purl.obolibrary.org/obo/XAO_0004513	foregut endoderm
http://purl.obolibrary.org/obo/XPO_0141295	abnormal foregut epithelium morphology	http://purl.obolibrary.org/obo/XAO_0005297	foregut epithelium
http://purl.obolibrary.org/obo/XPO_0101788	abnormal foregut morphology	http://purl.obolibrary.org/obo/XAO_0000232	foregut
http://purl.obolibrary.org/obo/XPO_0102821	abnormal forelimb bud morphology	http://purl.obolibrary.org/obo/XAO_0003065	forelimb bud
http://purl.obolibrary.org/obo/XPO_0102717	abnormal forelimb bud tip morphology	http://purl.obolibrary.org/obo/XAO_0004490	forelimb bud tip
http://purl.obolibrary.org/obo/XPO_0102746	abnormal forelimb digit 2 morphology	http://purl.obolibrary.org/obo/XAO_0004478	forelimb digit 2
http://purl.obolibrary.org/obo/XPO_0102598	abnormal forelimb digit 3 morphology	http://purl.obolibrary.org/obo/XAO_0004479	forelimb digit 3
http://purl.obolibrary.org/obo/XPO_0102529	abnormal forelimb digit 4 morphology	http://purl.obolibrary.org/obo/XAO_0004480	forelimb digit 4
http://purl.obolibrary.org/obo/XPO_0102787	abnormal forelimb digit 5 morphology	http://purl.obolibrary.org/obo/XAO_0004481	forelimb digit 5
http://purl.obolibrary.org/obo/XPO_0102214	abnormal forelimb digit morphology	http://purl.obolibrary.org/obo/XAO_0003036	forelimb digit
http://purl.obolibrary.org/obo/XPO_0102035	abnormal forelimb morphology	http://purl.obolibrary.org/obo/XAO_0003030	forelimb
http://purl.obolibrary.org/obo/XPO_0103202	abnormal forelimb region morphology	http://purl.obolibrary.org/obo/XAO_0000080	forelimb region
http://purl.obolibrary.org/obo/XPO_0101974	abnormal forelimb skeleton morphology	http://purl.obolibrary.org/obo/XAO_0003061	forelimb skeleton
http://purl.obolibrary.org/obo/XPO_0102142	abnormal forelimb stylopod morphology	http://purl.obolibrary.org/obo/XAO_0004295	forelimb stylopod
http://purl.obolibrary.org/obo/XPO_0102302	abnormal forelimb zeugopod morphology	http://purl.obolibrary.org/obo/XAO_0004297	forelimb zeugopod
http://purl.obolibrary.org/obo/XPO_0102984	abnormal fourth ventricle morphology	http://purl.obolibrary.org/obo/XAO_0003099	fourth ventricle
http://purl.obolibrary.org/obo/XPO_0141297	abnormal frontal nerve morphology	http://purl.obolibrary.org/obo/XAO_0005295	frontal nerve
http://purl.obolibrary.org/obo/XPO_0101665	abnormal fundus morphology	http://purl.obolibrary.org/obo/XAO_0005145	fundus
http://purl.obolibrary.org/obo/XPO_0103018	abnormal gall bladder morphology	http://purl.obolibrary.org/obo/XAO_0000135	gall bladder
http://purl.obolibrary.org/obo/XPO_0102124	abnormal gall bladder primordium morphology	http://purl.obolibrary.org/obo/XAO_0004205	gall bladder primordium
http://purl.obolibrary.org/obo/XPO_0101948	abnormal gamete morphology	http://purl.obolibrary.org/obo/XAO_0003150	gamete
http://purl.obolibrary.org/obo/XPO_0101935	abnormal gamma cell morphology	http://purl.obolibrary.org/obo/XAO_0005168	gamma cell
http://purl.obolibrary.org/obo/XPO_0101990	abnormal ganglion morphology	http://purl.obolibrary.org/obo/XAO_0000209	ganglion
http://purl.obolibrary.org/obo/XPO_0102866	abnormal gasserian ganglion morphology	http://purl.obolibrary.org/obo/XAO_0000427	gasserian ganglion
http://purl.obolibrary.org/obo/XPO_0102791	abnormal gastric vein morphology	http://purl.obolibrary.org/obo/XAO_0000389	gastric vein
http://purl.obolibrary.org/obo/XPO_0101815	abnormal gastrocoel roof plate morphology	http://purl.obolibrary.org/obo/XAO_0000094	gastrocoel roof plate
