defined_class	defined_class_label	biological_process	biological_process_label
http://purl.obolibrary.org/obo/XPO_0141794	abnormal prosthetic group metabolic process	http://purl.obolibrary.org/obo/GO_0051189	prosthetic group metabolic process
http://purl.obolibrary.org/obo/XPO_0131727	abnormal protein kinase B signaling	http://purl.obolibrary.org/obo/GO_0043491	phosphatidylinositol 3-kinase/protein kinase B signal transduction
http://purl.obolibrary.org/obo/XPO_0131724	abnormal protein phosphorylation	http://purl.obolibrary.org/obo/GO_0006468	protein phosphorylation
http://purl.obolibrary.org/obo/XPO_0103446	abnormal proximal/distal axis specification	http://purl.obolibrary.org/obo/GO_0009946	proximal/distal axis specification
http://purl.obolibrary.org/obo/XPO_0141861	abnormal purine nucleoside metabolic process	http://purl.obolibrary.org/obo/GO_0042278	purine nucleoside metabolic process
http://purl.obolibrary.org/obo/XPO_0141907	abnormal putrescine metabolic process	http://purl.obolibrary.org/obo/GO_0009445	putrescine metabolic process
http://purl.obolibrary.org/obo/XPO_0141908	abnormal pyridine metabolic process	http://purl.obolibrary.org/obo/GO_0019507	pyridine metabolic process
http://purl.obolibrary.org/obo/XPO_0131728	abnormal regulation of cell size	http://purl.obolibrary.org/obo/GO_0008361	regulation of cell size
http://purl.obolibrary.org/obo/XPO_0131729	abnormal regulation of growth rate	http://purl.obolibrary.org/obo/GO_0040009	regulation of growth rate
http://purl.obolibrary.org/obo/XPO_0131730	abnormal regulation of protein folding	http://purl.obolibrary.org/obo/GO_1903332	regulation of protein folding
http://purl.obolibrary.org/obo/XPO_0141909	abnormal ribonucleoside metabolic process	http://purl.obolibrary.org/obo/GO_0009119	ribonucleoside metabolic process
http://purl.obolibrary.org/obo/XPO_0141911	abnormal ribose phosphate metabolic process	http://purl.obolibrary.org/obo/GO_0019693	ribose phosphate metabolic process
http://purl.obolibrary.org/obo/XPO_0141781	abnormal secondary metabolic process	http://purl.obolibrary.org/obo/GO_0019748	secondary metabolic process
http://purl.obolibrary.org/obo/XPO_0141858	abnormal serine family amino acid metabolic process	http://purl.obolibrary.org/obo/GO_0009069	serine family amino acid metabolic process
http://purl.obolibrary.org/obo/XPO_0131732	abnormal sex differentiation	http://purl.obolibrary.org/obo/GO_0007548	sex differentiation
http://purl.obolibrary.org/obo/XPO_0141792	abnormal small molecule metabolic process	http://purl.obolibrary.org/obo/GO_0044281	small molecule metabolic process
http://purl.obolibrary.org/obo/XPO_0131406	abnormal social behavior	http://purl.obolibrary.org/obo/GO_0035176	social behavior
http://purl.obolibrary.org/obo/XPO_0131733	abnormal somitogenesis	http://purl.obolibrary.org/obo/GO_0001756	somitogenesis
http://purl.obolibrary.org/obo/XPO_0131734	abnormal spermatogonial cell division	http://purl.obolibrary.org/obo/GO_0007284	spermatogonial cell division
http://purl.obolibrary.org/obo/XPO_0131735	abnormal spindle assembly	http://purl.obolibrary.org/obo/GO_0051225	spindle assembly
http://purl.obolibrary.org/obo/XPO_0141914	abnormal succinate metabolic process	http://purl.obolibrary.org/obo/GO_0006105	succinate metabolic process
http://purl.obolibrary.org/obo/XPO_0131398	abnormal swimming behavior	http://purl.obolibrary.org/obo/GO_0036269	swimming behavior
http://purl.obolibrary.org/obo/XPO_0141915	abnormal taurine metabolic process	http://purl.obolibrary.org/obo/GO_0019530	taurine metabolic process
http://purl.obolibrary.org/obo/XPO_0141767	abnormal temperature homeostasis	http://purl.obolibrary.org/obo/GO_0001659	temperature homeostasis
http://purl.obolibrary.org/obo/XPO_0141888	abnormal threonine metabolic process	http://purl.obolibrary.org/obo/GO_0006566	threonine metabolic process
http://purl.obolibrary.org/obo/XPO_0141916	abnormal thymine metabolic process	http://purl.obolibrary.org/obo/GO_0019859	thymine metabolic process
http://purl.obolibrary.org/obo/XPO_0131736	abnormal thyroid hormone generation	http://purl.obolibrary.org/obo/GO_0006590	thyroid hormone generation
http://purl.obolibrary.org/obo/XPO_0141785	abnormal thyroid hormone metabolic process	http://purl.obolibrary.org/obo/GO_0042403	thyroid hormone metabolic process
http://purl.obolibrary.org/obo/XPO_0141768	abnormal tissue homeostasis	http://purl.obolibrary.org/obo/GO_0001894	tissue homeostasis
http://purl.obolibrary.org/obo/XPO_0141873	abnormal tricarboxylic acid metabolic process	http://purl.obolibrary.org/obo/GO_0072350	tricarboxylic acid metabolic process
http://purl.obolibrary.org/obo/XPO_0141917	abnormal tryptophan metabolic process	http://purl.obolibrary.org/obo/GO_0006568	tryptophan metabolic process
http://purl.obolibrary.org/obo/XPO_0131737	abnormal type B pancreatic cell differentiation	http://purl.obolibrary.org/obo/GO_0003309	type B pancreatic cell differentiation
http://purl.obolibrary.org/obo/XPO_0141918	abnormal tyrosine metabolic process	http://purl.obolibrary.org/obo/GO_0006570	tyrosine metabolic process
http://purl.obolibrary.org/obo/XPO_0141769	abnormal ubiquitin recycling	http://purl.obolibrary.org/obo/GO_0010992	ubiquitin recycling
http://purl.obolibrary.org/obo/XPO_0141919	abnormal uracil metabolic process	http://purl.obolibrary.org/obo/GO_0019860	uracil metabolic process
http://purl.obolibrary.org/obo/XPO_0141862	abnormal urea cycle	http://purl.obolibrary.org/obo/GO_0000050	urea cycle
http://purl.obolibrary.org/obo/XPO_0141920	abnormal urea metabolic process	http://purl.obolibrary.org/obo/GO_0019627	urea metabolic process
http://purl.obolibrary.org/obo/XPO_0141921	abnormal uridine metabolic process	http://purl.obolibrary.org/obo/GO_0046108	uridine metabolic process
http://purl.obolibrary.org/obo/XPO_0141922	abnormal valine metabolic process	http://purl.obolibrary.org/obo/GO_0006573	valine metabolic process
http://purl.obolibrary.org/obo/XPO_0131404	abnormal visual behavior	http://purl.obolibrary.org/obo/GO_0007632	visual behavior
http://purl.obolibrary.org/obo/XPO_0131399	abnormal vocalization behavior	http://purl.obolibrary.org/obo/GO_0071625	vocalization behavior
http://purl.obolibrary.org/obo/XPO_0131739	abnormal wound healing	http://purl.obolibrary.org/obo/GO_0042060	wound healing
http://purl.obolibrary.org/obo/XPO_0141923	abnormal xanthine metabolic process	http://purl.obolibrary.org/obo/GO_0046110	xanthine metabolic process
