defined_class	defined_class_label	biological_process	biological_process_label	location	location_label
http://purl.obolibrary.org/obo/ZP_0140205	liver increased occurrence lipid oxidation, abnormal	http://purl.obolibrary.org/obo/GO_0034440	lipid oxidation	http://purl.obolibrary.org/obo/ZFA_0000123	liver
http://purl.obolibrary.org/obo/ZP_0138072	liver increased occurrence macrophage migration, abnormal	http://purl.obolibrary.org/obo/GO_1905517	macrophage migration	http://purl.obolibrary.org/obo/ZFA_0000123	liver
http://purl.obolibrary.org/obo/ZP_0021621	liver increased occurrence necroptotic process, abnormal	http://purl.obolibrary.org/obo/GO_0070266	necroptotic process	http://purl.obolibrary.org/obo/ZFA_0000123	liver
http://purl.obolibrary.org/obo/ZP_0022625	liver increased occurrence nucleotide biosynthetic process, abnormal	http://purl.obolibrary.org/obo/GO_0009165	nucleotide biosynthetic process	http://purl.obolibrary.org/obo/ZFA_0000123	liver
http://purl.obolibrary.org/obo/ZP_0149471	liver increased occurrence phosphatidylethanolamine biosynthetic process, abnormal	http://purl.obolibrary.org/obo/GO_0006646	phosphatidylethanolamine biosynthetic process	http://purl.obolibrary.org/obo/ZFA_0000123	liver
http://purl.obolibrary.org/obo/ZP_0149493	liver increased occurrence phosphatidylserine biosynthetic process, abnormal	http://purl.obolibrary.org/obo/GO_0006659	phosphatidylserine biosynthetic process	http://purl.obolibrary.org/obo/ZFA_0000123	liver
http://purl.obolibrary.org/obo/ZP_0021548	liver increased occurrence reactive oxygen species biosynthetic process, abnormal	http://purl.obolibrary.org/obo/GO_1903409	reactive oxygen species biosynthetic process	http://purl.obolibrary.org/obo/ZFA_0000123	liver
http://purl.obolibrary.org/obo/ZP_0137920	liver increased occurrence response to endoplasmic reticulum stress, abnormal	http://purl.obolibrary.org/obo/GO_0034976	response to endoplasmic reticulum stress	http://purl.obolibrary.org/obo/ZFA_0000123	liver
http://purl.obolibrary.org/obo/ZP_0144730	locus coeruleus increased occurrence calcium ion transport into cytosol, abnormal	http://purl.obolibrary.org/obo/GO_0060402	calcium ion transport into cytosol	http://purl.obolibrary.org/obo/ZFA_0000539	locus coeruleus
http://purl.obolibrary.org/obo/ZP_0148339	macrophage increased occurrence activation of immune response, abnormal	http://purl.obolibrary.org/obo/GO_0002253	activation of immune response	http://purl.obolibrary.org/obo/ZFA_0009141	macrophage
http://purl.obolibrary.org/obo/ZP_0140556	macrophage increased occurrence apoptotic process, abnormal	http://purl.obolibrary.org/obo/GO_0006915	apoptotic process	http://purl.obolibrary.org/obo/ZFA_0009141	macrophage
http://purl.obolibrary.org/obo/ZP_0130992	macrophage increased occurrence cell death, abnormal	http://purl.obolibrary.org/obo/GO_0008219	cell death	http://purl.obolibrary.org/obo/ZFA_0009141	macrophage
http://purl.obolibrary.org/obo/ZP_0148175	macrophage increased occurrence macrophage activation, abnormal	http://purl.obolibrary.org/obo/GO_0042116	macrophage activation	http://purl.obolibrary.org/obo/ZFA_0009141	macrophage
http://purl.obolibrary.org/obo/ZP_0106038	macrophage increased occurrence phagocytosis, abnormal	http://purl.obolibrary.org/obo/GO_0006909	phagocytosis	http://purl.obolibrary.org/obo/ZFA_0009141	macrophage
http://purl.obolibrary.org/obo/ZP_0141946	macrophage increased occurrence pyroptosis, abnormal	http://purl.obolibrary.org/obo/GO_0070269	pyroptotic inflammatory response	http://purl.obolibrary.org/obo/ZFA_0009141	macrophage
http://purl.obolibrary.org/obo/ZP_0105763	macrophage increased occurrence reactive oxygen species biosynthetic process, abnormal	http://purl.obolibrary.org/obo/GO_1903409	reactive oxygen species biosynthetic process	http://purl.obolibrary.org/obo/ZFA_0009141	macrophage
http://purl.obolibrary.org/obo/ZP_0005373	macula saccule increased occurrence cell death, abnormal	http://purl.obolibrary.org/obo/GO_0008219	cell death	http://purl.obolibrary.org/obo/ZFA_0007000	macula saccule
http://purl.obolibrary.org/obo/ZP_0005371	macula utricle increased occurrence cell death, abnormal	http://purl.obolibrary.org/obo/GO_0008219	cell death	http://purl.obolibrary.org/obo/ZFA_0000030	macula utricle
http://purl.obolibrary.org/obo/ZP_0104039	male organism increased occurrence development of secondary female sexual characteristics, abnormal	http://purl.obolibrary.org/obo/GO_0046543	development of secondary female sexual characteristics	http://purl.obolibrary.org/obo/ZFA_0000242	male organism
http://purl.obolibrary.org/obo/ZP_0141510	male organism increased occurrence hepatocyte proliferation, abnormal	http://purl.obolibrary.org/obo/GO_0072574	hepatocyte proliferation	http://purl.obolibrary.org/obo/ZFA_0000242	male organism
http://purl.obolibrary.org/obo/ZP_0143573	medial octavolateralis nucleus increased occurrence calcium ion transport into cytosol, abnormal	http://purl.obolibrary.org/obo/GO_0060402	calcium ion transport into cytosol	http://purl.obolibrary.org/obo/ZFA_0000291	medial octavolateralis nucleus
http://purl.obolibrary.org/obo/ZP_0017526	median fin fold increased occurrence epithelial cell proliferation, abnormal	http://purl.obolibrary.org/obo/GO_0050673	epithelial cell proliferation	http://purl.obolibrary.org/obo/ZFA_0000040	median fin fold
http://purl.obolibrary.org/obo/ZP_0149510	melanocyte increased occurrence DNA biosynthetic process, abnormal	http://purl.obolibrary.org/obo/GO_0071897	DNA biosynthetic process	http://purl.obolibrary.org/obo/ZFA_0009091	melanocyte
http://purl.obolibrary.org/obo/ZP_0022454	melanocyte increased occurrence ERK1 and ERK2 cascade, abnormal	http://purl.obolibrary.org/obo/GO_0070371	ERK1 and ERK2 cascade	http://purl.obolibrary.org/obo/ZFA_0009091	melanocyte
http://purl.obolibrary.org/obo/ZP_0009917	melanocyte increased occurrence apoptotic process, abnormal	http://purl.obolibrary.org/obo/GO_0006915	apoptotic process	http://purl.obolibrary.org/obo/ZFA_0009091	melanocyte
http://purl.obolibrary.org/obo/ZP_0144852	melanocyte increased occurrence cell death, abnormal	http://purl.obolibrary.org/obo/GO_0008219	cell death	http://purl.obolibrary.org/obo/ZFA_0009091	melanocyte
http://purl.obolibrary.org/obo/ZP_0022452	melanocyte increased occurrence hippo signaling, abnormal	http://purl.obolibrary.org/obo/GO_0035329	hippo signaling	http://purl.obolibrary.org/obo/ZFA_0009091	melanocyte
http://purl.obolibrary.org/obo/ZP_0141138	microglial cell increased occurrence phagocytosis, abnormal	http://purl.obolibrary.org/obo/GO_0006909	phagocytosis	http://purl.obolibrary.org/obo/ZFA_0009077	microglial cell
http://purl.obolibrary.org/obo/ZP_0021861	microvillous olfactory receptor neuron increased occurrence ERK1 and ERK2 cascade, abnormal	http://purl.obolibrary.org/obo/GO_0070371	ERK1 and ERK2 cascade	http://purl.obolibrary.org/obo/ZFA_0009359	microvillous olfactory receptor neuron
http://purl.obolibrary.org/obo/ZP_0020157	mid intestine increased occurrence epithelial cell migration, abnormal	http://purl.obolibrary.org/obo/GO_0010631	epithelial cell migration	http://purl.obolibrary.org/obo/ZFA_0001323	mid intestine
http://purl.obolibrary.org/obo/ZP_0144876	midbrain increased occurrence Wnt signaling pathway, abnormal	http://purl.obolibrary.org/obo/GO_0016055	Wnt signaling pathway	http://purl.obolibrary.org/obo/ZFA_0000128	midbrain
http://purl.obolibrary.org/obo/ZP_0012168	midbrain increased occurrence apoptotic process, abnormal	http://purl.obolibrary.org/obo/GO_0006915	apoptotic process	http://purl.obolibrary.org/obo/ZFA_0000128	midbrain
http://purl.obolibrary.org/obo/ZP_0141990	midbrain increased occurrence calcium-mediated signaling, abnormal	http://purl.obolibrary.org/obo/GO_0019722	calcium-mediated signaling	http://purl.obolibrary.org/obo/ZFA_0000128	midbrain
http://purl.obolibrary.org/obo/ZP_0008140	midbrain increased occurrence cell death, abnormal	http://purl.obolibrary.org/obo/GO_0008219	cell death	http://purl.obolibrary.org/obo/ZFA_0000128	midbrain
http://purl.obolibrary.org/obo/ZP_0149145	midbrain increased occurrence cell population proliferation, abnormal	http://purl.obolibrary.org/obo/GO_0008283	cell population proliferation	http://purl.obolibrary.org/obo/ZFA_0000128	midbrain
http://purl.obolibrary.org/obo/ZP_0142235	midbrain increased occurrence cell proliferation in midbrain, abnormal	http://purl.obolibrary.org/obo/GO_0033278	cell proliferation in midbrain	http://purl.obolibrary.org/obo/ZFA_0000128	midbrain
http://purl.obolibrary.org/obo/ZP_0142226	midbrain increased occurrence neural precursor cell proliferation, abnormal	http://purl.obolibrary.org/obo/GO_0061351	neural precursor cell proliferation	http://purl.obolibrary.org/obo/ZFA_0000128	midbrain
http://purl.obolibrary.org/obo/ZP_0147934	midbrain increased occurrence neuronal action potential, abnormal	http://purl.obolibrary.org/obo/GO_0019228	neuronal action potential	http://purl.obolibrary.org/obo/ZFA_0000128	midbrain
http://purl.obolibrary.org/obo/ZP_0020610	migratory neural crest increased occurrence cell population proliferation, abnormal	http://purl.obolibrary.org/obo/GO_0008283	cell population proliferation	http://purl.obolibrary.org/obo/ZFA_0007085	migratory neural crest
http://purl.obolibrary.org/obo/ZP_0020473	motor neuron increased occurrence bleb assembly, abnormal	http://purl.obolibrary.org/obo/GO_0032060	bleb assembly	http://purl.obolibrary.org/obo/ZFA_0009052	motor neuron
http://purl.obolibrary.org/obo/ZP_0103781	motor neuron increased occurrence cell death, abnormal	http://purl.obolibrary.org/obo/GO_0008219	cell death	http://purl.obolibrary.org/obo/ZFA_0009052	motor neuron
http://purl.obolibrary.org/obo/ZP_0019401	motor neuron increased occurrence collateral sprouting, abnormal	http://purl.obolibrary.org/obo/GO_0048668	collateral sprouting	http://purl.obolibrary.org/obo/ZFA_0009052	motor neuron
http://purl.obolibrary.org/obo/ZP_0141905	motor neuron increased occurrence protein complex oligomerization, abnormal	http://purl.obolibrary.org/obo/GO_0051259	protein complex oligomerization	http://purl.obolibrary.org/obo/ZFA_0009052	motor neuron
http://purl.obolibrary.org/obo/ZP_0019403	motor neuron increased occurrence synapse assembly, abnormal	http://purl.obolibrary.org/obo/GO_0007416	synapse assembly	http://purl.obolibrary.org/obo/ZFA_0009052	motor neuron
http://purl.obolibrary.org/obo/ZP_0004937	muscle cell increased occurrence apoptotic process, abnormal	http://purl.obolibrary.org/obo/GO_0006915	apoptotic process	http://purl.obolibrary.org/obo/ZFA_0009114	muscle cell
http://purl.obolibrary.org/obo/ZP_0004938	muscle cell increased occurrence cell death, abnormal	http://purl.obolibrary.org/obo/GO_0008219	cell death	http://purl.obolibrary.org/obo/ZFA_0009114	muscle cell
http://purl.obolibrary.org/obo/ZP_0100815	muscle increased occurrence autophagy, abnormal	http://purl.obolibrary.org/obo/GO_0006914	autophagy	http://purl.obolibrary.org/obo/ZFA_0005145	muscle
http://purl.obolibrary.org/obo/ZP_0142017	muscle increased occurrence fatty acid beta-oxidation, abnormal	http://purl.obolibrary.org/obo/GO_0006635	fatty acid beta-oxidation	http://purl.obolibrary.org/obo/ZFA_0005145	muscle
http://purl.obolibrary.org/obo/ZP_0140097	muscle increased occurrence hyphal growth, abnormal	http://purl.obolibrary.org/obo/GO_0030448	hyphal growth	http://purl.obolibrary.org/obo/ZFA_0005145	muscle
http://purl.obolibrary.org/obo/ZP_0146504	muscle increased occurrence mitophagy, abnormal	http://purl.obolibrary.org/obo/GO_0000423	mitophagy	http://purl.obolibrary.org/obo/ZFA_0005145	muscle
http://purl.obolibrary.org/obo/ZP_0137531	myeloid cell increased occurrence apoptotic process, abnormal	http://purl.obolibrary.org/obo/GO_0006915	apoptotic process	http://purl.obolibrary.org/obo/ZFA_0009324	myeloid cell
http://purl.obolibrary.org/obo/ZP_0021663	myeloid cell increased occurrence cell population proliferation, abnormal	http://purl.obolibrary.org/obo/GO_0008283	cell population proliferation	http://purl.obolibrary.org/obo/ZFA_0009324	myeloid cell
http://purl.obolibrary.org/obo/ZP_0100466	myocardium increased occurrence apoptotic process, abnormal	http://purl.obolibrary.org/obo/GO_0006915	apoptotic process	http://purl.obolibrary.org/obo/ZFA_0001319	myocardium
http://purl.obolibrary.org/obo/ZP_0021041	myocardium increased occurrence cell population proliferation, abnormal	http://purl.obolibrary.org/obo/GO_0008283	cell population proliferation	http://purl.obolibrary.org/obo/ZFA_0001319	myocardium
http://purl.obolibrary.org/obo/ZP_0103223	myotome increased occurrence apoptotic process, abnormal	http://purl.obolibrary.org/obo/GO_0006915	apoptotic process	http://purl.obolibrary.org/obo/ZFA_0001056	myotome
http://purl.obolibrary.org/obo/ZP_0021606	nervous system increased occurrence inflammatory response, abnormal	http://purl.obolibrary.org/obo/GO_0006954	inflammatory response	http://purl.obolibrary.org/obo/ZFA_0000396	nervous system
http://purl.obolibrary.org/obo/ZP_0131232	neural crest cell increased occurrence apoptotic process, abnormal	http://purl.obolibrary.org/obo/GO_0006915	apoptotic process	http://purl.obolibrary.org/obo/ZFA_0009165	neural crest cell
http://purl.obolibrary.org/obo/ZP_0131034	neural crest cell increased occurrence cell population proliferation, abnormal	http://purl.obolibrary.org/obo/GO_0008283	cell population proliferation	http://purl.obolibrary.org/obo/ZFA_0009165	neural crest cell
http://purl.obolibrary.org/obo/ZP_0100253	neural crest increased occurrence apoptotic process, abnormal	http://purl.obolibrary.org/obo/GO_0006915	apoptotic process	http://purl.obolibrary.org/obo/ZFA_0000045	neural crest
http://purl.obolibrary.org/obo/ZP_0104357	neural crest increased occurrence cell death, abnormal	http://purl.obolibrary.org/obo/GO_0008219	cell death	http://purl.obolibrary.org/obo/ZFA_0000045	neural crest
http://purl.obolibrary.org/obo/ZP_0149543	neural tube increased occurrence DNA damage response, abnormal	http://purl.obolibrary.org/obo/GO_0006974	DNA damage response	http://purl.obolibrary.org/obo/ZFA_0001135	neural tube
http://purl.obolibrary.org/obo/ZP_0020243	neural tube increased occurrence apoptotic process, abnormal	http://purl.obolibrary.org/obo/GO_0006915	apoptotic process	http://purl.obolibrary.org/obo/ZFA_0001135	neural tube
http://purl.obolibrary.org/obo/ZP_0137834	neural tube increased occurrence cell population proliferation, abnormal	http://purl.obolibrary.org/obo/GO_0008283	cell population proliferation	http://purl.obolibrary.org/obo/ZFA_0001135	neural tube
http://purl.obolibrary.org/obo/ZP_0020560	neural tube increased occurrence pigmentation, abnormal	http://purl.obolibrary.org/obo/GO_0043473	pigmentation	http://purl.obolibrary.org/obo/ZFA_0001135	neural tube
http://purl.obolibrary.org/obo/ZP_0019201	neuroblast (sensu Vertebrata) increased occurrence apoptotic process, abnormal	http://purl.obolibrary.org/obo/GO_0006915	apoptotic process	http://purl.obolibrary.org/obo/ZFA_0009168	neuroblast (sensu Vertebrata)
http://purl.obolibrary.org/obo/ZP_0141094	neuroepithelial cell increased occurrence apoptotic process, abnormal	http://purl.obolibrary.org/obo/GO_0006915	apoptotic process	http://purl.obolibrary.org/obo/ZFA_0009306	neuroepithelial cell
http://purl.obolibrary.org/obo/ZP_0019788	neuroepithelial cell increased occurrence cell population proliferation, abnormal	http://purl.obolibrary.org/obo/GO_0008283	cell population proliferation	http://purl.obolibrary.org/obo/ZFA_0009306	neuroepithelial cell
http://purl.obolibrary.org/obo/ZP_0100459	neuromast hair cell increased occurrence apoptotic process, abnormal	http://purl.obolibrary.org/obo/GO_0006915	apoptotic process	http://purl.obolibrary.org/obo/ZFA_0009367	neuromast hair cell
http://purl.obolibrary.org/obo/ZP_0016537	neuromast hair cell increased occurrence cell death, abnormal	http://purl.obolibrary.org/obo/GO_0008219	cell death	http://purl.obolibrary.org/obo/ZFA_0009367	neuromast hair cell
http://purl.obolibrary.org/obo/ZP_0137345	neuromast hair cell increased occurrence cell population proliferation, abnormal	http://purl.obolibrary.org/obo/GO_0008283	cell population proliferation	http://purl.obolibrary.org/obo/ZFA_0009367	neuromast hair cell
http://purl.obolibrary.org/obo/ZP_0018074	neuromast increased occurrence apoptotic process, abnormal	http://purl.obolibrary.org/obo/GO_0006915	apoptotic process	http://purl.obolibrary.org/obo/ZFA_0000243	neuromast
http://purl.obolibrary.org/obo/ZP_0014913	neuromast increased occurrence cell death, abnormal	http://purl.obolibrary.org/obo/GO_0008219	cell death	http://purl.obolibrary.org/obo/ZFA_0000243	neuromast
http://purl.obolibrary.org/obo/ZP_0130709	neuromast increased occurrence cell population proliferation, abnormal	http://purl.obolibrary.org/obo/GO_0008283	cell population proliferation	http://purl.obolibrary.org/obo/ZFA_0000243	neuromast
http://purl.obolibrary.org/obo/ZP_0142059	neuromast mantle cell increased occurrence cell population proliferation, abnormal	http://purl.obolibrary.org/obo/GO_0008283	cell population proliferation	http://purl.obolibrary.org/obo/ZFA_0009362	neuromast mantle cell
http://purl.obolibrary.org/obo/ZP_0137696	neuromast support cell increased occurrence cell population proliferation, abnormal	http://purl.obolibrary.org/obo/GO_0008283	cell population proliferation	http://purl.obolibrary.org/obo/ZFA_0009363	neuromast support cell
http://purl.obolibrary.org/obo/ZP_0105737	neuromast support cell increased occurrence mitotic cell cycle, abnormal	http://purl.obolibrary.org/obo/GO_0000278	mitotic cell cycle	http://purl.obolibrary.org/obo/ZFA_0009363	neuromast support cell
http://purl.obolibrary.org/obo/ZP_0018862	neuron increased occurrence cell death, abnormal	http://purl.obolibrary.org/obo/GO_0008219	cell death	http://purl.obolibrary.org/obo/ZFA_0009248	neuron
http://purl.obolibrary.org/obo/ZP_0023076	neuron increased occurrence cellular response to stress, abnormal	http://purl.obolibrary.org/obo/GO_0033554	cellular response to stress	http://purl.obolibrary.org/obo/ZFA_0009248	neuron
http://purl.obolibrary.org/obo/ZP_0130778	neuron increased occurrence chromosome organization, abnormal	http://purl.obolibrary.org/obo/GO_0051276	chromosome organization	http://purl.obolibrary.org/obo/ZFA_0009248	neuron
http://purl.obolibrary.org/obo/ZP_0130777	neuron increased occurrence double-strand break repair, abnormal	http://purl.obolibrary.org/obo/GO_0006302	double-strand break repair	http://purl.obolibrary.org/obo/ZFA_0009248	neuron
http://purl.obolibrary.org/obo/ZP_0003930	neuron increased occurrence positive regulation of ERK1 and ERK2 cascade, abnormal	http://purl.obolibrary.org/obo/GO_0070374	positive regulation of ERK1 and ERK2 cascade	http://purl.obolibrary.org/obo/ZFA_0009248	neuron
http://purl.obolibrary.org/obo/ZP_0142224	neuronal stem cell increased occurrence apoptotic process, abnormal	http://purl.obolibrary.org/obo/GO_0006915	apoptotic process	http://purl.obolibrary.org/obo/ZFA_0009019	neuronal stem cell
http://purl.obolibrary.org/obo/ZP_0131168	neutrophil increased occurrence cell population proliferation, abnormal	http://purl.obolibrary.org/obo/GO_0008283	cell population proliferation	http://purl.obolibrary.org/obo/ZFA_0009327	neutrophil
http://purl.obolibrary.org/obo/ZP_0137653	notochord increased occurrence apoptotic process, abnormal	http://purl.obolibrary.org/obo/GO_0006915	apoptotic process	http://purl.obolibrary.org/obo/ZFA_0000135	notochord
http://purl.obolibrary.org/obo/ZP_0148954	notochord increased occurrence cell population proliferation, abnormal	http://purl.obolibrary.org/obo/GO_0008283	cell population proliferation	http://purl.obolibrary.org/obo/ZFA_0000135	notochord
http://purl.obolibrary.org/obo/ZP_0148953	notochord increased occurrence inflammatory response, abnormal	http://purl.obolibrary.org/obo/GO_0006954	inflammatory response	http://purl.obolibrary.org/obo/ZFA_0000135	notochord
http://purl.obolibrary.org/obo/ZP_0021927	notochord increased occurrence nitric oxide biosynthetic process, abnormal	http://purl.obolibrary.org/obo/GO_0006809	nitric oxide biosynthetic process	http://purl.obolibrary.org/obo/ZFA_0000135	notochord
http://purl.obolibrary.org/obo/ZP_0146350	notochord outer sheath cell increased occurrence biomineral tissue development, abnormal	http://purl.obolibrary.org/obo/GO_0031214	biomineral tissue development	http://purl.obolibrary.org/obo/ZFA_0005744	notochord outer sheath cell
http://purl.obolibrary.org/obo/ZP_0012011	notochord outer sheath cell increased occurrence bone mineralization, abnormal	http://purl.obolibrary.org/obo/GO_0030282	bone mineralization	http://purl.obolibrary.org/obo/ZFA_0005744	notochord outer sheath cell
http://purl.obolibrary.org/obo/ZP_0011903	nucleate erythrocyte increased occurrence autophagy, abnormal	http://purl.obolibrary.org/obo/GO_0006914	autophagy	http://purl.obolibrary.org/obo/ZFA_0009256	nucleate erythrocyte
http://purl.obolibrary.org/obo/ZP_0130681	nucleate erythrocyte increased occurrence phagocytosis, abnormal	http://purl.obolibrary.org/obo/GO_0006909	phagocytosis	http://purl.obolibrary.org/obo/ZFA_0009256	nucleate erythrocyte
http://purl.obolibrary.org/obo/ZP_0143065	ocular blood vessel increased occurrence angiogenesis, abnormal	http://purl.obolibrary.org/obo/GO_0001525	angiogenesis	http://purl.obolibrary.org/obo/ZFA_0007057	ocular blood vessel
http://purl.obolibrary.org/obo/ZP_0143057	ocular blood vessel increased occurrence sprouting angiogenesis, abnormal	http://purl.obolibrary.org/obo/GO_0002040	sprouting angiogenesis	http://purl.obolibrary.org/obo/ZFA_0007057	ocular blood vessel
http://purl.obolibrary.org/obo/ZP_0145804	olfactory bulb increased occurrence apoptotic process, abnormal	http://purl.obolibrary.org/obo/GO_0006915	apoptotic process	http://purl.obolibrary.org/obo/ZFA_0000402	olfactory bulb
http://purl.obolibrary.org/obo/ZP_0144728	olfactory bulb increased occurrence calcium ion transport into cytosol, abnormal	http://purl.obolibrary.org/obo/GO_0060402	calcium ion transport into cytosol	http://purl.obolibrary.org/obo/ZFA_0000402	olfactory bulb
http://purl.obolibrary.org/obo/ZP_0021615	olfactory bulb increased occurrence inflammatory response, abnormal	http://purl.obolibrary.org/obo/GO_0006954	inflammatory response	http://purl.obolibrary.org/obo/ZFA_0000402	olfactory bulb
http://purl.obolibrary.org/obo/ZP_0019336	oligodendrocyte increased occurrence TOR signaling, abnormal	http://purl.obolibrary.org/obo/GO_0031929	TOR signaling	http://purl.obolibrary.org/obo/ZFA_0009076	oligodendrocyte
http://purl.obolibrary.org/obo/ZP_0101802	oligodendrocyte increased occurrence cell death, abnormal	http://purl.obolibrary.org/obo/GO_0008219	cell death	http://purl.obolibrary.org/obo/ZFA_0009076	oligodendrocyte
http://purl.obolibrary.org/obo/ZP_0003928	oligodendrocyte increased occurrence cell migration, abnormal	http://purl.obolibrary.org/obo/GO_0016477	cell migration	http://purl.obolibrary.org/obo/ZFA_0009076	oligodendrocyte
http://purl.obolibrary.org/obo/ZP_0101867	oocyte increased occurrence reproductive senescence, abnormal	http://purl.obolibrary.org/obo/GO_1990636	reproductive senescence	http://purl.obolibrary.org/obo/ZFA_0001109	oocyte
http://purl.obolibrary.org/obo/ZP_0138602	oocyte stage III increased occurrence apoptotic process, abnormal	http://purl.obolibrary.org/obo/GO_0006915	apoptotic process	http://purl.obolibrary.org/obo/ZFA_0001566	oocyte stage III
http://purl.obolibrary.org/obo/ZP_0142164	oocyte stage III increased occurrence oocyte maturation, abnormal	http://purl.obolibrary.org/obo/GO_0001556	oocyte maturation	http://purl.obolibrary.org/obo/ZFA_0001566	oocyte stage III
http://purl.obolibrary.org/obo/ZP_0138603	oocyte stage IV increased occurrence apoptotic process, abnormal	http://purl.obolibrary.org/obo/GO_0006915	apoptotic process	http://purl.obolibrary.org/obo/ZFA_0001568	oocyte stage IV
http://purl.obolibrary.org/obo/ZP_0142153	oocyte stage IV increased occurrence oocyte maturation, abnormal	http://purl.obolibrary.org/obo/GO_0001556	oocyte maturation	http://purl.obolibrary.org/obo/ZFA_0001568	oocyte stage IV
http://purl.obolibrary.org/obo/ZP_0105730	opercle increased occurrence ossification, abnormal	http://purl.obolibrary.org/obo/GO_0001503	ossification	http://purl.obolibrary.org/obo/ZFA_0000250	opercle
http://purl.obolibrary.org/obo/ZP_0009006	optic cup increased occurrence apoptotic process, abnormal	http://purl.obolibrary.org/obo/GO_0006915	apoptotic process	http://purl.obolibrary.org/obo/ZFA_0001202	optic cup
http://purl.obolibrary.org/obo/ZP_0138342	optic stalk increased occurrence cell death, abnormal	http://purl.obolibrary.org/obo/GO_0008219	cell death	http://purl.obolibrary.org/obo/ZFA_0000137	optic stalk
http://purl.obolibrary.org/obo/ZP_0100974	optic tectum increased occurrence action potential, abnormal	http://purl.obolibrary.org/obo/GO_0001508	action potential	http://purl.obolibrary.org/obo/ZFA_0000445	optic tectum
http://purl.obolibrary.org/obo/ZP_0011507	optic tectum increased occurrence apoptotic process, abnormal	http://purl.obolibrary.org/obo/GO_0006915	apoptotic process	http://purl.obolibrary.org/obo/ZFA_0000445	optic tectum
http://purl.obolibrary.org/obo/ZP_0019052	optic tectum increased occurrence cell death, abnormal	http://purl.obolibrary.org/obo/GO_0008219	cell death	http://purl.obolibrary.org/obo/ZFA_0000445	optic tectum
http://purl.obolibrary.org/obo/ZP_0020379	optic tectum increased occurrence cell population proliferation, abnormal	http://purl.obolibrary.org/obo/GO_0008283	cell population proliferation	http://purl.obolibrary.org/obo/ZFA_0000445	optic tectum
http://purl.obolibrary.org/obo/ZP_0011508	optic tectum increased occurrence cell proliferation in midbrain, abnormal	http://purl.obolibrary.org/obo/GO_0033278	cell proliferation in midbrain	http://purl.obolibrary.org/obo/ZFA_0000445	optic tectum
