defined_class	defined_class_label	biological_process	biological_process_label	location	location_label
http://purl.obolibrary.org/obo/ZP_0107036	B cell increased occurrence apoptotic process, abnormal	http://purl.obolibrary.org/obo/GO_0006915	apoptotic process	http://purl.obolibrary.org/obo/ZFA_0009142	B cell
http://purl.obolibrary.org/obo/ZP_0020200	CaP motoneuron increased occurrence collateral sprouting, abnormal	http://purl.obolibrary.org/obo/GO_0048668	collateral sprouting	http://purl.obolibrary.org/obo/ZFA_0009243	CaP motoneuron
http://purl.obolibrary.org/obo/ZP_0022486	CaP motoneuron increased occurrence inhibitory postsynaptic potential, abnormal	http://purl.obolibrary.org/obo/GO_0060080	inhibitory postsynaptic potential	http://purl.obolibrary.org/obo/ZFA_0009243	CaP motoneuron
http://purl.obolibrary.org/obo/ZP_0014796	Kolmer-Agduhr neuron increased occurrence ventral spinal cord interneuron specification, abnormal	http://purl.obolibrary.org/obo/GO_0021521	ventral spinal cord interneuron specification	http://purl.obolibrary.org/obo/ZFA_0005240	Kolmer-Agduhr neuron
http://purl.obolibrary.org/obo/ZP_0141211	Kupffer's vesicle increased occurrence cell death, abnormal	http://purl.obolibrary.org/obo/GO_0008219	cell death	http://purl.obolibrary.org/obo/ZFA_0000001	Kupffer's vesicle
http://purl.obolibrary.org/obo/ZP_0010813	Mauthner neuron increased occurrence action potential, abnormal	http://purl.obolibrary.org/obo/GO_0001508	action potential	http://purl.obolibrary.org/obo/ZFA_0009149	Mauthner neuron
http://purl.obolibrary.org/obo/ZP_0100475	Meckel's cartilage increased occurrence bone mineralization, abnormal	http://purl.obolibrary.org/obo/GO_0030282	bone mineralization	http://purl.obolibrary.org/obo/ZFA_0001205	Meckel's cartilage
http://purl.obolibrary.org/obo/ZP_0017664	Muller cell increased occurrence apoptotic process, abnormal	http://purl.obolibrary.org/obo/GO_0006915	apoptotic process	http://purl.obolibrary.org/obo/ZFA_0009280	Muller cell
http://purl.obolibrary.org/obo/ZP_0104449	Muller cell increased occurrence cell dedifferentiation, abnormal	http://purl.obolibrary.org/obo/GO_0043697	cell dedifferentiation	http://purl.obolibrary.org/obo/ZFA_0009280	Muller cell
http://purl.obolibrary.org/obo/ZP_0022050	Muller cell increased occurrence cell population proliferation, abnormal	http://purl.obolibrary.org/obo/GO_0008283	cell population proliferation	http://purl.obolibrary.org/obo/ZFA_0009280	Muller cell
http://purl.obolibrary.org/obo/ZP_0017600	Muller cell increased occurrence cell surface receptor signaling pathway via JAK-STAT, abnormal	http://purl.obolibrary.org/obo/GO_0007259	cell surface receptor signaling pathway via JAK-STAT	http://purl.obolibrary.org/obo/ZFA_0009280	Muller cell
http://purl.obolibrary.org/obo/ZP_0015289	Muller cell increased occurrence interkinetic nuclear migration, abnormal	http://purl.obolibrary.org/obo/GO_0022027	interkinetic nuclear migration	http://purl.obolibrary.org/obo/ZFA_0009280	Muller cell
http://purl.obolibrary.org/obo/ZP_0140812	NaK ionocyte increased occurrence cell division, abnormal	http://purl.obolibrary.org/obo/GO_0051301	cell division	http://purl.obolibrary.org/obo/ZFA_0005326	NaK ionocyte
http://purl.obolibrary.org/obo/ZP_0149197	Rohon-Beard neuron increased occurrence fasciculation of sensory neuron axon, abnormal	http://purl.obolibrary.org/obo/GO_0097155	fasciculation of sensory neuron axon	http://purl.obolibrary.org/obo/ZFA_0009150	Rohon-Beard neuron
http://purl.obolibrary.org/obo/ZP_0100279	Rohon-Beard neuron increased occurrence retrograde axonal transport, abnormal	http://purl.obolibrary.org/obo/GO_0008090	retrograde axonal transport	http://purl.obolibrary.org/obo/ZFA_0009150	Rohon-Beard neuron
http://purl.obolibrary.org/obo/ZP_0101064	Sertoli cell increased occurrence cell population proliferation, abnormal	http://purl.obolibrary.org/obo/GO_0008283	cell population proliferation	http://purl.obolibrary.org/obo/ZFA_0009133	Sertoli cell
http://purl.obolibrary.org/obo/ZP_0104085	T cell increased occurrence apoptotic process, abnormal	http://purl.obolibrary.org/obo/GO_0006915	apoptotic process	http://purl.obolibrary.org/obo/ZFA_0009046	T cell
http://purl.obolibrary.org/obo/ZP_0102580	UV sensitive photoreceptor cell increased occurrence apoptotic process, abnormal	http://purl.obolibrary.org/obo/GO_0006915	apoptotic process	http://purl.obolibrary.org/obo/ZFA_0009221	UV sensitive photoreceptor cell
http://purl.obolibrary.org/obo/ZP_0012063	adenohypophysis increased occurrence apoptotic process, abnormal	http://purl.obolibrary.org/obo/GO_0006915	apoptotic process	http://purl.obolibrary.org/obo/ZFA_0001282	adenohypophysis
http://purl.obolibrary.org/obo/ZP_0104649	afferent neuron increased occurrence innervation, abnormal	http://purl.obolibrary.org/obo/GO_0060384	innervation	http://purl.obolibrary.org/obo/ZFA_0009238	afferent neuron
http://purl.obolibrary.org/obo/ZP_0141705	anterior pancreatic bud increased occurrence apoptotic process, abnormal	http://purl.obolibrary.org/obo/GO_0006915	apoptotic process	http://purl.obolibrary.org/obo/ZFA_0001369	anterior pancreatic bud
http://purl.obolibrary.org/obo/ZP_0102364	atrial myocardium increased occurrence cardiac muscle cell proliferation, abnormal	http://purl.obolibrary.org/obo/GO_0060038	cardiac muscle cell proliferation	http://purl.obolibrary.org/obo/ZFA_0001374	atrial myocardium
http://purl.obolibrary.org/obo/ZP_0103843	atrial myocardium increased occurrence cell population proliferation, abnormal	http://purl.obolibrary.org/obo/GO_0008283	cell population proliferation	http://purl.obolibrary.org/obo/ZFA_0001374	atrial myocardium
http://purl.obolibrary.org/obo/ZP_0103064	atrioventricular canal endocardium increased occurrence Notch signaling involved in heart development, abnormal	http://purl.obolibrary.org/obo/GO_0061314	Notch signaling involved in heart development	http://purl.obolibrary.org/obo/ZFA_0001616	atrioventricular canal endocardium
http://purl.obolibrary.org/obo/ZP_0141884	atrioventricular canal increased occurrence cell proliferation involved in heart valve morphogenesis, abnormal	http://purl.obolibrary.org/obo/GO_0003249	cell proliferation involved in heart valve morphogenesis	http://purl.obolibrary.org/obo/ZFA_0001315	atrioventricular canal
http://purl.obolibrary.org/obo/ZP_0022026	atrium increased occurrence BMP signaling pathway, abnormal	http://purl.obolibrary.org/obo/GO_0030509	BMP signaling pathway	http://purl.obolibrary.org/obo/ZFA_0000471	atrium
http://purl.obolibrary.org/obo/ZP_0137550	atrium increased occurrence apoptotic process, abnormal	http://purl.obolibrary.org/obo/GO_0006915	apoptotic process	http://purl.obolibrary.org/obo/ZFA_0000471	atrium
http://purl.obolibrary.org/obo/ZP_0137334	atrium increased occurrence cardiac muscle cell proliferation, abnormal	http://purl.obolibrary.org/obo/GO_0060038	cardiac muscle cell proliferation	http://purl.obolibrary.org/obo/ZFA_0000471	atrium
http://purl.obolibrary.org/obo/ZP_0137807	atrium increased occurrence cell population proliferation, abnormal	http://purl.obolibrary.org/obo/GO_0008283	cell population proliferation	http://purl.obolibrary.org/obo/ZFA_0000471	atrium
http://purl.obolibrary.org/obo/ZP_0147279	axis increased occurrence cell population proliferation, abnormal	http://purl.obolibrary.org/obo/GO_0008283	cell population proliferation	http://purl.obolibrary.org/obo/ZFA_0000092	axis
http://purl.obolibrary.org/obo/ZP_0101412	bile ductule increased occurrence morphogenesis of a branching epithelium, abnormal	http://purl.obolibrary.org/obo/GO_0061138	morphogenesis of a branching epithelium	http://purl.obolibrary.org/obo/ZFA_0005164	bile ductule
http://purl.obolibrary.org/obo/ZP_0141574	blastema increased occurrence apoptotic process, abnormal	http://purl.obolibrary.org/obo/GO_0006915	apoptotic process	http://purl.obolibrary.org/obo/ZFA_0001270	blastema
http://purl.obolibrary.org/obo/ZP_0020529	blastoderm increased occurrence apoptotic process, abnormal	http://purl.obolibrary.org/obo/GO_0006915	apoptotic process	http://purl.obolibrary.org/obo/ZFA_0001176	blastoderm
http://purl.obolibrary.org/obo/ZP_0106957	blastomere increased occurrence apoptotic process, abnormal	http://purl.obolibrary.org/obo/GO_0006915	apoptotic process	http://purl.obolibrary.org/obo/ZFA_0000093	blastomere
http://purl.obolibrary.org/obo/ZP_0105823	blastomere increased occurrence release of sequestered calcium ion into cytosol, abnormal	http://purl.obolibrary.org/obo/GO_0051209	release of sequestered calcium ion into cytosol	http://purl.obolibrary.org/obo/ZFA_0000093	blastomere
http://purl.obolibrary.org/obo/ZP_0004488	blood island increased occurrence apoptotic process, abnormal	http://purl.obolibrary.org/obo/GO_0006915	apoptotic process	http://purl.obolibrary.org/obo/ZFA_0000094	blood island
http://purl.obolibrary.org/obo/ZP_0022153	blood island increased occurrence autophagy, abnormal	http://purl.obolibrary.org/obo/GO_0006914	autophagy	http://purl.obolibrary.org/obo/ZFA_0000094	blood island
http://purl.obolibrary.org/obo/ZP_0102754	blood island increased occurrence hepatoblast apoptotic process, abnormal	http://purl.obolibrary.org/obo/GO_1902489	hepatoblast apoptotic process	http://purl.obolibrary.org/obo/ZFA_0000094	blood island
http://purl.obolibrary.org/obo/ZP_0140900	blood vessel endothelial cell increased occurrence apoptotic process, abnormal	http://purl.obolibrary.org/obo/GO_0006915	apoptotic process	http://purl.obolibrary.org/obo/ZFA_0009036	blood vessel endothelial cell
http://purl.obolibrary.org/obo/ZP_0140051	blood vessel endothelial cell increased occurrence cell population proliferation, abnormal	http://purl.obolibrary.org/obo/GO_0008283	cell population proliferation	http://purl.obolibrary.org/obo/ZFA_0009036	blood vessel endothelial cell
http://purl.obolibrary.org/obo/ZP_0148638	blood vessel increased occurrence formation of infection structure, abnormal	http://purl.obolibrary.org/obo/GO_0075015	formation of infection structure	http://purl.obolibrary.org/obo/ZFA_0005314	blood vessel
http://purl.obolibrary.org/obo/ZP_0102582	blue sensitive photoreceptor cell increased occurrence apoptotic process, abnormal	http://purl.obolibrary.org/obo/GO_0006915	apoptotic process	http://purl.obolibrary.org/obo/ZFA_0009222	blue sensitive photoreceptor cell
http://purl.obolibrary.org/obo/ZP_0021099	brain increased occurrence BMP signaling pathway, abnormal	http://purl.obolibrary.org/obo/GO_0030509	BMP signaling pathway	http://purl.obolibrary.org/obo/ZFA_0000008	brain
http://purl.obolibrary.org/obo/ZP_0003046	brain increased occurrence DNA damage response, abnormal	http://purl.obolibrary.org/obo/GO_0006974	DNA damage response	http://purl.obolibrary.org/obo/ZFA_0000008	brain
http://purl.obolibrary.org/obo/ZP_0018137	brain increased occurrence Notch signaling pathway, abnormal	http://purl.obolibrary.org/obo/GO_0007219	Notch signaling pathway	http://purl.obolibrary.org/obo/ZFA_0000008	brain
http://purl.obolibrary.org/obo/ZP_0141771	brain increased occurrence Wnt signaling pathway, abnormal	http://purl.obolibrary.org/obo/GO_0016055	Wnt signaling pathway	http://purl.obolibrary.org/obo/ZFA_0000008	brain
http://purl.obolibrary.org/obo/ZP_0142996	brain increased occurrence action potential, abnormal	http://purl.obolibrary.org/obo/GO_0001508	action potential	http://purl.obolibrary.org/obo/ZFA_0000008	brain
http://purl.obolibrary.org/obo/ZP_0009002	brain increased occurrence apoptotic process, abnormal	http://purl.obolibrary.org/obo/GO_0006915	apoptotic process	http://purl.obolibrary.org/obo/ZFA_0000008	brain
http://purl.obolibrary.org/obo/ZP_0142076	brain increased occurrence astrocyte activation, abnormal	http://purl.obolibrary.org/obo/GO_0048143	astrocyte activation	http://purl.obolibrary.org/obo/ZFA_0000008	brain
http://purl.obolibrary.org/obo/ZP_0021100	brain increased occurrence astrocyte development, abnormal	http://purl.obolibrary.org/obo/GO_0014002	astrocyte development	http://purl.obolibrary.org/obo/ZFA_0000008	brain
http://purl.obolibrary.org/obo/ZP_0018102	brain increased occurrence astrocyte differentiation, abnormal	http://purl.obolibrary.org/obo/GO_0048708	astrocyte differentiation	http://purl.obolibrary.org/obo/ZFA_0000008	brain
http://purl.obolibrary.org/obo/ZP_0140529	brain increased occurrence blood coagulation, abnormal	http://purl.obolibrary.org/obo/GO_0007596	blood coagulation	http://purl.obolibrary.org/obo/ZFA_0000008	brain
http://purl.obolibrary.org/obo/ZP_0103877	brain increased occurrence calcium-mediated signaling, abnormal	http://purl.obolibrary.org/obo/GO_0019722	calcium-mediated signaling	http://purl.obolibrary.org/obo/ZFA_0000008	brain
http://purl.obolibrary.org/obo/ZP_0101168	brain increased occurrence cell death, abnormal	http://purl.obolibrary.org/obo/GO_0008219	cell death	http://purl.obolibrary.org/obo/ZFA_0000008	brain
http://purl.obolibrary.org/obo/ZP_0019200	brain increased occurrence cell population proliferation, abnormal	http://purl.obolibrary.org/obo/GO_0008283	cell population proliferation	http://purl.obolibrary.org/obo/ZFA_0000008	brain
http://purl.obolibrary.org/obo/ZP_0142023	brain increased occurrence engulfment of apoptotic cell, abnormal	http://purl.obolibrary.org/obo/GO_0043652	engulfment of apoptotic cell	http://purl.obolibrary.org/obo/ZFA_0000008	brain
http://purl.obolibrary.org/obo/ZP_0130764	brain increased occurrence infection cushion formation, abnormal	http://purl.obolibrary.org/obo/GO_0075183	infection cushion formation	http://purl.obolibrary.org/obo/ZFA_0000008	brain
http://purl.obolibrary.org/obo/ZP_0140528	brain increased occurrence inflammatory response, abnormal	http://purl.obolibrary.org/obo/GO_0006954	inflammatory response	http://purl.obolibrary.org/obo/ZFA_0000008	brain
http://purl.obolibrary.org/obo/ZP_0019402	brain increased occurrence mRNA modification, abnormal	http://purl.obolibrary.org/obo/GO_0016556	mRNA modification	http://purl.obolibrary.org/obo/ZFA_0000008	brain
http://purl.obolibrary.org/obo/ZP_0022970	brain increased occurrence macrophage chemotaxis, abnormal	http://purl.obolibrary.org/obo/GO_0048246	macrophage chemotaxis	http://purl.obolibrary.org/obo/ZFA_0000008	brain
http://purl.obolibrary.org/obo/ZP_0106285	brain increased occurrence mitotic cell cycle, abnormal	http://purl.obolibrary.org/obo/GO_0000278	mitotic cell cycle	http://purl.obolibrary.org/obo/ZFA_0000008	brain
http://purl.obolibrary.org/obo/ZP_0018103	brain increased occurrence neural precursor cell proliferation, abnormal	http://purl.obolibrary.org/obo/GO_0061351	neural precursor cell proliferation	http://purl.obolibrary.org/obo/ZFA_0000008	brain
http://purl.obolibrary.org/obo/ZP_0021910	brain increased occurrence neurogenesis, abnormal	http://purl.obolibrary.org/obo/GO_0022008	neurogenesis	http://purl.obolibrary.org/obo/ZFA_0000008	brain
http://purl.obolibrary.org/obo/ZP_0018173	brain increased occurrence neuron differentiation, abnormal	http://purl.obolibrary.org/obo/GO_0030182	neuron differentiation	http://purl.obolibrary.org/obo/ZFA_0000008	brain
http://purl.obolibrary.org/obo/ZP_0146987	brain increased occurrence neuronal action potential, abnormal	http://purl.obolibrary.org/obo/GO_0019228	neuronal action potential	http://purl.obolibrary.org/obo/ZFA_0000008	brain
http://purl.obolibrary.org/obo/ZP_0140530	brain increased occurrence neutrophil chemotaxis, abnormal	http://purl.obolibrary.org/obo/GO_0030593	neutrophil chemotaxis	http://purl.obolibrary.org/obo/ZFA_0000008	brain
http://purl.obolibrary.org/obo/ZP_0145679	brain increased occurrence programmed necrotic cell death, abnormal	http://purl.obolibrary.org/obo/GO_0097300	programmed necrotic cell death	http://purl.obolibrary.org/obo/ZFA_0000008	brain
http://purl.obolibrary.org/obo/ZP_0149438	brain increased occurrence protein aggregate center assembly, abnormal	http://purl.obolibrary.org/obo/GO_0140454	protein aggregate center assembly	http://purl.obolibrary.org/obo/ZFA_0000008	brain
http://purl.obolibrary.org/obo/ZP_0021542	brain increased occurrence reactive oxygen species biosynthetic process, abnormal	http://purl.obolibrary.org/obo/GO_1903409	reactive oxygen species biosynthetic process	http://purl.obolibrary.org/obo/ZFA_0000008	brain
http://purl.obolibrary.org/obo/ZP_0100501	brain increased occurrence transmission of nerve impulse, abnormal	http://purl.obolibrary.org/obo/GO_0019226	transmission of nerve impulse	http://purl.obolibrary.org/obo/ZFA_0000008	brain
http://purl.obolibrary.org/obo/ZP_0137806	bulbus arteriosus increased occurrence cell population proliferation, abnormal	http://purl.obolibrary.org/obo/GO_0008283	cell population proliferation	http://purl.obolibrary.org/obo/ZFA_0000173	bulbus arteriosus
http://purl.obolibrary.org/obo/ZP_0140336	cardiac muscle cell increased occurrence apoptotic process, abnormal	http://purl.obolibrary.org/obo/GO_0006915	apoptotic process	http://purl.obolibrary.org/obo/ZFA_0009316	cardiac muscle cell
http://purl.obolibrary.org/obo/ZP_0144130	cardiac muscle cell increased occurrence cardiac muscle cell proliferation, abnormal	http://purl.obolibrary.org/obo/GO_0060038	cardiac muscle cell proliferation	http://purl.obolibrary.org/obo/ZFA_0009316	cardiac muscle cell
http://purl.obolibrary.org/obo/ZP_0022867	cardiac muscle cell increased occurrence cell population proliferation, abnormal	http://purl.obolibrary.org/obo/GO_0008283	cell population proliferation	http://purl.obolibrary.org/obo/ZFA_0009316	cardiac muscle cell
http://purl.obolibrary.org/obo/ZP_0021733	cardiac muscle cell increased occurrence mitotic cell cycle process, abnormal	http://purl.obolibrary.org/obo/GO_1903047	mitotic cell cycle process	http://purl.obolibrary.org/obo/ZFA_0009316	cardiac muscle cell
http://purl.obolibrary.org/obo/ZP_0021316	cardiac muscle cell increased occurrence re-entry into mitotic cell cycle, abnormal	http://purl.obolibrary.org/obo/GO_0000320	re-entry into mitotic cell cycle	http://purl.obolibrary.org/obo/ZFA_0009316	cardiac muscle cell
http://purl.obolibrary.org/obo/ZP_0145654	cardiac muscle myoblast increased occurrence cell population proliferation, abnormal	http://purl.obolibrary.org/obo/GO_0008283	cell population proliferation	http://purl.obolibrary.org/obo/ZFA_0009234	cardiac muscle myoblast
http://purl.obolibrary.org/obo/ZP_0022025	cardiac ventricle increased occurrence BMP signaling pathway, abnormal	http://purl.obolibrary.org/obo/GO_0030509	BMP signaling pathway	http://purl.obolibrary.org/obo/ZFA_0000009	cardiac ventricle
http://purl.obolibrary.org/obo/ZP_0021224	cardiac ventricle increased occurrence Notch signaling pathway, abnormal	http://purl.obolibrary.org/obo/GO_0007219	Notch signaling pathway	http://purl.obolibrary.org/obo/ZFA_0000009	cardiac ventricle
http://purl.obolibrary.org/obo/ZP_0137549	cardiac ventricle increased occurrence apoptotic process, abnormal	http://purl.obolibrary.org/obo/GO_0006915	apoptotic process	http://purl.obolibrary.org/obo/ZFA_0000009	cardiac ventricle
http://purl.obolibrary.org/obo/ZP_0131162	cardiac ventricle increased occurrence cardiac muscle cell proliferation, abnormal	http://purl.obolibrary.org/obo/GO_0060038	cardiac muscle cell proliferation	http://purl.obolibrary.org/obo/ZFA_0000009	cardiac ventricle
http://purl.obolibrary.org/obo/ZP_0145548	cardiac ventricle increased occurrence cell death, abnormal	http://purl.obolibrary.org/obo/GO_0008219	cell death	http://purl.obolibrary.org/obo/ZFA_0000009	cardiac ventricle
http://purl.obolibrary.org/obo/ZP_0130752	cardiac ventricle increased occurrence cell population proliferation, abnormal	http://purl.obolibrary.org/obo/GO_0008283	cell population proliferation	http://purl.obolibrary.org/obo/ZFA_0000009	cardiac ventricle
http://purl.obolibrary.org/obo/ZP_0105926	cardiac ventricle increased occurrence heart contraction, abnormal	http://purl.obolibrary.org/obo/GO_0060047	heart contraction	http://purl.obolibrary.org/obo/ZFA_0000009	cardiac ventricle
http://purl.obolibrary.org/obo/ZP_0141365	cardiac ventricle increased occurrence heart trabecula formation, abnormal	http://purl.obolibrary.org/obo/GO_0060347	heart trabecula formation	http://purl.obolibrary.org/obo/ZFA_0000009	cardiac ventricle
http://purl.obolibrary.org/obo/ZP_0100895	cardiac ventricle increased occurrence inflammatory response, abnormal	http://purl.obolibrary.org/obo/GO_0006954	inflammatory response	http://purl.obolibrary.org/obo/ZFA_0000009	cardiac ventricle
http://purl.obolibrary.org/obo/ZP_0018516	caudal division of the internal carotid artery increased occurrence blood vessel endothelial cell migration, abnormal	http://purl.obolibrary.org/obo/GO_0043534	blood vessel endothelial cell migration	http://purl.obolibrary.org/obo/ZFA_0001051	caudal division of the internal carotid artery
http://purl.obolibrary.org/obo/ZP_0004522	caudal fin increased occurrence apoptotic process, abnormal	http://purl.obolibrary.org/obo/GO_0006915	apoptotic process	http://purl.obolibrary.org/obo/ZFA_0001058	caudal fin
http://purl.obolibrary.org/obo/ZP_0141294	caudal fin increased occurrence cell population proliferation, abnormal	http://purl.obolibrary.org/obo/GO_0008283	cell population proliferation	http://purl.obolibrary.org/obo/ZFA_0001058	caudal fin
http://purl.obolibrary.org/obo/ZP_0006820	caudal fin increased occurrence intrinsic apoptotic signaling pathway by p53 class mediator, abnormal	http://purl.obolibrary.org/obo/GO_0072332	intrinsic apoptotic signaling pathway by p53 class mediator	http://purl.obolibrary.org/obo/ZFA_0001058	caudal fin
http://purl.obolibrary.org/obo/ZP_0144479	caudal fin increased occurrence macrophage migration, abnormal	http://purl.obolibrary.org/obo/GO_1905517	macrophage migration	http://purl.obolibrary.org/obo/ZFA_0001058	caudal fin
http://purl.obolibrary.org/obo/ZP_0103575	caudal fin increased occurrence muscle contraction, abnormal	http://purl.obolibrary.org/obo/GO_0006936	muscle contraction	http://purl.obolibrary.org/obo/ZFA_0001058	caudal fin
http://purl.obolibrary.org/obo/ZP_0144480	caudal fin increased occurrence neutrophil migration, abnormal	http://purl.obolibrary.org/obo/GO_1990266	neutrophil migration	http://purl.obolibrary.org/obo/ZFA_0001058	caudal fin
http://purl.obolibrary.org/obo/ZP_0141995	caudal hematopoietic tissue increased occurrence apoptotic process, abnormal	http://purl.obolibrary.org/obo/GO_0006915	apoptotic process	http://purl.obolibrary.org/obo/ZFA_0005898	caudal hematopoietic tissue
http://purl.obolibrary.org/obo/ZP_0141633	caudal hematopoietic tissue increased occurrence canonical Wnt signaling pathway, abnormal	http://purl.obolibrary.org/obo/GO_0060070	canonical Wnt signaling pathway	http://purl.obolibrary.org/obo/ZFA_0005898	caudal hematopoietic tissue
http://purl.obolibrary.org/obo/ZP_0138288	caudal hematopoietic tissue increased occurrence cell death, abnormal	http://purl.obolibrary.org/obo/GO_0008219	cell death	http://purl.obolibrary.org/obo/ZFA_0005898	caudal hematopoietic tissue
http://purl.obolibrary.org/obo/ZP_0145996	caudal hematopoietic tissue increased occurrence erythrocyte differentiation, abnormal	http://purl.obolibrary.org/obo/GO_0030218	erythrocyte differentiation	http://purl.obolibrary.org/obo/ZFA_0005898	caudal hematopoietic tissue
http://purl.obolibrary.org/obo/ZP_0145998	caudal hematopoietic tissue increased occurrence hematopoietic progenitor cell differentiation, abnormal	http://purl.obolibrary.org/obo/GO_0002244	hematopoietic progenitor cell differentiation	http://purl.obolibrary.org/obo/ZFA_0005898	caudal hematopoietic tissue
http://purl.obolibrary.org/obo/ZP_0145995	caudal hematopoietic tissue increased occurrence myeloid cell differentiation, abnormal	http://purl.obolibrary.org/obo/GO_0030099	myeloid cell differentiation	http://purl.obolibrary.org/obo/ZFA_0005898	caudal hematopoietic tissue
http://purl.obolibrary.org/obo/ZP_0140012	caudal hematopoietic tissue increased occurrence neutrophil apoptotic process, abnormal	http://purl.obolibrary.org/obo/GO_0001781	neutrophil apoptotic process	http://purl.obolibrary.org/obo/ZFA_0005898	caudal hematopoietic tissue
http://purl.obolibrary.org/obo/ZP_0020912	caudal vein plexus increased occurrence apoptotic process, abnormal	http://purl.obolibrary.org/obo/GO_0006915	apoptotic process	http://purl.obolibrary.org/obo/ZFA_0001286	caudal vein plexus
http://purl.obolibrary.org/obo/ZP_0011342	caudal vein plexus increased occurrence sprouting angiogenesis, abnormal	http://purl.obolibrary.org/obo/GO_0002040	sprouting angiogenesis	http://purl.obolibrary.org/obo/ZFA_0001286	caudal vein plexus
http://purl.obolibrary.org/obo/ZP_0019207	central nervous system increased occurrence apoptotic process, abnormal	http://purl.obolibrary.org/obo/GO_0006915	apoptotic process	http://purl.obolibrary.org/obo/ZFA_0000012	central nervous system
http://purl.obolibrary.org/obo/ZP_0100800	central nervous system increased occurrence cell death, abnormal	http://purl.obolibrary.org/obo/GO_0008219	cell death	http://purl.obolibrary.org/obo/ZFA_0000012	central nervous system
http://purl.obolibrary.org/obo/ZP_0141400	central nervous system increased occurrence cell population proliferation, abnormal	http://purl.obolibrary.org/obo/GO_0008283	cell population proliferation	http://purl.obolibrary.org/obo/ZFA_0000012	central nervous system
http://purl.obolibrary.org/obo/ZP_0144614	central nervous system increased occurrence generation of neurons, abnormal	http://purl.obolibrary.org/obo/GO_0048699	generation of neurons	http://purl.obolibrary.org/obo/ZFA_0000012	central nervous system
http://purl.obolibrary.org/obo/ZP_0149440	central nervous system increased occurrence protein aggregate center assembly, abnormal	http://purl.obolibrary.org/obo/GO_0140454	protein aggregate center assembly	http://purl.obolibrary.org/obo/ZFA_0000012	central nervous system
