defined_class	defined_class_label	biological_process	biological_process_label	location	location_label
http://purl.obolibrary.org/obo/ZP_0103941	optic tectum process quality neuronal signal transduction, abnormal	http://purl.obolibrary.org/obo/GO_0023041	neuronal signal transduction	http://purl.obolibrary.org/obo/ZFA_0000445	optic tectum
http://purl.obolibrary.org/obo/ZP_0011509	optic tectum process quality regulation of neurogenesis, abnormal	http://purl.obolibrary.org/obo/GO_0050767	regulation of neurogenesis	http://purl.obolibrary.org/obo/ZFA_0000445	optic tectum
http://purl.obolibrary.org/obo/ZP_0017232	optic tectum process quality regulation of neuronal action potential, abnormal	http://purl.obolibrary.org/obo/GO_0098908	regulation of neuronal action potential	http://purl.obolibrary.org/obo/ZFA_0000445	optic tectum
http://purl.obolibrary.org/obo/ZP_0103939	optic tectum process quality response to light stimulus, abnormal	http://purl.obolibrary.org/obo/GO_0009416	response to light stimulus	http://purl.obolibrary.org/obo/ZFA_0000445	optic tectum
http://purl.obolibrary.org/obo/ZP_0017495	optic tectum process quality transmission of nerve impulse, abnormal	http://purl.obolibrary.org/obo/GO_0019226	transmission of nerve impulse	http://purl.obolibrary.org/obo/ZFA_0000445	optic tectum
http://purl.obolibrary.org/obo/ZP_0105767	optic vesicle process quality cell migration, abnormal	http://purl.obolibrary.org/obo/GO_0016477	cell migration	http://purl.obolibrary.org/obo/ZFA_0000050	optic vesicle
http://purl.obolibrary.org/obo/ZP_0102091	oral region process quality neural crest cell migration, abnormal	http://purl.obolibrary.org/obo/GO_0001755	neural crest cell migration	http://purl.obolibrary.org/obo/ZFA_0000590	oral region
http://purl.obolibrary.org/obo/ZP_0022204	osteoblast process quality fin regeneration, abnormal	http://purl.obolibrary.org/obo/GO_0031101	fin regeneration	http://purl.obolibrary.org/obo/ZFA_0009031	osteoblast
http://purl.obolibrary.org/obo/ZP_0017796	otic vesicle process quality Notch signaling pathway, abnormal	http://purl.obolibrary.org/obo/GO_0007219	Notch signaling pathway	http://purl.obolibrary.org/obo/ZFA_0000051	otic vesicle
http://purl.obolibrary.org/obo/ZP_0143260	otic vesicle process quality apoptotic process, abnormal	http://purl.obolibrary.org/obo/GO_0006915	apoptotic process	http://purl.obolibrary.org/obo/ZFA_0000051	otic vesicle
http://purl.obolibrary.org/obo/ZP_0143261	otic vesicle process quality cell population proliferation, abnormal	http://purl.obolibrary.org/obo/GO_0008283	cell population proliferation	http://purl.obolibrary.org/obo/ZFA_0000051	otic vesicle
http://purl.obolibrary.org/obo/ZP_0021358	otic vesicle process quality cilium assembly, abnormal	http://purl.obolibrary.org/obo/GO_0060271	cilium assembly	http://purl.obolibrary.org/obo/ZFA_0000051	otic vesicle
http://purl.obolibrary.org/obo/ZP_0014617	otic vesicle process quality establishment or maintenance of epithelial cell apical/basal polarity, abnormal	http://purl.obolibrary.org/obo/GO_0045197	establishment or maintenance of epithelial cell apical/basal polarity	http://purl.obolibrary.org/obo/ZFA_0000051	otic vesicle
http://purl.obolibrary.org/obo/ZP_0017797	otic vesicle process quality fibroblast growth factor receptor signaling pathway, abnormal	http://purl.obolibrary.org/obo/GO_0008543	fibroblast growth factor receptor signaling pathway	http://purl.obolibrary.org/obo/ZFA_0000051	otic vesicle
http://purl.obolibrary.org/obo/ZP_0013146	otic vesicle process quality inner ear receptor cell differentiation, abnormal	http://purl.obolibrary.org/obo/GO_0060113	inner ear receptor cell differentiation	http://purl.obolibrary.org/obo/ZFA_0000051	otic vesicle
http://purl.obolibrary.org/obo/ZP_0016883	otic vesicle process quality neurogenesis, abnormal	http://purl.obolibrary.org/obo/GO_0022008	neurogenesis	http://purl.obolibrary.org/obo/ZFA_0000051	otic vesicle
http://purl.obolibrary.org/obo/ZP_0017197	otic vesicle process quality neuron differentiation, abnormal	http://purl.obolibrary.org/obo/GO_0030182	neuron differentiation	http://purl.obolibrary.org/obo/ZFA_0000051	otic vesicle
http://purl.obolibrary.org/obo/ZP_0104592	otic vesicle process quality otolith formation, abnormal	http://purl.obolibrary.org/obo/GO_0032475	otolith formation	http://purl.obolibrary.org/obo/ZFA_0000051	otic vesicle
http://purl.obolibrary.org/obo/ZP_0013707	otic vesicle process quality otolith tethering, abnormal	http://purl.obolibrary.org/obo/GO_0035889	otolith tethering	http://purl.obolibrary.org/obo/ZFA_0000051	otic vesicle
http://purl.obolibrary.org/obo/ZP_0100461	otolith process quality regeneration, abnormal	http://purl.obolibrary.org/obo/GO_0031099	regeneration	http://purl.obolibrary.org/obo/ZFA_0001617	otolith
http://purl.obolibrary.org/obo/ZP_0105916	ovarian follicle stage III process quality chorion micropyle formation, abnormal	http://purl.obolibrary.org/obo/GO_0046844	chorion micropyle formation	http://purl.obolibrary.org/obo/ZFA_0001266	ovarian follicle stage III
http://purl.obolibrary.org/obo/ZP_0137540	ovarian follicle stage IV process quality cellular response to progesterone stimulus, abnormal	http://purl.obolibrary.org/obo/GO_0071393	cellular response to progesterone stimulus	http://purl.obolibrary.org/obo/ZFA_0001264	ovarian follicle stage IV
http://purl.obolibrary.org/obo/ZP_0145810	ovary process quality animal organ regeneration, abnormal	http://purl.obolibrary.org/obo/GO_0031100	animal organ regeneration	http://purl.obolibrary.org/obo/ZFA_0000403	ovary
http://purl.obolibrary.org/obo/ZP_0103096	palate process quality cell migration, abnormal	http://purl.obolibrary.org/obo/GO_0016477	cell migration	http://purl.obolibrary.org/obo/ZFA_0005509	palate
http://purl.obolibrary.org/obo/ZP_0014016	palatoquadrate cartilage process quality chondrocyte differentiation, abnormal	http://purl.obolibrary.org/obo/GO_0002062	chondrocyte differentiation	http://purl.obolibrary.org/obo/ZFA_0001399	palatoquadrate cartilage
http://purl.obolibrary.org/obo/ZP_0148809	pancreas process quality regeneration, abnormal	http://purl.obolibrary.org/obo/GO_0031099	regeneration	http://purl.obolibrary.org/obo/ZFA_0000140	pancreas
http://purl.obolibrary.org/obo/ZP_0022336	pancreatic B cell process quality cell population proliferation, abnormal	http://purl.obolibrary.org/obo/GO_0008283	cell population proliferation	http://purl.obolibrary.org/obo/ZFA_0009102	pancreatic B cell
http://purl.obolibrary.org/obo/ZP_0138361	parapineal organ process quality cell migration, abnormal	http://purl.obolibrary.org/obo/GO_0016477	cell migration	http://purl.obolibrary.org/obo/ZFA_0001360	parapineal organ
http://purl.obolibrary.org/obo/ZP_0011764	parapineal organ process quality determination of left/right asymmetry in diencephalon, abnormal	http://purl.obolibrary.org/obo/GO_0035462	determination of left/right asymmetry in diencephalon	http://purl.obolibrary.org/obo/ZFA_0001360	parapineal organ
http://purl.obolibrary.org/obo/ZP_0011267	parapineal organ process quality determination of left/right asymmetry in nervous system, abnormal	http://purl.obolibrary.org/obo/GO_0035545	determination of left/right asymmetry in nervous system	http://purl.obolibrary.org/obo/ZFA_0001360	parapineal organ
http://purl.obolibrary.org/obo/ZP_0011763	parapineal organ process quality epithalamus development, abnormal	http://purl.obolibrary.org/obo/GO_0021538	epithalamus development	http://purl.obolibrary.org/obo/ZFA_0001360	parapineal organ
http://purl.obolibrary.org/obo/ZP_0138360	parapineal organ process quality specification of animal organ identity, abnormal	http://purl.obolibrary.org/obo/GO_0010092	specification of animal organ identity	http://purl.obolibrary.org/obo/ZFA_0001360	parapineal organ
http://purl.obolibrary.org/obo/ZP_0149498	parasphenoid process quality ossification, abnormal	http://purl.obolibrary.org/obo/GO_0001503	ossification	http://purl.obolibrary.org/obo/ZFA_0000561	parasphenoid
http://purl.obolibrary.org/obo/ZP_0145576	paraventricular organ process quality serotonin biosynthetic process, abnormal	http://purl.obolibrary.org/obo/GO_0042427	serotonin biosynthetic process	http://purl.obolibrary.org/obo/ZFA_0000475	paraventricular organ
http://purl.obolibrary.org/obo/ZP_0017224	pectoral fin bud process quality regulation of smoothened signaling pathway, abnormal	http://purl.obolibrary.org/obo/GO_0008589	regulation of smoothened signaling pathway	http://purl.obolibrary.org/obo/ZFA_0000141	pectoral fin bud
http://purl.obolibrary.org/obo/ZP_0101888	pectoral fin motor nerve 1 process quality motor neuron axon guidance, abnormal	http://purl.obolibrary.org/obo/GO_0008045	motor neuron axon guidance	http://purl.obolibrary.org/obo/ZFA_0005439	pectoral fin motor nerve 1
http://purl.obolibrary.org/obo/ZP_0101889	pectoral fin motor nerve 2 process quality motor neuron axon guidance, abnormal	http://purl.obolibrary.org/obo/GO_0008045	motor neuron axon guidance	http://purl.obolibrary.org/obo/ZFA_0005440	pectoral fin motor nerve 2
http://purl.obolibrary.org/obo/ZP_0101882	pectoral fin motor nerve 3 process quality motor neuron axon guidance, abnormal	http://purl.obolibrary.org/obo/GO_0008045	motor neuron axon guidance	http://purl.obolibrary.org/obo/ZFA_0005441	pectoral fin motor nerve 3
http://purl.obolibrary.org/obo/ZP_0101890	pectoral fin motor nerve 4 process quality motor neuron axon guidance, abnormal	http://purl.obolibrary.org/obo/GO_0008045	motor neuron axon guidance	http://purl.obolibrary.org/obo/ZFA_0005450	pectoral fin motor nerve 4
http://purl.obolibrary.org/obo/ZP_0102258	pericardial cavity process quality bone mineralization, abnormal	http://purl.obolibrary.org/obo/GO_0030282	bone mineralization	http://purl.obolibrary.org/obo/ZFA_0001655	pericardial cavity
http://purl.obolibrary.org/obo/ZP_0106109	peripheral nervous system process quality myelination in peripheral nervous system, abnormal	http://purl.obolibrary.org/obo/GO_0022011	myelination in peripheral nervous system	http://purl.obolibrary.org/obo/ZFA_0000142	peripheral nervous system
http://purl.obolibrary.org/obo/ZP_0018474	peripheral neuron process quality axon guidance, abnormal	http://purl.obolibrary.org/obo/GO_0007411	axon guidance	http://purl.obolibrary.org/obo/ZFA_0009063	peripheral neuron
http://purl.obolibrary.org/obo/ZP_0142449	periventricular grey zone process quality calcium-mediated signaling, abnormal	http://purl.obolibrary.org/obo/GO_0019722	calcium-mediated signaling	http://purl.obolibrary.org/obo/ZFA_0000516	periventricular grey zone
http://purl.obolibrary.org/obo/ZP_0012751	pharyngeal arch 1 process quality neural crest cell migration, abnormal	http://purl.obolibrary.org/obo/GO_0001755	neural crest cell migration	http://purl.obolibrary.org/obo/ZFA_0001612	pharyngeal arch 1
http://purl.obolibrary.org/obo/ZP_0022646	pharyngeal arch process quality blood vessel development, abnormal	http://purl.obolibrary.org/obo/GO_0001568	blood vessel development	http://purl.obolibrary.org/obo/ZFA_0001306	pharyngeal arch
http://purl.obolibrary.org/obo/ZP_0102441	pharyngeal arch process quality neural crest cell fate specification, abnormal	http://purl.obolibrary.org/obo/GO_0014036	neural crest cell fate specification	http://purl.obolibrary.org/obo/ZFA_0001306	pharyngeal arch
http://purl.obolibrary.org/obo/ZP_0013866	pharyngeal arch process quality neural crest cell migration, abnormal	http://purl.obolibrary.org/obo/GO_0001755	neural crest cell migration	http://purl.obolibrary.org/obo/ZFA_0001306	pharyngeal arch
http://purl.obolibrary.org/obo/ZP_0012518	pharyngeal pouch process quality adherens junction organization, abnormal	http://purl.obolibrary.org/obo/GO_0034332	adherens junction organization	http://purl.obolibrary.org/obo/ZFA_0001106	pharyngeal pouch
http://purl.obolibrary.org/obo/ZP_0012521	pharyngeal pouch process quality epithelial cell migration, abnormal	http://purl.obolibrary.org/obo/GO_0010631	epithelial cell migration	http://purl.obolibrary.org/obo/ZFA_0001106	pharyngeal pouch
http://purl.obolibrary.org/obo/ZP_0102788	pharyngeal pouch process quality neural crest cell migration, abnormal	http://purl.obolibrary.org/obo/GO_0001755	neural crest cell migration	http://purl.obolibrary.org/obo/ZFA_0001106	pharyngeal pouch
http://purl.obolibrary.org/obo/ZP_0011749	pharyngeal pouch process quality pharyngeal system development, abnormal	http://purl.obolibrary.org/obo/GO_0060037	pharyngeal system development	http://purl.obolibrary.org/obo/ZFA_0001106	pharyngeal pouch
http://purl.obolibrary.org/obo/ZP_0022423	pharyngeal vasculature process quality endothelial cell migration, abnormal	http://purl.obolibrary.org/obo/GO_0043542	endothelial cell migration	http://purl.obolibrary.org/obo/ZFA_0005003	pharyngeal vasculature
http://purl.obolibrary.org/obo/ZP_0100951	pharynx process quality apoptotic process, abnormal	http://purl.obolibrary.org/obo/GO_0006915	apoptotic process	http://purl.obolibrary.org/obo/ZFA_0000056	pharynx
http://purl.obolibrary.org/obo/ZP_0015856	photoreceptor cell process quality regeneration, abnormal	http://purl.obolibrary.org/obo/GO_0031099	regeneration	http://purl.obolibrary.org/obo/ZFA_0009127	photoreceptor cell
http://purl.obolibrary.org/obo/ZP_0101488	photoreceptor outer segment layer process quality tissue regeneration, abnormal	http://purl.obolibrary.org/obo/GO_0042246	tissue regeneration	http://purl.obolibrary.org/obo/ZFA_0001466	photoreceptor outer segment layer
http://purl.obolibrary.org/obo/ZP_0011690	pineal complex process quality circadian regulation of gene expression, abnormal	http://purl.obolibrary.org/obo/GO_0032922	circadian regulation of gene expression	http://purl.obolibrary.org/obo/ZFA_0001359	pineal complex
http://purl.obolibrary.org/obo/ZP_0148918	postcranial axial skeleton process quality skeletal system development, abnormal	http://purl.obolibrary.org/obo/GO_0001501	skeletal system development	http://purl.obolibrary.org/obo/ZFA_0000317	postcranial axial skeleton
http://purl.obolibrary.org/obo/ZP_0022060	posterior cardinal vein process quality blood vessel development, abnormal	http://purl.obolibrary.org/obo/GO_0001568	blood vessel development	http://purl.obolibrary.org/obo/ZFA_0000477	posterior cardinal vein
http://purl.obolibrary.org/obo/ZP_0021383	posterior cardinal vein process quality blood vessel lumenization, abnormal	http://purl.obolibrary.org/obo/GO_0072554	blood vessel lumenization	http://purl.obolibrary.org/obo/ZFA_0000477	posterior cardinal vein
http://purl.obolibrary.org/obo/ZP_0103297	posterior cardinal vein process quality sprouting angiogenesis, abnormal	http://purl.obolibrary.org/obo/GO_0002040	sprouting angiogenesis	http://purl.obolibrary.org/obo/ZFA_0000477	posterior cardinal vein
http://purl.obolibrary.org/obo/ZP_0139747	posterior cardinal vein process quality venous blood vessel development, abnormal	http://purl.obolibrary.org/obo/GO_0060841	venous blood vessel development	http://purl.obolibrary.org/obo/ZFA_0000477	posterior cardinal vein
http://purl.obolibrary.org/obo/ZP_0100598	posterior intestine process quality cell population proliferation, abnormal	http://purl.obolibrary.org/obo/GO_0008283	cell population proliferation	http://purl.obolibrary.org/obo/ZFA_0000706	posterior intestine
http://purl.obolibrary.org/obo/ZP_0015419	posterior lateral line nerve process quality axon guidance, abnormal	http://purl.obolibrary.org/obo/GO_0007411	axon guidance	http://purl.obolibrary.org/obo/ZFA_0000175	posterior lateral line nerve
http://purl.obolibrary.org/obo/ZP_0015421	posterior lateral line nerve process quality axon regeneration, abnormal	http://purl.obolibrary.org/obo/GO_0031103	axon regeneration	http://purl.obolibrary.org/obo/ZFA_0000175	posterior lateral line nerve
http://purl.obolibrary.org/obo/ZP_0022536	posterior lateral line nerve process quality sensory perception of mechanical stimulus, abnormal	http://purl.obolibrary.org/obo/GO_0050954	sensory perception of mechanical stimulus	http://purl.obolibrary.org/obo/ZFA_0000175	posterior lateral line nerve
http://purl.obolibrary.org/obo/ZP_0105743	posterior lateral line neuromast process quality calcium ion import, abnormal	http://purl.obolibrary.org/obo/GO_0070509	calcium ion import	http://purl.obolibrary.org/obo/ZFA_0000940	posterior lateral line neuromast
http://purl.obolibrary.org/obo/ZP_0106600	posterior lateral line neuromast process quality detection of mechanical stimulus involved in sensory perception of sound, abnormal	http://purl.obolibrary.org/obo/GO_0050910	detection of mechanical stimulus involved in sensory perception of sound	http://purl.obolibrary.org/obo/ZFA_0000940	posterior lateral line neuromast
http://purl.obolibrary.org/obo/ZP_0022537	posterior lateral line neuromast process quality sensory perception of mechanical stimulus, abnormal	http://purl.obolibrary.org/obo/GO_0050954	sensory perception of mechanical stimulus	http://purl.obolibrary.org/obo/ZFA_0000940	posterior lateral line neuromast
http://purl.obolibrary.org/obo/ZP_0010782	posterior lateral line primordium process quality actin filament bundle organization, abnormal	http://purl.obolibrary.org/obo/GO_0061572	actin filament bundle organization	http://purl.obolibrary.org/obo/ZFA_0001157	posterior lateral line primordium
http://purl.obolibrary.org/obo/ZP_0102373	posterior lateral line primordium process quality apoptotic process, abnormal	http://purl.obolibrary.org/obo/GO_0006915	apoptotic process	http://purl.obolibrary.org/obo/ZFA_0001157	posterior lateral line primordium
http://purl.obolibrary.org/obo/ZP_0017668	posterior lateral line process quality Schwann cell development, abnormal	http://purl.obolibrary.org/obo/GO_0014044	Schwann cell development	http://purl.obolibrary.org/obo/ZFA_0000944	posterior lateral line
http://purl.obolibrary.org/obo/ZP_0017669	posterior lateral line process quality peripheral nervous system axon ensheathment, abnormal	http://purl.obolibrary.org/obo/GO_0032292	peripheral nervous system axon ensheathment	http://purl.obolibrary.org/obo/ZFA_0000944	posterior lateral line
http://purl.obolibrary.org/obo/ZP_0138006	posterior lateral plate mesoderm process quality cell migration involved in vasculogenesis, abnormal	http://purl.obolibrary.org/obo/GO_0035441	cell migration involved in vasculogenesis	http://purl.obolibrary.org/obo/ZFA_0005042	posterior lateral plate mesoderm
http://purl.obolibrary.org/obo/ZP_0014507	postoptic commissure process quality commissural neuron axon guidance, abnormal	http://purl.obolibrary.org/obo/GO_0071679	commissural neuron axon guidance	http://purl.obolibrary.org/obo/ZFA_0000059	postoptic commissure
http://purl.obolibrary.org/obo/ZP_0106273	prechordal plate process quality cell migration involved in gastrulation, abnormal	http://purl.obolibrary.org/obo/GO_0042074	cell migration involved in gastrulation	http://purl.obolibrary.org/obo/ZFA_0000060	prechordal plate
http://purl.obolibrary.org/obo/ZP_0141694	prechordal plate process quality cell migration, abnormal	http://purl.obolibrary.org/obo/GO_0016477	cell migration	http://purl.obolibrary.org/obo/ZFA_0000060	prechordal plate
http://purl.obolibrary.org/obo/ZP_0012493	prechordal plate process quality mesodermal cell migration, abnormal	http://purl.obolibrary.org/obo/GO_0008078	mesodermal cell migration	http://purl.obolibrary.org/obo/ZFA_0000060	prechordal plate
http://purl.obolibrary.org/obo/ZP_0011043	presumptive endoderm process quality cell migration involved in gastrulation, abnormal	http://purl.obolibrary.org/obo/GO_0042074	cell migration involved in gastrulation	http://purl.obolibrary.org/obo/ZFA_0000416	presumptive endoderm
http://purl.obolibrary.org/obo/ZP_0101887	primary motor neuron process quality axon guidance, abnormal	http://purl.obolibrary.org/obo/GO_0007411	axon guidance	http://purl.obolibrary.org/obo/ZFA_0009244	primary motor neuron
http://purl.obolibrary.org/obo/ZP_0020797	primary motor neuron process quality axonogenesis, abnormal	http://purl.obolibrary.org/obo/GO_0007409	axonogenesis	http://purl.obolibrary.org/obo/ZFA_0009244	primary motor neuron
http://purl.obolibrary.org/obo/ZP_0100314	primordial germ cell process quality regulation of intracellular pH, abnormal	http://purl.obolibrary.org/obo/GO_0051453	regulation of intracellular pH	http://purl.obolibrary.org/obo/ZFA_0009288	primordial germ cell
http://purl.obolibrary.org/obo/ZP_0107126	primordial midbrain channel process quality blood circulation, abnormal	http://purl.obolibrary.org/obo/GO_0008015	blood circulation	http://purl.obolibrary.org/obo/ZFA_0005017	primordial midbrain channel
http://purl.obolibrary.org/obo/ZP_0022599	primordial midbrain channel process quality sprouting angiogenesis, abnormal	http://purl.obolibrary.org/obo/GO_0002040	sprouting angiogenesis	http://purl.obolibrary.org/obo/ZFA_0005017	primordial midbrain channel
http://purl.obolibrary.org/obo/ZP_0149339	pro-T cell process quality negative regulation of signal transduction by p53 class mediator, abnormal	http://purl.obolibrary.org/obo/GO_1901797	negative regulation of signal transduction by p53 class mediator	http://purl.obolibrary.org/obo/ZFA_0009350	pro-T cell
http://purl.obolibrary.org/obo/ZP_0149012	pronephric duct process quality ATP biosynthetic process, abnormal	http://purl.obolibrary.org/obo/GO_0006754	ATP biosynthetic process	http://purl.obolibrary.org/obo/ZFA_0000150	pronephric duct
http://purl.obolibrary.org/obo/ZP_0103339	pronephric duct process quality cilium assembly, abnormal	http://purl.obolibrary.org/obo/GO_0060271	cilium assembly	http://purl.obolibrary.org/obo/ZFA_0000150	pronephric duct
http://purl.obolibrary.org/obo/ZP_0020319	pronephric duct process quality epithelial cilium movement involved in extracellular fluid movement, abnormal	http://purl.obolibrary.org/obo/GO_0003351	epithelial cilium movement involved in extracellular fluid movement	http://purl.obolibrary.org/obo/ZFA_0000150	pronephric duct
http://purl.obolibrary.org/obo/ZP_0022203	pronephric duct process quality establishment or maintenance of apical/basal cell polarity, abnormal	http://purl.obolibrary.org/obo/GO_0035088	establishment or maintenance of apical/basal cell polarity	http://purl.obolibrary.org/obo/ZFA_0000150	pronephric duct
http://purl.obolibrary.org/obo/ZP_0019953	pronephric duct process quality kidney epithelium development, abnormal	http://purl.obolibrary.org/obo/GO_0072073	kidney epithelium development	http://purl.obolibrary.org/obo/ZFA_0000150	pronephric duct
http://purl.obolibrary.org/obo/ZP_0102493	pronephric duct process quality motile cilium assembly, abnormal	http://purl.obolibrary.org/obo/GO_0044458	motile cilium assembly	http://purl.obolibrary.org/obo/ZFA_0000150	pronephric duct
http://purl.obolibrary.org/obo/ZP_0103763	pronephric duct process quality regulation of autophagy, abnormal	http://purl.obolibrary.org/obo/GO_0010506	regulation of autophagy	http://purl.obolibrary.org/obo/ZFA_0000150	pronephric duct
http://purl.obolibrary.org/obo/ZP_0012785	pronephric glomerulus process quality renal system vasculature development, abnormal	http://purl.obolibrary.org/obo/GO_0061437	renal system vasculature development	http://purl.obolibrary.org/obo/ZFA_0001557	pronephric glomerulus
http://purl.obolibrary.org/obo/ZP_0012810	pronephric proximal convoluted tubule process quality cell differentiation involved in pronephros development, abnormal	http://purl.obolibrary.org/obo/GO_0039014	cell differentiation involved in pronephros development	http://purl.obolibrary.org/obo/ZFA_0001620	pronephric proximal convoluted tubule
http://purl.obolibrary.org/obo/ZP_0012811	pronephric proximal straight tubule process quality cell differentiation involved in pronephros development, abnormal	http://purl.obolibrary.org/obo/GO_0039014	cell differentiation involved in pronephros development	http://purl.obolibrary.org/obo/ZFA_0001621	pronephric proximal straight tubule
http://purl.obolibrary.org/obo/ZP_0105719	pronephros process quality cell migration, abnormal	http://purl.obolibrary.org/obo/GO_0016477	cell migration	http://purl.obolibrary.org/obo/ZFA_0000151	pronephros
http://purl.obolibrary.org/obo/ZP_0012021	pronephros process quality cilium movement, abnormal	http://purl.obolibrary.org/obo/GO_0003341	cilium movement	http://purl.obolibrary.org/obo/ZFA_0000151	pronephros
http://purl.obolibrary.org/obo/ZP_0017436	pronephros process quality endocytic recycling, abnormal	http://purl.obolibrary.org/obo/GO_0032456	endocytic recycling	http://purl.obolibrary.org/obo/ZFA_0000151	pronephros
http://purl.obolibrary.org/obo/ZP_0017410	pronephros process quality pronephric nephron tubule epithelial cell differentiation, abnormal	http://purl.obolibrary.org/obo/GO_0035778	pronephric nephron tubule epithelial cell differentiation	http://purl.obolibrary.org/obo/ZFA_0000151	pronephros
http://purl.obolibrary.org/obo/ZP_0144860	pronephros process quality pronephros development, abnormal	http://purl.obolibrary.org/obo/GO_0048793	pronephros development	http://purl.obolibrary.org/obo/ZFA_0000151	pronephros
http://purl.obolibrary.org/obo/ZP_0105774	pronephros process quality regeneration, abnormal	http://purl.obolibrary.org/obo/GO_0031099	regeneration	http://purl.obolibrary.org/obo/ZFA_0000151	pronephros
http://purl.obolibrary.org/obo/ZP_0017440	pronephros process quality renal absorption, abnormal	http://purl.obolibrary.org/obo/GO_0070293	renal absorption	http://purl.obolibrary.org/obo/ZFA_0000151	pronephros
http://purl.obolibrary.org/obo/ZP_0103209	radial glial cell process quality cell population proliferation, abnormal	http://purl.obolibrary.org/obo/GO_0008283	cell population proliferation	http://purl.obolibrary.org/obo/ZFA_0009292	radial glial cell
http://purl.obolibrary.org/obo/ZP_0104546	radial glial cell process quality cell quiescence, abnormal	http://purl.obolibrary.org/obo/GO_0044838	cell quiescence	http://purl.obolibrary.org/obo/ZFA_0009292	radial glial cell
