defined_class	defined_class_label	biological_process	biological_process_label	location	location_label
http://purl.obolibrary.org/obo/ZP_0022045	liver and biliary system process quality cell population proliferation, abnormal	http://purl.obolibrary.org/obo/GO_0008283	cell population proliferation	http://purl.obolibrary.org/obo/ZFA_0000036	liver and biliary system
http://purl.obolibrary.org/obo/ZP_0017067	liver process quality apoptotic process, abnormal	http://purl.obolibrary.org/obo/GO_0006915	apoptotic process	http://purl.obolibrary.org/obo/ZFA_0000123	liver
http://purl.obolibrary.org/obo/ZP_0143781	liver process quality calcium ion homeostasis, abnormal	http://purl.obolibrary.org/obo/GO_0055074	calcium ion homeostasis	http://purl.obolibrary.org/obo/ZFA_0000123	liver
http://purl.obolibrary.org/obo/ZP_0102064	liver process quality cell population proliferation, abnormal	http://purl.obolibrary.org/obo/GO_0008283	cell population proliferation	http://purl.obolibrary.org/obo/ZFA_0000123	liver
http://purl.obolibrary.org/obo/ZP_0015719	liver process quality connective tissue replacement involved in inflammatory response wound healing, abnormal	http://purl.obolibrary.org/obo/GO_0002248	connective tissue replacement involved in inflammatory response wound healing	http://purl.obolibrary.org/obo/ZFA_0000123	liver
http://purl.obolibrary.org/obo/ZP_0142055	liver process quality fatty acid oxidation, abnormal	http://purl.obolibrary.org/obo/GO_0019395	fatty acid oxidation	http://purl.obolibrary.org/obo/ZFA_0000123	liver
http://purl.obolibrary.org/obo/ZP_0015720	liver process quality tissue remodeling, abnormal	http://purl.obolibrary.org/obo/GO_0048771	tissue remodeling	http://purl.obolibrary.org/obo/ZFA_0000123	liver
http://purl.obolibrary.org/obo/ZP_0140248	locus coeruleus process quality hyperpolarization of postsynaptic membrane, abnormal	http://purl.obolibrary.org/obo/GO_0098818	hyperpolarization of postsynaptic membrane	http://purl.obolibrary.org/obo/ZFA_0000539	locus coeruleus
http://purl.obolibrary.org/obo/ZP_0106444	lymphangiogenic sprout process quality lymphangiogenesis, abnormal	http://purl.obolibrary.org/obo/GO_0001946	lymphangiogenesis	http://purl.obolibrary.org/obo/ZFA_0005603	lymphangiogenic sprout
http://purl.obolibrary.org/obo/ZP_0022438	macrophage process quality granuloma formation, abnormal	http://purl.obolibrary.org/obo/GO_0002432	granuloma formation	http://purl.obolibrary.org/obo/ZFA_0009141	macrophage
http://purl.obolibrary.org/obo/ZP_0141325	macrophage process quality immune effector process, abnormal	http://purl.obolibrary.org/obo/GO_0002252	immune effector process	http://purl.obolibrary.org/obo/ZFA_0009141	macrophage
http://purl.obolibrary.org/obo/ZP_0022742	macrophage process quality immune response, abnormal	http://purl.obolibrary.org/obo/GO_0006955	immune response	http://purl.obolibrary.org/obo/ZFA_0009141	macrophage
http://purl.obolibrary.org/obo/ZP_0013550	macrophage process quality mitotic cell cycle, abnormal	http://purl.obolibrary.org/obo/GO_0000278	mitotic cell cycle	http://purl.obolibrary.org/obo/ZFA_0009141	macrophage
http://purl.obolibrary.org/obo/ZP_0018625	macrophage process quality myeloid leukocyte migration, abnormal	http://purl.obolibrary.org/obo/GO_0097529	myeloid leukocyte migration	http://purl.obolibrary.org/obo/ZFA_0009141	macrophage
http://purl.obolibrary.org/obo/ZP_0130993	macrophage process quality reactive oxygen species metabolic process, abnormal	http://purl.obolibrary.org/obo/GO_0072593	reactive oxygen species metabolic process	http://purl.obolibrary.org/obo/ZFA_0009141	macrophage
http://purl.obolibrary.org/obo/ZP_0022743	macrophage process quality response to bacterium, abnormal	http://purl.obolibrary.org/obo/GO_0009617	response to bacterium	http://purl.obolibrary.org/obo/ZFA_0009141	macrophage
http://purl.obolibrary.org/obo/ZP_0017107	macrophage process quality response to wounding, abnormal	http://purl.obolibrary.org/obo/GO_0009611	response to wounding	http://purl.obolibrary.org/obo/ZFA_0009141	macrophage
http://purl.obolibrary.org/obo/ZP_0148173	macrophage process quality tumor necrosis factor-mediated signaling pathway, abnormal	http://purl.obolibrary.org/obo/GO_0033209	tumor necrosis factor-mediated signaling pathway	http://purl.obolibrary.org/obo/ZFA_0009141	macrophage
http://purl.obolibrary.org/obo/ZP_0101111	male organism process quality mating behavior, abnormal	http://purl.obolibrary.org/obo/GO_0007617	mating behavior	http://purl.obolibrary.org/obo/ZFA_0000242	male organism
http://purl.obolibrary.org/obo/ZP_0146235	male organism process quality reproductive behavior, abnormal	http://purl.obolibrary.org/obo/GO_0019098	reproductive behavior	http://purl.obolibrary.org/obo/ZFA_0000242	male organism
http://purl.obolibrary.org/obo/ZP_0103667	male organism process quality sperm motility, abnormal	http://purl.obolibrary.org/obo/GO_0097722	sperm motility	http://purl.obolibrary.org/obo/ZFA_0000242	male organism
http://purl.obolibrary.org/obo/ZP_0107186	male organism process quality swimming behavior, abnormal	http://purl.obolibrary.org/obo/GO_0036269	swimming behavior	http://purl.obolibrary.org/obo/ZFA_0000242	male organism
http://purl.obolibrary.org/obo/ZP_0015603	maxillary barbel process quality tissue regeneration, abnormal	http://purl.obolibrary.org/obo/GO_0042246	tissue regeneration	http://purl.obolibrary.org/obo/ZFA_0005408	maxillary barbel
http://purl.obolibrary.org/obo/ZP_0103340	medial longitudinal fasciculus process quality axon guidance, abnormal	http://purl.obolibrary.org/obo/GO_0007411	axon guidance	http://purl.obolibrary.org/obo/ZFA_0000543	medial longitudinal fasciculus
http://purl.obolibrary.org/obo/ZP_0022046	median fin fold process quality cell population proliferation, abnormal	http://purl.obolibrary.org/obo/GO_0008283	cell population proliferation	http://purl.obolibrary.org/obo/ZFA_0000040	median fin fold
http://purl.obolibrary.org/obo/ZP_0012433	melanocyte process quality developmental pigmentation, abnormal	http://purl.obolibrary.org/obo/GO_0048066	developmental pigmentation	http://purl.obolibrary.org/obo/ZFA_0009091	melanocyte
http://purl.obolibrary.org/obo/ZP_0011759	melanocyte process quality neural crest cell migration, abnormal	http://purl.obolibrary.org/obo/GO_0001755	neural crest cell migration	http://purl.obolibrary.org/obo/ZFA_0009091	melanocyte
http://purl.obolibrary.org/obo/ZP_0020626	microglial cell process quality lysosome organization, abnormal	http://purl.obolibrary.org/obo/GO_0007040	lysosome organization	http://purl.obolibrary.org/obo/ZFA_0009077	microglial cell
http://purl.obolibrary.org/obo/ZP_0131218	microglial cell process quality response to wounding, abnormal	http://purl.obolibrary.org/obo/GO_0009611	response to wounding	http://purl.obolibrary.org/obo/ZFA_0009077	microglial cell
http://purl.obolibrary.org/obo/ZP_0145761	mid intestine process quality endocytosis, abnormal	http://purl.obolibrary.org/obo/GO_0006897	endocytosis	http://purl.obolibrary.org/obo/ZFA_0001323	mid intestine
http://purl.obolibrary.org/obo/ZP_0137316	midbrain hindbrain boundary constriction process quality epithelial cell morphogenesis, abnormal	http://purl.obolibrary.org/obo/GO_0003382	epithelial cell morphogenesis	http://purl.obolibrary.org/obo/ZFA_0007125	midbrain hindbrain boundary constriction
http://purl.obolibrary.org/obo/ZP_0137317	midbrain hindbrain boundary constriction process quality midbrain-hindbrain boundary morphogenesis, abnormal	http://purl.obolibrary.org/obo/GO_0021555	midbrain-hindbrain boundary morphogenesis	http://purl.obolibrary.org/obo/ZFA_0007125	midbrain hindbrain boundary constriction
http://purl.obolibrary.org/obo/ZP_0141134	midbrain process quality autophagy, abnormal	http://purl.obolibrary.org/obo/GO_0006914	autophagy	http://purl.obolibrary.org/obo/ZFA_0000128	midbrain
http://purl.obolibrary.org/obo/ZP_0103283	middle mesencephalic central artery process quality angiogenesis, abnormal	http://purl.obolibrary.org/obo/GO_0001525	angiogenesis	http://purl.obolibrary.org/obo/ZFA_0005078	middle mesencephalic central artery
http://purl.obolibrary.org/obo/ZP_0022887	migratory cranial neural crest cell process quality apoptotic process, abnormal	http://purl.obolibrary.org/obo/GO_0006915	apoptotic process	http://purl.obolibrary.org/obo/ZFA_0007091	migratory cranial neural crest cell
http://purl.obolibrary.org/obo/ZP_0141258	motor neuron process quality axon arborization, abnormal	http://purl.obolibrary.org/obo/GO_0140060	axon arborization	http://purl.obolibrary.org/obo/ZFA_0009052	motor neuron
http://purl.obolibrary.org/obo/ZP_0106236	motor neuron process quality axon extension involved in regeneration, abnormal	http://purl.obolibrary.org/obo/GO_0048677	axon extension involved in regeneration	http://purl.obolibrary.org/obo/ZFA_0009052	motor neuron
http://purl.obolibrary.org/obo/ZP_0012560	motor neuron process quality axon extension, abnormal	http://purl.obolibrary.org/obo/GO_0048675	axon extension	http://purl.obolibrary.org/obo/ZFA_0009052	motor neuron
http://purl.obolibrary.org/obo/ZP_0019323	motor neuron process quality axon guidance, abnormal	http://purl.obolibrary.org/obo/GO_0007411	axon guidance	http://purl.obolibrary.org/obo/ZFA_0009052	motor neuron
http://purl.obolibrary.org/obo/ZP_0141627	motor neuron process quality axon regeneration, abnormal	http://purl.obolibrary.org/obo/GO_0031103	axon regeneration	http://purl.obolibrary.org/obo/ZFA_0009052	motor neuron
http://purl.obolibrary.org/obo/ZP_0018295	motor neuron process quality bleb assembly, abnormal	http://purl.obolibrary.org/obo/GO_0032060	bleb assembly	http://purl.obolibrary.org/obo/ZFA_0009052	motor neuron
http://purl.obolibrary.org/obo/ZP_0010995	motor neuron process quality collateral sprouting, abnormal	http://purl.obolibrary.org/obo/GO_0048668	collateral sprouting	http://purl.obolibrary.org/obo/ZFA_0009052	motor neuron
http://purl.obolibrary.org/obo/ZP_0141936	motor neuron process quality microtubule cytoskeleton organization, abnormal	http://purl.obolibrary.org/obo/GO_0000226	microtubule cytoskeleton organization	http://purl.obolibrary.org/obo/ZFA_0009052	motor neuron
http://purl.obolibrary.org/obo/ZP_0141992	motor neuron process quality myelination, abnormal	http://purl.obolibrary.org/obo/GO_0042552	myelination	http://purl.obolibrary.org/obo/ZFA_0009052	motor neuron
http://purl.obolibrary.org/obo/ZP_0138366	motor neuron process quality neuron projection development, abnormal	http://purl.obolibrary.org/obo/GO_0031175	neuron projection development	http://purl.obolibrary.org/obo/ZFA_0009052	motor neuron
http://purl.obolibrary.org/obo/ZP_0106050	motor neuron process quality regeneration, abnormal	http://purl.obolibrary.org/obo/GO_0031099	regeneration	http://purl.obolibrary.org/obo/ZFA_0009052	motor neuron
http://purl.obolibrary.org/obo/ZP_0022752	muscle cell process quality cell wall repair, abnormal	http://purl.obolibrary.org/obo/GO_0071433	cell wall repair	http://purl.obolibrary.org/obo/ZFA_0009114	muscle cell
http://purl.obolibrary.org/obo/ZP_0102676	muscle pioneer process quality skeletal muscle cell differentiation, abnormal	http://purl.obolibrary.org/obo/GO_0035914	skeletal muscle cell differentiation	http://purl.obolibrary.org/obo/ZFA_0001086	muscle pioneer
http://purl.obolibrary.org/obo/ZP_0142056	muscle process quality fatty acid oxidation, abnormal	http://purl.obolibrary.org/obo/GO_0019395	fatty acid oxidation	http://purl.obolibrary.org/obo/ZFA_0005145	muscle
http://purl.obolibrary.org/obo/ZP_0105956	muscle process quality wound healing, abnormal	http://purl.obolibrary.org/obo/GO_0042060	wound healing	http://purl.obolibrary.org/obo/ZFA_0005145	muscle
http://purl.obolibrary.org/obo/ZP_0022273	myocardium process quality tissue regeneration, abnormal	http://purl.obolibrary.org/obo/GO_0042246	tissue regeneration	http://purl.obolibrary.org/obo/ZFA_0001319	myocardium
http://purl.obolibrary.org/obo/ZP_0102263	myotome process quality cilium assembly, abnormal	http://purl.obolibrary.org/obo/GO_0060271	cilium assembly	http://purl.obolibrary.org/obo/ZFA_0001056	myotome
http://purl.obolibrary.org/obo/ZP_0022951	myotome process quality neuromuscular junction development, abnormal	http://purl.obolibrary.org/obo/GO_0007528	neuromuscular junction development	http://purl.obolibrary.org/obo/ZFA_0001056	myotome
http://purl.obolibrary.org/obo/ZP_0018896	myotome process quality skeletal muscle cell differentiation, abnormal	http://purl.obolibrary.org/obo/GO_0035914	skeletal muscle cell differentiation	http://purl.obolibrary.org/obo/ZFA_0001056	myotome
http://purl.obolibrary.org/obo/ZP_0131130	neural crest cell process quality apoptotic process, abnormal	http://purl.obolibrary.org/obo/GO_0006915	apoptotic process	http://purl.obolibrary.org/obo/ZFA_0009165	neural crest cell
http://purl.obolibrary.org/obo/ZP_0021485	neural crest cell process quality endocytosis, abnormal	http://purl.obolibrary.org/obo/GO_0006897	endocytosis	http://purl.obolibrary.org/obo/ZFA_0009165	neural crest cell
http://purl.obolibrary.org/obo/ZP_0021486	neural crest cell process quality endosomal lumen acidification, abnormal	http://purl.obolibrary.org/obo/GO_0048388	endosomal lumen acidification	http://purl.obolibrary.org/obo/ZFA_0009165	neural crest cell
http://purl.obolibrary.org/obo/ZP_0009962	neural crest hindbrain process quality neural crest cell migration, abnormal	http://purl.obolibrary.org/obo/GO_0001755	neural crest cell migration	http://purl.obolibrary.org/obo/ZFA_0007063	neural crest hindbrain
http://purl.obolibrary.org/obo/ZP_0149721	neural crest process quality negative regulation of gene expression via chromosomal CpG island methylation, abnormal	http://purl.obolibrary.org/obo/GO_0044027	negative regulation of gene expression via chromosomal CpG island methylation	http://purl.obolibrary.org/obo/ZFA_0000045	neural crest
http://purl.obolibrary.org/obo/ZP_0020889	neural plate process quality cell migration, abnormal	http://purl.obolibrary.org/obo/GO_0016477	cell migration	http://purl.obolibrary.org/obo/ZFA_0000132	neural plate
http://purl.obolibrary.org/obo/ZP_0012488	neural plate process quality cell motility, abnormal	http://purl.obolibrary.org/obo/GO_0048870	cell motility	http://purl.obolibrary.org/obo/ZFA_0000132	neural plate
http://purl.obolibrary.org/obo/ZP_0137293	neural plate process quality dorsal convergence, abnormal	http://purl.obolibrary.org/obo/GO_0060030	dorsal convergence	http://purl.obolibrary.org/obo/ZFA_0000132	neural plate
http://purl.obolibrary.org/obo/ZP_0011596	neural plate process quality establishment of mitotic spindle orientation, abnormal	http://purl.obolibrary.org/obo/GO_0000132	establishment of mitotic spindle orientation	http://purl.obolibrary.org/obo/ZFA_0000132	neural plate
http://purl.obolibrary.org/obo/ZP_0012772	neural rod process quality anterior/posterior pattern specification, abnormal	http://purl.obolibrary.org/obo/GO_0009952	anterior/posterior pattern specification	http://purl.obolibrary.org/obo/ZFA_0000133	neural rod
http://purl.obolibrary.org/obo/ZP_0020685	neural tube process quality cilium assembly, abnormal	http://purl.obolibrary.org/obo/GO_0060271	cilium assembly	http://purl.obolibrary.org/obo/ZFA_0001135	neural tube
http://purl.obolibrary.org/obo/ZP_0140802	neuroepithelial cell process quality cell morphogenesis, abnormal	http://purl.obolibrary.org/obo/GO_0000902	cell morphogenesis	http://purl.obolibrary.org/obo/ZFA_0009306	neuroepithelial cell
http://purl.obolibrary.org/obo/ZP_0011235	neuromast hair cell process quality cellular response to mechanical stimulus, abnormal	http://purl.obolibrary.org/obo/GO_0071260	cellular response to mechanical stimulus	http://purl.obolibrary.org/obo/ZFA_0009367	neuromast hair cell
http://purl.obolibrary.org/obo/ZP_0103087	neuromast hair cell process quality cilium assembly, abnormal	http://purl.obolibrary.org/obo/GO_0060271	cilium assembly	http://purl.obolibrary.org/obo/ZFA_0009367	neuromast hair cell
http://purl.obolibrary.org/obo/ZP_0130969	neuromast hair cell process quality detection of mechanical stimulus involved in sensory perception of sound, abnormal	http://purl.obolibrary.org/obo/GO_0050910	detection of mechanical stimulus involved in sensory perception of sound	http://purl.obolibrary.org/obo/ZFA_0009367	neuromast hair cell
http://purl.obolibrary.org/obo/ZP_0106510	neuromast hair cell process quality establishment of animal organ orientation, abnormal	http://purl.obolibrary.org/obo/GO_0048561	establishment of animal organ orientation	http://purl.obolibrary.org/obo/ZFA_0009367	neuromast hair cell
http://purl.obolibrary.org/obo/ZP_0106509	neuromast hair cell process quality establishment of planar polarity, abnormal	http://purl.obolibrary.org/obo/GO_0001736	establishment of planar polarity	http://purl.obolibrary.org/obo/ZFA_0009367	neuromast hair cell
http://purl.obolibrary.org/obo/ZP_0102036	neuromast hair cell process quality innervation, abnormal	http://purl.obolibrary.org/obo/GO_0060384	innervation	http://purl.obolibrary.org/obo/ZFA_0009367	neuromast hair cell
http://purl.obolibrary.org/obo/ZP_0141183	neuromast hair cell process quality polarity specification of anterior/posterior axis, abnormal	http://purl.obolibrary.org/obo/GO_0009949	polarity specification of anterior/posterior axis	http://purl.obolibrary.org/obo/ZFA_0009367	neuromast hair cell
http://purl.obolibrary.org/obo/ZP_0142020	neuromast hair cell process quality regeneration, abnormal	http://purl.obolibrary.org/obo/GO_0031099	regeneration	http://purl.obolibrary.org/obo/ZFA_0009367	neuromast hair cell
http://purl.obolibrary.org/obo/ZP_0110338	neuromast hair cell process quality regulation of mitochondrial membrane potential, abnormal	http://purl.obolibrary.org/obo/GO_0051881	regulation of mitochondrial membrane potential	http://purl.obolibrary.org/obo/ZFA_0009367	neuromast hair cell
http://purl.obolibrary.org/obo/ZP_0130963	neuromast hair cell process quality stereocilium maintenance, abnormal	http://purl.obolibrary.org/obo/GO_0120045	stereocilium maintenance	http://purl.obolibrary.org/obo/ZFA_0009367	neuromast hair cell
http://purl.obolibrary.org/obo/ZP_0011234	neuromast hair cell process quality synapse organization, abnormal	http://purl.obolibrary.org/obo/GO_0050808	synapse organization	http://purl.obolibrary.org/obo/ZFA_0009367	neuromast hair cell
http://purl.obolibrary.org/obo/ZP_0149109	neuromast process quality macrophage migration, abnormal	http://purl.obolibrary.org/obo/GO_1905517	macrophage migration	http://purl.obolibrary.org/obo/ZFA_0000243	neuromast
http://purl.obolibrary.org/obo/ZP_0140046	neuromast process quality polarity specification of anterior/posterior axis, abnormal	http://purl.obolibrary.org/obo/GO_0009949	polarity specification of anterior/posterior axis	http://purl.obolibrary.org/obo/ZFA_0000243	neuromast
http://purl.obolibrary.org/obo/ZP_0016664	neuron process quality mitochondrion localization, abnormal	http://purl.obolibrary.org/obo/GO_0051646	mitochondrion localization	http://purl.obolibrary.org/obo/ZFA_0009248	neuron
http://purl.obolibrary.org/obo/ZP_0021322	neutrophil process quality immune response, abnormal	http://purl.obolibrary.org/obo/GO_0006955	immune response	http://purl.obolibrary.org/obo/ZFA_0009327	neutrophil
http://purl.obolibrary.org/obo/ZP_0015311	neutrophil process quality response to bacterium, abnormal	http://purl.obolibrary.org/obo/GO_0009617	response to bacterium	http://purl.obolibrary.org/obo/ZFA_0009327	neutrophil
http://purl.obolibrary.org/obo/ZP_0014825	neutrophil process quality response to wounding, abnormal	http://purl.obolibrary.org/obo/GO_0009611	response to wounding	http://purl.obolibrary.org/obo/ZFA_0009327	neutrophil
http://purl.obolibrary.org/obo/ZP_0103916	notochord process quality cell-cell adhesion, abnormal	http://purl.obolibrary.org/obo/GO_0098609	cell-cell adhesion	http://purl.obolibrary.org/obo/ZFA_0000135	notochord
http://purl.obolibrary.org/obo/ZP_0106602	notochord process quality regeneration, abnormal	http://purl.obolibrary.org/obo/GO_0031099	regeneration	http://purl.obolibrary.org/obo/ZFA_0000135	notochord
http://purl.obolibrary.org/obo/ZP_0014705	nucleus of the medial longitudinal fasciculus medulla oblongata process quality axon regeneration, abnormal	http://purl.obolibrary.org/obo/GO_0031103	axon regeneration	http://purl.obolibrary.org/obo/ZFA_0000815	nucleus of the medial longitudinal fasciculus medulla oblongata
http://purl.obolibrary.org/obo/ZP_0106097	occipital lateral line neuromast process quality innervation, abnormal	http://purl.obolibrary.org/obo/GO_0060384	innervation	http://purl.obolibrary.org/obo/ZFA_0001025	occipital lateral line neuromast
http://purl.obolibrary.org/obo/ZP_0101726	olfactory bulb process quality response to odorant, abnormal	http://purl.obolibrary.org/obo/GO_1990834	response to odorant	http://purl.obolibrary.org/obo/ZFA_0000402	olfactory bulb
http://purl.obolibrary.org/obo/ZP_0102669	olfactory epithelium process quality epithelial cell development, abnormal	http://purl.obolibrary.org/obo/GO_0002064	epithelial cell development	http://purl.obolibrary.org/obo/ZFA_0000554	olfactory epithelium
http://purl.obolibrary.org/obo/ZP_0102261	olfactory pit process quality cilium assembly, abnormal	http://purl.obolibrary.org/obo/GO_0060271	cilium assembly	http://purl.obolibrary.org/obo/ZFA_0000130	olfactory pit
http://purl.obolibrary.org/obo/ZP_0144953	olfactory pit process quality cilium movement, abnormal	http://purl.obolibrary.org/obo/GO_0003341	cilium movement	http://purl.obolibrary.org/obo/ZFA_0000130	olfactory pit
http://purl.obolibrary.org/obo/ZP_0130890	olfactory placode process quality cilium assembly, abnormal	http://purl.obolibrary.org/obo/GO_0060271	cilium assembly	http://purl.obolibrary.org/obo/ZFA_0000048	olfactory placode
http://purl.obolibrary.org/obo/ZP_0104331	olfactory receptor cell process quality axon guidance, abnormal	http://purl.obolibrary.org/obo/GO_0007411	axon guidance	http://purl.obolibrary.org/obo/ZFA_0009125	olfactory receptor cell
http://purl.obolibrary.org/obo/ZP_0137493	olfactory receptor cell process quality olfactory bulb axon guidance, abnormal	http://purl.obolibrary.org/obo/GO_0071678	olfactory bulb axon guidance	http://purl.obolibrary.org/obo/ZFA_0009125	olfactory receptor cell
http://purl.obolibrary.org/obo/ZP_0149539	oligodendrocyte process quality cell migration, abnormal	http://purl.obolibrary.org/obo/GO_0016477	cell migration	http://purl.obolibrary.org/obo/ZFA_0009076	oligodendrocyte
http://purl.obolibrary.org/obo/ZP_0137468	oligodendrocyte process quality glial cell migration, abnormal	http://purl.obolibrary.org/obo/GO_0008347	glial cell migration	http://purl.obolibrary.org/obo/ZFA_0009076	oligodendrocyte
http://purl.obolibrary.org/obo/ZP_0142151	oocyte stage III process quality oocyte maturation, abnormal	http://purl.obolibrary.org/obo/GO_0001556	oocyte maturation	http://purl.obolibrary.org/obo/ZFA_0001566	oocyte stage III
http://purl.obolibrary.org/obo/ZP_0100627	opercle process quality bone mineralization, abnormal	http://purl.obolibrary.org/obo/GO_0030282	bone mineralization	http://purl.obolibrary.org/obo/ZFA_0000250	opercle
http://purl.obolibrary.org/obo/ZP_0022477	optic cup process quality apoptotic process, abnormal	http://purl.obolibrary.org/obo/GO_0006915	apoptotic process	http://purl.obolibrary.org/obo/ZFA_0001202	optic cup
http://purl.obolibrary.org/obo/ZP_0105769	optic cup process quality cell migration, abnormal	http://purl.obolibrary.org/obo/GO_0016477	cell migration	http://purl.obolibrary.org/obo/ZFA_0001202	optic cup
http://purl.obolibrary.org/obo/ZP_0141648	optic cup process quality cell motility, abnormal	http://purl.obolibrary.org/obo/GO_0048870	cell motility	http://purl.obolibrary.org/obo/ZFA_0001202	optic cup
http://purl.obolibrary.org/obo/ZP_0105770	optic fissure process quality cell migration, abnormal	http://purl.obolibrary.org/obo/GO_0016477	cell migration	http://purl.obolibrary.org/obo/ZFA_0001284	optic fissure
http://purl.obolibrary.org/obo/ZP_0105768	optic stalk process quality cell migration, abnormal	http://purl.obolibrary.org/obo/GO_0016477	cell migration	http://purl.obolibrary.org/obo/ZFA_0000137	optic stalk
http://purl.obolibrary.org/obo/ZP_0022376	optic stalk process quality optic nerve development, abnormal	http://purl.obolibrary.org/obo/GO_0021554	optic nerve development	http://purl.obolibrary.org/obo/ZFA_0000137	optic stalk
http://purl.obolibrary.org/obo/ZP_0105876	optic tectum process quality action potential, abnormal	http://purl.obolibrary.org/obo/GO_0001508	action potential	http://purl.obolibrary.org/obo/ZFA_0000445	optic tectum
http://purl.obolibrary.org/obo/ZP_0017231	optic tectum process quality cellular response to heat, abnormal	http://purl.obolibrary.org/obo/GO_0034605	cellular response to heat	http://purl.obolibrary.org/obo/ZFA_0000445	optic tectum
http://purl.obolibrary.org/obo/ZP_0014904	optic tectum process quality innervation, abnormal	http://purl.obolibrary.org/obo/GO_0060384	innervation	http://purl.obolibrary.org/obo/ZFA_0000445	optic tectum
http://purl.obolibrary.org/obo/ZP_0103629	optic tectum process quality lysosome localization, abnormal	http://purl.obolibrary.org/obo/GO_0032418	lysosome localization	http://purl.obolibrary.org/obo/ZFA_0000445	optic tectum
http://purl.obolibrary.org/obo/ZP_0102504	optic tectum process quality microglial cell migration, abnormal	http://purl.obolibrary.org/obo/GO_1904124	microglial cell migration	http://purl.obolibrary.org/obo/ZFA_0000445	optic tectum
http://purl.obolibrary.org/obo/ZP_0103838	optic tectum process quality neuronal action potential, abnormal	http://purl.obolibrary.org/obo/GO_0019228	neuronal action potential	http://purl.obolibrary.org/obo/ZFA_0000445	optic tectum
