defined_class	defined_class_label	biological_process	biological_process_label	location	location_label
http://purl.obolibrary.org/obo/ZP_0104675	optic tectum increased occurrence cellular response to light stimulus, abnormal	http://purl.obolibrary.org/obo/GO_0071482	cellular response to light stimulus	http://purl.obolibrary.org/obo/ZFA_0000445	optic tectum
http://purl.obolibrary.org/obo/ZP_0104676	optic tectum increased occurrence membrane depolarization during action potential, abnormal	http://purl.obolibrary.org/obo/GO_0086010	membrane depolarization during action potential	http://purl.obolibrary.org/obo/ZFA_0000445	optic tectum
http://purl.obolibrary.org/obo/ZP_0140130	optic tectum increased occurrence mitotic S phase, abnormal	http://purl.obolibrary.org/obo/GO_0000084	mitotic S phase	http://purl.obolibrary.org/obo/ZFA_0000445	optic tectum
http://purl.obolibrary.org/obo/ZP_0104425	optic tectum increased occurrence neuronal action potential, abnormal	http://purl.obolibrary.org/obo/GO_0019228	neuronal action potential	http://purl.obolibrary.org/obo/ZFA_0000445	optic tectum
http://purl.obolibrary.org/obo/ZP_0130909	optic tectum increased occurrence transmission of nerve impulse, abnormal	http://purl.obolibrary.org/obo/GO_0019226	transmission of nerve impulse	http://purl.obolibrary.org/obo/ZFA_0000445	optic tectum
http://purl.obolibrary.org/obo/ZP_0012629	optic vesicle increased occurrence apoptotic process, abnormal	http://purl.obolibrary.org/obo/GO_0006915	apoptotic process	http://purl.obolibrary.org/obo/ZFA_0000050	optic vesicle
http://purl.obolibrary.org/obo/ZP_0107138	optic vesicle increased occurrence neurogenesis, abnormal	http://purl.obolibrary.org/obo/GO_0022008	neurogenesis	http://purl.obolibrary.org/obo/ZFA_0000050	optic vesicle
http://purl.obolibrary.org/obo/ZP_0014731	osteoblast increased occurrence cell dedifferentiation, abnormal	http://purl.obolibrary.org/obo/GO_0043697	cell dedifferentiation	http://purl.obolibrary.org/obo/ZFA_0009031	osteoblast
http://purl.obolibrary.org/obo/ZP_0014730	osteoblast increased occurrence cell population proliferation, abnormal	http://purl.obolibrary.org/obo/GO_0008283	cell population proliferation	http://purl.obolibrary.org/obo/ZFA_0009031	osteoblast
http://purl.obolibrary.org/obo/ZP_0143074	osteoclast increased occurrence apoptotic process, abnormal	http://purl.obolibrary.org/obo/GO_0006915	apoptotic process	http://purl.obolibrary.org/obo/ZFA_0009047	osteoclast
http://purl.obolibrary.org/obo/ZP_0145944	otic vesicle increased occurrence apoptotic process, abnormal	http://purl.obolibrary.org/obo/GO_0006915	apoptotic process	http://purl.obolibrary.org/obo/ZFA_0000051	otic vesicle
http://purl.obolibrary.org/obo/ZP_0022763	otic vesicle increased occurrence epithelial to mesenchymal transition, abnormal	http://purl.obolibrary.org/obo/GO_0001837	epithelial to mesenchymal transition	http://purl.obolibrary.org/obo/ZFA_0000051	otic vesicle
http://purl.obolibrary.org/obo/ZP_0142692	otic vesicle increased occurrence macrophage migration, abnormal	http://purl.obolibrary.org/obo/GO_1905517	macrophage migration	http://purl.obolibrary.org/obo/ZFA_0000051	otic vesicle
http://purl.obolibrary.org/obo/ZP_0020366	otic vesicle increased occurrence neuroblast delamination, abnormal	http://purl.obolibrary.org/obo/GO_0060234	neuroblast delamination	http://purl.obolibrary.org/obo/ZFA_0000051	otic vesicle
http://purl.obolibrary.org/obo/ZP_0017779	otic vesicle increased occurrence neuroblast fate specification, abnormal	http://purl.obolibrary.org/obo/GO_0014018	neuroblast fate specification	http://purl.obolibrary.org/obo/ZFA_0000051	otic vesicle
http://purl.obolibrary.org/obo/ZP_0104588	otic vesicle increased occurrence otolith formation, abnormal	http://purl.obolibrary.org/obo/GO_0032475	otolith formation	http://purl.obolibrary.org/obo/ZFA_0000051	otic vesicle
http://purl.obolibrary.org/obo/ZP_0022834	ovary increased occurrence apoptotic process, abnormal	http://purl.obolibrary.org/obo/GO_0006915	apoptotic process	http://purl.obolibrary.org/obo/ZFA_0000403	ovary
http://purl.obolibrary.org/obo/ZP_0101871	ovary increased occurrence spermatogenesis, abnormal	http://purl.obolibrary.org/obo/GO_0007283	spermatogenesis	http://purl.obolibrary.org/obo/ZFA_0000403	ovary
http://purl.obolibrary.org/obo/ZP_0100476	palatoquadrate arch increased occurrence bone mineralization, abnormal	http://purl.obolibrary.org/obo/GO_0030282	bone mineralization	http://purl.obolibrary.org/obo/ZFA_0001272	palatoquadrate arch
http://purl.obolibrary.org/obo/ZP_0131126	pancreas increased occurrence cell population proliferation, abnormal	http://purl.obolibrary.org/obo/GO_0008283	cell population proliferation	http://purl.obolibrary.org/obo/ZFA_0000140	pancreas
http://purl.obolibrary.org/obo/ZP_0141106	pancreas increased occurrence inflammatory response, abnormal	http://purl.obolibrary.org/obo/GO_0006954	inflammatory response	http://purl.obolibrary.org/obo/ZFA_0000140	pancreas
http://purl.obolibrary.org/obo/ZP_0149078	pancreatic B cell increased occurrence apoptotic process, abnormal	http://purl.obolibrary.org/obo/GO_0006915	apoptotic process	http://purl.obolibrary.org/obo/ZFA_0009102	pancreatic B cell
http://purl.obolibrary.org/obo/ZP_0022668	pancreatic B cell increased occurrence cell cycle, abnormal	http://purl.obolibrary.org/obo/GO_0007049	cell cycle	http://purl.obolibrary.org/obo/ZFA_0009102	pancreatic B cell
http://purl.obolibrary.org/obo/ZP_0016632	pancreatic B cell increased occurrence cell population proliferation, abnormal	http://purl.obolibrary.org/obo/GO_0008283	cell population proliferation	http://purl.obolibrary.org/obo/ZFA_0009102	pancreatic B cell
http://purl.obolibrary.org/obo/ZP_0148812	pancreatic B cell increased occurrence insulin secretion, abnormal	http://purl.obolibrary.org/obo/GO_0030073	insulin secretion	http://purl.obolibrary.org/obo/ZFA_0009102	pancreatic B cell
http://purl.obolibrary.org/obo/ZP_0147828	pancreatic B cell increased occurrence phagocytosis, abnormal	http://purl.obolibrary.org/obo/GO_0006909	phagocytosis	http://purl.obolibrary.org/obo/ZFA_0009102	pancreatic B cell
http://purl.obolibrary.org/obo/ZP_0148820	pancreatic B cell increased occurrence positive regulation of cell cycle, abnormal	http://purl.obolibrary.org/obo/GO_0045787	positive regulation of cell cycle	http://purl.obolibrary.org/obo/ZFA_0009102	pancreatic B cell
http://purl.obolibrary.org/obo/ZP_0148818	pancreatic B cell increased occurrence proteasome assembly, abnormal	http://purl.obolibrary.org/obo/GO_0043248	proteasome assembly	http://purl.obolibrary.org/obo/ZFA_0009102	pancreatic B cell
http://purl.obolibrary.org/obo/ZP_0022669	pancreatic B cell increased occurrence regeneration, abnormal	http://purl.obolibrary.org/obo/GO_0031099	regeneration	http://purl.obolibrary.org/obo/ZFA_0009102	pancreatic B cell
http://purl.obolibrary.org/obo/ZP_0148816	pancreatic B cell increased occurrence ribosome biogenesis, abnormal	http://purl.obolibrary.org/obo/GO_0042254	ribosome biogenesis	http://purl.obolibrary.org/obo/ZFA_0009102	pancreatic B cell
http://purl.obolibrary.org/obo/ZP_0020275	parapineal organ increased occurrence neuron fate specification, abnormal	http://purl.obolibrary.org/obo/GO_0048665	neuron fate specification	http://purl.obolibrary.org/obo/ZFA_0001360	parapineal organ
http://purl.obolibrary.org/obo/ZP_0106638	parietal bone increased occurrence bone growth, abnormal	http://purl.obolibrary.org/obo/GO_0098868	bone growth	http://purl.obolibrary.org/obo/ZFA_0000486	parietal bone
http://purl.obolibrary.org/obo/ZP_0106645	parietal bone increased occurrence osteoblast proliferation, abnormal	http://purl.obolibrary.org/obo/GO_0033687	osteoblast proliferation	http://purl.obolibrary.org/obo/ZFA_0000486	parietal bone
http://purl.obolibrary.org/obo/ZP_0012753	pectoral fin bud increased occurrence cell death, abnormal	http://purl.obolibrary.org/obo/GO_0008219	cell death	http://purl.obolibrary.org/obo/ZFA_0000141	pectoral fin bud
http://purl.obolibrary.org/obo/ZP_0100069	pectoral fin increased occurrence apoptotic process, abnormal	http://purl.obolibrary.org/obo/GO_0006915	apoptotic process	http://purl.obolibrary.org/obo/ZFA_0001161	pectoral fin
http://purl.obolibrary.org/obo/ZP_0145127	pectoral fin musculature increased occurrence cell population proliferation, abnormal	http://purl.obolibrary.org/obo/GO_0008283	cell population proliferation	http://purl.obolibrary.org/obo/ZFA_0000563	pectoral fin musculature
http://purl.obolibrary.org/obo/ZP_0131016	pericardium increased occurrence apoptotic process, abnormal	http://purl.obolibrary.org/obo/GO_0006915	apoptotic process	http://purl.obolibrary.org/obo/ZFA_0000054	pericardium
http://purl.obolibrary.org/obo/ZP_0012697	periderm increased occurrence cell population proliferation, abnormal	http://purl.obolibrary.org/obo/GO_0008283	cell population proliferation	http://purl.obolibrary.org/obo/ZFA_0001185	periderm
http://purl.obolibrary.org/obo/ZP_0012695	peridermal cell increased occurrence apoptotic process, abnormal	http://purl.obolibrary.org/obo/GO_0006915	apoptotic process	http://purl.obolibrary.org/obo/ZFA_0009041	peridermal cell
http://purl.obolibrary.org/obo/ZP_0106822	peridermal cell increased occurrence cell population proliferation, abnormal	http://purl.obolibrary.org/obo/GO_0008283	cell population proliferation	http://purl.obolibrary.org/obo/ZFA_0009041	peridermal cell
http://purl.obolibrary.org/obo/ZP_0106820	peridermal cell increased occurrence endocytosis, abnormal	http://purl.obolibrary.org/obo/GO_0006897	endocytosis	http://purl.obolibrary.org/obo/ZFA_0009041	peridermal cell
http://purl.obolibrary.org/obo/ZP_0138333	peripheral neuron increased occurrence myelination, abnormal	http://purl.obolibrary.org/obo/GO_0042552	myelination	http://purl.obolibrary.org/obo/ZFA_0009063	peripheral neuron
http://purl.obolibrary.org/obo/ZP_0101286	peritoneum increased occurrence macrophage chemotaxis, abnormal	http://purl.obolibrary.org/obo/GO_0048246	macrophage chemotaxis	http://purl.obolibrary.org/obo/ZFA_0005120	peritoneum
http://purl.obolibrary.org/obo/ZP_0145946	pharyngeal arch 1 increased occurrence apoptotic process, abnormal	http://purl.obolibrary.org/obo/GO_0006915	apoptotic process	http://purl.obolibrary.org/obo/ZFA_0001612	pharyngeal arch 1
http://purl.obolibrary.org/obo/ZP_0145945	pharyngeal arch 2 increased occurrence apoptotic process, abnormal	http://purl.obolibrary.org/obo/GO_0006915	apoptotic process	http://purl.obolibrary.org/obo/ZFA_0001611	pharyngeal arch 2
http://purl.obolibrary.org/obo/ZP_0145805	pharyngeal arch 3-7 increased occurrence apoptotic process, abnormal	http://purl.obolibrary.org/obo/GO_0006915	apoptotic process	http://purl.obolibrary.org/obo/ZFA_0001613	pharyngeal arch 3-7
http://purl.obolibrary.org/obo/ZP_0140641	pharyngeal arch 5 increased occurrence innervation, abnormal	http://purl.obolibrary.org/obo/GO_0060384	innervation	http://purl.obolibrary.org/obo/ZFA_0001608	pharyngeal arch 5
http://purl.obolibrary.org/obo/ZP_0019199	pharyngeal arch increased occurrence apoptotic process, abnormal	http://purl.obolibrary.org/obo/GO_0006915	apoptotic process	http://purl.obolibrary.org/obo/ZFA_0001306	pharyngeal arch
http://purl.obolibrary.org/obo/ZP_0101004	photoreceptor cell increased occurrence cell death, abnormal	http://purl.obolibrary.org/obo/GO_0008219	cell death	http://purl.obolibrary.org/obo/ZFA_0009127	photoreceptor cell
http://purl.obolibrary.org/obo/ZP_0022392	podocyte increased occurrence apoptotic process, abnormal	http://purl.obolibrary.org/obo/GO_0006915	apoptotic process	http://purl.obolibrary.org/obo/ZFA_0009285	podocyte
http://purl.obolibrary.org/obo/ZP_0019580	post-vent region increased occurrence apoptotic process, abnormal	http://purl.obolibrary.org/obo/GO_0006915	apoptotic process	http://purl.obolibrary.org/obo/ZFA_0001117	post-vent region
http://purl.obolibrary.org/obo/ZP_0018635	post-vent region increased occurrence cell death, abnormal	http://purl.obolibrary.org/obo/GO_0008219	cell death	http://purl.obolibrary.org/obo/ZFA_0001117	post-vent region
http://purl.obolibrary.org/obo/ZP_0145396	postcranial axial skeleton increased occurrence biomineral tissue development, abnormal	http://purl.obolibrary.org/obo/GO_0031214	biomineral tissue development	http://purl.obolibrary.org/obo/ZFA_0000317	postcranial axial skeleton
http://purl.obolibrary.org/obo/ZP_0017919	posterior cardinal vein increased occurrence blood coagulation, fibrin clot formation, abnormal	http://purl.obolibrary.org/obo/GO_0072378	blood coagulation, fibrin clot formation	http://purl.obolibrary.org/obo/ZFA_0000477	posterior cardinal vein
http://purl.obolibrary.org/obo/ZP_0011559	posterior cardinal vein increased occurrence endothelial cell apoptotic process, abnormal	http://purl.obolibrary.org/obo/GO_0072577	endothelial cell apoptotic process	http://purl.obolibrary.org/obo/ZFA_0000477	posterior cardinal vein
http://purl.obolibrary.org/obo/ZP_0149251	posterior cardinal vein increased occurrence endothelial cell differentiation, abnormal	http://purl.obolibrary.org/obo/GO_0045446	endothelial cell differentiation	http://purl.obolibrary.org/obo/ZFA_0000477	posterior cardinal vein
http://purl.obolibrary.org/obo/ZP_0017074	posterior cardinal vein increased occurrence lipid oxidation, abnormal	http://purl.obolibrary.org/obo/GO_0034440	lipid oxidation	http://purl.obolibrary.org/obo/ZFA_0000477	posterior cardinal vein
http://purl.obolibrary.org/obo/ZP_0146276	posterior cardinal vein increased occurrence platelet aggregation, abnormal	http://purl.obolibrary.org/obo/GO_0070527	platelet aggregation	http://purl.obolibrary.org/obo/ZFA_0000477	posterior cardinal vein
http://purl.obolibrary.org/obo/ZP_0020158	posterior intestine increased occurrence epithelial cell migration, abnormal	http://purl.obolibrary.org/obo/GO_0010631	epithelial cell migration	http://purl.obolibrary.org/obo/ZFA_0000706	posterior intestine
http://purl.obolibrary.org/obo/ZP_0140478	posterior lateral line ganglion increased occurrence apoptotic process, abnormal	http://purl.obolibrary.org/obo/GO_0006915	apoptotic process	http://purl.obolibrary.org/obo/ZFA_0001314	posterior lateral line ganglion
http://purl.obolibrary.org/obo/ZP_0146562	posterior lateral line nerve increased occurrence Schwann cell proliferation, abnormal	http://purl.obolibrary.org/obo/GO_0014010	Schwann cell proliferation	http://purl.obolibrary.org/obo/ZFA_0000175	posterior lateral line nerve
http://purl.obolibrary.org/obo/ZP_0141184	posterior lateral line neuromast increased occurrence apoptotic process, abnormal	http://purl.obolibrary.org/obo/GO_0006915	apoptotic process	http://purl.obolibrary.org/obo/ZFA_0000940	posterior lateral line neuromast
http://purl.obolibrary.org/obo/ZP_0018148	posterior lateral line primordium increased occurrence apoptotic process, abnormal	http://purl.obolibrary.org/obo/GO_0006915	apoptotic process	http://purl.obolibrary.org/obo/ZFA_0001157	posterior lateral line primordium
http://purl.obolibrary.org/obo/ZP_0018582	posterior lateral line primordium increased occurrence cell population proliferation, abnormal	http://purl.obolibrary.org/obo/GO_0008283	cell population proliferation	http://purl.obolibrary.org/obo/ZFA_0001157	posterior lateral line primordium
http://purl.obolibrary.org/obo/ZP_0144729	preoptic area increased occurrence calcium ion transport into cytosol, abnormal	http://purl.obolibrary.org/obo/GO_0060402	calcium ion transport into cytosol	http://purl.obolibrary.org/obo/ZFA_0000470	preoptic area
http://purl.obolibrary.org/obo/ZP_0142925	preoptic area increased occurrence neuronal action potential, abnormal	http://purl.obolibrary.org/obo/GO_0019228	neuronal action potential	http://purl.obolibrary.org/obo/ZFA_0000470	preoptic area
http://purl.obolibrary.org/obo/ZP_0104465	primary motor neuron increased occurrence cell division, abnormal	http://purl.obolibrary.org/obo/GO_0051301	cell division	http://purl.obolibrary.org/obo/ZFA_0009244	primary motor neuron
http://purl.obolibrary.org/obo/ZP_0014797	primary motor neuron increased occurrence ventral spinal cord interneuron specification, abnormal	http://purl.obolibrary.org/obo/GO_0021521	ventral spinal cord interneuron specification	http://purl.obolibrary.org/obo/ZFA_0009244	primary motor neuron
http://purl.obolibrary.org/obo/ZP_0101912	primordial germ cell increased occurrence bleb assembly, abnormal	http://purl.obolibrary.org/obo/GO_0032060	bleb assembly	http://purl.obolibrary.org/obo/ZFA_0009288	primordial germ cell
http://purl.obolibrary.org/obo/ZP_0006817	proliferative region increased occurrence intrinsic apoptotic signaling pathway by p53 class mediator, abnormal	http://purl.obolibrary.org/obo/GO_0072332	intrinsic apoptotic signaling pathway by p53 class mediator	http://purl.obolibrary.org/obo/ZFA_0000098	proliferative region
http://purl.obolibrary.org/obo/ZP_0137835	pronephric duct increased occurrence apoptotic process, abnormal	http://purl.obolibrary.org/obo/GO_0006915	apoptotic process	http://purl.obolibrary.org/obo/ZFA_0000150	pronephric duct
http://purl.obolibrary.org/obo/ZP_0100576	pronephric duct increased occurrence autophagy, abnormal	http://purl.obolibrary.org/obo/GO_0006914	autophagy	http://purl.obolibrary.org/obo/ZFA_0000150	pronephric duct
http://purl.obolibrary.org/obo/ZP_0137346	pronephric duct increased occurrence cell dedifferentiation, abnormal	http://purl.obolibrary.org/obo/GO_0043697	cell dedifferentiation	http://purl.obolibrary.org/obo/ZFA_0000150	pronephric duct
http://purl.obolibrary.org/obo/ZP_0137307	pronephric duct increased occurrence cell population proliferation, abnormal	http://purl.obolibrary.org/obo/GO_0008283	cell population proliferation	http://purl.obolibrary.org/obo/ZFA_0000150	pronephric duct
http://purl.obolibrary.org/obo/ZP_0101433	pronephric duct increased occurrence epithelial cell proliferation, abnormal	http://purl.obolibrary.org/obo/GO_0050673	epithelial cell proliferation	http://purl.obolibrary.org/obo/ZFA_0000150	pronephric duct
http://purl.obolibrary.org/obo/ZP_0103367	pronephric glomerulus increased occurrence apoptotic process, abnormal	http://purl.obolibrary.org/obo/GO_0006915	apoptotic process	http://purl.obolibrary.org/obo/ZFA_0001557	pronephric glomerulus
http://purl.obolibrary.org/obo/ZP_0017418	pronephric proximal convoluted tubule increased occurrence apoptotic process, abnormal	http://purl.obolibrary.org/obo/GO_0006915	apoptotic process	http://purl.obolibrary.org/obo/ZFA_0001620	pronephric proximal convoluted tubule
http://purl.obolibrary.org/obo/ZP_0101615	pronephric proximal convoluted tubule increased occurrence blood vessel morphogenesis, abnormal	http://purl.obolibrary.org/obo/GO_0048514	blood vessel morphogenesis	http://purl.obolibrary.org/obo/ZFA_0001620	pronephric proximal convoluted tubule
http://purl.obolibrary.org/obo/ZP_0021069	pronephric proximal convoluted tubule increased occurrence cell population proliferation, abnormal	http://purl.obolibrary.org/obo/GO_0008283	cell population proliferation	http://purl.obolibrary.org/obo/ZFA_0001620	pronephric proximal convoluted tubule
http://purl.obolibrary.org/obo/ZP_0101622	pronephric proximal convoluted tubule increased occurrence endocytosis, abnormal	http://purl.obolibrary.org/obo/GO_0006897	endocytosis	http://purl.obolibrary.org/obo/ZFA_0001620	pronephric proximal convoluted tubule
http://purl.obolibrary.org/obo/ZP_0101619	pronephric proximal convoluted tubule increased occurrence renal system vasculature morphogenesis, abnormal	http://purl.obolibrary.org/obo/GO_0061438	renal system vasculature morphogenesis	http://purl.obolibrary.org/obo/ZFA_0001620	pronephric proximal convoluted tubule
http://purl.obolibrary.org/obo/ZP_0021076	pronephric proximal straight tubule increased occurrence apoptotic process, abnormal	http://purl.obolibrary.org/obo/GO_0006915	apoptotic process	http://purl.obolibrary.org/obo/ZFA_0001621	pronephric proximal straight tubule
http://purl.obolibrary.org/obo/ZP_0101617	pronephric proximal straight tubule increased occurrence blood vessel morphogenesis, abnormal	http://purl.obolibrary.org/obo/GO_0048514	blood vessel morphogenesis	http://purl.obolibrary.org/obo/ZFA_0001621	pronephric proximal straight tubule
http://purl.obolibrary.org/obo/ZP_0021065	pronephric proximal straight tubule increased occurrence cell population proliferation, abnormal	http://purl.obolibrary.org/obo/GO_0008283	cell population proliferation	http://purl.obolibrary.org/obo/ZFA_0001621	pronephric proximal straight tubule
http://purl.obolibrary.org/obo/ZP_0101623	pronephric proximal straight tubule increased occurrence endocytosis, abnormal	http://purl.obolibrary.org/obo/GO_0006897	endocytosis	http://purl.obolibrary.org/obo/ZFA_0001621	pronephric proximal straight tubule
http://purl.obolibrary.org/obo/ZP_0107286	pronephric proximal straight tubule increased occurrence pronephric nephron tubule epithelial cell differentiation, abnormal	http://purl.obolibrary.org/obo/GO_0035778	pronephric nephron tubule epithelial cell differentiation	http://purl.obolibrary.org/obo/ZFA_0001621	pronephric proximal straight tubule
http://purl.obolibrary.org/obo/ZP_0101621	pronephric proximal straight tubule increased occurrence renal system vasculature morphogenesis, abnormal	http://purl.obolibrary.org/obo/GO_0061438	renal system vasculature morphogenesis	http://purl.obolibrary.org/obo/ZFA_0001621	pronephric proximal straight tubule
http://purl.obolibrary.org/obo/ZP_0100269	pronephric tubule increased occurrence cell population proliferation, abnormal	http://purl.obolibrary.org/obo/GO_0008283	cell population proliferation	http://purl.obolibrary.org/obo/ZFA_0001558	pronephric tubule
http://purl.obolibrary.org/obo/ZP_0102548	pronephros increased occurrence apoptotic process, abnormal	http://purl.obolibrary.org/obo/GO_0006915	apoptotic process	http://purl.obolibrary.org/obo/ZFA_0000151	pronephros
http://purl.obolibrary.org/obo/ZP_0019773	pronephros increased occurrence multi-ciliated epithelial cell differentiation, abnormal	http://purl.obolibrary.org/obo/GO_1903251	multi-ciliated epithelial cell differentiation	http://purl.obolibrary.org/obo/ZFA_0000151	pronephros
http://purl.obolibrary.org/obo/ZP_0147285	radial glial cell increased occurrence apoptotic process, abnormal	http://purl.obolibrary.org/obo/GO_0006915	apoptotic process	http://purl.obolibrary.org/obo/ZFA_0009292	radial glial cell
http://purl.obolibrary.org/obo/ZP_0021909	radial glial cell increased occurrence cell population proliferation, abnormal	http://purl.obolibrary.org/obo/GO_0008283	cell population proliferation	http://purl.obolibrary.org/obo/ZFA_0009292	radial glial cell
http://purl.obolibrary.org/obo/ZP_0104777	radial glial cell increased occurrence neuron differentiation, abnormal	http://purl.obolibrary.org/obo/GO_0030182	neuron differentiation	http://purl.obolibrary.org/obo/ZFA_0009292	radial glial cell
http://purl.obolibrary.org/obo/ZP_0104478	radial glial cell increased occurrence stem cell proliferation, abnormal	http://purl.obolibrary.org/obo/GO_0072089	stem cell proliferation	http://purl.obolibrary.org/obo/ZFA_0009292	radial glial cell
http://purl.obolibrary.org/obo/ZP_0100603	regenerating fin increased occurrence apoptotic process, abnormal	http://purl.obolibrary.org/obo/GO_0006915	apoptotic process	http://purl.obolibrary.org/obo/ZFA_0001269	regenerating fin
http://purl.obolibrary.org/obo/ZP_0100827	regenerating fin increased occurrence cell death, abnormal	http://purl.obolibrary.org/obo/GO_0008219	cell death	http://purl.obolibrary.org/obo/ZFA_0001269	regenerating fin
http://purl.obolibrary.org/obo/ZP_0102825	regenerating fin increased occurrence endothelial cell proliferation, abnormal	http://purl.obolibrary.org/obo/GO_0001935	endothelial cell proliferation	http://purl.obolibrary.org/obo/ZFA_0001269	regenerating fin
http://purl.obolibrary.org/obo/ZP_0140010	regenerating fin increased occurrence neutrophil apoptotic process, abnormal	http://purl.obolibrary.org/obo/GO_0001781	neutrophil apoptotic process	http://purl.obolibrary.org/obo/ZFA_0001269	regenerating fin
http://purl.obolibrary.org/obo/ZP_0101975	regenerating tissue increased occurrence cardiac muscle cell proliferation, abnormal	http://purl.obolibrary.org/obo/GO_0060038	cardiac muscle cell proliferation	http://purl.obolibrary.org/obo/ZFA_0005147	regenerating tissue
http://purl.obolibrary.org/obo/ZP_0021886	regenerating tissue increased occurrence cell death, abnormal	http://purl.obolibrary.org/obo/GO_0008219	cell death	http://purl.obolibrary.org/obo/ZFA_0005147	regenerating tissue
http://purl.obolibrary.org/obo/ZP_0137347	regenerating tissue increased occurrence cell dedifferentiation, abnormal	http://purl.obolibrary.org/obo/GO_0043697	cell dedifferentiation	http://purl.obolibrary.org/obo/ZFA_0005147	regenerating tissue
http://purl.obolibrary.org/obo/ZP_0022572	regenerating tissue increased occurrence cell population proliferation, abnormal	http://purl.obolibrary.org/obo/GO_0008283	cell population proliferation	http://purl.obolibrary.org/obo/ZFA_0005147	regenerating tissue
http://purl.obolibrary.org/obo/ZP_0137357	renal tubule increased occurrence apoptotic process, abnormal	http://purl.obolibrary.org/obo/GO_0006915	apoptotic process	http://purl.obolibrary.org/obo/ZFA_0001287	renal tubule
http://purl.obolibrary.org/obo/ZP_0140134	renal tubule increased occurrence pyroptosis, abnormal	http://purl.obolibrary.org/obo/GO_0070269	pyroptotic inflammatory response	http://purl.obolibrary.org/obo/ZFA_0001287	renal tubule
http://purl.obolibrary.org/obo/ZP_0100205	retina increased occurrence Notch signaling pathway, abnormal	http://purl.obolibrary.org/obo/GO_0007219	Notch signaling pathway	http://purl.obolibrary.org/obo/ZFA_0000152	retina
http://purl.obolibrary.org/obo/ZP_0149110	retina increased occurrence angiogenesis, abnormal	http://purl.obolibrary.org/obo/GO_0001525	angiogenesis	http://purl.obolibrary.org/obo/ZFA_0000152	retina
