defined_class	defined_class_label	anatomical_entity	anatomical_entity_label	location	location_label
http://purl.obolibrary.org/obo/ZP_0102713	GABAergic neuron diencephalon amount, abnormal	http://purl.obolibrary.org/obo/ZFA_0009276	GABAergic neuron	http://purl.obolibrary.org/obo/ZFA_0000101	diencephalon
http://purl.obolibrary.org/obo/ZP_0102711	GABAergic neuron hindbrain amount, abnormal	http://purl.obolibrary.org/obo/ZFA_0009276	GABAergic neuron	http://purl.obolibrary.org/obo/ZFA_0000029	hindbrain
http://purl.obolibrary.org/obo/ZP_0102714	GABAergic neuron midbrain amount, abnormal	http://purl.obolibrary.org/obo/ZFA_0009276	GABAergic neuron	http://purl.obolibrary.org/obo/ZFA_0000128	midbrain
http://purl.obolibrary.org/obo/ZP_0003768	GABAergic neuron spinal cord amount, abnormal	http://purl.obolibrary.org/obo/ZFA_0009276	GABAergic neuron	http://purl.obolibrary.org/obo/ZFA_0000075	spinal cord
http://purl.obolibrary.org/obo/ZP_0102712	GABAergic neuron telencephalon amount, abnormal	http://purl.obolibrary.org/obo/ZFA_0009276	GABAergic neuron	http://purl.obolibrary.org/obo/ZFA_0000079	telencephalon
http://purl.obolibrary.org/obo/ZP_0017203	NCC ionocyte gill filament amount, abnormal	http://purl.obolibrary.org/obo/ZFA_0005579	NCC ionocyte	http://purl.obolibrary.org/obo/ZFA_0000667	gill filament
http://purl.obolibrary.org/obo/ZP_0106728	NCC ionocyte yolk amount, abnormal	http://purl.obolibrary.org/obo/ZFA_0005579	NCC ionocyte	http://purl.obolibrary.org/obo/ZFA_0000084	yolk
http://purl.obolibrary.org/obo/ZP_0014899	Rohon-Beard neuron spinal cord amount, abnormal	http://purl.obolibrary.org/obo/ZFA_0009150	Rohon-Beard neuron	http://purl.obolibrary.org/obo/ZFA_0000075	spinal cord
http://purl.obolibrary.org/obo/ZP_0101148	adipose tissue whole organism amount, abnormal	http://purl.obolibrary.org/obo/ZFA_0005345	adipose tissue	http://purl.obolibrary.org/obo/ZFA_0001094	whole organism
http://purl.obolibrary.org/obo/ZP_0145897	amphisome chondrocyte amount, abnormal	http://purl.obolibrary.org/obo/GO_0044753	amphisome	http://purl.obolibrary.org/obo/ZFA_0009084	chondrocyte
http://purl.obolibrary.org/obo/ZP_0021314	angiogenic sprout intersegmental vessel amount, abnormal	http://purl.obolibrary.org/obo/ZFA_0005604	angiogenic sprout	http://purl.obolibrary.org/obo/ZFA_0001285	intersegmental vessel
http://purl.obolibrary.org/obo/ZP_0145896	autophagosome chondrocyte amount, abnormal	http://purl.obolibrary.org/obo/GO_0005776	autophagosome	http://purl.obolibrary.org/obo/ZFA_0009084	chondrocyte
http://purl.obolibrary.org/obo/ZP_0013643	axon anterior commissure amount, abnormal	http://purl.obolibrary.org/obo/GO_0030424	axon	http://purl.obolibrary.org/obo/ZFA_0001108	anterior commissure
http://purl.obolibrary.org/obo/ZP_0017659	axon posterior lateral line amount, abnormal	http://purl.obolibrary.org/obo/GO_0030424	axon	http://purl.obolibrary.org/obo/ZFA_0000944	posterior lateral line
http://purl.obolibrary.org/obo/ZP_0100349	axon trigeminal ganglion amount, abnormal	http://purl.obolibrary.org/obo/GO_0030424	axon	http://purl.obolibrary.org/obo/ZFA_0000295	trigeminal ganglion
http://purl.obolibrary.org/obo/ZP_0021249	basement membrane dorsal aorta amount, abnormal	http://purl.obolibrary.org/obo/GO_0005604	basement membrane	http://purl.obolibrary.org/obo/ZFA_0000014	dorsal aorta
http://purl.obolibrary.org/obo/ZP_0106448	blood cell caudal vein amount, abnormal	http://purl.obolibrary.org/obo/ZFA_0009044	blood cell	http://purl.obolibrary.org/obo/ZFA_0000180	caudal vein
http://purl.obolibrary.org/obo/ZP_0013310	blood vessel endothelial cell axial vasculature amount, abnormal	http://purl.obolibrary.org/obo/ZFA_0009036	blood vessel endothelial cell	http://purl.obolibrary.org/obo/ZFA_0001073	axial vasculature
http://purl.obolibrary.org/obo/ZP_0102584	blood vessel endothelial cell dorsal aorta amount, abnormal	http://purl.obolibrary.org/obo/ZFA_0009036	blood vessel endothelial cell	http://purl.obolibrary.org/obo/ZFA_0000014	dorsal aorta
http://purl.obolibrary.org/obo/ZP_0015060	blood vessel endothelial cell intersegmental artery amount, abnormal	http://purl.obolibrary.org/obo/ZFA_0009036	blood vessel endothelial cell	http://purl.obolibrary.org/obo/ZFA_0001061	intersegmental artery
http://purl.obolibrary.org/obo/ZP_0130857	brain vasculature hindbrain amount, abnormal	http://purl.obolibrary.org/obo/ZFA_0000099	brain vasculature	http://purl.obolibrary.org/obo/ZFA_0000029	hindbrain
http://purl.obolibrary.org/obo/ZP_0100023	cardiac muscle cell atrial myocardium amount, abnormal	http://purl.obolibrary.org/obo/ZFA_0009316	cardiac muscle cell	http://purl.obolibrary.org/obo/ZFA_0001374	atrial myocardium
http://purl.obolibrary.org/obo/ZP_0013958	cardiac muscle cell atrium amount, abnormal	http://purl.obolibrary.org/obo/ZFA_0009316	cardiac muscle cell	http://purl.obolibrary.org/obo/ZFA_0000471	atrium
http://purl.obolibrary.org/obo/ZP_0100533	cardiac muscle cell cardiac ventricle amount, abnormal	http://purl.obolibrary.org/obo/ZFA_0009316	cardiac muscle cell	http://purl.obolibrary.org/obo/ZFA_0000009	cardiac ventricle
http://purl.obolibrary.org/obo/ZP_0100024	cardiac muscle cell ventricular myocardium amount, abnormal	http://purl.obolibrary.org/obo/ZFA_0009316	cardiac muscle cell	http://purl.obolibrary.org/obo/ZFA_0005061	ventricular myocardium
http://purl.obolibrary.org/obo/ZP_0131103	cell atrioventricular canal endocardium amount, abnormal	http://purl.obolibrary.org/obo/ZFA_0009000	cell	http://purl.obolibrary.org/obo/ZFA_0001616	atrioventricular canal endocardium
http://purl.obolibrary.org/obo/ZP_0014929	cell endocardial cushion amount, abnormal	http://purl.obolibrary.org/obo/ZFA_0009000	cell	http://purl.obolibrary.org/obo/ZFA_0001317	endocardial cushion
http://purl.obolibrary.org/obo/ZP_0015996	cell retinal ganglion cell layer amount, abnormal	http://purl.obolibrary.org/obo/ZFA_0009000	cell	http://purl.obolibrary.org/obo/ZFA_0000024	retinal ganglion cell layer
http://purl.obolibrary.org/obo/ZP_0131182	cell retinal inner nuclear layer amount, abnormal	http://purl.obolibrary.org/obo/ZFA_0009000	cell	http://purl.obolibrary.org/obo/ZFA_0000119	retinal inner nuclear layer
http://purl.obolibrary.org/obo/ZP_0103561	cell roof plate amount, abnormal	http://purl.obolibrary.org/obo/ZFA_0009000	cell	http://purl.obolibrary.org/obo/ZFA_0007058	roof plate
http://purl.obolibrary.org/obo/ZP_0017574	cell ventricular zone amount, abnormal	http://purl.obolibrary.org/obo/ZFA_0009000	cell	http://purl.obolibrary.org/obo/ZFA_0001083	ventricular zone
http://purl.obolibrary.org/obo/ZP_0100540	chondrocyte ceratohyal cartilage amount, abnormal	http://purl.obolibrary.org/obo/ZFA_0009084	chondrocyte	http://purl.obolibrary.org/obo/ZFA_0001400	ceratohyal cartilage
http://purl.obolibrary.org/obo/ZP_0014480	chondrocyte palatoquadrate cartilage amount, abnormal	http://purl.obolibrary.org/obo/ZFA_0009084	chondrocyte	http://purl.obolibrary.org/obo/ZFA_0001399	palatoquadrate cartilage
http://purl.obolibrary.org/obo/ZP_0019256	chromosome cell amount, abnormal	http://purl.obolibrary.org/obo/GO_0005694	chromosome	http://purl.obolibrary.org/obo/ZFA_0009000	cell
http://purl.obolibrary.org/obo/ZP_0002274	chromosome peripheral nervous system amount, abnormal	http://purl.obolibrary.org/obo/GO_0005694	chromosome	http://purl.obolibrary.org/obo/ZFA_0000142	peripheral nervous system
http://purl.obolibrary.org/obo/ZP_0100469	cilium Kupffer's vesicle amount, abnormal	http://purl.obolibrary.org/obo/GO_0005929	cilium	http://purl.obolibrary.org/obo/ZFA_0000001	Kupffer's vesicle
http://purl.obolibrary.org/obo/ZP_0137350	cilium blood vessel amount, abnormal	http://purl.obolibrary.org/obo/GO_0005929	cilium	http://purl.obolibrary.org/obo/ZFA_0005314	blood vessel
http://purl.obolibrary.org/obo/ZP_0141369	cilium central canal amount, abnormal	http://purl.obolibrary.org/obo/GO_0005929	cilium	http://purl.obolibrary.org/obo/ZFA_0000938	central canal
http://purl.obolibrary.org/obo/ZP_0101446	cilium pronephric duct amount, abnormal	http://purl.obolibrary.org/obo/GO_0005929	cilium	http://purl.obolibrary.org/obo/ZFA_0000150	pronephric duct
http://purl.obolibrary.org/obo/ZP_0018325	common myeloid progenitor blood amount, abnormal	http://purl.obolibrary.org/obo/ZFA_0009021	common myeloid progenitor	http://purl.obolibrary.org/obo/ZFA_0000007	blood
http://purl.obolibrary.org/obo/ZP_0141162	cone photoreceptor outer segment retina amount, abnormal	http://purl.obolibrary.org/obo/GO_0120199	cone photoreceptor outer segment	http://purl.obolibrary.org/obo/ZFA_0000152	retina
http://purl.obolibrary.org/obo/ZP_0137860	cone telodendria UV sensitive photoreceptor cell amount, abnormal	http://purl.obolibrary.org/obo/GO_0120209	cone telodendria	http://purl.obolibrary.org/obo/ZFA_0009221	UV sensitive photoreceptor cell
http://purl.obolibrary.org/obo/ZP_0017592	dopaminergic neuron caudal tuberculum amount, abnormal	http://purl.obolibrary.org/obo/ZFA_0009301	dopaminergic neuron	http://purl.obolibrary.org/obo/ZFA_0000633	caudal tuberculum
http://purl.obolibrary.org/obo/ZP_0105864	dopaminergic neuron regenerating tissue amount, abnormal	http://purl.obolibrary.org/obo/ZFA_0009301	dopaminergic neuron	http://purl.obolibrary.org/obo/ZFA_0005147	regenerating tissue
http://purl.obolibrary.org/obo/ZP_0017439	endocytic vesicle pronephric duct amount, abnormal	http://purl.obolibrary.org/obo/GO_0030139	endocytic vesicle	http://purl.obolibrary.org/obo/ZFA_0000150	pronephric duct
http://purl.obolibrary.org/obo/ZP_0017437	endosome pronephric duct amount, abnormal	http://purl.obolibrary.org/obo/GO_0005768	endosome	http://purl.obolibrary.org/obo/ZFA_0000150	pronephric duct
http://purl.obolibrary.org/obo/ZP_0013054	endothelial cell caudal vein amount, abnormal	http://purl.obolibrary.org/obo/ZFA_0009065	endothelial cell	http://purl.obolibrary.org/obo/ZFA_0000180	caudal vein
http://purl.obolibrary.org/obo/ZP_0017552	endothelial cell caudal vein plexus amount, abnormal	http://purl.obolibrary.org/obo/ZFA_0009065	endothelial cell	http://purl.obolibrary.org/obo/ZFA_0001286	caudal vein plexus
http://purl.obolibrary.org/obo/ZP_0101922	endothelial cell intersegmental vessel amount, abnormal	http://purl.obolibrary.org/obo/ZFA_0009065	endothelial cell	http://purl.obolibrary.org/obo/ZFA_0001285	intersegmental vessel
http://purl.obolibrary.org/obo/ZP_0022931	endothelial cell otolithic lymph vessel amount, abnormal	http://purl.obolibrary.org/obo/ZFA_0009065	endothelial cell	http://purl.obolibrary.org/obo/ZFA_0005838	otolithic lymph vessel
http://purl.obolibrary.org/obo/ZP_0013058	endothelial cell posterior cardinal vein amount, abnormal	http://purl.obolibrary.org/obo/ZFA_0009065	endothelial cell	http://purl.obolibrary.org/obo/ZFA_0000477	posterior cardinal vein
http://purl.obolibrary.org/obo/ZP_0018265	endothelial cell primordial hindbrain channel amount, abnormal	http://purl.obolibrary.org/obo/ZFA_0009065	endothelial cell	http://purl.obolibrary.org/obo/ZFA_0001052	primordial hindbrain channel
http://purl.obolibrary.org/obo/ZP_0013060	endothelial cell subintestinal vein amount, abnormal	http://purl.obolibrary.org/obo/ZFA_0009065	endothelial cell	http://purl.obolibrary.org/obo/ZFA_0005035	subintestinal vein
http://purl.obolibrary.org/obo/ZP_0137217	filopodium CaP motoneuron amount, abnormal	http://purl.obolibrary.org/obo/GO_0030175	filopodium	http://purl.obolibrary.org/obo/ZFA_0009243	CaP motoneuron
http://purl.obolibrary.org/obo/ZP_0101927	filopodium intersegmental vessel amount, abnormal	http://purl.obolibrary.org/obo/GO_0030175	filopodium	http://purl.obolibrary.org/obo/ZFA_0001285	intersegmental vessel
http://purl.obolibrary.org/obo/ZP_0011393	glial cell (sensu Vertebrata) floor plate spinal cord region amount, abnormal	http://purl.obolibrary.org/obo/ZFA_0009147	glial cell (sensu Vertebrata)	http://purl.obolibrary.org/obo/ZFA_0000890	floor plate spinal cord region
http://purl.obolibrary.org/obo/ZP_0012853	glial cell (sensu Vertebrata) ventricular zone amount, abnormal	http://purl.obolibrary.org/obo/ZFA_0009147	glial cell (sensu Vertebrata)	http://purl.obolibrary.org/obo/ZFA_0001083	ventricular zone
http://purl.obolibrary.org/obo/ZP_0143732	glutamatergic neuron spinal cord amount, abnormal	http://purl.obolibrary.org/obo/ZFA_0009290	glutamatergic neuron	http://purl.obolibrary.org/obo/ZFA_0000075	spinal cord
http://purl.obolibrary.org/obo/ZP_0139937	glycinergic neuron spinal cord interneuron amount, abnormal	http://purl.obolibrary.org/obo/ZFA_0009396	glycinergic neuron	http://purl.obolibrary.org/obo/ZFA_0000778	spinal cord interneuron
http://purl.obolibrary.org/obo/ZP_0013970	goblet cell intestine amount, abnormal	http://purl.obolibrary.org/obo/ZFA_0009094	goblet cell	http://purl.obolibrary.org/obo/ZFA_0001338	intestine
http://purl.obolibrary.org/obo/ZP_0141101	growth cone filopodium CaP motoneuron amount, abnormal	http://purl.obolibrary.org/obo/GO_1990812	growth cone filopodium	http://purl.obolibrary.org/obo/ZFA_0009243	CaP motoneuron
http://purl.obolibrary.org/obo/ZP_0012933	hair cell macula utricle amount, abnormal	http://purl.obolibrary.org/obo/ZFA_0009366	hair cell	http://purl.obolibrary.org/obo/ZFA_0000030	macula utricle
http://purl.obolibrary.org/obo/ZP_0014917	hair cell otic vesicle amount, abnormal	http://purl.obolibrary.org/obo/ZFA_0009366	hair cell	http://purl.obolibrary.org/obo/ZFA_0000051	otic vesicle
http://purl.obolibrary.org/obo/ZP_0018328	hematopoietic multipotent progenitor cell blood amount, abnormal	http://purl.obolibrary.org/obo/ZFA_0009354	hematopoietic multipotent progenitor cell	http://purl.obolibrary.org/obo/ZFA_0000007	blood
http://purl.obolibrary.org/obo/ZP_0106453	hematopoietic multipotent progenitor cell caudal hematopoietic tissue amount, abnormal	http://purl.obolibrary.org/obo/ZFA_0009354	hematopoietic multipotent progenitor cell	http://purl.obolibrary.org/obo/ZFA_0005898	caudal hematopoietic tissue
http://purl.obolibrary.org/obo/ZP_0106452	hematopoietic multipotent progenitor cell thymus amount, abnormal	http://purl.obolibrary.org/obo/ZFA_0009354	hematopoietic multipotent progenitor cell	http://purl.obolibrary.org/obo/ZFA_0001078	thymus
http://purl.obolibrary.org/obo/ZP_0141999	hematopoietic stem cell kidney amount, abnormal	http://purl.obolibrary.org/obo/ZFA_0009014	hematopoietic stem cell	http://purl.obolibrary.org/obo/ZFA_0000529	kidney
http://purl.obolibrary.org/obo/ZP_0100647	hematopoietic stem cell ventral wall of dorsal aorta amount, abnormal	http://purl.obolibrary.org/obo/ZFA_0009014	hematopoietic stem cell	http://purl.obolibrary.org/obo/ZFA_0005028	ventral wall of dorsal aorta
http://purl.obolibrary.org/obo/ZP_0137870	intersegmental vessel thoracic duct amount, abnormal	http://purl.obolibrary.org/obo/ZFA_0001285	intersegmental vessel	http://purl.obolibrary.org/obo/ZFA_0005110	thoracic duct
http://purl.obolibrary.org/obo/ZP_0137717	iridophore trunk amount, abnormal	http://purl.obolibrary.org/obo/ZFA_0009199	iridophore	http://purl.obolibrary.org/obo/ZFA_0001115	trunk
http://purl.obolibrary.org/obo/ZP_0141504	kinocilium auditory receptor cell amount, abnormal	http://purl.obolibrary.org/obo/GO_0060091	kinocilium	http://purl.obolibrary.org/obo/ZFA_0009121	auditory receptor cell
http://purl.obolibrary.org/obo/ZP_0141506	kinocilium lateral crista amount, abnormal	http://purl.obolibrary.org/obo/GO_0060091	kinocilium	http://purl.obolibrary.org/obo/ZFA_0000166	lateral crista
http://purl.obolibrary.org/obo/ZP_0106773	leukocyte intestine amount, abnormal	http://purl.obolibrary.org/obo/ZFA_0009309	leukocyte	http://purl.obolibrary.org/obo/ZFA_0001338	intestine
http://purl.obolibrary.org/obo/ZP_0013174	lipid droplet fat cell amount, abnormal	http://purl.obolibrary.org/obo/GO_0005811	lipid droplet	http://purl.obolibrary.org/obo/ZFA_0009082	fat cell
http://purl.obolibrary.org/obo/ZP_0022170	lymphangioblast horizontal myoseptum amount, abnormal	http://purl.obolibrary.org/obo/ZFA_0009393	lymphangioblast	http://purl.obolibrary.org/obo/ZFA_0000671	horizontal myoseptum
http://purl.obolibrary.org/obo/ZP_0018326	lymphocyte blood amount, abnormal	http://purl.obolibrary.org/obo/ZFA_0009250	lymphocyte	http://purl.obolibrary.org/obo/ZFA_0000007	blood
http://purl.obolibrary.org/obo/ZP_0141330	macrophage caudal fin amount, abnormal	http://purl.obolibrary.org/obo/ZFA_0009141	macrophage	http://purl.obolibrary.org/obo/ZFA_0001058	caudal fin
http://purl.obolibrary.org/obo/ZP_0101557	macrophage regenerating fin amount, abnormal	http://purl.obolibrary.org/obo/ZFA_0009141	macrophage	http://purl.obolibrary.org/obo/ZFA_0001269	regenerating fin
http://purl.obolibrary.org/obo/ZP_0106878	macrophage regenerating tissue amount, abnormal	http://purl.obolibrary.org/obo/ZFA_0009141	macrophage	http://purl.obolibrary.org/obo/ZFA_0005147	regenerating tissue
http://purl.obolibrary.org/obo/ZP_0102107	mature B cell head kidney amount, abnormal	http://purl.obolibrary.org/obo/ZFA_0009331	mature B cell	http://purl.obolibrary.org/obo/ZFA_0000669	head kidney
http://purl.obolibrary.org/obo/ZP_0106709	melanocyte caudal fin amount, abnormal	http://purl.obolibrary.org/obo/ZFA_0009091	melanocyte	http://purl.obolibrary.org/obo/ZFA_0001058	caudal fin
http://purl.obolibrary.org/obo/ZP_0013720	melanocyte melanophore stripe amount, abnormal	http://purl.obolibrary.org/obo/ZFA_0009091	melanocyte	http://purl.obolibrary.org/obo/ZFA_0001463	melanophore stripe
http://purl.obolibrary.org/obo/ZP_0013677	melanocyte trunk amount, abnormal	http://purl.obolibrary.org/obo/ZFA_0009091	melanocyte	http://purl.obolibrary.org/obo/ZFA_0001115	trunk
http://purl.obolibrary.org/obo/ZP_0017520	melanosome retinal pigmented epithelium amount, abnormal	http://purl.obolibrary.org/obo/GO_0042470	melanosome	http://purl.obolibrary.org/obo/ZFA_0000144	retinal pigmented epithelium
http://purl.obolibrary.org/obo/ZP_0141993	microglial cell brain amount, abnormal	http://purl.obolibrary.org/obo/ZFA_0009077	microglial cell	http://purl.obolibrary.org/obo/ZFA_0000008	brain
http://purl.obolibrary.org/obo/ZP_0103437	microglial cell midbrain amount, abnormal	http://purl.obolibrary.org/obo/ZFA_0009077	microglial cell	http://purl.obolibrary.org/obo/ZFA_0000128	midbrain
http://purl.obolibrary.org/obo/ZP_0102507	microglial cell optic tectum amount, abnormal	http://purl.obolibrary.org/obo/ZFA_0009077	microglial cell	http://purl.obolibrary.org/obo/ZFA_0000445	optic tectum
http://purl.obolibrary.org/obo/ZP_0141816	mitochondrial chromosome head amount, abnormal	http://purl.obolibrary.org/obo/GO_0000262	mitochondrial chromosome	http://purl.obolibrary.org/obo/ZFA_0001114	head
http://purl.obolibrary.org/obo/ZP_0141814	mitochondrial chromosome liver amount, abnormal	http://purl.obolibrary.org/obo/GO_0000262	mitochondrial chromosome	http://purl.obolibrary.org/obo/ZFA_0000123	liver
http://purl.obolibrary.org/obo/ZP_0141815	mitochondrial chromosome trunk musculature amount, abnormal	http://purl.obolibrary.org/obo/GO_0000262	mitochondrial chromosome	http://purl.obolibrary.org/obo/ZFA_0000473	trunk musculature
http://purl.obolibrary.org/obo/ZP_0018254	mitochondrial chromosome whole organism amount, abnormal	http://purl.obolibrary.org/obo/GO_0000262	mitochondrial chromosome	http://purl.obolibrary.org/obo/ZFA_0001094	whole organism
http://purl.obolibrary.org/obo/ZP_0102854	mitochondrion liver amount, abnormal	http://purl.obolibrary.org/obo/GO_0005739	mitochondrion	http://purl.obolibrary.org/obo/ZFA_0000123	liver
http://purl.obolibrary.org/obo/ZP_0100059	motile cilium Kupffer's vesicle amount, abnormal	http://purl.obolibrary.org/obo/GO_0031514	motile cilium	http://purl.obolibrary.org/obo/ZFA_0000001	Kupffer's vesicle
http://purl.obolibrary.org/obo/ZP_0013312	motile cilium floor plate amount, abnormal	http://purl.obolibrary.org/obo/GO_0031514	motile cilium	http://purl.obolibrary.org/obo/ZFA_0000022	floor plate
http://purl.obolibrary.org/obo/ZP_0013237	motor neuron abducens motor nucleus amount, abnormal	http://purl.obolibrary.org/obo/ZFA_0009052	motor neuron	http://purl.obolibrary.org/obo/ZFA_0000713	abducens motor nucleus
http://purl.obolibrary.org/obo/ZP_0101856	multi-ciliated epithelial cell pronephric duct amount, abnormal	http://purl.obolibrary.org/obo/ZFA_0005242	multi-ciliated epithelial cell	http://purl.obolibrary.org/obo/ZFA_0000150	pronephric duct
http://purl.obolibrary.org/obo/ZP_0106605	multi-ciliated epithelial cell pronephric tubule amount, abnormal	http://purl.obolibrary.org/obo/ZFA_0005242	multi-ciliated epithelial cell	http://purl.obolibrary.org/obo/ZFA_0001558	pronephric tubule
http://purl.obolibrary.org/obo/ZP_0015216	multi-ciliated epithelial cell pronephros amount, abnormal	http://purl.obolibrary.org/obo/ZFA_0005242	multi-ciliated epithelial cell	http://purl.obolibrary.org/obo/ZFA_0000151	pronephros
http://purl.obolibrary.org/obo/ZP_0141786	mural cell brain vasculature amount, abnormal	http://purl.obolibrary.org/obo/ZFA_0005944	mural cell	http://purl.obolibrary.org/obo/ZFA_0000099	brain vasculature
http://purl.obolibrary.org/obo/ZP_0141787	mural cell trunk vasculature amount, abnormal	http://purl.obolibrary.org/obo/ZFA_0005944	mural cell	http://purl.obolibrary.org/obo/ZFA_0005024	trunk vasculature
http://purl.obolibrary.org/obo/ZP_0013129	muscle cell adductor mandibulae amount, abnormal	http://purl.obolibrary.org/obo/ZFA_0009114	muscle cell	http://purl.obolibrary.org/obo/ZFA_0007049	adductor mandibulae
http://purl.obolibrary.org/obo/ZP_0013133	muscle cell interhyoideus amount, abnormal	http://purl.obolibrary.org/obo/ZFA_0009114	muscle cell	http://purl.obolibrary.org/obo/ZFA_0007051	interhyoideus
http://purl.obolibrary.org/obo/ZP_0013117	muscle cell medial rectus amount, abnormal	http://purl.obolibrary.org/obo/ZFA_0009114	muscle cell	http://purl.obolibrary.org/obo/ZFA_0000301	medial rectus
http://purl.obolibrary.org/obo/ZP_0103300	muscle pioneer horizontal myoseptum amount, abnormal	http://purl.obolibrary.org/obo/ZFA_0001086	muscle pioneer	http://purl.obolibrary.org/obo/ZFA_0000671	horizontal myoseptum
http://purl.obolibrary.org/obo/ZP_0013704	myoblast adductor hyomandibulae amount, abnormal	http://purl.obolibrary.org/obo/ZFA_0009025	myoblast	http://purl.obolibrary.org/obo/ZFA_0007053	adductor hyomandibulae
http://purl.obolibrary.org/obo/ZP_0013703	myoblast levator arcus palatini amount, abnormal	http://purl.obolibrary.org/obo/ZFA_0009025	myoblast	http://purl.obolibrary.org/obo/ZFA_0000384	levator arcus palatini
http://purl.obolibrary.org/obo/ZP_0012884	myosin filament fast muscle cell amount, abnormal	http://purl.obolibrary.org/obo/GO_0032982	myosin filament	http://purl.obolibrary.org/obo/ZFA_0009117	fast muscle cell
http://purl.obolibrary.org/obo/ZP_0015058	myosin filament slow muscle cell amount, abnormal	http://purl.obolibrary.org/obo/GO_0032982	myosin filament	http://purl.obolibrary.org/obo/ZFA_0009116	slow muscle cell
http://purl.obolibrary.org/obo/ZP_0013114	neuromast anterior lateral line amount, abnormal	http://purl.obolibrary.org/obo/ZFA_0000243	neuromast	http://purl.obolibrary.org/obo/ZFA_0001470	anterior lateral line
http://purl.obolibrary.org/obo/ZP_0105744	neuromast hair cell posterior lateral line neuromast amount, abnormal	http://purl.obolibrary.org/obo/ZFA_0009367	neuromast hair cell	http://purl.obolibrary.org/obo/ZFA_0000940	posterior lateral line neuromast
http://purl.obolibrary.org/obo/ZP_0102969	neuromast head amount, abnormal	http://purl.obolibrary.org/obo/ZFA_0000243	neuromast	http://purl.obolibrary.org/obo/ZFA_0001114	head
http://purl.obolibrary.org/obo/ZP_0142029	neuron cerebellum amount, abnormal	http://purl.obolibrary.org/obo/ZFA_0009248	neuron	http://purl.obolibrary.org/obo/ZFA_0000100	cerebellum
http://purl.obolibrary.org/obo/ZP_0017089	neuron dorsal root ganglion amount, abnormal	http://purl.obolibrary.org/obo/ZFA_0009248	neuron	http://purl.obolibrary.org/obo/ZFA_0000200	dorsal root ganglion
http://purl.obolibrary.org/obo/ZP_0014158	neuron enteric nervous system amount, abnormal	http://purl.obolibrary.org/obo/ZFA_0009248	neuron	http://purl.obolibrary.org/obo/ZFA_0001155	enteric nervous system
http://purl.obolibrary.org/obo/ZP_0137673	neuron projection branchiomotor neuron amount, abnormal	http://purl.obolibrary.org/obo/GO_0043005	neuron projection	http://purl.obolibrary.org/obo/ZFA_0005731	branchiomotor neuron
http://purl.obolibrary.org/obo/ZP_0013851	neuron spinal cord amount, abnormal	http://purl.obolibrary.org/obo/ZFA_0009248	neuron	http://purl.obolibrary.org/obo/ZFA_0000075	spinal cord
http://purl.obolibrary.org/obo/ZP_0022037	neuron telencephalon amount, abnormal	http://purl.obolibrary.org/obo/ZFA_0009248	neuron	http://purl.obolibrary.org/obo/ZFA_0000079	telencephalon
http://purl.obolibrary.org/obo/ZP_0137713	neuron trigeminal ganglion amount, abnormal	http://purl.obolibrary.org/obo/ZFA_0009248	neuron	http://purl.obolibrary.org/obo/ZFA_0000295	trigeminal ganglion
http://purl.obolibrary.org/obo/ZP_0018331	neutrophil epithelium amount, abnormal	http://purl.obolibrary.org/obo/ZFA_0009327	neutrophil	http://purl.obolibrary.org/obo/ZFA_0001486	epithelium
http://purl.obolibrary.org/obo/ZP_0021476	neutrophil intestine amount, abnormal	http://purl.obolibrary.org/obo/ZFA_0009327	neutrophil	http://purl.obolibrary.org/obo/ZFA_0001338	intestine
http://purl.obolibrary.org/obo/ZP_0103200	neutrophil regenerating fin amount, abnormal	http://purl.obolibrary.org/obo/ZFA_0009327	neutrophil	http://purl.obolibrary.org/obo/ZFA_0001269	regenerating fin
http://purl.obolibrary.org/obo/ZP_0140159	noradrenergic neuron aortic arch amount, abnormal	http://purl.obolibrary.org/obo/ZFA_0005873	noradrenergic neuron	http://purl.obolibrary.org/obo/ZFA_0005004	aortic arch
http://purl.obolibrary.org/obo/ZP_0142001	nucleate erythrocyte kidney amount, abnormal	http://purl.obolibrary.org/obo/ZFA_0009256	nucleate erythrocyte	http://purl.obolibrary.org/obo/ZFA_0000529	kidney
