defined_class	defined_class_label	biological_process	biological_process_label	location	location_label
http://purl.obolibrary.org/obo/ZP_0143332	CaP motoneuron delayed axon extension involved in axon guidance, abnormal	http://purl.obolibrary.org/obo/GO_0048846	axon extension involved in axon guidance	http://purl.obolibrary.org/obo/ZFA_0009243	CaP motoneuron
http://purl.obolibrary.org/obo/ZP_0102204	DEL delayed cell migration involved in gastrulation, abnormal	http://purl.obolibrary.org/obo/GO_0042074	cell migration involved in gastrulation	http://purl.obolibrary.org/obo/ZFA_0000711	DEL
http://purl.obolibrary.org/obo/ZP_0014868	DEL delayed epiboly, abnormal	http://purl.obolibrary.org/obo/GO_0090504	epiboly	http://purl.obolibrary.org/obo/ZFA_0000711	DEL
http://purl.obolibrary.org/obo/ZP_0143672	EVL delayed abscission, abnormal	http://purl.obolibrary.org/obo/GO_0009838	abscission	http://purl.obolibrary.org/obo/ZFA_0000086	EVL
http://purl.obolibrary.org/obo/ZP_0014867	EVL delayed epiboly, abnormal	http://purl.obolibrary.org/obo/GO_0090504	epiboly	http://purl.obolibrary.org/obo/ZFA_0000086	EVL
http://purl.obolibrary.org/obo/ZP_0147012	anterior chamber swim bladder delayed swim bladder inflation, abnormal	http://purl.obolibrary.org/obo/GO_0048798	swim bladder inflation	http://purl.obolibrary.org/obo/ZFA_0001277	anterior chamber swim bladder
http://purl.obolibrary.org/obo/ZP_0144147	aortic arch delayed angiogenesis, abnormal	http://purl.obolibrary.org/obo/GO_0001525	angiogenesis	http://purl.obolibrary.org/obo/ZFA_0005004	aortic arch
http://purl.obolibrary.org/obo/ZP_0140919	artery delayed blood coagulation, abnormal	http://purl.obolibrary.org/obo/GO_0007596	blood coagulation	http://purl.obolibrary.org/obo/ZFA_0000005	artery
http://purl.obolibrary.org/obo/ZP_0147608	basihyal cartilage delayed ossification, abnormal	http://purl.obolibrary.org/obo/GO_0001503	ossification	http://purl.obolibrary.org/obo/ZFA_0001510	basihyal cartilage
http://purl.obolibrary.org/obo/ZP_0000775	blastomere delayed RNA localization, abnormal	http://purl.obolibrary.org/obo/GO_0006403	RNA localization	http://purl.obolibrary.org/obo/ZFA_0000093	blastomere
http://purl.obolibrary.org/obo/ZP_0147661	branchiostegal ray delayed anatomical structure development, abnormal	http://purl.obolibrary.org/obo/GO_0048856	anatomical structure development	http://purl.obolibrary.org/obo/ZFA_0000476	branchiostegal ray
http://purl.obolibrary.org/obo/ZP_0146839	branchiostegal ray delayed intramembranous ossification, abnormal	http://purl.obolibrary.org/obo/GO_0001957	intramembranous ossification	http://purl.obolibrary.org/obo/ZFA_0000476	branchiostegal ray
http://purl.obolibrary.org/obo/ZP_0147618	branchiostegal ray delayed ossification, abnormal	http://purl.obolibrary.org/obo/GO_0001503	ossification	http://purl.obolibrary.org/obo/ZFA_0000476	branchiostegal ray
http://purl.obolibrary.org/obo/ZP_0138118	cardiac ventricle delayed animal organ regeneration, abnormal	http://purl.obolibrary.org/obo/GO_0031100	animal organ regeneration	http://purl.obolibrary.org/obo/ZFA_0000009	cardiac ventricle
http://purl.obolibrary.org/obo/ZP_0142765	cardiac ventricle delayed regeneration, abnormal	http://purl.obolibrary.org/obo/GO_0031099	regeneration	http://purl.obolibrary.org/obo/ZFA_0000009	cardiac ventricle
http://purl.obolibrary.org/obo/ZP_0142937	cardiac ventricle delayed wound healing, abnormal	http://purl.obolibrary.org/obo/GO_0042060	wound healing	http://purl.obolibrary.org/obo/ZFA_0000009	cardiac ventricle
http://purl.obolibrary.org/obo/ZP_0146853	caudal artery delayed blood coagulation, abnormal	http://purl.obolibrary.org/obo/GO_0007596	blood coagulation	http://purl.obolibrary.org/obo/ZFA_0000011	caudal artery
http://purl.obolibrary.org/obo/ZP_0142543	caudal fin actinotrichium delayed cartilage development, abnormal	http://purl.obolibrary.org/obo/GO_0051216	cartilage development	http://purl.obolibrary.org/obo/ZFA_0005424	caudal fin actinotrichium
http://purl.obolibrary.org/obo/ZP_0144698	caudal fin delayed bone mineralization, abnormal	http://purl.obolibrary.org/obo/GO_0030282	bone mineralization	http://purl.obolibrary.org/obo/ZFA_0001058	caudal fin
http://purl.obolibrary.org/obo/ZP_0144700	caudal fin delayed cartilage development, abnormal	http://purl.obolibrary.org/obo/GO_0051216	cartilage development	http://purl.obolibrary.org/obo/ZFA_0001058	caudal fin
http://purl.obolibrary.org/obo/ZP_0147457	caudal fin delayed fin regeneration, abnormal	http://purl.obolibrary.org/obo/GO_0031101	fin regeneration	http://purl.obolibrary.org/obo/ZFA_0001058	caudal fin
http://purl.obolibrary.org/obo/ZP_0147234	caudal vein delayed blood coagulation, abnormal	http://purl.obolibrary.org/obo/GO_0007596	blood coagulation	http://purl.obolibrary.org/obo/ZFA_0000180	caudal vein
http://purl.obolibrary.org/obo/ZP_0100696	centrum delayed ossification, abnormal	http://purl.obolibrary.org/obo/GO_0001503	ossification	http://purl.obolibrary.org/obo/ZFA_0000126	centrum
http://purl.obolibrary.org/obo/ZP_0146833	ceratobranchial 5 bone delayed bone mineralization, abnormal	http://purl.obolibrary.org/obo/GO_0030282	bone mineralization	http://purl.obolibrary.org/obo/ZFA_0001239	ceratobranchial 5 bone
http://purl.obolibrary.org/obo/ZP_0146834	ceratobranchial 5 tooth delayed tooth mineralization, abnormal	http://purl.obolibrary.org/obo/GO_0034505	tooth mineralization	http://purl.obolibrary.org/obo/ZFA_0000694	ceratobranchial 5 tooth
http://purl.obolibrary.org/obo/ZP_0147624	ceratobranchial cartilage delayed endochondral ossification, abnormal	http://purl.obolibrary.org/obo/GO_0001958	endochondral ossification	http://purl.obolibrary.org/obo/ZFA_0001516	ceratobranchial cartilage
http://purl.obolibrary.org/obo/ZP_0143440	ceratohyal bone delayed bone mineralization, abnormal	http://purl.obolibrary.org/obo/GO_0030282	bone mineralization	http://purl.obolibrary.org/obo/ZFA_0000578	ceratohyal bone
http://purl.obolibrary.org/obo/ZP_0147659	ceratohyal bone delayed ossification, abnormal	http://purl.obolibrary.org/obo/GO_0001503	ossification	http://purl.obolibrary.org/obo/ZFA_0000578	ceratohyal bone
http://purl.obolibrary.org/obo/ZP_0147607	ceratohyal cartilage delayed ossification, abnormal	http://purl.obolibrary.org/obo/GO_0001503	ossification	http://purl.obolibrary.org/obo/ZFA_0001400	ceratohyal cartilage
http://purl.obolibrary.org/obo/ZP_0146840	ceratohyal cartilage delayed perichondral ossification, abnormal	http://purl.obolibrary.org/obo/GO_0036073	perichondral ossification	http://purl.obolibrary.org/obo/ZFA_0001400	ceratohyal cartilage
http://purl.obolibrary.org/obo/ZP_0147620	claustrum cartilage delayed ossification, abnormal	http://purl.obolibrary.org/obo/GO_0001503	ossification	http://purl.obolibrary.org/obo/ZFA_0000637	claustrum cartilage
http://purl.obolibrary.org/obo/ZP_0014735	cranial cartilage delayed cartilage development, abnormal	http://purl.obolibrary.org/obo/GO_0051216	cartilage development	http://purl.obolibrary.org/obo/ZFA_0001458	cranial cartilage
http://purl.obolibrary.org/obo/ZP_0103341	cranial nerve II delayed axon extension involved in axon guidance, abnormal	http://purl.obolibrary.org/obo/GO_0048846	axon extension involved in axon guidance	http://purl.obolibrary.org/obo/ZFA_0000435	cranial nerve II
http://purl.obolibrary.org/obo/ZP_0019852	cranial nerve II delayed axonogenesis involved in innervation, abnormal	http://purl.obolibrary.org/obo/GO_0060385	axonogenesis involved in innervation	http://purl.obolibrary.org/obo/ZFA_0000435	cranial nerve II
http://purl.obolibrary.org/obo/ZP_0140646	cranial nerve X delayed axonogenesis involved in innervation, abnormal	http://purl.obolibrary.org/obo/GO_0060385	axonogenesis involved in innervation	http://purl.obolibrary.org/obo/ZFA_0000453	cranial nerve X
http://purl.obolibrary.org/obo/ZP_0106757	cranial neural crest cell delayed cell migration, abnormal	http://purl.obolibrary.org/obo/GO_0016477	cell migration	http://purl.obolibrary.org/obo/ZFA_0009003	cranial neural crest cell
http://purl.obolibrary.org/obo/ZP_0146837	dentary delayed intramembranous ossification, abnormal	http://purl.obolibrary.org/obo/GO_0001957	intramembranous ossification	http://purl.obolibrary.org/obo/ZFA_0000191	dentary
http://purl.obolibrary.org/obo/ZP_0022629	dermatocranium delayed ossification, abnormal	http://purl.obolibrary.org/obo/GO_0001503	ossification	http://purl.obolibrary.org/obo/ZFA_0000863	dermatocranium
http://purl.obolibrary.org/obo/ZP_0102935	digestive system delayed G1/S transition of mitotic cell cycle, abnormal	http://purl.obolibrary.org/obo/GO_0000082	G1/S transition of mitotic cell cycle	http://purl.obolibrary.org/obo/ZFA_0000339	digestive system
http://purl.obolibrary.org/obo/ZP_0141560	dorsal aorta delayed blood coagulation, fibrin clot formation, abnormal	http://purl.obolibrary.org/obo/GO_0072378	blood coagulation, fibrin clot formation	http://purl.obolibrary.org/obo/ZFA_0000014	dorsal aorta
http://purl.obolibrary.org/obo/ZP_0139907	dorsal habenular nucleus delayed neuron differentiation, abnormal	http://purl.obolibrary.org/obo/GO_0030182	neuron differentiation	http://purl.obolibrary.org/obo/ZFA_0000197	dorsal habenular nucleus
http://purl.obolibrary.org/obo/ZP_0016748	dorsal longitudinal anastomotic vessel delayed angiogenesis, abnormal	http://purl.obolibrary.org/obo/GO_0001525	angiogenesis	http://purl.obolibrary.org/obo/ZFA_0005025	dorsal longitudinal anastomotic vessel
http://purl.obolibrary.org/obo/ZP_0023065	dorsal longitudinal anastomotic vessel delayed blood vessel development, abnormal	http://purl.obolibrary.org/obo/GO_0001568	blood vessel development	http://purl.obolibrary.org/obo/ZFA_0005025	dorsal longitudinal anastomotic vessel
http://purl.obolibrary.org/obo/ZP_0011334	endodermal cell delayed cell migration, abnormal	http://purl.obolibrary.org/obo/GO_0016477	cell migration	http://purl.obolibrary.org/obo/ZFA_0009139	endodermal cell
http://purl.obolibrary.org/obo/ZP_0101920	endothelial tip cell delayed cell migration, abnormal	http://purl.obolibrary.org/obo/GO_0016477	cell migration	http://purl.obolibrary.org/obo/ZFA_0009303	endothelial tip cell
http://purl.obolibrary.org/obo/ZP_0011539	enteric nervous system delayed neuron migration, abnormal	http://purl.obolibrary.org/obo/GO_0001764	neuron migration	http://purl.obolibrary.org/obo/ZFA_0001155	enteric nervous system
http://purl.obolibrary.org/obo/ZP_0142287	ependymal cell delayed calcium ion import into cytosol, abnormal	http://purl.obolibrary.org/obo/GO_1902656	calcium ion import into cytosol	http://purl.obolibrary.org/obo/ZFA_0009033	ependymal cell
http://purl.obolibrary.org/obo/ZP_0101824	erythroid lineage cell delayed cell cycle G1/S phase transition, abnormal	http://purl.obolibrary.org/obo/GO_0044843	cell cycle G1/S phase transition	http://purl.obolibrary.org/obo/ZFA_0009325	erythroid lineage cell
http://purl.obolibrary.org/obo/ZP_0146368	ethmoid cartilage delayed chondrocyte development, abnormal	http://purl.obolibrary.org/obo/GO_0002063	chondrocyte development	http://purl.obolibrary.org/obo/ZFA_0001405	ethmoid cartilage
http://purl.obolibrary.org/obo/ZP_0017637	eye delayed cell cycle, abnormal	http://purl.obolibrary.org/obo/GO_0007049	cell cycle	http://purl.obolibrary.org/obo/ZFA_0000107	eye
http://purl.obolibrary.org/obo/ZP_0140763	fast muscle cell delayed cell morphogenesis, abnormal	http://purl.obolibrary.org/obo/GO_0000902	cell morphogenesis	http://purl.obolibrary.org/obo/ZFA_0009117	fast muscle cell
http://purl.obolibrary.org/obo/ZP_0140587	fast muscle cell delayed skeletal muscle tissue development, abnormal	http://purl.obolibrary.org/obo/GO_0007519	skeletal muscle tissue development	http://purl.obolibrary.org/obo/ZFA_0009117	fast muscle cell
http://purl.obolibrary.org/obo/ZP_0144563	female organism delayed developmental process involved in reproduction, abnormal	http://purl.obolibrary.org/obo/GO_0003006	developmental process involved in reproduction	http://purl.obolibrary.org/obo/ZFA_0000303	female organism
http://purl.obolibrary.org/obo/ZP_0144564	female organism delayed follicle cell of egg chamber development, abnormal	http://purl.obolibrary.org/obo/GO_0030707	follicle cell of egg chamber development	http://purl.obolibrary.org/obo/ZFA_0000303	female organism
http://purl.obolibrary.org/obo/ZP_0147663	frontal bone delayed ossification, abnormal	http://purl.obolibrary.org/obo/GO_0001503	ossification	http://purl.obolibrary.org/obo/ZFA_0000514	frontal bone
http://purl.obolibrary.org/obo/ZP_0014951	habenula delayed neurogenesis, abnormal	http://purl.obolibrary.org/obo/GO_0022008	neurogenesis	http://purl.obolibrary.org/obo/ZFA_0000213	habenula
http://purl.obolibrary.org/obo/ZP_0139909	habenula delayed neuron differentiation, abnormal	http://purl.obolibrary.org/obo/GO_0030182	neuron differentiation	http://purl.obolibrary.org/obo/ZFA_0000213	habenula
http://purl.obolibrary.org/obo/ZP_0144699	head delayed bone mineralization, abnormal	http://purl.obolibrary.org/obo/GO_0030282	bone mineralization	http://purl.obolibrary.org/obo/ZFA_0001114	head
http://purl.obolibrary.org/obo/ZP_0144701	head delayed cartilage development, abnormal	http://purl.obolibrary.org/obo/GO_0051216	cartilage development	http://purl.obolibrary.org/obo/ZFA_0001114	head
http://purl.obolibrary.org/obo/ZP_0138481	head delayed developmental process, abnormal	http://purl.obolibrary.org/obo/GO_0032502	developmental process	http://purl.obolibrary.org/obo/ZFA_0001114	head
http://purl.obolibrary.org/obo/ZP_0103170	head delayed embryo development, abnormal	http://purl.obolibrary.org/obo/GO_0009790	embryo development	http://purl.obolibrary.org/obo/ZFA_0001114	head
http://purl.obolibrary.org/obo/ZP_0019650	head delayed neural crest cell migration, abnormal	http://purl.obolibrary.org/obo/GO_0001755	neural crest cell migration	http://purl.obolibrary.org/obo/ZFA_0001114	head
http://purl.obolibrary.org/obo/ZP_0140564	head muscle delayed muscle cell development, abnormal	http://purl.obolibrary.org/obo/GO_0055001	muscle cell development	http://purl.obolibrary.org/obo/ZFA_0001652	head muscle
http://purl.obolibrary.org/obo/ZP_0138101	heart delayed regeneration, abnormal	http://purl.obolibrary.org/obo/GO_0031099	regeneration	http://purl.obolibrary.org/obo/ZFA_0000114	heart
http://purl.obolibrary.org/obo/ZP_0012279	hindbrain delayed exit from mitosis, abnormal	http://purl.obolibrary.org/obo/GO_0010458	exit from mitosis	http://purl.obolibrary.org/obo/ZFA_0000029	hindbrain
http://purl.obolibrary.org/obo/ZP_0011427	hyaloid vessel delayed vasculature development, abnormal	http://purl.obolibrary.org/obo/GO_0001944	vasculature development	http://purl.obolibrary.org/obo/ZFA_0005046	hyaloid vessel
http://purl.obolibrary.org/obo/ZP_0143441	hyomandibula delayed bone mineralization, abnormal	http://purl.obolibrary.org/obo/GO_0030282	bone mineralization	http://purl.obolibrary.org/obo/ZFA_0000672	hyomandibula
http://purl.obolibrary.org/obo/ZP_0147625	hypobranchial cartilage delayed endochondral ossification, abnormal	http://purl.obolibrary.org/obo/GO_0001958	endochondral ossification	http://purl.obolibrary.org/obo/ZFA_0001522	hypobranchial cartilage
http://purl.obolibrary.org/obo/ZP_0147619	intercalarium delayed ossification, abnormal	http://purl.obolibrary.org/obo/GO_0001503	ossification	http://purl.obolibrary.org/obo/ZFA_0000525	intercalarium
http://purl.obolibrary.org/obo/ZP_0011587	intersegmental vein delayed sprouting angiogenesis, abnormal	http://purl.obolibrary.org/obo/GO_0002040	sprouting angiogenesis	http://purl.obolibrary.org/obo/ZFA_0001057	intersegmental vein
http://purl.obolibrary.org/obo/ZP_0016747	intersegmental vessel delayed angiogenesis, abnormal	http://purl.obolibrary.org/obo/GO_0001525	angiogenesis	http://purl.obolibrary.org/obo/ZFA_0001285	intersegmental vessel
http://purl.obolibrary.org/obo/ZP_0144340	intersegmental vessel delayed blood vessel lumenization, abnormal	http://purl.obolibrary.org/obo/GO_0072554	blood vessel lumenization	http://purl.obolibrary.org/obo/ZFA_0001285	intersegmental vessel
http://purl.obolibrary.org/obo/ZP_0015124	intersegmental vessel delayed sprouting angiogenesis, abnormal	http://purl.obolibrary.org/obo/GO_0002040	sprouting angiogenesis	http://purl.obolibrary.org/obo/ZFA_0001285	intersegmental vessel
http://purl.obolibrary.org/obo/ZP_0017751	intersegmental vessel delayed vasculature development, abnormal	http://purl.obolibrary.org/obo/GO_0001944	vasculature development	http://purl.obolibrary.org/obo/ZFA_0001285	intersegmental vessel
http://purl.obolibrary.org/obo/ZP_0139866	kidney delayed cell cycle G1/S phase transition, abnormal	http://purl.obolibrary.org/obo/GO_0044843	cell cycle G1/S phase transition	http://purl.obolibrary.org/obo/ZFA_0000529	kidney
http://purl.obolibrary.org/obo/ZP_0103749	lateral rectus delayed tissue regeneration, abnormal	http://purl.obolibrary.org/obo/GO_0042246	tissue regeneration	http://purl.obolibrary.org/obo/ZFA_0000383	lateral rectus
http://purl.obolibrary.org/obo/ZP_0148902	lens epithelium delayed cytokinesis, abnormal	http://purl.obolibrary.org/obo/GO_0000910	cytokinesis	http://purl.obolibrary.org/obo/ZFA_0001326	lens epithelium
http://purl.obolibrary.org/obo/ZP_0015580	macrophage delayed phagocytosis, abnormal	http://purl.obolibrary.org/obo/GO_0006909	phagocytosis	http://purl.obolibrary.org/obo/ZFA_0009141	macrophage
http://purl.obolibrary.org/obo/ZP_0015581	macrophage delayed phagocytosis, engulfment, abnormal	http://purl.obolibrary.org/obo/GO_0006911	phagocytosis, engulfment	http://purl.obolibrary.org/obo/ZFA_0009141	macrophage
http://purl.obolibrary.org/obo/ZP_0142540	mandibular arch skeleton delayed developmental process, abnormal	http://purl.obolibrary.org/obo/GO_0032502	developmental process	http://purl.obolibrary.org/obo/ZFA_0001227	mandibular arch skeleton
http://purl.obolibrary.org/obo/ZP_0106417	microglial cell delayed cell population proliferation, abnormal	http://purl.obolibrary.org/obo/GO_0008283	cell population proliferation	http://purl.obolibrary.org/obo/ZFA_0009077	microglial cell
http://purl.obolibrary.org/obo/ZP_0138615	migratory muscle precursor delayed cell migration, abnormal	http://purl.obolibrary.org/obo/GO_0016477	cell migration	http://purl.obolibrary.org/obo/ZFA_0005921	migratory muscle precursor
http://purl.obolibrary.org/obo/ZP_0142926	motor neuron delayed neuronal action potential, abnormal	http://purl.obolibrary.org/obo/GO_0019228	neuronal action potential	http://purl.obolibrary.org/obo/ZFA_0009052	motor neuron
http://purl.obolibrary.org/obo/ZP_0143439	notochord delayed bone mineralization, abnormal	http://purl.obolibrary.org/obo/GO_0030282	bone mineralization	http://purl.obolibrary.org/obo/ZFA_0000135	notochord
http://purl.obolibrary.org/obo/ZP_0142166	oocyte stage III delayed oocyte maturation, abnormal	http://purl.obolibrary.org/obo/GO_0001556	oocyte maturation	http://purl.obolibrary.org/obo/ZFA_0001566	oocyte stage III
http://purl.obolibrary.org/obo/ZP_0142152	oocyte stage IV delayed oocyte maturation, abnormal	http://purl.obolibrary.org/obo/GO_0001556	oocyte maturation	http://purl.obolibrary.org/obo/ZFA_0001568	oocyte stage IV
http://purl.obolibrary.org/obo/ZP_0146838	opercle delayed intramembranous ossification, abnormal	http://purl.obolibrary.org/obo/GO_0001957	intramembranous ossification	http://purl.obolibrary.org/obo/ZFA_0000250	opercle
http://purl.obolibrary.org/obo/ZP_0020288	optic furrow delayed basement membrane disassembly, abnormal	http://purl.obolibrary.org/obo/GO_0034769	basement membrane disassembly	http://purl.obolibrary.org/obo/ZFA_0005491	optic furrow
http://purl.obolibrary.org/obo/ZP_0014906	optic tectum delayed innervation, abnormal	http://purl.obolibrary.org/obo/GO_0060384	innervation	http://purl.obolibrary.org/obo/ZFA_0000445	optic tectum
http://purl.obolibrary.org/obo/ZP_0107162	optic vesicle delayed neurogenesis, abnormal	http://purl.obolibrary.org/obo/GO_0022008	neurogenesis	http://purl.obolibrary.org/obo/ZFA_0000050	optic vesicle
http://purl.obolibrary.org/obo/ZP_0012720	otic vesicle delayed otolith formation, abnormal	http://purl.obolibrary.org/obo/GO_0032475	otolith formation	http://purl.obolibrary.org/obo/ZFA_0000051	otic vesicle
http://purl.obolibrary.org/obo/ZP_0012721	otic vesicle delayed otolith tethering, abnormal	http://purl.obolibrary.org/obo/GO_0035889	otolith tethering	http://purl.obolibrary.org/obo/ZFA_0000051	otic vesicle
http://purl.obolibrary.org/obo/ZP_0019396	otolithic lymph vessel delayed lymph vessel development, abnormal	http://purl.obolibrary.org/obo/GO_0001945	lymph vessel development	http://purl.obolibrary.org/obo/ZFA_0005838	otolithic lymph vessel
http://purl.obolibrary.org/obo/ZP_0104057	ovary delayed oocyte maturation, abnormal	http://purl.obolibrary.org/obo/GO_0001556	oocyte maturation	http://purl.obolibrary.org/obo/ZFA_0000403	ovary
http://purl.obolibrary.org/obo/ZP_0147623	palatoquadrate cartilage delayed endochondral ossification, abnormal	http://purl.obolibrary.org/obo/GO_0001958	endochondral ossification	http://purl.obolibrary.org/obo/ZFA_0001399	palatoquadrate cartilage
http://purl.obolibrary.org/obo/ZP_0147662	parietal bone delayed ossification, abnormal	http://purl.obolibrary.org/obo/GO_0001503	ossification	http://purl.obolibrary.org/obo/ZFA_0000486	parietal bone
http://purl.obolibrary.org/obo/ZP_0144702	pectoral fin delayed cartilage development, abnormal	http://purl.obolibrary.org/obo/GO_0051216	cartilage development	http://purl.obolibrary.org/obo/ZFA_0001161	pectoral fin
http://purl.obolibrary.org/obo/ZP_0144697	pectoral girdle delayed bone mineralization, abnormal	http://purl.obolibrary.org/obo/GO_0030282	bone mineralization	http://purl.obolibrary.org/obo/ZFA_0000407	pectoral girdle
http://purl.obolibrary.org/obo/ZP_0020734	pharyngeal arch 3-7 delayed embryonic viscerocranium morphogenesis, abnormal	http://purl.obolibrary.org/obo/GO_0048703	embryonic viscerocranium morphogenesis	http://purl.obolibrary.org/obo/ZFA_0001613	pharyngeal arch 3-7
http://purl.obolibrary.org/obo/ZP_0140647	pharyngeal arch delayed axonogenesis involved in innervation, abnormal	http://purl.obolibrary.org/obo/GO_0060385	axonogenesis involved in innervation	http://purl.obolibrary.org/obo/ZFA_0001306	pharyngeal arch
http://purl.obolibrary.org/obo/ZP_0017947	posterior cardinal vein delayed blood coagulation, fibrin clot formation, abnormal	http://purl.obolibrary.org/obo/GO_0072378	blood coagulation, fibrin clot formation	http://purl.obolibrary.org/obo/ZFA_0000477	posterior cardinal vein
http://purl.obolibrary.org/obo/ZP_0104208	posterior lateral line delayed myelination in peripheral nervous system, abnormal	http://purl.obolibrary.org/obo/GO_0022011	myelination in peripheral nervous system	http://purl.obolibrary.org/obo/ZFA_0000944	posterior lateral line
http://purl.obolibrary.org/obo/ZP_0104209	posterior lateral line delayed myelination of posterior lateral line nerve axons, abnormal	http://purl.obolibrary.org/obo/GO_0048932	myelination of posterior lateral line nerve axons	http://purl.obolibrary.org/obo/ZFA_0000944	posterior lateral line
http://purl.obolibrary.org/obo/ZP_0015420	posterior lateral line nerve delayed axon regeneration, abnormal	http://purl.obolibrary.org/obo/GO_0031103	axon regeneration	http://purl.obolibrary.org/obo/ZFA_0000175	posterior lateral line nerve
http://purl.obolibrary.org/obo/ZP_0106543	posterior lateral line primordium delayed posterior lateral line neuromast deposition, abnormal	http://purl.obolibrary.org/obo/GO_0048922	posterior lateral line neuromast deposition	http://purl.obolibrary.org/obo/ZFA_0001157	posterior lateral line primordium
http://purl.obolibrary.org/obo/ZP_0104731	presumptive cardiac ventricle primitive heart tube delayed cardioblast migration to the midline involved in heart field formation, abnormal	http://purl.obolibrary.org/obo/GO_0060975	cardioblast migration to the midline involved in heart field formation	http://purl.obolibrary.org/obo/ZFA_0001720	presumptive cardiac ventricle primitive heart tube
http://purl.obolibrary.org/obo/ZP_0022598	primordial midbrain channel delayed sprouting angiogenesis, abnormal	http://purl.obolibrary.org/obo/GO_0002040	sprouting angiogenesis	http://purl.obolibrary.org/obo/ZFA_0005017	primordial midbrain channel
http://purl.obolibrary.org/obo/ZP_0149142	pronephros delayed regeneration, abnormal	http://purl.obolibrary.org/obo/GO_0031099	regeneration	http://purl.obolibrary.org/obo/ZFA_0000151	pronephros
http://purl.obolibrary.org/obo/ZP_0138610	regenerating tissue delayed cell population proliferation, abnormal	http://purl.obolibrary.org/obo/GO_0008283	cell population proliferation	http://purl.obolibrary.org/obo/ZFA_0005147	regenerating tissue
http://purl.obolibrary.org/obo/ZP_0022809	regenerating tissue delayed coronary vasculature development, abnormal	http://purl.obolibrary.org/obo/GO_0060976	coronary vasculature development	http://purl.obolibrary.org/obo/ZFA_0005147	regenerating tissue
http://purl.obolibrary.org/obo/ZP_0106054	regenerating tissue delayed hepatocyte differentiation, abnormal	http://purl.obolibrary.org/obo/GO_0070365	hepatocyte differentiation	http://purl.obolibrary.org/obo/ZFA_0005147	regenerating tissue
http://purl.obolibrary.org/obo/ZP_0142739	retina delayed cell differentiation, abnormal	http://purl.obolibrary.org/obo/GO_0030154	cell differentiation	http://purl.obolibrary.org/obo/ZFA_0000152	retina
http://purl.obolibrary.org/obo/ZP_0144365	retina delayed neurogenesis, abnormal	http://purl.obolibrary.org/obo/GO_0022008	neurogenesis	http://purl.obolibrary.org/obo/ZFA_0000152	retina
http://purl.obolibrary.org/obo/ZP_0001167	retina delayed neuron differentiation, abnormal	http://purl.obolibrary.org/obo/GO_0030182	neuron differentiation	http://purl.obolibrary.org/obo/ZFA_0000152	retina
