defined_class	defined_class_label	anatomical_entity	anatomical_entity_label	location	location_label
http://purl.obolibrary.org/obo/ZP_0008639	Golgi apparatus chondrocyte decreased size, abnormal	http://purl.obolibrary.org/obo/GO_0005794	Golgi apparatus	http://purl.obolibrary.org/obo/ZFA_0009084	chondrocyte
http://purl.obolibrary.org/obo/ZP_0005318	P granule blastomere decreased size, abnormal	http://purl.obolibrary.org/obo/GO_0043186	P granule	http://purl.obolibrary.org/obo/ZFA_0000093	blastomere
http://purl.obolibrary.org/obo/ZP_0008038	Z disc cardiac muscle cell decreased size, abnormal	http://purl.obolibrary.org/obo/GO_0030018	Z disc	http://purl.obolibrary.org/obo/ZFA_0009316	cardiac muscle cell
http://purl.obolibrary.org/obo/ZP_0145619	actin-based cell projection fast muscle myoblast decreased size, abnormal	http://purl.obolibrary.org/obo/GO_0098858	actin-based cell projection	http://purl.obolibrary.org/obo/ZFA_0009369	fast muscle myoblast
http://purl.obolibrary.org/obo/ZP_0102471	actin-based cell projection peridermal cell decreased size, abnormal	http://purl.obolibrary.org/obo/GO_0098858	actin-based cell projection	http://purl.obolibrary.org/obo/ZFA_0009041	peridermal cell
http://purl.obolibrary.org/obo/ZP_0021327	actinotrichium regenerating fin decreased size, abnormal	http://purl.obolibrary.org/obo/ZFA_0005435	actinotrichium	http://purl.obolibrary.org/obo/ZFA_0001269	regenerating fin
http://purl.obolibrary.org/obo/ZP_0137764	adaxial-abaxial axis whole organism decreased size, abnormal	http://purl.obolibrary.org/obo/BSPO_0000195	adaxial-abaxial axis	http://purl.obolibrary.org/obo/ZFA_0001094	whole organism
http://purl.obolibrary.org/obo/ZP_0018358	anatomical axis whole organism decreased size, abnormal	http://purl.obolibrary.org/obo/BSPO_0000010	anatomical axis	http://purl.obolibrary.org/obo/ZFA_0001094	whole organism
http://purl.obolibrary.org/obo/ZP_0012178	anatomical region hemal arch decreased size, abnormal	http://purl.obolibrary.org/obo/BSPO_0000070	anatomical region	http://purl.obolibrary.org/obo/ZFA_0000519	hemal arch
http://purl.obolibrary.org/obo/ZP_0011417	anatomical region motor nucleus of vagal nerve decreased size, abnormal	http://purl.obolibrary.org/obo/BSPO_0000070	anatomical region	http://purl.obolibrary.org/obo/ZFA_0000387	motor nucleus of vagal nerve
http://purl.obolibrary.org/obo/ZP_0017448	anatomical region statoacoustic (VIII) ganglion decreased size, abnormal	http://purl.obolibrary.org/obo/BSPO_0000070	anatomical region	http://purl.obolibrary.org/obo/ZFA_0000588	statoacoustic (VIII) ganglion
http://purl.obolibrary.org/obo/ZP_0010313	anterior region brain decreased size, abnormal	http://purl.obolibrary.org/obo/BSPO_0000071	anterior region	http://purl.obolibrary.org/obo/ZFA_0000008	brain
http://purl.obolibrary.org/obo/ZP_0002077	anterior region hindbrain decreased size, abnormal	http://purl.obolibrary.org/obo/BSPO_0000071	anterior region	http://purl.obolibrary.org/obo/ZFA_0000029	hindbrain
http://purl.obolibrary.org/obo/ZP_0004402	anterior region neurocranium decreased size, abnormal	http://purl.obolibrary.org/obo/BSPO_0000071	anterior region	http://purl.obolibrary.org/obo/ZFA_0001580	neurocranium
http://purl.obolibrary.org/obo/ZP_0005535	anterior region neuroectoderm decreased size, abnormal	http://purl.obolibrary.org/obo/BSPO_0000071	anterior region	http://purl.obolibrary.org/obo/ZFA_0001120	neuroectoderm
http://purl.obolibrary.org/obo/ZP_0107236	anterior region palatoquadrate cartilage decreased size, abnormal	http://purl.obolibrary.org/obo/BSPO_0000071	anterior region	http://purl.obolibrary.org/obo/ZFA_0001399	palatoquadrate cartilage
http://purl.obolibrary.org/obo/ZP_0107177	anterior region spinal cord decreased size, abnormal	http://purl.obolibrary.org/obo/BSPO_0000071	anterior region	http://purl.obolibrary.org/obo/ZFA_0000075	spinal cord
http://purl.obolibrary.org/obo/ZP_0102042	anterior region whole organism decreased size, abnormal	http://purl.obolibrary.org/obo/BSPO_0000071	anterior region	http://purl.obolibrary.org/obo/ZFA_0001094	whole organism
http://purl.obolibrary.org/obo/ZP_0106078	anterior-most region cranium decreased size, abnormal	http://purl.obolibrary.org/obo/BSPO_0000036	anterior-most region	http://purl.obolibrary.org/obo/ZFA_0000737	cranium
http://purl.obolibrary.org/obo/ZP_0008427	anterior-most region head decreased size, abnormal	http://purl.obolibrary.org/obo/BSPO_0000036	anterior-most region	http://purl.obolibrary.org/obo/ZFA_0001114	head
http://purl.obolibrary.org/obo/ZP_0002762	anterior-posterior axis brain decreased size, abnormal	http://purl.obolibrary.org/obo/BSPO_0000013	anterior-posterior axis	http://purl.obolibrary.org/obo/ZFA_0000008	brain
http://purl.obolibrary.org/obo/ZP_0016361	anterior-posterior axis eye decreased size, abnormal	http://purl.obolibrary.org/obo/BSPO_0000013	anterior-posterior axis	http://purl.obolibrary.org/obo/ZFA_0000107	eye
http://purl.obolibrary.org/obo/ZP_0102088	anterior-posterior axis whole organism decreased size, abnormal	http://purl.obolibrary.org/obo/BSPO_0000013	anterior-posterior axis	http://purl.obolibrary.org/obo/ZFA_0001094	whole organism
http://purl.obolibrary.org/obo/ZP_0017935	antero-dorsal region forebrain decreased size, abnormal	http://purl.obolibrary.org/obo/BSPO_0000026	antero-dorsal region	http://purl.obolibrary.org/obo/ZFA_0000109	forebrain
http://purl.obolibrary.org/obo/ZP_0000352	antero-lateral region prechordal plate decreased size, abnormal	http://purl.obolibrary.org/obo/BSPO_0000029	antero-lateral region	http://purl.obolibrary.org/obo/ZFA_0000060	prechordal plate
http://purl.obolibrary.org/obo/ZP_0143665	apical part of cell EVL decreased size, abnormal	http://purl.obolibrary.org/obo/GO_0045177	apical part of cell	http://purl.obolibrary.org/obo/ZFA_0000086	EVL
http://purl.obolibrary.org/obo/ZP_0146704	apical recycling endosome pronephric proximal convoluted tubule decreased size, abnormal	http://purl.obolibrary.org/obo/GO_0090653	apical recycling endosome	http://purl.obolibrary.org/obo/ZFA_0001620	pronephric proximal convoluted tubule
http://purl.obolibrary.org/obo/ZP_0017194	aster yolk syncytial layer decreased size, abnormal	http://purl.obolibrary.org/obo/GO_0005818	aster	http://purl.obolibrary.org/obo/ZFA_0000088	yolk syncytial layer
http://purl.obolibrary.org/obo/ZP_0003227	axon forebrain decreased size, abnormal	http://purl.obolibrary.org/obo/GO_0030424	axon	http://purl.obolibrary.org/obo/ZFA_0000109	forebrain
http://purl.obolibrary.org/obo/ZP_0001685	axon motor neuron decreased size, abnormal	http://purl.obolibrary.org/obo/GO_0030424	axon	http://purl.obolibrary.org/obo/ZFA_0009052	motor neuron
http://purl.obolibrary.org/obo/ZP_0012287	axon posterior lateral line nerve decreased size, abnormal	http://purl.obolibrary.org/obo/GO_0030424	axon	http://purl.obolibrary.org/obo/ZFA_0000175	posterior lateral line nerve
http://purl.obolibrary.org/obo/ZP_0003953	axon secondary motor neuron decreased size, abnormal	http://purl.obolibrary.org/obo/GO_0030424	axon	http://purl.obolibrary.org/obo/ZFA_0009247	secondary motor neuron
http://purl.obolibrary.org/obo/ZP_0015261	axon trigeminal ganglion decreased size, abnormal	http://purl.obolibrary.org/obo/GO_0030424	axon	http://purl.obolibrary.org/obo/ZFA_0000295	trigeminal ganglion
http://purl.obolibrary.org/obo/ZP_0006630	axonemal microtubule pronephric duct decreased size, abnormal	http://purl.obolibrary.org/obo/GO_0005879	axonemal microtubule	http://purl.obolibrary.org/obo/ZFA_0000150	pronephric duct
http://purl.obolibrary.org/obo/ZP_0014264	blastema caudal fin decreased size, abnormal	http://purl.obolibrary.org/obo/ZFA_0001270	blastema	http://purl.obolibrary.org/obo/ZFA_0001058	caudal fin
http://purl.obolibrary.org/obo/ZP_0008716	blood vessel inner optic circle decreased size, abnormal	http://purl.obolibrary.org/obo/ZFA_0005314	blood vessel	http://purl.obolibrary.org/obo/ZFA_0005054	inner optic circle
http://purl.obolibrary.org/obo/ZP_0104230	blood vessel superior ocular sulcus decreased size, abnormal	http://purl.obolibrary.org/obo/ZFA_0005314	blood vessel	http://purl.obolibrary.org/obo/ZFA_0005901	superior ocular sulcus
http://purl.obolibrary.org/obo/ZP_0010992	breeding tubercle jaw flap decreased size, abnormal	http://purl.obolibrary.org/obo/ZFA_0005791	breeding tubercle	http://purl.obolibrary.org/obo/ZFA_0005792	jaw flap
http://purl.obolibrary.org/obo/ZP_0017459	brush border gut epithelium decreased size, abnormal	http://purl.obolibrary.org/obo/GO_0005903	brush border	http://purl.obolibrary.org/obo/ZFA_0005123	gut epithelium
http://purl.obolibrary.org/obo/ZP_0005555	brush border pronephric duct decreased size, abnormal	http://purl.obolibrary.org/obo/GO_0005903	brush border	http://purl.obolibrary.org/obo/ZFA_0000150	pronephric duct
http://purl.obolibrary.org/obo/ZP_0003472	cardiac muscle cell cardiac ventricle decreased size, abnormal	http://purl.obolibrary.org/obo/ZFA_0009316	cardiac muscle cell	http://purl.obolibrary.org/obo/ZFA_0000009	cardiac ventricle
http://purl.obolibrary.org/obo/ZP_0007044	cardiac muscle cell ventricular myocardium decreased size, abnormal	http://purl.obolibrary.org/obo/ZFA_0009316	cardiac muscle cell	http://purl.obolibrary.org/obo/ZFA_0005061	ventricular myocardium
http://purl.obolibrary.org/obo/ZP_0003940	cartilage element neurocranium decreased size, abnormal	http://purl.obolibrary.org/obo/ZFA_0001501	cartilage element	http://purl.obolibrary.org/obo/ZFA_0001580	neurocranium
http://purl.obolibrary.org/obo/ZP_0146543	cartilage element palatoquadrate arch decreased size, abnormal	http://purl.obolibrary.org/obo/ZFA_0001501	cartilage element	http://purl.obolibrary.org/obo/ZFA_0001272	palatoquadrate arch
http://purl.obolibrary.org/obo/ZP_0146544	cartilage element ventral mandibular arch decreased size, abnormal	http://purl.obolibrary.org/obo/ZFA_0001501	cartilage element	http://purl.obolibrary.org/obo/ZFA_0001273	ventral mandibular arch
http://purl.obolibrary.org/obo/ZP_0014085	caudal fin vasculature regenerating fin decreased size, abnormal	http://purl.obolibrary.org/obo/ZFA_0005097	caudal fin vasculature	http://purl.obolibrary.org/obo/ZFA_0001269	regenerating fin
http://purl.obolibrary.org/obo/ZP_0143666	cell EVL decreased size, abnormal	http://purl.obolibrary.org/obo/ZFA_0009000	cell	http://purl.obolibrary.org/obo/ZFA_0000086	EVL
http://purl.obolibrary.org/obo/ZP_0019705	cell body photoreceptor cell decreased size, abnormal	http://purl.obolibrary.org/obo/GO_0044297	cell body	http://purl.obolibrary.org/obo/ZFA_0009127	photoreceptor cell
http://purl.obolibrary.org/obo/ZP_0021024	cell epicardium decreased size, abnormal	http://purl.obolibrary.org/obo/ZFA_0009000	cell	http://purl.obolibrary.org/obo/ZFA_0005057	epicardium
http://purl.obolibrary.org/obo/ZP_0149240	cell epidermal basal stratum decreased size, abnormal	http://purl.obolibrary.org/obo/ZFA_0009000	cell	http://purl.obolibrary.org/obo/ZFA_0001180	epidermal basal stratum
http://purl.obolibrary.org/obo/ZP_0137749	cell gonad decreased size, abnormal	http://purl.obolibrary.org/obo/ZFA_0009000	cell	http://purl.obolibrary.org/obo/ZFA_0000413	gonad
http://purl.obolibrary.org/obo/ZP_0003598	cell notochord decreased size, abnormal	http://purl.obolibrary.org/obo/ZFA_0009000	cell	http://purl.obolibrary.org/obo/ZFA_0000135	notochord
http://purl.obolibrary.org/obo/ZP_0007898	cell pectoral fin decreased size, abnormal	http://purl.obolibrary.org/obo/ZFA_0009000	cell	http://purl.obolibrary.org/obo/ZFA_0001161	pectoral fin
http://purl.obolibrary.org/obo/ZP_0137858	cell projection cerebrospinal fluid contacting neuron decreased size, abnormal	http://purl.obolibrary.org/obo/GO_0042995	cell projection	http://purl.obolibrary.org/obo/ZFA_0007120	cerebrospinal fluid contacting neuron
http://purl.obolibrary.org/obo/ZP_0103418	cell retina decreased size, abnormal	http://purl.obolibrary.org/obo/ZFA_0009000	cell	http://purl.obolibrary.org/obo/ZFA_0000152	retina
http://purl.obolibrary.org/obo/ZP_0006857	cell-cell junction atrial endocardium decreased size, abnormal	http://purl.obolibrary.org/obo/GO_0005911	cell-cell junction	http://purl.obolibrary.org/obo/ZFA_0001614	atrial endocardium
http://purl.obolibrary.org/obo/ZP_0002177	chondrocyte Meckel's cartilage decreased size, abnormal	http://purl.obolibrary.org/obo/ZFA_0009084	chondrocyte	http://purl.obolibrary.org/obo/ZFA_0001205	Meckel's cartilage
http://purl.obolibrary.org/obo/ZP_0004482	chondrocyte ceratobranchial cartilage decreased size, abnormal	http://purl.obolibrary.org/obo/ZFA_0009084	chondrocyte	http://purl.obolibrary.org/obo/ZFA_0001516	ceratobranchial cartilage
http://purl.obolibrary.org/obo/ZP_0000667	chondrocyte ceratohyal cartilage decreased size, abnormal	http://purl.obolibrary.org/obo/ZFA_0009084	chondrocyte	http://purl.obolibrary.org/obo/ZFA_0001400	ceratohyal cartilage
http://purl.obolibrary.org/obo/ZP_0102657	chondrocyte palate decreased size, abnormal	http://purl.obolibrary.org/obo/ZFA_0009084	chondrocyte	http://purl.obolibrary.org/obo/ZFA_0005509	palate
http://purl.obolibrary.org/obo/ZP_0146925	chondrocyte palatoquadrate cartilage decreased size, abnormal	http://purl.obolibrary.org/obo/ZFA_0009084	chondrocyte	http://purl.obolibrary.org/obo/ZFA_0001399	palatoquadrate cartilage
http://purl.obolibrary.org/obo/ZP_0010017	chondrocyte pharyngeal arch cartilage decreased size, abnormal	http://purl.obolibrary.org/obo/ZFA_0009084	chondrocyte	http://purl.obolibrary.org/obo/ZFA_0001460	pharyngeal arch cartilage
http://purl.obolibrary.org/obo/ZP_0142161	chorion unfertilized egg decreased size, abnormal	http://purl.obolibrary.org/obo/ZFA_0000329	chorion	http://purl.obolibrary.org/obo/ZFA_0001570	unfertilized egg
http://purl.obolibrary.org/obo/ZP_0104740	cilium Kupffer's vesicle decreased size, abnormal	http://purl.obolibrary.org/obo/GO_0005929	cilium	http://purl.obolibrary.org/obo/ZFA_0000001	Kupffer's vesicle
http://purl.obolibrary.org/obo/ZP_0140786	cilium olfactory placode decreased size, abnormal	http://purl.obolibrary.org/obo/GO_0005929	cilium	http://purl.obolibrary.org/obo/ZFA_0000048	olfactory placode
http://purl.obolibrary.org/obo/ZP_0140499	cone photoreceptor outer segment UV sensitive photoreceptor cell decreased size, abnormal	http://purl.obolibrary.org/obo/GO_0120199	cone photoreceptor outer segment	http://purl.obolibrary.org/obo/ZFA_0009221	UV sensitive photoreceptor cell
http://purl.obolibrary.org/obo/ZP_0141981	cone photoreceptor outer segment blue sensitive photoreceptor cell decreased size, abnormal	http://purl.obolibrary.org/obo/GO_0120199	cone photoreceptor outer segment	http://purl.obolibrary.org/obo/ZFA_0009222	blue sensitive photoreceptor cell
http://purl.obolibrary.org/obo/ZP_0139978	cone photoreceptor outer segment retinal cone cell decreased size, abnormal	http://purl.obolibrary.org/obo/GO_0120199	cone photoreceptor outer segment	http://purl.obolibrary.org/obo/ZFA_0009262	retinal cone cell
http://purl.obolibrary.org/obo/ZP_0008034	contractile muscle fiber skeletal muscle decreased size, abnormal	http://purl.obolibrary.org/obo/GO_0043292	contractile muscle fiber	http://purl.obolibrary.org/obo/ZFA_0005277	skeletal muscle
http://purl.obolibrary.org/obo/ZP_0106901	cortical granule oocyte stage II decreased size, abnormal	http://purl.obolibrary.org/obo/GO_0060473	cortical granule	http://purl.obolibrary.org/obo/ZFA_0001565	oocyte stage II
http://purl.obolibrary.org/obo/ZP_0008208	cranial cartilage neurocranium decreased size, abnormal	http://purl.obolibrary.org/obo/ZFA_0001458	cranial cartilage	http://purl.obolibrary.org/obo/ZFA_0001580	neurocranium
http://purl.obolibrary.org/obo/ZP_0008207	cranial cartilage pharyngeal arch decreased size, abnormal	http://purl.obolibrary.org/obo/ZFA_0001458	cranial cartilage	http://purl.obolibrary.org/obo/ZFA_0001306	pharyngeal arch
http://purl.obolibrary.org/obo/ZP_0149532	cytoplasm nucleate erythrocyte decreased size, abnormal	http://purl.obolibrary.org/obo/GO_0005737	cytoplasm	http://purl.obolibrary.org/obo/ZFA_0009256	nucleate erythrocyte
http://purl.obolibrary.org/obo/ZP_0014347	cytoskeleton of presynaptic active zone neuromast hair cell decreased size, abnormal	http://purl.obolibrary.org/obo/GO_0048788	cytoskeleton of presynaptic active zone	http://purl.obolibrary.org/obo/ZFA_0009367	neuromast hair cell
http://purl.obolibrary.org/obo/ZP_0021139	cytoskeleton of presynaptic active zone retinal cone cell decreased size, abnormal	http://purl.obolibrary.org/obo/GO_0048788	cytoskeleton of presynaptic active zone	http://purl.obolibrary.org/obo/ZFA_0009262	retinal cone cell
http://purl.obolibrary.org/obo/ZP_0103376	distal region Meckel's cartilage decreased size, abnormal	http://purl.obolibrary.org/obo/BSPO_0000078	distal region	http://purl.obolibrary.org/obo/ZFA_0001205	Meckel's cartilage
http://purl.obolibrary.org/obo/ZP_0144265	dorsal side diencephalon decreased size, abnormal	http://purl.obolibrary.org/obo/BSPO_0000063	dorsal side	http://purl.obolibrary.org/obo/ZFA_0000101	diencephalon
http://purl.obolibrary.org/obo/ZP_0009089	dorsal-ventral axis brain decreased size, abnormal	http://purl.obolibrary.org/obo/BSPO_0000016	dorsal-ventral axis	http://purl.obolibrary.org/obo/ZFA_0000008	brain
http://purl.obolibrary.org/obo/ZP_0016362	dorsal-ventral axis eye decreased size, abnormal	http://purl.obolibrary.org/obo/BSPO_0000016	dorsal-ventral axis	http://purl.obolibrary.org/obo/ZFA_0000107	eye
http://purl.obolibrary.org/obo/ZP_0104145	dorsal-ventral axis whole organism decreased size, abnormal	http://purl.obolibrary.org/obo/BSPO_0000016	dorsal-ventral axis	http://purl.obolibrary.org/obo/ZFA_0001094	whole organism
http://purl.obolibrary.org/obo/ZP_0149505	epithelial cell oral epithelium decreased size, abnormal	http://purl.obolibrary.org/obo/ZFA_0009034	epithelial cell	http://purl.obolibrary.org/obo/ZFA_0000816	oral epithelium
http://purl.obolibrary.org/obo/ZP_0005126	epithelium swim bladder decreased size, abnormal	http://purl.obolibrary.org/obo/ZFA_0001486	epithelium	http://purl.obolibrary.org/obo/ZFA_0000076	swim bladder
http://purl.obolibrary.org/obo/ZP_0011493	extracellular matrix cell decreased size, abnormal	http://purl.obolibrary.org/obo/GO_0031012	extracellular matrix	http://purl.obolibrary.org/obo/ZFA_0009000	cell
http://purl.obolibrary.org/obo/ZP_0002374	extracellular matrix cranial cartilage decreased size, abnormal	http://purl.obolibrary.org/obo/GO_0031012	extracellular matrix	http://purl.obolibrary.org/obo/ZFA_0001458	cranial cartilage
http://purl.obolibrary.org/obo/ZP_0014856	fast muscle cell somite decreased size, abnormal	http://purl.obolibrary.org/obo/ZFA_0009117	fast muscle cell	http://purl.obolibrary.org/obo/ZFA_0000155	somite
http://purl.obolibrary.org/obo/ZP_0014009	filopodium intersegmental vessel decreased size, abnormal	http://purl.obolibrary.org/obo/GO_0030175	filopodium	http://purl.obolibrary.org/obo/ZFA_0001285	intersegmental vessel
http://purl.obolibrary.org/obo/ZP_0001584	gap junction horizontal cell decreased size, abnormal	http://purl.obolibrary.org/obo/GO_0005921	gap junction	http://purl.obolibrary.org/obo/ZFA_0009315	horizontal cell
http://purl.obolibrary.org/obo/ZP_0106612	germ plasm blastomere decreased size, abnormal	http://purl.obolibrary.org/obo/GO_0060293	germ plasm	http://purl.obolibrary.org/obo/ZFA_0000093	blastomere
http://purl.obolibrary.org/obo/ZP_0131221	glial cell projection microglial cell decreased size, abnormal	http://purl.obolibrary.org/obo/GO_0097386	glial cell projection	http://purl.obolibrary.org/obo/ZFA_0009077	microglial cell
http://purl.obolibrary.org/obo/ZP_0131222	glial filament radial glial cell decreased size, abnormal	http://purl.obolibrary.org/obo/GO_0097426	glial filament	http://purl.obolibrary.org/obo/ZFA_0009292	radial glial cell
http://purl.obolibrary.org/obo/ZP_0142441	hyaloid vessel lens decreased size, abnormal	http://purl.obolibrary.org/obo/ZFA_0005046	hyaloid vessel	http://purl.obolibrary.org/obo/ZFA_0000035	lens
http://purl.obolibrary.org/obo/ZP_0137656	kidney epithelial cell pronephric distal early tubule decreased size, abnormal	http://purl.obolibrary.org/obo/ZFA_0009374	kidney epithelial cell	http://purl.obolibrary.org/obo/ZFA_0001622	pronephric distal early tubule
http://purl.obolibrary.org/obo/ZP_0021483	late endosome neural crest cell decreased size, abnormal	http://purl.obolibrary.org/obo/GO_0005770	late endosome	http://purl.obolibrary.org/obo/ZFA_0009165	neural crest cell
http://purl.obolibrary.org/obo/ZP_0008355	lepidotrichium anal fin decreased size, abnormal	http://purl.obolibrary.org/obo/ZFA_0001554	lepidotrichium	http://purl.obolibrary.org/obo/ZFA_0001162	anal fin
http://purl.obolibrary.org/obo/ZP_0008352	lepidotrichium caudal fin decreased size, abnormal	http://purl.obolibrary.org/obo/ZFA_0001554	lepidotrichium	http://purl.obolibrary.org/obo/ZFA_0001058	caudal fin
http://purl.obolibrary.org/obo/ZP_0008356	lepidotrichium dorsal fin decreased size, abnormal	http://purl.obolibrary.org/obo/ZFA_0001554	lepidotrichium	http://purl.obolibrary.org/obo/ZFA_0001173	dorsal fin
http://purl.obolibrary.org/obo/ZP_0014519	lipid droplet fat cell decreased size, abnormal	http://purl.obolibrary.org/obo/GO_0005811	lipid droplet	http://purl.obolibrary.org/obo/ZFA_0009082	fat cell
http://purl.obolibrary.org/obo/ZP_0020778	lipid droplet pleuroperitoneal cavity decreased size, abnormal	http://purl.obolibrary.org/obo/GO_0005811	lipid droplet	http://purl.obolibrary.org/obo/ZFA_0001656	pleuroperitoneal cavity
http://purl.obolibrary.org/obo/ZP_0142295	lipid droplet whole organism decreased size, abnormal	http://purl.obolibrary.org/obo/GO_0005811	lipid droplet	http://purl.obolibrary.org/obo/ZFA_0001094	whole organism
http://purl.obolibrary.org/obo/ZP_0010175	medial region brain decreased size, abnormal	http://purl.obolibrary.org/obo/BSPO_0000083	medial region	http://purl.obolibrary.org/obo/ZFA_0000008	brain
http://purl.obolibrary.org/obo/ZP_0016363	medial-lateral axis eye decreased size, abnormal	http://purl.obolibrary.org/obo/BSPO_0001001	medial-lateral axis	http://purl.obolibrary.org/obo/ZFA_0000107	eye
http://purl.obolibrary.org/obo/ZP_0006708	melanocyte dermis decreased size, abnormal	http://purl.obolibrary.org/obo/ZFA_0009091	melanocyte	http://purl.obolibrary.org/obo/ZFA_0001119	dermis
http://purl.obolibrary.org/obo/ZP_0006706	melanocyte retinal pigmented epithelium decreased size, abnormal	http://purl.obolibrary.org/obo/ZFA_0009091	melanocyte	http://purl.obolibrary.org/obo/ZFA_0000144	retinal pigmented epithelium
http://purl.obolibrary.org/obo/ZP_0009968	melanocyte trunk decreased size, abnormal	http://purl.obolibrary.org/obo/ZFA_0009091	melanocyte	http://purl.obolibrary.org/obo/ZFA_0001115	trunk
http://purl.obolibrary.org/obo/ZP_0009434	melanosome integument decreased size, abnormal	http://purl.obolibrary.org/obo/GO_0042470	melanosome	http://purl.obolibrary.org/obo/ZFA_0000368	integument
http://purl.obolibrary.org/obo/ZP_0017844	melanosome melanocyte decreased size, abnormal	http://purl.obolibrary.org/obo/GO_0042470	melanosome	http://purl.obolibrary.org/obo/ZFA_0009091	melanocyte
http://purl.obolibrary.org/obo/ZP_0002445	melanosome retinal pigmented epithelium decreased size, abnormal	http://purl.obolibrary.org/obo/GO_0042470	melanosome	http://purl.obolibrary.org/obo/ZFA_0000144	retinal pigmented epithelium
http://purl.obolibrary.org/obo/ZP_0007952	mesenchyme gut decreased size, abnormal	http://purl.obolibrary.org/obo/ZFA_0000393	mesenchyme	http://purl.obolibrary.org/obo/ZFA_0000112	gut
http://purl.obolibrary.org/obo/ZP_0007948	mesenchyme swim bladder decreased size, abnormal	http://purl.obolibrary.org/obo/ZFA_0000393	mesenchyme	http://purl.obolibrary.org/obo/ZFA_0000076	swim bladder
http://purl.obolibrary.org/obo/ZP_0009785	mesoderm post-vent region decreased size, abnormal	http://purl.obolibrary.org/obo/ZFA_0000041	mesoderm	http://purl.obolibrary.org/obo/ZFA_0001117	post-vent region
http://purl.obolibrary.org/obo/ZP_0009784	mesoderm trunk decreased size, abnormal	http://purl.obolibrary.org/obo/ZFA_0000041	mesoderm	http://purl.obolibrary.org/obo/ZFA_0001115	trunk
http://purl.obolibrary.org/obo/ZP_0003511	microvillus intestinal epithelium decreased size, abnormal	http://purl.obolibrary.org/obo/GO_0005902	microvillus	http://purl.obolibrary.org/obo/ZFA_0005124	intestinal epithelium
http://purl.obolibrary.org/obo/ZP_0106609	mitochondrial cloud oocyte decreased size, abnormal	http://purl.obolibrary.org/obo/GO_0032019	mitochondrial cloud	http://purl.obolibrary.org/obo/ZFA_0001109	oocyte
http://purl.obolibrary.org/obo/ZP_0146852	mitochondrial crista cardiac muscle cell decreased size, abnormal	http://purl.obolibrary.org/obo/GO_0030061	mitochondrial crista	http://purl.obolibrary.org/obo/ZFA_0009316	cardiac muscle cell
http://purl.obolibrary.org/obo/ZP_0145442	mitochondrial membrane eye photoreceptor cell decreased size, abnormal	http://purl.obolibrary.org/obo/GO_0031966	mitochondrial membrane	http://purl.obolibrary.org/obo/ZFA_0009154	eye photoreceptor cell
http://purl.obolibrary.org/obo/ZP_0143452	mitochondrion cardiac muscle cell decreased size, abnormal	http://purl.obolibrary.org/obo/GO_0005739	mitochondrion	http://purl.obolibrary.org/obo/ZFA_0009316	cardiac muscle cell
http://purl.obolibrary.org/obo/ZP_0145467	mitochondrion cardiac ventricle decreased size, abnormal	http://purl.obolibrary.org/obo/GO_0005739	mitochondrion	http://purl.obolibrary.org/obo/ZFA_0000009	cardiac ventricle
http://purl.obolibrary.org/obo/ZP_0006730	mitochondrion liver decreased size, abnormal	http://purl.obolibrary.org/obo/GO_0005739	mitochondrion	http://purl.obolibrary.org/obo/ZFA_0000123	liver
http://purl.obolibrary.org/obo/ZP_0147206	mitochondrion retina decreased size, abnormal	http://purl.obolibrary.org/obo/GO_0005739	mitochondrion	http://purl.obolibrary.org/obo/ZFA_0000152	retina
