defined_class	defined_class_label	anatomical_entity	anatomical_entity_label
http://purl.obolibrary.org/obo/ZP_0016027	Leydig cell apoptotic, abnormal	http://purl.obolibrary.org/obo/ZFA_0009108	Leydig cell
http://purl.obolibrary.org/obo/ZP_0017663	Muller cell apoptotic, abnormal	http://purl.obolibrary.org/obo/ZFA_0009280	Muller cell
http://purl.obolibrary.org/obo/ZP_0016025	Sertoli cell apoptotic, abnormal	http://purl.obolibrary.org/obo/ZFA_0009133	Sertoli cell
http://purl.obolibrary.org/obo/ZP_0020804	anatomical structure apoptotic, abnormal	http://purl.obolibrary.org/obo/ZFA_0000037	anatomical structure
http://purl.obolibrary.org/obo/ZP_0006037	angioblastic mesenchymal cell apoptotic, abnormal	http://purl.obolibrary.org/obo/ZFA_0009258	angioblastic mesenchymal cell
http://purl.obolibrary.org/obo/ZP_0005288	axial vasculature apoptotic, abnormal	http://purl.obolibrary.org/obo/ZFA_0001073	axial vasculature
http://purl.obolibrary.org/obo/ZP_0009066	blood cell apoptotic, abnormal	http://purl.obolibrary.org/obo/ZFA_0009044	blood cell
http://purl.obolibrary.org/obo/ZP_0004974	blood vessel endothelial cell apoptotic, abnormal	http://purl.obolibrary.org/obo/ZFA_0009036	blood vessel endothelial cell
http://purl.obolibrary.org/obo/ZP_0001125	brain apoptotic, abnormal	http://purl.obolibrary.org/obo/ZFA_0000008	brain
http://purl.obolibrary.org/obo/ZP_0005292	caudal vein plexus apoptotic, abnormal	http://purl.obolibrary.org/obo/ZFA_0001286	caudal vein plexus
http://purl.obolibrary.org/obo/ZP_0004108	central nervous system apoptotic, abnormal	http://purl.obolibrary.org/obo/ZFA_0000012	central nervous system
http://purl.obolibrary.org/obo/ZP_0007231	ceratobranchial 5 bone apoptotic, abnormal	http://purl.obolibrary.org/obo/ZFA_0001239	ceratobranchial 5 bone
http://purl.obolibrary.org/obo/ZP_0001133	cerebellum apoptotic, abnormal	http://purl.obolibrary.org/obo/ZFA_0000100	cerebellum
http://purl.obolibrary.org/obo/ZP_0146727	cholangiocyte apoptotic, abnormal	http://purl.obolibrary.org/obo/ZFA_0009397	cholangiocyte
http://purl.obolibrary.org/obo/ZP_0019361	chondrocyte apoptotic, abnormal	http://purl.obolibrary.org/obo/ZFA_0009084	chondrocyte
http://purl.obolibrary.org/obo/ZP_0006943	ciliary marginal zone apoptotic, abnormal	http://purl.obolibrary.org/obo/ZFA_0001289	ciliary marginal zone
http://purl.obolibrary.org/obo/ZP_0007488	cranial cartilage apoptotic, abnormal	http://purl.obolibrary.org/obo/ZFA_0001458	cranial cartilage
http://purl.obolibrary.org/obo/ZP_0009667	cranial neural crest apoptotic, abnormal	http://purl.obolibrary.org/obo/ZFA_0001194	cranial neural crest
http://purl.obolibrary.org/obo/ZP_0003483	cranial neural crest cell apoptotic, abnormal	http://purl.obolibrary.org/obo/ZFA_0009003	cranial neural crest cell
http://purl.obolibrary.org/obo/ZP_0004002	diencephalon apoptotic, abnormal	http://purl.obolibrary.org/obo/ZFA_0000101	diencephalon
http://purl.obolibrary.org/obo/ZP_0103834	endodermal cell apoptotic, abnormal	http://purl.obolibrary.org/obo/ZFA_0009139	endodermal cell
http://purl.obolibrary.org/obo/ZP_0005282	endothelial cell apoptotic, abnormal	http://purl.obolibrary.org/obo/ZFA_0009065	endothelial cell
http://purl.obolibrary.org/obo/ZP_0008692	epiphysis apoptotic, abnormal	http://purl.obolibrary.org/obo/ZFA_0000019	epiphysis
http://purl.obolibrary.org/obo/ZP_0102816	erythroid progenitor cell apoptotic, abnormal	http://purl.obolibrary.org/obo/ZFA_0009015	erythroid progenitor cell
http://purl.obolibrary.org/obo/ZP_0001349	eye apoptotic, abnormal	http://purl.obolibrary.org/obo/ZFA_0000107	eye
http://purl.obolibrary.org/obo/ZP_0015176	floor plate apoptotic, abnormal	http://purl.obolibrary.org/obo/ZFA_0000022	floor plate
http://purl.obolibrary.org/obo/ZP_0001350	forebrain apoptotic, abnormal	http://purl.obolibrary.org/obo/ZFA_0000109	forebrain
http://purl.obolibrary.org/obo/ZP_0005258	germ line cell apoptotic, abnormal	http://purl.obolibrary.org/obo/ZFA_0009016	germ line cell
http://purl.obolibrary.org/obo/ZP_0005254	gonad apoptotic, abnormal	http://purl.obolibrary.org/obo/ZFA_0000413	gonad
http://purl.obolibrary.org/obo/ZP_0001009	hair cell apoptotic, abnormal	http://purl.obolibrary.org/obo/ZFA_0009366	hair cell
http://purl.obolibrary.org/obo/ZP_0000374	head apoptotic, abnormal	http://purl.obolibrary.org/obo/ZFA_0001114	head
http://purl.obolibrary.org/obo/ZP_0007926	heart apoptotic, abnormal	http://purl.obolibrary.org/obo/ZFA_0000114	heart
http://purl.obolibrary.org/obo/ZP_0022154	hematopoietic multipotent progenitor cell apoptotic, abnormal	http://purl.obolibrary.org/obo/ZFA_0009354	hematopoietic multipotent progenitor cell
http://purl.obolibrary.org/obo/ZP_0006657	hematopoietic stem cell apoptotic, abnormal	http://purl.obolibrary.org/obo/ZFA_0009014	hematopoietic stem cell
http://purl.obolibrary.org/obo/ZP_0004982	hindbrain apoptotic, abnormal	http://purl.obolibrary.org/obo/ZFA_0000029	hindbrain
http://purl.obolibrary.org/obo/ZP_0002908	hypoblast apoptotic, abnormal	http://purl.obolibrary.org/obo/ZFA_0000117	hypoblast
http://purl.obolibrary.org/obo/ZP_0004963	immature eye apoptotic, abnormal	http://purl.obolibrary.org/obo/ZFA_0001678	immature eye
http://purl.obolibrary.org/obo/ZP_0142669	immature gonad apoptotic, abnormal	http://purl.obolibrary.org/obo/ZFA_0005272	immature gonad
http://purl.obolibrary.org/obo/ZP_0006562	inner ear apoptotic, abnormal	http://purl.obolibrary.org/obo/ZFA_0000217	inner ear
http://purl.obolibrary.org/obo/ZP_0007370	integument apoptotic, abnormal	http://purl.obolibrary.org/obo/ZFA_0000368	integument
http://purl.obolibrary.org/obo/ZP_0005200	intermediate cell mass of mesoderm apoptotic, abnormal	http://purl.obolibrary.org/obo/ZFA_0000033	intermediate cell mass of mesoderm
http://purl.obolibrary.org/obo/ZP_0006303	intestinal epithelial cell apoptotic, abnormal	http://purl.obolibrary.org/obo/ZFA_0009399	intestinal epithelial cell
http://purl.obolibrary.org/obo/ZP_0008772	intestine apoptotic, abnormal	http://purl.obolibrary.org/obo/ZFA_0001338	intestine
http://purl.obolibrary.org/obo/ZP_0004127	intrahepatic bile duct apoptotic, abnormal	http://purl.obolibrary.org/obo/ZFA_0005169	intrahepatic bile duct
http://purl.obolibrary.org/obo/ZP_0007062	lateral plate mesoderm apoptotic, abnormal	http://purl.obolibrary.org/obo/ZFA_0000121	lateral plate mesoderm
http://purl.obolibrary.org/obo/ZP_0005202	lens apoptotic, abnormal	http://purl.obolibrary.org/obo/ZFA_0000035	lens
http://purl.obolibrary.org/obo/ZP_0005623	liver apoptotic, abnormal	http://purl.obolibrary.org/obo/ZFA_0000123	liver
http://purl.obolibrary.org/obo/ZP_0016286	mandibular arch skeleton apoptotic, abnormal	http://purl.obolibrary.org/obo/ZFA_0001227	mandibular arch skeleton
http://purl.obolibrary.org/obo/ZP_0002874	median fin fold apoptotic, abnormal	http://purl.obolibrary.org/obo/ZFA_0000040	median fin fold
http://purl.obolibrary.org/obo/ZP_0008740	melanocyte apoptotic, abnormal	http://purl.obolibrary.org/obo/ZFA_0009091	melanocyte
http://purl.obolibrary.org/obo/ZP_0141119	microglial cell apoptotic, abnormal	http://purl.obolibrary.org/obo/ZFA_0009077	microglial cell
http://purl.obolibrary.org/obo/ZP_0001154	mid diencephalic organizer apoptotic, abnormal	http://purl.obolibrary.org/obo/ZFA_0005757	mid diencephalic organizer
http://purl.obolibrary.org/obo/ZP_0001135	midbrain apoptotic, abnormal	http://purl.obolibrary.org/obo/ZFA_0000128	midbrain
http://purl.obolibrary.org/obo/ZP_0004225	midbrain hindbrain boundary apoptotic, abnormal	http://purl.obolibrary.org/obo/ZFA_0000042	midbrain hindbrain boundary
http://purl.obolibrary.org/obo/ZP_0140639	motor neuron apoptotic, abnormal	http://purl.obolibrary.org/obo/ZFA_0009052	motor neuron
http://purl.obolibrary.org/obo/ZP_0000668	muscle apoptotic, abnormal	http://purl.obolibrary.org/obo/ZFA_0005145	muscle
http://purl.obolibrary.org/obo/ZP_0008750	muscle cell apoptotic, abnormal	http://purl.obolibrary.org/obo/ZFA_0009114	muscle cell
http://purl.obolibrary.org/obo/ZP_0004161	nervous system apoptotic, abnormal	http://purl.obolibrary.org/obo/ZFA_0000396	nervous system
http://purl.obolibrary.org/obo/ZP_0006907	neural crest apoptotic, abnormal	http://purl.obolibrary.org/obo/ZFA_0000045	neural crest
http://purl.obolibrary.org/obo/ZP_0010861	neural crest cell apoptotic, abnormal	http://purl.obolibrary.org/obo/ZFA_0009165	neural crest cell
http://purl.obolibrary.org/obo/ZP_0003576	neural keel apoptotic, abnormal	http://purl.obolibrary.org/obo/ZFA_0000131	neural keel
http://purl.obolibrary.org/obo/ZP_0017145	neural plate apoptotic, abnormal	http://purl.obolibrary.org/obo/ZFA_0000132	neural plate
http://purl.obolibrary.org/obo/ZP_0003396	neural tube apoptotic, abnormal	http://purl.obolibrary.org/obo/ZFA_0001135	neural tube
http://purl.obolibrary.org/obo/ZP_0008628	neuroectoderm apoptotic, abnormal	http://purl.obolibrary.org/obo/ZFA_0001120	neuroectoderm
http://purl.obolibrary.org/obo/ZP_0016188	neuroepithelial cell apoptotic, abnormal	http://purl.obolibrary.org/obo/ZFA_0009306	neuroepithelial cell
http://purl.obolibrary.org/obo/ZP_0002169	neuromast hair cell apoptotic, abnormal	http://purl.obolibrary.org/obo/ZFA_0009367	neuromast hair cell
http://purl.obolibrary.org/obo/ZP_0142605	neuromast support cell apoptotic, abnormal	http://purl.obolibrary.org/obo/ZFA_0009363	neuromast support cell
http://purl.obolibrary.org/obo/ZP_0001197	neuron apoptotic, abnormal	http://purl.obolibrary.org/obo/ZFA_0009248	neuron
http://purl.obolibrary.org/obo/ZP_0007656	neuronal stem cell apoptotic, abnormal	http://purl.obolibrary.org/obo/ZFA_0009019	neuronal stem cell
http://purl.obolibrary.org/obo/ZP_0001632	notochord apoptotic, abnormal	http://purl.obolibrary.org/obo/ZFA_0000135	notochord
http://purl.obolibrary.org/obo/ZP_0006030	nucleate erythrocyte apoptotic, abnormal	http://purl.obolibrary.org/obo/ZFA_0009256	nucleate erythrocyte
http://purl.obolibrary.org/obo/ZP_0009194	olfactory bulb apoptotic, abnormal	http://purl.obolibrary.org/obo/ZFA_0000402	olfactory bulb
http://purl.obolibrary.org/obo/ZP_0009195	olfactory placode apoptotic, abnormal	http://purl.obolibrary.org/obo/ZFA_0000048	olfactory placode
http://purl.obolibrary.org/obo/ZP_0003203	olfactory system apoptotic, abnormal	http://purl.obolibrary.org/obo/ZFA_0001149	olfactory system
http://purl.obolibrary.org/obo/ZP_0101746	oligodendrocyte apoptotic, abnormal	http://purl.obolibrary.org/obo/ZFA_0009076	oligodendrocyte
http://purl.obolibrary.org/obo/ZP_0004195	optic tectum apoptotic, abnormal	http://purl.obolibrary.org/obo/ZFA_0000445	optic tectum
http://purl.obolibrary.org/obo/ZP_0004642	optic vesicle apoptotic, abnormal	http://purl.obolibrary.org/obo/ZFA_0000050	optic vesicle
http://purl.obolibrary.org/obo/ZP_0010534	otic vesicle apoptotic, abnormal	http://purl.obolibrary.org/obo/ZFA_0000051	otic vesicle
http://purl.obolibrary.org/obo/ZP_0022335	pancreatic B cell apoptotic, abnormal	http://purl.obolibrary.org/obo/ZFA_0009102	pancreatic B cell
http://purl.obolibrary.org/obo/ZP_0007376	pectoral fin apoptotic, abnormal	http://purl.obolibrary.org/obo/ZFA_0001161	pectoral fin
http://purl.obolibrary.org/obo/ZP_0007423	periocular mesenchyme apoptotic, abnormal	http://purl.obolibrary.org/obo/ZFA_0005572	periocular mesenchyme
http://purl.obolibrary.org/obo/ZP_0016287	pharyngeal arch 2 skeleton apoptotic, abnormal	http://purl.obolibrary.org/obo/ZFA_0001276	pharyngeal arch 2 skeleton
http://purl.obolibrary.org/obo/ZP_0003984	pharyngeal arch apoptotic, abnormal	http://purl.obolibrary.org/obo/ZFA_0001306	pharyngeal arch
http://purl.obolibrary.org/obo/ZP_0011687	pharyngeal endoderm apoptotic, abnormal	http://purl.obolibrary.org/obo/ZFA_0001104	pharyngeal endoderm
http://purl.obolibrary.org/obo/ZP_0001278	photoreceptor cell apoptotic, abnormal	http://purl.obolibrary.org/obo/ZFA_0009127	photoreceptor cell
http://purl.obolibrary.org/obo/ZP_0017327	photoreceptor outer segment layer apoptotic, abnormal	http://purl.obolibrary.org/obo/ZFA_0001466	photoreceptor outer segment layer
http://purl.obolibrary.org/obo/ZP_0137508	podocyte apoptotic, abnormal	http://purl.obolibrary.org/obo/ZFA_0009285	podocyte
http://purl.obolibrary.org/obo/ZP_0003959	post-vent region apoptotic, abnormal	http://purl.obolibrary.org/obo/ZFA_0001117	post-vent region
http://purl.obolibrary.org/obo/ZP_0004317	posterior intestine apoptotic, abnormal	http://purl.obolibrary.org/obo/ZFA_0000706	posterior intestine
http://purl.obolibrary.org/obo/ZP_0010544	posterior lateral line primordium apoptotic, abnormal	http://purl.obolibrary.org/obo/ZFA_0001157	posterior lateral line primordium
http://purl.obolibrary.org/obo/ZP_0005299	posterior neural tube apoptotic, abnormal	http://purl.obolibrary.org/obo/ZFA_0007037	posterior neural tube
http://purl.obolibrary.org/obo/ZP_0016177	prechordal plate apoptotic, abnormal	http://purl.obolibrary.org/obo/ZFA_0000060	prechordal plate
http://purl.obolibrary.org/obo/ZP_0011443	primordial germ cell apoptotic, abnormal	http://purl.obolibrary.org/obo/ZFA_0009288	primordial germ cell
http://purl.obolibrary.org/obo/ZP_0004933	proctodeum apoptotic, abnormal	http://purl.obolibrary.org/obo/ZFA_0000066	proctodeum
http://purl.obolibrary.org/obo/ZP_0017077	pronephric podocyte apoptotic, abnormal	http://purl.obolibrary.org/obo/ZFA_0001673	pronephric podocyte
http://purl.obolibrary.org/obo/ZP_0017417	pronephric proximal convoluted tubule apoptotic, abnormal	http://purl.obolibrary.org/obo/ZFA_0001620	pronephric proximal convoluted tubule
http://purl.obolibrary.org/obo/ZP_0009193	pronephros apoptotic, abnormal	http://purl.obolibrary.org/obo/ZFA_0000151	pronephros
http://purl.obolibrary.org/obo/ZP_0014279	regeneration epithelium apoptotic, abnormal	http://purl.obolibrary.org/obo/ZFA_0001389	regeneration epithelium
http://purl.obolibrary.org/obo/ZP_0001366	retina apoptotic, abnormal	http://purl.obolibrary.org/obo/ZFA_0000152	retina
http://purl.obolibrary.org/obo/ZP_0015711	retinal bipolar neuron apoptotic, abnormal	http://purl.obolibrary.org/obo/ZFA_0009318	retinal bipolar neuron
http://purl.obolibrary.org/obo/ZP_0147201	retinal cone cell apoptotic, abnormal	http://purl.obolibrary.org/obo/ZFA_0009262	retinal cone cell
http://purl.obolibrary.org/obo/ZP_0004793	retinal ganglion cell apoptotic, abnormal	http://purl.obolibrary.org/obo/ZFA_0009310	retinal ganglion cell
http://purl.obolibrary.org/obo/ZP_0003140	retinal ganglion cell layer apoptotic, abnormal	http://purl.obolibrary.org/obo/ZFA_0000024	retinal ganglion cell layer
http://purl.obolibrary.org/obo/ZP_0018436	retinal inner nuclear layer apoptotic, abnormal	http://purl.obolibrary.org/obo/ZFA_0000119	retinal inner nuclear layer
http://purl.obolibrary.org/obo/ZP_0009102	retinal neural layer apoptotic, abnormal	http://purl.obolibrary.org/obo/ZFA_0000046	retinal neural layer
http://purl.obolibrary.org/obo/ZP_0004787	retinal outer nuclear layer apoptotic, abnormal	http://purl.obolibrary.org/obo/ZFA_0001464	retinal outer nuclear layer
http://purl.obolibrary.org/obo/ZP_0005803	retinal photoreceptor layer apoptotic, abnormal	http://purl.obolibrary.org/obo/ZFA_0000143	retinal photoreceptor layer
http://purl.obolibrary.org/obo/ZP_0002581	rhombomere 2 apoptotic, abnormal	http://purl.obolibrary.org/obo/ZFA_0000822	rhombomere 2
http://purl.obolibrary.org/obo/ZP_0002584	rhombomere 3 apoptotic, abnormal	http://purl.obolibrary.org/obo/ZFA_0000948	rhombomere 3
http://purl.obolibrary.org/obo/ZP_0002585	rhombomere 4 apoptotic, abnormal	http://purl.obolibrary.org/obo/ZFA_0001032	rhombomere 4
http://purl.obolibrary.org/obo/ZP_0002582	rhombomere 5 apoptotic, abnormal	http://purl.obolibrary.org/obo/ZFA_0000823	rhombomere 5
http://purl.obolibrary.org/obo/ZP_0006786	skeletal muscle cell apoptotic, abnormal	http://purl.obolibrary.org/obo/ZFA_0009115	skeletal muscle cell
http://purl.obolibrary.org/obo/ZP_0007923	somite apoptotic, abnormal	http://purl.obolibrary.org/obo/ZFA_0000155	somite
http://purl.obolibrary.org/obo/ZP_0148280	spermatid apoptotic, abnormal	http://purl.obolibrary.org/obo/ZFA_0005769	spermatid
http://purl.obolibrary.org/obo/ZP_0008205	spermatocyte apoptotic, abnormal	http://purl.obolibrary.org/obo/ZFA_0009005	spermatocyte
http://purl.obolibrary.org/obo/ZP_0103073	spermatogonium apoptotic, abnormal	http://purl.obolibrary.org/obo/ZFA_0009007	spermatogonium
http://purl.obolibrary.org/obo/ZP_0002486	spinal cord apoptotic, abnormal	http://purl.obolibrary.org/obo/ZFA_0000075	spinal cord
http://purl.obolibrary.org/obo/ZP_0003587	spinal cord neural keel apoptotic, abnormal	http://purl.obolibrary.org/obo/ZFA_0007028	spinal cord neural keel
http://purl.obolibrary.org/obo/ZP_0002875	tail bud apoptotic, abnormal	http://purl.obolibrary.org/obo/ZFA_0000077	tail bud
http://purl.obolibrary.org/obo/ZP_0008693	telencephalon apoptotic, abnormal	http://purl.obolibrary.org/obo/ZFA_0000079	telencephalon
http://purl.obolibrary.org/obo/ZP_0005972	testis apoptotic, abnormal	http://purl.obolibrary.org/obo/ZFA_0000598	testis
http://purl.obolibrary.org/obo/ZP_0149324	thyroid follicle apoptotic, abnormal	http://purl.obolibrary.org/obo/ZFA_0001072	thyroid follicle
http://purl.obolibrary.org/obo/ZP_0014665	thyroid stimulating hormone secreting cell apoptotic, abnormal	http://purl.obolibrary.org/obo/ZFA_0009218	thyroid stimulating hormone secreting cell
http://purl.obolibrary.org/obo/ZP_0014322	trigeminal ganglion apoptotic, abnormal	http://purl.obolibrary.org/obo/ZFA_0000295	trigeminal ganglion
http://purl.obolibrary.org/obo/ZP_0002473	trunk apoptotic, abnormal	http://purl.obolibrary.org/obo/ZFA_0001115	trunk
http://purl.obolibrary.org/obo/ZP_0004065	vascular endothelium apoptotic, abnormal	http://purl.obolibrary.org/obo/ZFA_0001639	vascular endothelium
http://purl.obolibrary.org/obo/ZP_0009198	ventral fin fold apoptotic, abnormal	http://purl.obolibrary.org/obo/ZFA_0001069	ventral fin fold
http://purl.obolibrary.org/obo/ZP_0020458	ventral mandibular arch apoptotic, abnormal	http://purl.obolibrary.org/obo/ZFA_0001273	ventral mandibular arch
http://purl.obolibrary.org/obo/ZP_0009063	ventral wall of dorsal aorta apoptotic, abnormal	http://purl.obolibrary.org/obo/ZFA_0005028	ventral wall of dorsal aorta
http://purl.obolibrary.org/obo/ZP_0010040	ventricular system apoptotic, abnormal	http://purl.obolibrary.org/obo/ZFA_0001261	ventricular system
http://purl.obolibrary.org/obo/ZP_0003087	whole organism apoptotic, abnormal	http://purl.obolibrary.org/obo/ZFA_0001094	whole organism
