				NV notes<http://purl.obolibrary.org/obo/MP_0009275>	bruising	<http://purl.obolibrary.org/obo/MP_0009276>	ecchymosis	these have the same logical def<http://purl.obolibrary.org/obo/MP_0009864>	abnormal aorta endothelium morphology	<http://purl.obolibrary.org/obo/MP_0009872>	abnormal aorta tunica intima morphology	not sure why these are equiv<http://purl.obolibrary.org/obo/MP_0004983>	abnormal osteoclast cell number	<http://purl.obolibrary.org/obo/MP_0020202>	abnormal macrophage cell number	"looks like there is an additional logical def on the HP term, which is likely a mistake"<http://purl.obolibrary.org/obo/MP_0013830>	abnormal intrathoracic topology of vagus nerve	<http://purl.obolibrary.org/obo/MP_0013837>	abnormal vagus nerve topology	these have the same logical def<http://purl.obolibrary.org/obo/MP_0010373>	myeloid hyperplasia	<http://purl.obolibrary.org/obo/MP_0013663>	increased myeloid cell number	these have the same logical def<http://purl.obolibrary.org/obo/MP_0004157>	interrupted aortic arch	<http://purl.obolibrary.org/obo/MP_0011676>	aortic arch obstruction	these have the same logical def<http://purl.obolibrary.org/obo/MP_0003387>	aorta coarctation	<http://purl.obolibrary.org/obo/MP_0010463>	aorta stenosis	these have the same logical def<http://purl.obolibrary.org/obo/MP_0009406>	decreased skeletal muscle fiber number	<http://purl.obolibrary.org/obo/MP_0009408>	decreased skeletal muscle fiber density	these have the same logical def<http://purl.obolibrary.org/obo/MP_0003755>	abnormal palate morphology	<http://purl.obolibrary.org/obo/MP_0013550>	abnormal secondary palate morphology	"this may have been through string matching, although I can't tell for sure. The logical defs are similar but  not exactly the same"