defined_class	defined_class_label	cellular_component	cellular_component_label	location	location_label
http://purl.obolibrary.org/obo/ZP_0012656	axon cerebellum degenerate, abnormal	http://purl.obolibrary.org/obo/GO_0030424	axon	http://purl.obolibrary.org/obo/ZFA_0000100	cerebellum
http://purl.obolibrary.org/obo/ZP_0016972	axon facial ganglion degenerate, abnormal	http://purl.obolibrary.org/obo/GO_0030424	axon	http://purl.obolibrary.org/obo/ZFA_0001291	facial ganglion
http://purl.obolibrary.org/obo/ZP_0016973	axon glossopharyngeal ganglion degenerate, abnormal	http://purl.obolibrary.org/obo/GO_0030424	axon	http://purl.obolibrary.org/obo/ZFA_0001301	glossopharyngeal ganglion
http://purl.obolibrary.org/obo/ZP_0016891	axon motor neuron degenerate, abnormal	http://purl.obolibrary.org/obo/GO_0030424	axon	http://purl.obolibrary.org/obo/ZFA_0009052	motor neuron
http://purl.obolibrary.org/obo/ZP_0016971	axon trigeminal ganglion degenerate, abnormal	http://purl.obolibrary.org/obo/GO_0030424	axon	http://purl.obolibrary.org/obo/ZFA_0000295	trigeminal ganglion
http://purl.obolibrary.org/obo/ZP_0016974	axon vagal ganglion degenerate, abnormal	http://purl.obolibrary.org/obo/GO_0030424	axon	http://purl.obolibrary.org/obo/ZFA_0007067	vagal ganglion
http://purl.obolibrary.org/obo/ZP_0016976	cell body cranial ganglion degenerate, abnormal	http://purl.obolibrary.org/obo/GO_0044297	cell body	http://purl.obolibrary.org/obo/ZFA_0000013	cranial ganglion
http://purl.obolibrary.org/obo/ZP_0107078	cone photoreceptor outer segment retinal cone cell degenerate, abnormal	http://purl.obolibrary.org/obo/GO_0120199	cone photoreceptor outer segment	http://purl.obolibrary.org/obo/ZFA_0009262	retinal cone cell
http://purl.obolibrary.org/obo/ZP_0100460	cytoplasm neuromast hair cell degenerate, abnormal	http://purl.obolibrary.org/obo/GO_0005737	cytoplasm	http://purl.obolibrary.org/obo/ZFA_0009367	neuromast hair cell
http://purl.obolibrary.org/obo/ZP_0011012	focal adhesion intestinal epithelium degenerate, abnormal	http://purl.obolibrary.org/obo/GO_0005925	focal adhesion	http://purl.obolibrary.org/obo/ZFA_0005124	intestinal epithelium
http://purl.obolibrary.org/obo/ZP_0021948	intracellular canaliculus hepatocyte degenerate, abnormal	http://purl.obolibrary.org/obo/GO_0046691	intracellular canaliculus	http://purl.obolibrary.org/obo/ZFA_0009111	hepatocyte
http://purl.obolibrary.org/obo/ZP_0004681	melanosome melanocyte degenerate, abnormal	http://purl.obolibrary.org/obo/GO_0042470	melanosome	http://purl.obolibrary.org/obo/ZFA_0009091	melanocyte
http://purl.obolibrary.org/obo/ZP_0017867	melanosome retinal pigmented epithelium degenerate, abnormal	http://purl.obolibrary.org/obo/GO_0042470	melanosome	http://purl.obolibrary.org/obo/ZFA_0000144	retinal pigmented epithelium
http://purl.obolibrary.org/obo/ZP_0103959	mitochondrial crista hepatocyte degenerate, abnormal	http://purl.obolibrary.org/obo/GO_0030061	mitochondrial crista	http://purl.obolibrary.org/obo/ZFA_0009111	hepatocyte
http://purl.obolibrary.org/obo/ZP_0016825	mitochondrion heart degenerate, abnormal	http://purl.obolibrary.org/obo/GO_0005739	mitochondrion	http://purl.obolibrary.org/obo/ZFA_0000114	heart
http://purl.obolibrary.org/obo/ZP_0000249	myofibril fast muscle cell degenerate, abnormal	http://purl.obolibrary.org/obo/GO_0030016	myofibril	http://purl.obolibrary.org/obo/ZFA_0009117	fast muscle cell
http://purl.obolibrary.org/obo/ZP_0008469	myofibril muscle degenerate, abnormal	http://purl.obolibrary.org/obo/GO_0030016	myofibril	http://purl.obolibrary.org/obo/ZFA_0005145	muscle
http://purl.obolibrary.org/obo/ZP_0130968	myofibril skeletal muscle degenerate, abnormal	http://purl.obolibrary.org/obo/GO_0030016	myofibril	http://purl.obolibrary.org/obo/ZFA_0005277	skeletal muscle
http://purl.obolibrary.org/obo/ZP_0016056	photoreceptor inner segment retinal rod cell degenerate, abnormal	http://purl.obolibrary.org/obo/GO_0001917	photoreceptor inner segment	http://purl.obolibrary.org/obo/ZFA_0009275	retinal rod cell
http://purl.obolibrary.org/obo/ZP_0106383	photoreceptor outer segment eye photoreceptor cell degenerate, abnormal	http://purl.obolibrary.org/obo/GO_0001750	photoreceptor outer segment	http://purl.obolibrary.org/obo/ZFA_0009154	eye photoreceptor cell
http://purl.obolibrary.org/obo/ZP_0102004	photoreceptor outer segment photoreceptor cell degenerate, abnormal	http://purl.obolibrary.org/obo/GO_0001750	photoreceptor outer segment	http://purl.obolibrary.org/obo/ZFA_0009127	photoreceptor cell
http://purl.obolibrary.org/obo/ZP_0102006	photoreceptor outer segment retinal cone cell degenerate, abnormal	http://purl.obolibrary.org/obo/GO_0001750	photoreceptor outer segment	http://purl.obolibrary.org/obo/ZFA_0009262	retinal cone cell
http://purl.obolibrary.org/obo/ZP_0015499	photoreceptor outer segment retinal rod cell degenerate, abnormal	http://purl.obolibrary.org/obo/GO_0001750	photoreceptor outer segment	http://purl.obolibrary.org/obo/ZFA_0009275	retinal rod cell
http://purl.obolibrary.org/obo/ZP_0103958	plasma membrane hepatocyte degenerate, abnormal	http://purl.obolibrary.org/obo/GO_0005886	plasma membrane	http://purl.obolibrary.org/obo/ZFA_0009111	hepatocyte
http://purl.obolibrary.org/obo/ZP_0100990	skeletal muscle myofibril skeletal muscle degenerate, abnormal	http://purl.obolibrary.org/obo/GO_0098723	skeletal muscle myofibril	http://purl.obolibrary.org/obo/ZFA_0005277	skeletal muscle
http://purl.obolibrary.org/obo/ZP_0021911	synapse brain degenerate, abnormal	http://purl.obolibrary.org/obo/GO_0045202	synapse	http://purl.obolibrary.org/obo/ZFA_0000008	brain
http://purl.obolibrary.org/obo/ZP_0100785	vacuole liver degenerate, abnormal	http://purl.obolibrary.org/obo/GO_0005773	vacuole	http://purl.obolibrary.org/obo/ZFA_0000123	liver
